Tool,Moniker,Category,Severity,RSS Available,Feed URL,Tracking Method,Repo URL,Repo Status,Stars,Contributors,Docs URL,Website URL,Source Type,Discovery Method,Launch Status,Last Seen Update,Status,Date Added
New attack on ChatGPT research agent pilfers secrets from Gmail inboxes,new-attack-on-chatgpt-research-agent-pilfers-secrets-from-gmail-inboxes,Article,Minor,❌,,HTML/Blog,,,,,,https://arstechnica.com/information-technology/2025/09/new-attack-on-chatgpt-research-agent-pilfers-secrets-from-gmail-inboxes/,Press,Auto-Discovery,,,,2025-09-19
Scaleway on Hugging Face Inference Providers 🔥,scaleway-on-hugging-face-inference-providers,Article,Minor,❌,,HTML/Blog,,,,,,https://huggingface.co/blog/inference-providers-scaleway,Press,Auto-Discovery,,,,2025-09-19
Unified Crew Planning and Replanning Optimization in Multi-Line Metro Systems Considering Workforce Heterogeneity,unified-crew-planning-and-replanning-optimization-in-multi-line-metro-systems-considering-workforce-heterogeneity,Article,Minor,❌,,HTML/Blog,,,,,,https://arxiv.org/abs/2509.14251,Press,Auto-Discovery,,,,2025-09-19
Detecting Pipeline Failures through Fine-Grained Analysis of Web Agents,detecting-pipeline-failures-through-fine-grained-analysis-of-web-agents,Article,Minor,❌,,HTML/Blog,,,,,,https://arxiv.org/abs/2509.14382,Press,Auto-Discovery,,,,2025-09-19
Beyond the high score: Prosocial ability profiles of multi-agent populations,beyond-the-high-score-prosocial-ability-profiles-of-multi-agent-populations,Article,Minor,❌,,HTML/Blog,,,,,,https://arxiv.org/abs/2509.14485,Press,Auto-Discovery,,,,2025-09-19
(P)rior(D)yna(F)low: A Priori Dynamic Workflow Construction via Multi-Agent Collaboration,p-rior-d-yna-f-low-a-priori-dynamic-workflow-construction-via-multi-agent-collaboration,Article,Minor,❌,,HTML/Blog,,,,,,https://arxiv.org/abs/2509.14547,Press,Auto-Discovery,,,,2025-09-19
AgentCompass: Towards Reliable Evaluation of Agentic Workflows in Production,agentcompass-towards-reliable-evaluation-of-agentic-workflows-in-production,Article,Minor,❌,,HTML/Blog,,,,,,https://arxiv.org/abs/2509.14647,Press,Auto-Discovery,,,,2025-09-19
OpenLens AI: Fully Autonomous Research Agent for Health Infomatics,openlens-ai-fully-autonomous-research-agent-for-health-infomatics,Article,Minor,❌,,HTML/Blog,,,,,,https://arxiv.org/abs/2509.14778,Press,Auto-Discovery,,,,2025-09-19
Sentinel Agents for Secure and Trustworthy Agentic AI in Multi-Agent Systems,sentinel-agents-for-secure-and-trustworthy-agentic-ai-in-multi-agent-systems,Article,Minor,❌,,HTML/Blog,,,,,,https://arxiv.org/abs/2509.14956,Press,Auto-Discovery,,,,2025-09-19
Calibrated Generative AI as Meta-Reviewer: A Systemic Functional Linguistics Discourse Analysis of Reviews of Peer Reviews,calibrated-generative-ai-as-meta-reviewer-a-systemic-functional-linguistics-discourse-analysis-of-reviews-of-peer-reviews,Article,Minor,❌,,HTML/Blog,,,,,,https://arxiv.org/abs/2509.15035,Press,Auto-Discovery,,,,2025-09-19
Internalizing Self-Consistency in Language Models: Multi-Agent Consensus Alignment,internalizing-self-consistency-in-language-models-multi-agent-consensus-alignment,Article,Minor,❌,,HTML/Blog,,,,,,https://arxiv.org/abs/2509.15172,Press,Auto-Discovery,,,,2025-09-19
From Correction to Mastery: Reinforced Distillation of Large Language Model Agents,from-correction-to-mastery-reinforced-distillation-of-large-language-model-agents,Article,Minor,❌,,HTML/Blog,,,,,,https://arxiv.org/abs/2509.14257,Press,Auto-Discovery,,,,2025-09-19
Constructive Conflict-Driven Multi-Agent Reinforcement Learning for Strategic Diversity,constructive-conflict-driven-multi-agent-reinforcement-learning-for-strategic-diversity,Article,Minor,❌,,HTML/Blog,,,,,,https://arxiv.org/abs/2509.14276,Press,Auto-Discovery,,,,2025-09-19
"Towards Robust Agentic CUDA Kernel Benchmarking, Verification, and Optimization",towards-robust-agentic-cuda-kernel-benchmarking-verification-and-optimization,Article,Minor,❌,,HTML/Blog,,,,,,https://arxiv.org/abs/2509.14279,Press,Auto-Discovery,,,,2025-09-19
The Sum Leaks More Than Its Parts: Compositional Privacy Risks and Mitigations in Multi-Agent Collaboration,the-sum-leaks-more-than-its-parts-compositional-privacy-risks-and-mitigations-in-multi-agent-collaboration,Article,Minor,❌,,HTML/Blog,,,,,,https://arxiv.org/abs/2509.14284,Press,Auto-Discovery,,,,2025-09-19
DreamControl: Human-Inspired Whole-Body Humanoid Control for Scene Interaction via Guided Diffusion,dreamcontrol-human-inspired-whole-body-humanoid-control-for-scene-interaction-via-guided-diffusion,Article,Minor,❌,,HTML/Blog,,,,,,https://arxiv.org/abs/2509.14353,Press,Auto-Discovery,,,,2025-09-19
Process-Supervised Reinforcement Learning for Interactive Multimodal Tool-Use Agents,process-supervised-reinforcement-learning-for-interactive-multimodal-tool-use-agents,Article,Minor,❌,,HTML/Blog,,,,,,https://arxiv.org/abs/2509.14480,Press,Auto-Discovery,,,,2025-09-19
Towards Human-like Multimodal Conversational Agent by Generating Engaging Speech,towards-human-like-multimodal-conversational-agent-by-generating-engaging-speech,Article,Minor,❌,,HTML/Blog,,,,,,https://arxiv.org/abs/2509.14627,Press,Auto-Discovery,,,,2025-09-19
OnlineMate: An LLM-Based Multi-Agent Companion System for Cognitive Support in Online Learning,onlinemate-an-llm-based-multi-agent-companion-system-for-cognitive-support-in-online-learning,Article,Minor,❌,,HTML/Blog,,,,,,https://arxiv.org/abs/2509.14803,Press,Auto-Discovery,,,,2025-09-19
MARIC: Multi-Agent Reasoning for Image Classification,maric-multi-agent-reasoning-for-image-classification,Article,Minor,❌,,HTML/Blog,,,,,,https://arxiv.org/abs/2509.14860,Press,Auto-Discovery,,,,2025-09-19
AI-Driven Multi-Agent Vehicular Planning for Battery Efficiency and QoS in 6G Smart Cities,ai-driven-multi-agent-vehicular-planning-for-battery-efficiency-and-qos-in-6g-smart-cities,Article,Minor,❌,,HTML/Blog,,,,,,https://arxiv.org/abs/2509.14877,Press,Auto-Discovery,,,,2025-09-19
Back to Ear: Perceptually Driven High Fidelity Music Reconstruction,back-to-ear-perceptually-driven-high-fidelity-music-reconstruction,Article,Minor,❌,,HTML/Blog,,,,,,https://arxiv.org/abs/2509.14912,Press,Auto-Discovery,,,,2025-09-19
RoboEye: Enhancing 2D Robotic Object Identification with Selective 3D Geometric Keypoint Matching,roboeye-enhancing-2d-robotic-object-identification-with-selective-3d-geometric-keypoint-matching,Article,Minor,❌,,HTML/Blog,,,,,,https://arxiv.org/abs/2509.14966,Press,Auto-Discovery,,,,2025-09-19
Reinforcement Learning Agent for a 2D Shooter Game,reinforcement-learning-agent-for-a-2d-shooter-game,Article,Minor,❌,,HTML/Blog,,,,,,https://arxiv.org/abs/2509.15042,Press,Auto-Discovery,,,,2025-09-19
Vulnerable Agent Identification in Large-Scale Multi-Agent Reinforcement Learning,vulnerable-agent-identification-in-large-scale-multi-agent-reinforcement-learning,Article,Minor,❌,,HTML/Blog,,,,,,https://arxiv.org/abs/2509.15103,Press,Auto-Discovery,,,,2025-09-19
WorldForge: Unlocking Emergent 3D/4D Generation in Video Diffusion Model via Training-Free Guidance,worldforge-unlocking-emergent-3d-4d-generation-in-video-diffusion-model-via-training-free-guidance,Article,Minor,❌,,HTML/Blog,,,,,,https://arxiv.org/abs/2509.15130,Press,Auto-Discovery,,,,2025-09-19
Explicit Context-Driven Neural Acoustic Modeling for High-Fidelity RIR Generation,explicit-context-driven-neural-acoustic-modeling-for-high-fidelity-rir-generation,Article,Minor,❌,,HTML/Blog,,,,,,https://arxiv.org/abs/2509.15210,Press,Auto-Discovery,,,,2025-09-19
Judging with Many Minds: Do More Perspectives Mean Less Prejudice? On Bias Amplifications and Resistance in Multi-Agent Based LLM-as-Judge,judging-with-many-minds-do-more-perspectives-mean-less-prejudice-on-bias-amplifications-and-resistance-in-multi-agent-based-llm-as-judge,Article,Minor,❌,,HTML/Blog,,,,,,https://arxiv.org/abs/2505.19477,Press,Auto-Discovery,,,,2025-09-19
DualSG: A Dual-Stream Explicit Semantic-Guided Multivariate Time Series Forecasting Framework,dualsg-a-dual-stream-explicit-semantic-guided-multivariate-time-series-forecasting-framework,Article,Minor,❌,,HTML/Blog,,,,,,https://arxiv.org/abs/2507.21830,Press,Auto-Discovery,,,,2025-09-19
METAL: A Multi-Agent Framework for Chart Generation with Test-Time Scaling,metal-a-multi-agent-framework-for-chart-generation-with-test-time-scaling,Article,Minor,❌,,HTML/Blog,,,,,,https://arxiv.org/abs/2502.17651,Press,Auto-Discovery,,,,2025-09-19
Predicting Multi-Agent Specialization via Task Parallelizability,predicting-multi-agent-specialization-via-task-parallelizability,Article,Minor,❌,,HTML/Blog,,,,,,https://arxiv.org/abs/2503.15703,Press,Auto-Discovery,,,,2025-09-19
"Trustless Autonomy: Understanding Motivations, Benefits, and Governance Dilemmas in Self-Sovereign Decentralized AI Agents",trustless-autonomy-understanding-motivations-benefits-and-governance-dilemmas-in-self-sovereign-decentralized-ai-agents,Article,Minor,❌,,HTML/Blog,,,,,,https://arxiv.org/abs/2505.09757,Press,Auto-Discovery,,,,2025-09-19
EnCoBo: Energy-Guided Concept Bottlenecks for Interpretable Generation,encobo-energy-guided-concept-bottlenecks-for-interpretable-generation,Article,Minor,❌,,HTML/Blog,,,,,,https://arxiv.org/abs/2507.08334,Press,Auto-Discovery,,,,2025-09-19
Deciding how to respond: A deliberative framework to guide policymaker responses to AI systems,deciding-how-to-respond-a-deliberative-framework-to-guide-policymaker-responses-to-ai-systems,Article,Minor,❌,,HTML/Blog,,,,,,https://arxiv.org/abs/2508.03666,Press,Auto-Discovery,,,,2025-09-19
Show HN: Guide to understanding your teen's lingo,show-hn-guide-to-understanding-your-teen-s-lingo,Article,Minor,❌,,HTML/Blog,,,,,,https://www.teenslangguide.com,Press,Auto-Discovery,,,,2025-09-20
Show HN: AvoSmash – AI video storytelling made easy,show-hn-avosmash-ai-video-storytelling-made-easy,Article,Minor,❌,,HTML/Blog,,,,,,https://avosmash.io/,Press,Auto-Discovery,,,,2025-09-20
"Show HN: Raspberry: Nutrition Tracking AI Agent(USDA, OpenFoodFacts, Web Search)",show-hn-raspberry-nutrition-tracking-ai-agent-usda-openfoodfacts-web-search,Article,Minor,❌,,HTML/Blog,,,,,,https://apps.apple.com/us/app/raspberry-ai/id6751657560,Press,Auto-Discovery,,,,2025-09-20
"Video in which I go over AABB collision system, gravity, as well as resolution for my indie custom Engine C++ game!",video-in-which-i-go-over-aabb-collision-system-gravity-as-well-as-resolution-for-my-indie-custom-engine-c-game,Article,Minor,❌,,HTML/Blog,,,,,,https://www.reddit.com/r/programming/comments/1nlncnk/video_in_which_i_go_over_aabb_collision_system/,Press,Auto-Discovery,,,,2025-09-20
Vogte: A language-specific agentic TUI targeting Go codebases,vogte-a-language-specific-agentic-tui-targeting-go-codebases,Article,Minor,❌,,HTML/Blog,,,,,,https://www.reddit.com/r/programming/comments/1nlv9xx/vogte_a_languagespecific_agentic_tui_targeting_go/,Press,Auto-Discovery,,,,2025-09-20
1K+ schemas of agentic projects visualized,1k-schemas-of-agentic-projects-visualized,Article,Minor,❌,,HTML/Blog,,,,,,https://www.reddit.com/r/LocalLLaMA/comments/1nlxq55/1k_schemas_of_agentic_projects_visualized/,Press,Auto-Discovery,,,,2025-09-20
KaniTTS – Fast and high-fidelity TTS with just 450M params,kanitts-fast-and-high-fidelity-tts-with-just-450m-params,Article,Minor,❌,,HTML/Blog,,,,,,https://www.reddit.com/r/LocalLLaMA/comments/1nldom8/kanitts_fast_and_highfidelity_tts_with_just_450m/,Press,Auto-Discovery,,,,2025-09-20
Open sourced my AI video generation project,open-sourced-my-ai-video-generation-project,Article,Minor,❌,,HTML/Blog,,,,,,https://www.reddit.com/r/LocalLLaMA/comments/1nlqu6q/open_sourced_my_ai_video_generation_project/,Press,Auto-Discovery,,,,2025-09-20
[D] AAAI 2026 Phase 2 Review,d-aaai-2026-phase-2-review,Article,Minor,❌,,HTML/Blog,,,,,,https://www.reddit.com/r/MachineLearning/comments/1nlnf5g/d_aaai_2026_phase_2_review/,Press,Auto-Discovery,,,,2025-09-20
[P] Building sub-100ms autocompletion for JetBrains IDEs,p-building-sub-100ms-autocompletion-for-jetbrains-ides,Article,Minor,❌,,HTML/Blog,,,,,,https://www.reddit.com/r/MachineLearning/comments/1nlfcpq/p_building_sub100ms_autocompletion_for_jetbrains/,Press,Auto-Discovery,,,,2025-09-20
Show HN: Shieldcode – Automated PR Code Reviews and Vulnerability Scanner,show-hn-shieldcode-automated-pr-code-reviews-and-vulnerability-scanner,Article,Minor,❌,,HTML/Blog,,,,,,https://shieldcode.space,Press,Auto-Discovery,,,,2025-09-21
Lucy-Edit : 1st Open-sourced model for Video editing,lucy-edit-1st-open-sourced-model-for-video-editing,Article,Minor,❌,,HTML/Blog,,,,,,https://www.reddit.com/r/LocalLLaMA/comments/1nmj3cr/lucyedit_1st_opensourced_model_for_video_editing/,Press,Auto-Discovery,,,,2025-09-21
Wan 2.2 Animate : Open-Sourced model for character replacement and animation in videos,wan-2-2-animate-open-sourced-model-for-character-replacement-and-animation-in-videos,Article,Minor,❌,,HTML/Blog,,,,,,https://www.reddit.com/r/LocalLLaMA/comments/1nmnmqh/wan_22_animate_opensourced_model_for_character/,Press,Auto-Discovery,,,,2025-09-21
[D] Is peer review overloaded due to rejecting too many papers?,d-is-peer-review-overloaded-due-to-rejecting-too-many-papers,Article,Minor,❌,,HTML/Blog,,,,,,https://www.reddit.com/r/MachineLearning/comments/1nmo57e/d_is_peer_review_overloaded_due_to_rejecting_too/,Press,Auto-Discovery,,,,2025-09-21
Show HN: AI provides real-time advice for offline two-person negotiations,show-hn-ai-provides-real-time-advice-for-offline-two-person-negotiations,Article,Minor,❌,,HTML/Blog,,,,,,https://negowiz.com,Press,Auto-Discovery,,,,2025-09-22
Show HN: Agentic Code – Make AI coding tools follow real workflows,show-hn-agentic-code-make-ai-coding-tools-follow-real-workflows,Article,Minor,❌,,HTML/Blog,,,,,,https://github.com/shinpr/agentic-code,Press,Auto-Discovery,,,,2025-09-22
Show HN: Coding Agents swarming your codebase,show-hn-coding-agents-swarming-your-codebase,Article,Minor,❌,,HTML/Blog,,,,,,https://infrastructureas.ai,Press,Auto-Discovery,,,,2025-09-22
"MemCP – A New In-Memory, Column-Oriented Database (Open Source, Go)",memcp-a-new-in-memory-column-oriented-database-open-source-go,Article,Minor,❌,,HTML/Blog,,,,,,https://www.reddit.com/r/programming/comments/1nnk9t7/memcp_a_new_inmemory_columnoriented_database_open/,Press,Auto-Discovery,,,,2025-09-22
Agentic feature flags,agentic-feature-flags,Article,Minor,❌,,HTML/Blog,,,,,,https://www.reddit.com/r/programming/comments/1nnkzdf/agentic_feature_flags/,Press,Auto-Discovery,,,,2025-09-22
A Developer's Guide to Negative API Testing,a-developer-s-guide-to-negative-api-testing,Article,Minor,❌,,HTML/Blog,,,,,,https://www.reddit.com/r/programming/comments/1nnkdz9/a_developers_guide_to_negative_api_testing/,Press,Auto-Discovery,,,,2025-09-22
Qwen3-Omni Promotional Video,qwen3-omni-promotional-video,Article,Minor,❌,,HTML/Blog,,,,,,https://www.reddit.com/r/LocalLLaMA/comments/1nncssq/qwen3omni_promotional_video/,Press,Auto-Discovery,,,,2025-09-22
Qwen3-Coder-480B on the M3 Ultra 512GB Mac Studio is perfect for agentic coding,qwen3-coder-480b-on-the-m3-ultra-512gb-mac-studio-is-perfect-for-agentic-coding,Article,Minor,❌,,HTML/Blog,,,,,,https://www.reddit.com/r/LocalLLaMA/comments/1nn01bj/qwen3coder480b_on_the_m3_ultra_512gb_mac_studio/,Press,Auto-Discovery,,,,2025-09-22
[D] Is it reasonable that reviewers aren’t required to read the appendix?,d-is-it-reasonable-that-reviewers-aren-t-required-to-read-the-appendix,Article,Minor,❌,,HTML/Blog,,,,,,https://www.reddit.com/r/MachineLearning/comments/1nnhkz8/d_is_it_reasonable_that_reviewers_arent_required/,Press,Auto-Discovery,,,,2025-09-22
[D] Best practice for providing code during review,d-best-practice-for-providing-code-during-review,Article,Minor,❌,,HTML/Blog,,,,,,https://www.reddit.com/r/MachineLearning/comments/1nni5ld/d_best_practice_for_providing_code_during_review/,Press,Auto-Discovery,,,,2025-09-22
[D] Missing AAAI Reviews,d-missing-aaai-reviews,Article,Minor,❌,,HTML/Blog,,,,,,https://www.reddit.com/r/MachineLearning/comments/1nmu1ad/d_missing_aaai_reviews/,Press,Auto-Discovery,,,,2025-09-22
[P] Video prediction pipeline using a frozen VAE and hierarchical LSTMs to learn latent dynamics,p-video-prediction-pipeline-using-a-frozen-vae-and-hierarchical-lstms-to-learn-latent-dynamics,Article,Minor,❌,,HTML/Blog,,,,,,https://www.reddit.com/r/MachineLearning/comments/1nlvvi1/p_video_prediction_pipeline_using_a_frozen_vae/,Press,Auto-Discovery,,,,2025-09-22
Windows 11 is getting a video wallpaper feature,windows-11-is-getting-a-video-wallpaper-feature,Article,Minor,❌,,HTML/Blog,,,,,,https://www.theverge.com/news/782383/microsoft-windows-11-video-wallpapers,Press,Auto-Discovery,,,,2025-09-22
Gaia2 and ARE: Empowering the community to study agents,gaia2-and-are-empowering-the-community-to-study-agents,Article,Minor,❌,,HTML/Blog,,,,,,https://huggingface.co/blog/gaia2,Press,Auto-Discovery,,,,2025-09-22
MICA: Multi-Agent Industrial Coordination Assistant,mica-multi-agent-industrial-coordination-assistant,Article,Minor,❌,,HTML/Blog,,,,,,https://arxiv.org/abs/2509.15237,Press,Auto-Discovery,,,,2025-09-22
Diagnostics of cognitive failures in multi-agent expert systems using dynamic evaluation protocols and subsequent mutation of the processing context,diagnostics-of-cognitive-failures-in-multi-agent-expert-systems-using-dynamic-evaluation-protocols-and-subsequent-mutation-of-the-processing-context,Article,Minor,❌,,HTML/Blog,,,,,,https://arxiv.org/abs/2509.15366,Press,Auto-Discovery,,,,2025-09-22
MicroRCA-Agent: Microservice Root Cause Analysis Method Based on Large Language Model Agents,microrca-agent-microservice-root-cause-analysis-method-based-on-large-language-model-agents,Article,Minor,❌,,HTML/Blog,,,,,,https://arxiv.org/abs/2509.15635,Press,Auto-Discovery,,,,2025-09-22
CCrepairBench: A High-Fidelity Benchmark and Reinforcement Learning Framework for C++ Compilation Repair,ccrepairbench-a-high-fidelity-benchmark-and-reinforcement-learning-framework-for-c-compilation-repair,Article,Minor,❌,,HTML/Blog,,,,,,https://arxiv.org/abs/2509.15690,Press,Auto-Discovery,,,,2025-09-22
Building Data-Driven Occupation Taxonomies: A Bottom-Up Multi-Stage Approach via Semantic Clustering and Multi-Agent Collaboration,building-data-driven-occupation-taxonomies-a-bottom-up-multi-stage-approach-via-semantic-clustering-and-multi-agent-collaboration,Article,Minor,❌,,HTML/Blog,,,,,,https://arxiv.org/abs/2509.15786,Press,Auto-Discovery,,,,2025-09-22
EHR-MCP: Real-world Evaluation of Clinical Information Retrieval by Large Language Models via Model Context Protocol,ehr-mcp-real-world-evaluation-of-clinical-information-retrieval-by-large-language-models-via-model-context-protocol,Article,Minor,❌,,HTML/Blog,,,,,,https://arxiv.org/abs/2509.15957,Press,Auto-Discovery,,,,2025-09-22
Generating Plans for Belief-Desire-Intention (BDI) Agents Using Alternating-Time Temporal Logic (ATL),generating-plans-for-belief-desire-intention-bdi-agents-using-alternating-time-temporal-logic-atl,Article,Minor,❌,,HTML/Blog,,,,,,https://arxiv.org/abs/2509.15238,Press,Auto-Discovery,,,,2025-09-22
IEFS-GMB: Gradient Memory Bank-Guided Feature Selection Based on Information Entropy for EEG Classification of Neurological Disorders,iefs-gmb-gradient-memory-bank-guided-feature-selection-based-on-information-entropy-for-eeg-classification-of-neurological-disorders,Article,Minor,❌,,HTML/Blog,,,,,,https://arxiv.org/abs/2509.15259,Press,Auto-Discovery,,,,2025-09-22
Autoguided Online Data Curation for Diffusion Model Training,autoguided-online-data-curation-for-diffusion-model-training,Article,Minor,❌,,HTML/Blog,,,,,,https://arxiv.org/abs/2509.15267,Press,Auto-Discovery,,,,2025-09-22
ORCA: Agentic Reasoning For Hallucination and Adversarial Robustness in Vision-Language Models,orca-agentic-reasoning-for-hallucination-and-adversarial-robustness-in-vision-language-models,Article,Minor,❌,,HTML/Blog,,,,,,https://arxiv.org/abs/2509.15435,Press,Auto-Discovery,,,,2025-09-22
Impact of Phonetics on Speaker Identity in Adversarial Voice Attack,impact-of-phonetics-on-speaker-identity-in-adversarial-voice-attack,Article,Minor,❌,,HTML/Blog,,,,,,https://arxiv.org/abs/2509.15437,Press,Auto-Discovery,,,,2025-09-22
Explainable AI-Enhanced Supervisory Control for Robust Multi-Agent Robotic Systems,explainable-ai-enhanced-supervisory-control-for-robust-multi-agent-robotic-systems,Article,Minor,❌,,HTML/Blog,,,,,,https://arxiv.org/abs/2509.15491,Press,Auto-Discovery,,,,2025-09-22
GUI-ARP: Enhancing Grounding with Adaptive Region Perception for GUI Agents,gui-arp-enhancing-grounding-with-adaptive-region-perception-for-gui-agents,Article,Minor,❌,,HTML/Blog,,,,,,https://arxiv.org/abs/2509.15532,Press,Auto-Discovery,,,,2025-09-22
BTL-UI: Blink-Think-Link Reasoning Model for GUI Agent,btl-ui-blink-think-link-reasoning-model-for-gui-agent,Article,Minor,❌,,HTML/Blog,,,,,,https://arxiv.org/abs/2509.15566,Press,Auto-Discovery,,,,2025-09-22
Multimodal Learning for Fake News Detection in Short Videos Using Linguistically Verified Data and Heterogeneous Modality Fusion,multimodal-learning-for-fake-news-detection-in-short-videos-using-linguistically-verified-data-and-heterogeneous-modality-fusion,Article,Minor,❌,,HTML/Blog,,,,,,https://arxiv.org/abs/2509.15578,Press,Auto-Discovery,,,,2025-09-22
FloorSAM: SAM-Guided Floorplan Reconstruction with Semantic-Geometric Fusion,floorsam-sam-guided-floorplan-reconstruction-with-semantic-geometric-fusion,Article,Minor,❌,,HTML/Blog,,,,,,https://arxiv.org/abs/2509.15750,Press,Auto-Discovery,,,,2025-09-22
Ideal Registration? Segmentation is All You Need,ideal-registration-segmentation-is-all-you-need,Article,Minor,❌,,HTML/Blog,,,,,,https://arxiv.org/abs/2509.15784,Press,Auto-Discovery,,,,2025-09-22
Hierarchical Reinforcement Learning with Low-Level MPC for Multi-Agent Control,hierarchical-reinforcement-learning-with-low-level-mpc-for-multi-agent-control,Article,Minor,❌,,HTML/Blog,,,,,,https://arxiv.org/abs/2509.15799,Press,Auto-Discovery,,,,2025-09-22
ChronoForge-RL: Chronological Forging through Reinforcement Learning for Enhanced Video Understanding,chronoforge-rl-chronological-forging-through-reinforcement-learning-for-enhanced-video-understanding,Article,Minor,❌,,HTML/Blog,,,,,,https://arxiv.org/abs/2509.15800,Press,Auto-Discovery,,,,2025-09-22
CIDER: A Causal Cure for Brand-Obsessed Text-to-Image Models,cider-a-causal-cure-for-brand-obsessed-text-to-image-models,Article,Minor,❌,,HTML/Blog,,,,,,https://arxiv.org/abs/2509.15803,Press,Auto-Discovery,,,,2025-09-22
Fed-PISA: Federated Voice Cloning via Personalized Identity-Style Adaptation,fed-pisa-federated-voice-cloning-via-personalized-identity-style-adaptation,Article,Minor,❌,,HTML/Blog,,,,,,https://arxiv.org/abs/2509.16010,Press,Auto-Discovery,,,,2025-09-22
FLARE: Faithful Logic-Aided Reasoning and Exploration,flare-faithful-logic-aided-reasoning-and-exploration,Article,Minor,❌,,HTML/Blog,,,,,,https://arxiv.org/abs/2410.11900,Press,Auto-Discovery,,,,2025-09-22
Watson: A Cognitive Observability Framework for the Reasoning of LLM-Powered Agents,watson-a-cognitive-observability-framework-for-the-reasoning-of-llm-powered-agents,Article,Minor,❌,,HTML/Blog,,,,,,https://arxiv.org/abs/2411.03455,Press,Auto-Discovery,,,,2025-09-22
DebFlow: Automating Agent Creation via Agent Debate,debflow-automating-agent-creation-via-agent-debate,Article,Minor,❌,,HTML/Blog,,,,,,https://arxiv.org/abs/2503.23781,Press,Auto-Discovery,,,,2025-09-22
World Modelling Improves Language Model Agents,world-modelling-improves-language-model-agents,Article,Minor,❌,,HTML/Blog,,,,,,https://arxiv.org/abs/2506.02918,Press,Auto-Discovery,,,,2025-09-22
The Anatomy of a Personal Health Agent,the-anatomy-of-a-personal-health-agent,Article,Minor,❌,,HTML/Blog,,,,,,https://arxiv.org/abs/2508.20148,Press,Auto-Discovery,,,,2025-09-22
The Great AI Witch Hunt: Reviewers Perception and (Mis)Conception of Generative AI in Research Writing,the-great-ai-witch-hunt-reviewers-perception-and-mis-conception-of-generative-ai-in-research-writing,Article,Minor,❌,,HTML/Blog,,,,,,https://arxiv.org/abs/2407.12015,Press,Auto-Discovery,,,,2025-09-22
G2D2: Gradient-Guided Discrete Diffusion for Inverse Problem Solving,g2d2-gradient-guided-discrete-diffusion-for-inverse-problem-solving,Article,Minor,❌,,HTML/Blog,,,,,,https://arxiv.org/abs/2410.14710,Press,Auto-Discovery,,,,2025-09-22
"Who is Responsible When AI Fails? Mapping Causes, Entities, and Consequences of AI Privacy and Ethical Incidents",who-is-responsible-when-ai-fails-mapping-causes-entities-and-consequences-of-ai-privacy-and-ethical-incidents,Article,Minor,❌,,HTML/Blog,,,,,,https://arxiv.org/abs/2504.01029,Press,Auto-Discovery,,,,2025-09-22
ConCISE: Confidence-guided Compression in Step-by-step Efficient Reasoning,concise-confidence-guided-compression-in-step-by-step-efficient-reasoning,Article,Minor,❌,,HTML/Blog,,,,,,https://arxiv.org/abs/2505.04881,Press,Auto-Discovery,,,,2025-09-22
StreamBridge: Turning Your Offline Video Large Language Model into a Proactive Streaming Assistant,streambridge-turning-your-offline-video-large-language-model-into-a-proactive-streaming-assistant,Article,Minor,❌,,HTML/Blog,,,,,,https://arxiv.org/abs/2505.05467,Press,Auto-Discovery,,,,2025-09-22
Spatial Understanding from Videos: Structured Prompts Meet Simulation Data,spatial-understanding-from-videos-structured-prompts-meet-simulation-data,Article,Minor,❌,,HTML/Blog,,,,,,https://arxiv.org/abs/2506.03642,Press,Auto-Discovery,,,,2025-09-22
