Tool,Moniker,Category,Severity,RSS Available,Feed URL,Tracking Method,Repo URL,Repo Status,Stars,Contributors,Docs URL,Website URL,Source Type,Discovery Method,Launch Status,Last Seen Update,Status,Date Added
Enhancing Live Broadcast Engagement: A Multi-modal Approach to Short Video Recommendations Using MMGCN and User Preferences,enhancing-live-broadcast-engagement-a-multi-modal-approach-to-short-video-recommendations-using-mmgcn-and-user-preferences,Article,Minor,❌,,HTML/Blog,,,,,,https://arxiv.org/abs/2506.23085,Press,Auto-Discovery,,,,2025-09-23
Quantifying Student Success with Generative AI: A Monte Carlo Simulation Informed by Systematic Review,quantifying-student-success-with-generative-ai-a-monte-carlo-simulation-informed-by-systematic-review,Article,Minor,❌,,HTML/Blog,,,,,,https://arxiv.org/abs/2507.01062,Press,Auto-Discovery,,,,2025-09-23
AgentMaster: A Multi-Agent Conversational Framework Using A2A and MCP Protocols for Multimodal Information Retrieval and Analysis,agentmaster-a-multi-agent-conversational-framework-using-a2a-and-mcp-protocols-for-multimodal-information-retrieval-and-analysis,Article,Minor,❌,,HTML/Blog,,,,,,https://arxiv.org/abs/2507.21105,Press,Auto-Discovery,,,,2025-09-23
BlockA2A: Towards Secure and Verifiable Agent-to-Agent Interoperability,blocka2a-towards-secure-and-verifiable-agent-to-agent-interoperability,Article,Minor,❌,,HTML/Blog,,,,,,https://arxiv.org/abs/2508.01332,Press,Auto-Discovery,,,,2025-09-23
Agentic AI for Software: thoughts from Software Engineering community,agentic-ai-for-software-thoughts-from-software-engineering-community,Article,Minor,❌,,HTML/Blog,,,,,,https://arxiv.org/abs/2508.17343,Press,Auto-Discovery,,,,2025-09-23
DCA: Graph-Guided Deep Embedding Clustering for Brain Atlases,dca-graph-guided-deep-embedding-clustering-for-brain-atlases,Article,Minor,❌,,HTML/Blog,,,,,,https://arxiv.org/abs/2509.01426,Press,Auto-Discovery,,,,2025-09-23
"Show HN: Verdent – AI coding agent that plans, tests, and ships",show-hn-verdent-ai-coding-agent-that-plans-tests-and-ships,Article,Minor,❌,,HTML/Blog,,,,,,https://www.verdent.ai/,Press,Auto-Discovery,,,,2025-09-24
"Show HN: I made the fastest, ad-free way to download videos from X/Twitter",show-hn-i-made-the-fastest-ad-free-way-to-download-videos-from-x-twitter,Article,Minor,❌,,HTML/Blog,,,,,,https://xdownload.org/,Press,Auto-Discovery,,,,2025-09-24
Show HN: Interactive video that brings websites to life,show-hn-interactive-video-that-brings-websites-to-life,Article,Minor,❌,,HTML/Blog,,,,,,https://sisuvideo.fi,Press,Auto-Discovery,,,,2025-09-24
Show HN: I made a tool to automate the stupid but fun Family Guy dialogue videos,show-hn-i-made-a-tool-to-automate-the-stupid-but-fun-family-guy-dialogue-videos,Article,Minor,❌,,HTML/Blog,,,,,,https://explainerslop.xyz/,Press,Auto-Discovery,,,,2025-09-24
"Show HN: Blur Image Online – A free, client-side tool to blur images",show-hn-blur-image-online-a-free-client-side-tool-to-blur-images,Article,Minor,❌,,HTML/Blog,,,,,,https://www.blurimageonline.com/,Press,Auto-Discovery,,,,2025-09-24
The Impatient Programmer’s Guide to Bevy and Rust: Chapter 1 - Let There Be a Player,the-impatient-programmer-s-guide-to-bevy-and-rust-chapter-1-let-there-be-a-player,Article,Minor,❌,,HTML/Blog,,,,,,https://www.reddit.com/r/programming/comments/1np724v/the_impatient_programmers_guide_to_bevy_and_rust/,Press,Auto-Discovery,,,,2025-09-24
"Awash in revisionist histories about Apple's web efforts, a look at the evidence",awash-in-revisionist-histories-about-apple-s-web-efforts-a-look-at-the-evidence,Article,Minor,❌,,HTML/Blog,,,,,,https://www.reddit.com/r/programming/comments/1nomsqf/awash_in_revisionist_histories_about_apples_web/,Press,Auto-Discovery,,,,2025-09-24
"My second modified 3080 20GB from China , for local Ai inference , video and image generation..",my-second-modified-3080-20gb-from-china-for-local-ai-inference-video-and-image-generation,Article,Minor,❌,,HTML/Blog,,,,,,https://www.reddit.com/r/LocalLLaMA/comments/1np9rav/my_second_modified_3080_20gb_from_china_for_local/,Press,Auto-Discovery,,,,2025-09-24
"GitHub - shantur/jarvis-mcp: Bring your AI to life—talk to assistants instantly in your browser. Zero hasle, No API keys, No Whisper",github-shantur-jarvis-mcp-bring-your-ai-to-life-talk-to-assistants-instantly-in-your-browser-zero-hasle-no-api-keys-no-whisper,Article,Minor,❌,,HTML/Blog,,,,,,https://www.reddit.com/r/LocalLLaMA/comments/1np6qlc/github_shanturjarvismcp_bring_your_ai_to_lifetalk/,Press,Auto-Discovery,,,,2025-09-24
[D] Training smaller LLM for Agentic tasks.,d-training-smaller-llm-for-agentic-tasks,Article,Minor,❌,,HTML/Blog,,,,,,https://www.reddit.com/r/MachineLearning/comments/1np483r/d_training_smaller_llm_for_agentic_tasks/,Press,Auto-Discovery,,,,2025-09-24
"[P] SyGra: Graph-oriented framework for reproducible synthetic data pipelines (SFT, DPO, agents, multimodal)",p-sygra-graph-oriented-framework-for-reproducible-synthetic-data-pipelines-sft-dpo-agents-multimodal,Article,Minor,❌,,HTML/Blog,,,,,,https://www.reddit.com/r/MachineLearning/comments/1nok8yy/p_sygra_graphoriented_framework_for_reproducible/,Press,Auto-Discovery,,,,2025-09-24
The Verge&#8217;s Guide to Amazon&#8217;s October Prime Day Event 2025,the-verge-8217-s-guide-to-amazon-8217-s-october-prime-day-event-2025,Article,Minor,❌,,HTML/Blog,,,,,,https://www.theverge.com/tech/782478/october-amazon-prime-day-deals-guide,Press,Auto-Discovery,,,,2025-09-24
"The Download: accidental AI relationships, and the future of contraception",the-download-accidental-ai-relationships-and-the-future-of-contraception,Article,Minor,❌,,HTML/Blog,,,,,,https://www.technologyreview.com/2025/09/24/1124026/the-download-accidental-ai-relationships-and-future-contraception/,Press,Auto-Discovery,,,,2025-09-24
"The Good, the Bad and the Constructive: Automatically Measuring Peer Review's Utility for Authors",the-good-the-bad-and-the-constructive-automatically-measuring-peer-review-s-utility-for-authors,Article,Minor,❌,,HTML/Blog,,,,,,https://arxiv.org/abs/2509.04484,Press,Auto-Discovery,,,,2025-09-24
Show HN: Bloom – A Free Screen and Video Recording Software,show-hn-bloom-a-free-screen-and-video-recording-software,Article,Minor,❌,,HTML/Blog,,,,,,https://www.thepublic.dev/posts/bloom-new-ui,Press,Auto-Discovery,,,,2025-09-25
"Show HN: Notifications for Claude, Codex, Gemini, Droid and More CLI Agent",show-hn-notifications-for-claude-codex-gemini-droid-and-more-cli-agent,Article,Minor,❌,,HTML/Blog,,,,,,https://www.heyagent.dev/,Press,Auto-Discovery,,,,2025-09-25
"Show HN: Roundtable MCP Server to Use Claude, Cursor, Codex, Gemini from One UI",show-hn-roundtable-mcp-server-to-use-claude-cursor-codex-gemini-from-one-ui,Article,Minor,❌,,HTML/Blog,,,,,,https://github.com/askbudi/roundtable,Press,Auto-Discovery,,,,2025-09-25
Show HN: Building sub-100ms autocompletion for JetBrains IDEs,show-hn-building-sub-100ms-autocompletion-for-jetbrains-ides,Article,Minor,❌,,HTML/Blog,,,,,,https://blog.sweep.dev/posts/next-edit-jetbrains,Press,Auto-Discovery,,,,2025-09-25
Identity Types,identity-types,Article,Minor,❌,,HTML/Blog,,,,,,https://www.reddit.com/r/programming/comments/1npqebt/identity_types/,Press,Auto-Discovery,,,,2025-09-25
Automating Vercel Deploys on Private Repos (Workaround Idea),automating-vercel-deploys-on-private-repos-workaround-idea,Article,Minor,❌,,HTML/Blog,,,,,,https://www.reddit.com/r/programming/comments/1npxaag/automating_vercel_deploys_on_private_repos/,Press,Auto-Discovery,,,,2025-09-25
I built a tiny fully local AI agent for a Raspberry Pi,i-built-a-tiny-fully-local-ai-agent-for-a-raspberry-pi,Article,Minor,❌,,HTML/Blog,,,,,,https://www.reddit.com/r/LocalLLaMA/comments/1npo93e/i_built_a_tiny_fully_local_ai_agent_for_a/,Press,Auto-Discovery,,,,2025-09-25
A step by step guide on how to build a LLM from scratch,a-step-by-step-guide-on-how-to-build-a-llm-from-scratch,Article,Minor,❌,,HTML/Blog,,,,,,https://www.reddit.com/r/LocalLLaMA/comments/1npzstw/a_step_by_step_guide_on_how_to_build_a_llm_from/,Press,Auto-Discovery,,,,2025-09-25
Kimi Infra team releases K2 Vendor Verifier: an open‑source tool‑call validator for LLM providers,kimi-infra-team-releases-k2-vendor-verifier-an-open-source-tool-call-validator-for-llm-providers,Article,Minor,❌,,HTML/Blog,,,,,,https://www.reddit.com/r/LocalLLaMA/comments/1nq6hdq/kimi_infra_team_releases_k2_vendor_verifier_an/,Press,Auto-Discovery,,,,2025-09-25
New Agent benchmark from Meta Super Intelligence Lab and Hugging Face,new-agent-benchmark-from-meta-super-intelligence-lab-and-hugging-face,Article,Minor,❌,,HTML/Blog,,,,,,https://www.reddit.com/r/LocalLLaMA/comments/1nph3az/new_agent_benchmark_from_meta_super_intelligence/,Press,Auto-Discovery,,,,2025-09-25
Made a Lip synced video in a old Laptop,made-a-lip-synced-video-in-a-old-laptop,Article,Minor,❌,,HTML/Blog,,,,,,https://www.reddit.com/r/LocalLLaMA/comments/1npyvpf/made_a_lip_synced_video_in_a_old_laptop/,Press,Auto-Discovery,,,,2025-09-25
[P] Built a confidential AI inference pipeline using phala network - sharing performance benchmarks and lessons learned,p-built-a-confidential-ai-inference-pipeline-using-phala-network-sharing-performance-benchmarks-and-lessons-learned,Article,Minor,❌,,HTML/Blog,,,,,,https://www.reddit.com/r/MachineLearning/comments/1npkdzb/p_built_a_confidential_ai_inference_pipeline/,Press,Auto-Discovery,,,,2025-09-25
Nano Bio-Agents (NBA): Small Language Model Agents for Genomics,nano-bio-agents-nba-small-language-model-agents-for-genomics,Article,Minor,❌,,HTML/Blog,,,,,,https://arxiv.org/abs/2509.19566,Press,Auto-Discovery,,,,2025-09-25
SteinerSQL: Graph-Guided Mathematical Reasoning for Text-to-SQL Generation,steinersql-graph-guided-mathematical-reasoning-for-text-to-sql-generation,Article,Minor,❌,,HTML/Blog,,,,,,https://arxiv.org/abs/2509.19623,Press,Auto-Discovery,,,,2025-09-25
UserRL: Training Interactive User-Centric Agent via Reinforcement Learning,userrl-training-interactive-user-centric-agent-via-reinforcement-learning,Article,Minor,❌,,HTML/Blog,,,,,,https://arxiv.org/abs/2509.19736,Press,Auto-Discovery,,,,2025-09-25
"Agentic Metacognition: Designing a ""Self-Aware"" Low-Code Agent for Failure Prediction and Human Handoff",agentic-metacognition-designing-a-self-aware-low-code-agent-for-failure-prediction-and-human-handoff,Article,Minor,❌,,HTML/Blog,,,,,,https://arxiv.org/abs/2509.19783,Press,Auto-Discovery,,,,2025-09-25
MACD: Multi-Agent Clinical Diagnosis with Self-Learned Knowledge for LLM,macd-multi-agent-clinical-diagnosis-with-self-learned-knowledge-for-llm,Article,Minor,❌,,HTML/Blog,,,,,,https://arxiv.org/abs/2509.20067,Press,Auto-Discovery,,,,2025-09-25
Federation of Agents: A Semantics-Aware Communication Fabric for Large-Scale Agentic AI,federation-of-agents-a-semantics-aware-communication-fabric-for-large-scale-agentic-ai,Article,Minor,❌,,HTML/Blog,,,,,,https://arxiv.org/abs/2509.20175,Press,Auto-Discovery,,,,2025-09-25
Scan-do Attitude: Towards Autonomous CT Protocol Management using a Large Language Model Agent,scan-do-attitude-towards-autonomous-ct-protocol-management-using-a-large-language-model-agent,Article,Minor,❌,,HTML/Blog,,,,,,https://arxiv.org/abs/2509.20270,Press,Auto-Discovery,,,,2025-09-25
FHIR-AgentBench: Benchmarking LLM Agents for Realistic Interoperable EHR Question Answering,fhir-agentbench-benchmarking-llm-agents-for-realistic-interoperable-ehr-question-answering,Article,Minor,❌,,HTML/Blog,,,,,,https://arxiv.org/abs/2509.19319,Press,Auto-Discovery,,,,2025-09-25
Unveiling the Merits and Defects of LLMs in Automatic Review Generation for Scientific Papers,unveiling-the-merits-and-defects-of-llms-in-automatic-review-generation-for-scientific-papers,Article,Minor,❌,,HTML/Blog,,,,,,https://arxiv.org/abs/2509.19326,Press,Auto-Discovery,,,,2025-09-25
A systematic review of trial-matching pipelines using large language models,a-systematic-review-of-trial-matching-pipelines-using-large-language-models,Article,Minor,❌,,HTML/Blog,,,,,,https://arxiv.org/abs/2509.19327,Press,Auto-Discovery,,,,2025-09-25
SLM-Based Agentic AI with P-C-G: Optimized for Korean Tool Use,slm-based-agentic-ai-with-p-c-g-optimized-for-korean-tool-use,Article,Minor,❌,,HTML/Blog,,,,,,https://arxiv.org/abs/2509.19369,Press,Auto-Discovery,,,,2025-09-25
TimeMosaic: Temporal Heterogeneity Guided Time Series Forecasting via Adaptive Granularity Patch and Segment-wise Decoding,timemosaic-temporal-heterogeneity-guided-time-series-forecasting-via-adaptive-granularity-patch-and-segment-wise-decoding,Article,Minor,❌,,HTML/Blog,,,,,,https://arxiv.org/abs/2509.19406,Press,Auto-Discovery,,,,2025-09-25
"Identifying and Addressing User-level Security Concerns in Smart Homes Using ""Smaller"" LLMs",identifying-and-addressing-user-level-security-concerns-in-smart-homes-using-smaller-llms,Article,Minor,❌,,HTML/Blog,,,,,,https://arxiv.org/abs/2509.19485,Press,Auto-Discovery,,,,2025-09-25
The Heterogeneous Multi-Agent Challenge,the-heterogeneous-multi-agent-challenge,Article,Minor,❌,,HTML/Blog,,,,,,https://arxiv.org/abs/2509.19512,Press,Auto-Discovery,,,,2025-09-25
"Semantic-Aware Fuzzing: An Empirical Framework for LLM-Guided, Reasoning-Driven Input Mutation",semantic-aware-fuzzing-an-empirical-framework-for-llm-guided-reasoning-driven-input-mutation,Article,Minor,❌,,HTML/Blog,,,,,,https://arxiv.org/abs/2509.19533,Press,Auto-Discovery,,,,2025-09-25
"Knowledge Base-Aware Orchestration: A Dynamic, Privacy-Preserving Method for Multi-Agent Systems",knowledge-base-aware-orchestration-a-dynamic-privacy-preserving-method-for-multi-agent-systems,Article,Minor,❌,,HTML/Blog,,,,,,https://arxiv.org/abs/2509.19599,Press,Auto-Discovery,,,,2025-09-25
Intuition to Evidence: Measuring AI's True Impact on Developer Productivity,intuition-to-evidence-measuring-ai-s-true-impact-on-developer-productivity,Article,Minor,❌,,HTML/Blog,,,,,,https://arxiv.org/abs/2509.19708,Press,Auto-Discovery,,,,2025-09-25
Dynamicasome: a molecular dynamics-guided and AI-driven pathogenicity prediction catalogue for all genetic mutations,dynamicasome-a-molecular-dynamics-guided-and-ai-driven-pathogenicity-prediction-catalogue-for-all-genetic-mutations,Article,Minor,❌,,HTML/Blog,,,,,,https://arxiv.org/abs/2509.19766,Press,Auto-Discovery,,,,2025-09-25
PPGFlowECG: Latent Rectified Flow with Cross-Modal Encoding for PPG-Guided ECG Generation and Cardiovascular Disease Detection,ppgflowecg-latent-rectified-flow-with-cross-modal-encoding-for-ppg-guided-ecg-generation-and-cardiovascular-disease-detection,Article,Minor,❌,,HTML/Blog,,,,,,https://arxiv.org/abs/2509.19774,Press,Auto-Discovery,,,,2025-09-25
RDAR: Reward-Driven Agent Relevance Estimation for Autonomous Driving,rdar-reward-driven-agent-relevance-estimation-for-autonomous-driving,Article,Minor,❌,,HTML/Blog,,,,,,https://arxiv.org/abs/2509.19789,Press,Auto-Discovery,,,,2025-09-25
When Words Can't Capture It All: Towards Video-Based User Complaint Text Generation with Multimodal Video Complaint Dataset,when-words-can-t-capture-it-all-towards-video-based-user-complaint-text-generation-with-multimodal-video-complaint-dataset,Article,Minor,❌,,HTML/Blog,,,,,,https://arxiv.org/abs/2509.19952,Press,Auto-Discovery,,,,2025-09-25
Generative Adversarial Networks Applied for Privacy Preservation in Biometric-Based Authentication and Identification,generative-adversarial-networks-applied-for-privacy-preservation-in-biometric-based-authentication-and-identification,Article,Minor,❌,,HTML/Blog,,,,,,https://arxiv.org/abs/2509.20024,Press,Auto-Discovery,,,,2025-09-25
Automated Multi-Agent Workflows for RTL Design,automated-multi-agent-workflows-for-rtl-design,Article,Minor,❌,,HTML/Blog,,,,,,https://arxiv.org/abs/2509.20182,Press,Auto-Discovery,,,,2025-09-25
Beyond Sharp Minima: Robust LLM Unlearning via Feedback-Guided Multi-Point Optimization,beyond-sharp-minima-robust-llm-unlearning-via-feedback-guided-multi-point-optimization,Article,Minor,❌,,HTML/Blog,,,,,,https://arxiv.org/abs/2509.20230,Press,Auto-Discovery,,,,2025-09-25
PGCLODA: Prompt-Guided Graph Contrastive Learning for Oligopeptide-Infectious Disease Association Prediction,pgcloda-prompt-guided-graph-contrastive-learning-for-oligopeptide-infectious-disease-association-prediction,Article,Minor,❌,,HTML/Blog,,,,,,https://arxiv.org/abs/2509.20290,Press,Auto-Discovery,,,,2025-09-25
Video models are zero-shot learners and reasoners,video-models-are-zero-shot-learners-and-reasoners,Article,Minor,❌,,HTML/Blog,,,,,,https://arxiv.org/abs/2509.20328,Press,Auto-Discovery,,,,2025-09-25
Adaptive Event-Triggered Policy Gradient for Multi-Agent Reinforcement Learning,adaptive-event-triggered-policy-gradient-for-multi-agent-reinforcement-learning,Article,Minor,❌,,HTML/Blog,,,,,,https://arxiv.org/abs/2509.20338,Press,Auto-Discovery,,,,2025-09-25
Tree Search for Language Model Agents,tree-search-for-language-model-agents,Article,Minor,❌,,HTML/Blog,,,,,,https://arxiv.org/abs/2407.01476,Press,Auto-Discovery,,,,2025-09-25
Reinforcement Learning and Machine ethics:a systematic review,reinforcement-learning-and-machine-ethics-a-systematic-review,Article,Minor,❌,,HTML/Blog,,,,,,https://arxiv.org/abs/2407.02425,Press,Auto-Discovery,,,,2025-09-25
Multi-Agents are Social Groups: Investigating Social Influence of Multiple Agents in Human-Agent Interactions,multi-agents-are-social-groups-investigating-social-influence-of-multiple-agents-in-human-agent-interactions,Article,Minor,❌,,HTML/Blog,,,,,,https://arxiv.org/abs/2411.04578,Press,Auto-Discovery,,,,2025-09-25
AutoEval: A Practical Framework for Autonomous Evaluation of Mobile Agents,autoeval-a-practical-framework-for-autonomous-evaluation-of-mobile-agents,Article,Minor,❌,,HTML/Blog,,,,,,https://arxiv.org/abs/2503.02403,Press,Auto-Discovery,,,,2025-09-25
Exploring Explainable Multi-agent MCTS-minimax Hybrids in Board Game Using Process Mining,exploring-explainable-multi-agent-mcts-minimax-hybrids-in-board-game-using-process-mining,Article,Minor,❌,,HTML/Blog,,,,,,https://arxiv.org/abs/2503.23326,Press,Auto-Discovery,,,,2025-09-25
Multi-Modal Artificial Intelligence of Embryo Grading and Pregnancy Prediction in Assisted Reproductive Technology: A Review,multi-modal-artificial-intelligence-of-embryo-grading-and-pregnancy-prediction-in-assisted-reproductive-technology-a-review,Article,Minor,❌,,HTML/Blog,,,,,,https://arxiv.org/abs/2505.20306,Press,Auto-Discovery,,,,2025-09-25
Emergent Risk Awareness in Rational Agents under Resource Constraints,emergent-risk-awareness-in-rational-agents-under-resource-constraints,Article,Minor,❌,,HTML/Blog,,,,,,https://arxiv.org/abs/2505.23436,Press,Auto-Discovery,,,,2025-09-25
Plan Verification for LLM-Based Embodied Task Completion Agents,plan-verification-for-llm-based-embodied-task-completion-agents,Article,Minor,❌,,HTML/Blog,,,,,,https://arxiv.org/abs/2509.02761,Press,Auto-Discovery,,,,2025-09-25
"VLM See, Robot Do: Human Demo Video to Robot Action Plan via Vision Language Model",vlm-see-robot-do-human-demo-video-to-robot-action-plan-via-vision-language-model,Article,Minor,❌,,HTML/Blog,,,,,,https://arxiv.org/abs/2410.08792,Press,Auto-Discovery,,,,2025-09-25
Diffusion Curriculum: Synthetic-to-Real Generative Curriculum Learning via Image-Guided Diffusion,diffusion-curriculum-synthetic-to-real-generative-curriculum-learning-via-image-guided-diffusion,Article,Minor,❌,,HTML/Blog,,,,,,https://arxiv.org/abs/2410.13674,Press,Auto-Discovery,,,,2025-09-25
Stepwise Guided Policy Optimization: Coloring your Incorrect Reasoning in GRPO,stepwise-guided-policy-optimization-coloring-your-incorrect-reasoning-in-grpo,Article,Minor,❌,,HTML/Blog,,,,,,https://arxiv.org/abs/2505.11595,Press,Auto-Discovery,,,,2025-09-25
CellCLIP -- Learning Perturbation Effects in Cell Painting via Text-Guided Contrastive Learning,cellclip-learning-perturbation-effects-in-cell-painting-via-text-guided-contrastive-learning,Article,Minor,❌,,HTML/Blog,,,,,,https://arxiv.org/abs/2506.06290,Press,Auto-Discovery,,,,2025-09-25
SurgVidLM: Towards Multi-grained Surgical Video Understanding with Large Language Model,surgvidlm-towards-multi-grained-surgical-video-understanding-with-large-language-model,Article,Minor,❌,,HTML/Blog,,,,,,https://arxiv.org/abs/2506.17873,Press,Auto-Discovery,,,,2025-09-25
HAZEMATCHING: Dehazing Light Microscopy Images with Guided Conditional Flow Matching,hazematching-dehazing-light-microscopy-images-with-guided-conditional-flow-matching,Article,Minor,❌,,HTML/Blog,,,,,,https://arxiv.org/abs/2506.22397,Press,Auto-Discovery,,,,2025-09-25
VisualTrap: A Stealthy Backdoor Attack on GUI Agents via Visual Grounding Manipulation,visualtrap-a-stealthy-backdoor-attack-on-gui-agents-via-visual-grounding-manipulation,Article,Minor,❌,,HTML/Blog,,,,,,https://arxiv.org/abs/2507.06899,Press,Auto-Discovery,,,,2025-09-25
CANDLE: A Cross-Modal Agentic Knowledge Distillation Framework for Interpretable Sarcopenia Diagnosis,candle-a-cross-modal-agentic-knowledge-distillation-framework-for-interpretable-sarcopenia-diagnosis,Article,Minor,❌,,HTML/Blog,,,,,,https://arxiv.org/abs/2507.21179,Press,Auto-Discovery,,,,2025-09-25
Measuring Harmfulness of Computer-Using Agents,measuring-harmfulness-of-computer-using-agents,Article,Minor,❌,,HTML/Blog,,,,,,https://arxiv.org/abs/2508.00935,Press,Auto-Discovery,,,,2025-09-25
COLT: Enhancing Video Large Language Models with Continual Tool Usage,colt-enhancing-video-large-language-models-with-continual-tool-usage,Article,Minor,❌,,HTML/Blog,,,,,,https://arxiv.org/abs/2509.18754,Press,Auto-Discovery,,,,2025-09-25
Show HN: VenturePulse – AI platform for idea validation,show-hn-venturepulse-ai-platform-for-idea-validation,Article,Minor,❌,,HTML/Blog,,,,,,https://venturepulse.app,Press,Auto-Discovery,,,,2025-09-26
Show HN: Collection of Steam games with zero reviews,show-hn-collection-of-steam-games-with-zero-reviews,Article,Minor,❌,,HTML/Blog,,,,,,https://www.gameswithnoreviews.com/?hn,Press,Auto-Discovery,,,,2025-09-26
How good are automated coding agents at building complex systems?,how-good-are-automated-coding-agents-at-building-complex-systems,Article,Minor,❌,,HTML/Blog,,,,,,https://www.reddit.com/r/programming/comments/1nqyfxv/how_good_are_automated_coding_agents_at_building/,Press,Auto-Discovery,,,,2025-09-26
"Apparently all third party providers downgrade, none of them provide a max quality model",apparently-all-third-party-providers-downgrade-none-of-them-provide-a-max-quality-model,Article,Minor,❌,,HTML/Blog,,,,,,https://www.reddit.com/r/LocalLLaMA/comments/1nqkx7o/apparently_all_third_party_providers_downgrade/,Press,Auto-Discovery,,,,2025-09-26
InfiniteTalk — open-source sparse-frame video dubbing (lip + head/body sync),infinitetalk-open-source-sparse-frame-video-dubbing-lip-head-body-sync,Article,Minor,❌,,HTML/Blog,,,,,,https://www.reddit.com/r/LocalLLaMA/comments/1nr020h/infinitetalk_opensource_sparseframe_video_dubbing/,Press,Auto-Discovery,,,,2025-09-26
OrKa quickstart: run a traceable multi agent workflow in under 2 minutes,orka-quickstart-run-a-traceable-multi-agent-workflow-in-under-2-minutes,Article,Minor,❌,,HTML/Blog,,,,,,https://www.reddit.com/r/LocalLLaMA/comments/1nqzdit/orka_quickstart_run_a_traceable_multi_agent/,Press,Auto-Discovery,,,,2025-09-26
"Meta launches ‘Vibes,’ a short-form video feed of AI slop",meta-launches-vibes-a-short-form-video-feed-of-ai-slop,Article,Minor,❌,,HTML/Blog,,,,,,https://techcrunch.com/2025/09/25/meta-launches-vibes-a-short-form-video-feed-of-ai-slop/,Press,Auto-Discovery,,,,2025-09-26
An Approach to Checking Correctness for Agentic Systems,an-approach-to-checking-correctness-for-agentic-systems,Article,Minor,❌,,HTML/Blog,,,,,,https://arxiv.org/abs/2509.20364,Press,Auto-Discovery,,,,2025-09-26
InsightGUIDE: An Opinionated AI Assistant for Guided Critical Reading of Scientific Literature,insightguide-an-opinionated-ai-assistant-for-guided-critical-reading-of-scientific-literature,Article,Minor,❌,,HTML/Blog,,,,,,https://arxiv.org/abs/2509.20493,Press,Auto-Discovery,,,,2025-09-26
SAMULE: Self-Learning Agents Enhanced by Multi-level Reflection,samule-self-learning-agents-enhanced-by-multi-level-reflection,Article,Minor,❌,,HTML/Blog,,,,,,https://arxiv.org/abs/2509.20562,Press,Auto-Discovery,,,,2025-09-26
Adaptive Cybersecurity Architecture for Digital Product Ecosystems Using Agentic AI,adaptive-cybersecurity-architecture-for-digital-product-ecosystems-using-agentic-ai,Article,Minor,❌,,HTML/Blog,,,,,,https://arxiv.org/abs/2509.20640,Press,Auto-Discovery,,,,2025-09-26
Fairy: Interactive Mobile Assistant to Real-world Tasks via LMM-based Multi-agent,fairy-interactive-mobile-assistant-to-real-world-tasks-via-lmm-based-multi-agent,Article,Minor,❌,,HTML/Blog,,,,,,https://arxiv.org/abs/2509.20729,Press,Auto-Discovery,,,,2025-09-26
DeFacto: Counterfactual Thinking with Images for Enforcing Evidence-Grounded and Faithful Reasoning,defacto-counterfactual-thinking-with-images-for-enforcing-evidence-grounded-and-faithful-reasoning,Article,Minor,❌,,HTML/Blog,,,,,,https://arxiv.org/abs/2509.20912,Press,Auto-Discovery,,,,2025-09-26
GALAX: Graph-Augmented Language Model for Explainable Reinforcement-Guided Subgraph Reasoning in Precision Medicine,galax-graph-augmented-language-model-for-explainable-reinforcement-guided-subgraph-reasoning-in-precision-medicine,Article,Minor,❌,,HTML/Blog,,,,,,https://arxiv.org/abs/2509.20935,Press,Auto-Discovery,,,,2025-09-26
Beyond Stars: Bridging the Gap Between Ratings and Review Sentiment with LLM,beyond-stars-bridging-the-gap-between-ratings-and-review-sentiment-with-llm,Article,Minor,❌,,HTML/Blog,,,,,,https://arxiv.org/abs/2509.20953,Press,Auto-Discovery,,,,2025-09-26
