Tool,Moniker,Category,Severity,RSS Available,Feed URL,Tracking Method,Repo URL,Repo Status,Stars,Contributors,Docs URL,Website URL,Source Type,Discovery Method,Launch Status,Last Seen Update,Status,Date Added
LinearizeLLM: An Agent-Based Framework for LLM-Driven Exact Linear Reformulation of Nonlinear Optimization Problems,linearizellm-an-agent-based-framework-for-llm-driven-exact-linear-reformulation-of-nonlinear-optimization-problems,Article,Minor,❌,,HTML/Blog,,,,,,https://arxiv.org/abs/2510.15969,Press,Auto-Discovery,,,,2025-10-21
Bolster Hallucination Detection via Prompt-Guided Data Augmentation,bolster-hallucination-detection-via-prompt-guided-data-augmentation,Article,Minor,❌,,HTML/Blog,,,,,,https://arxiv.org/abs/2510.15977,Press,Auto-Discovery,,,,2025-10-21
MCP Security Bench (MSB): Benchmarking Attacks Against Model Context Protocol in LLM Agents,mcp-security-bench-msb-benchmarking-attacks-against-model-context-protocol-in-llm-agents,Article,Minor,❌,,HTML/Blog,,,,,,https://arxiv.org/abs/2510.15994,Press,Auto-Discovery,,,,2025-10-21
Disaster Management in the Era of Agentic AI Systems: A Vision for Collective Human-Machine Intelligence for Augmented Resilience,disaster-management-in-the-era-of-agentic-ai-systems-a-vision-for-collective-human-machine-intelligence-for-augmented-resilience,Article,Minor,❌,,HTML/Blog,,,,,,https://arxiv.org/abs/2510.16034,Press,Auto-Discovery,,,,2025-10-21
EvolveR: Self-Evolving LLM Agents through an Experience-Driven Lifecycle,evolver-self-evolving-llm-agents-through-an-experience-driven-lifecycle,Article,Minor,❌,,HTML/Blog,,,,,,https://arxiv.org/abs/2510.16079,Press,Auto-Discovery,,,,2025-10-21
TriAgent: Automated Biomarker Discovery with Deep Research Grounding for Triage in Acute Care by LLM-Based Multi-Agent Collaboration,triagent-automated-biomarker-discovery-with-deep-research-grounding-for-triage-in-acute-care-by-llm-based-multi-agent-collaboration,Article,Minor,❌,,HTML/Blog,,,,,,https://arxiv.org/abs/2510.16080,Press,Auto-Discovery,,,,2025-10-21
Interpretable RNA-Seq Clustering with an LLM-Based Agentic Evidence-Grounded Framework,interpretable-rna-seq-clustering-with-an-llm-based-agentic-evidence-grounded-framework,Article,Minor,❌,,HTML/Blog,,,,,,https://arxiv.org/abs/2510.16082,Press,Auto-Discovery,,,,2025-10-21
MoPHES:Leveraging on-device LLMs as Agent for Mobile Psychological Health Evaluation and Support,mophes-leveraging-on-device-llms-as-agent-for-mobile-psychological-health-evaluation-and-support,Article,Minor,❌,,HTML/Blog,,,,,,https://arxiv.org/abs/2510.16085,Press,Auto-Discovery,,,,2025-10-21
Evaluating Prompting Strategies and Large Language Models in Systematic Literature Review Screening: Relevance and Task-Stage Classification,evaluating-prompting-strategies-and-large-language-models-in-systematic-literature-review-screening-relevance-and-task-stage-classification,Article,Minor,❌,,HTML/Blog,,,,,,https://arxiv.org/abs/2510.16091,Press,Auto-Discovery,,,,2025-10-21
GuideFlow3D: Optimization-Guided Rectified Flow For Appearance Transfer,guideflow3d-optimization-guided-rectified-flow-for-appearance-transfer,Article,Minor,❌,,HTML/Blog,,,,,,https://arxiv.org/abs/2510.16136,Press,Auto-Discovery,,,,2025-10-21
Agentic AI for Ultra-Modern Networks: Multi-Agent Framework for RAN Autonomy and Assurance,agentic-ai-for-ultra-modern-networks-multi-agent-framework-for-ran-autonomy-and-assurance,Article,Minor,❌,,HTML/Blog,,,,,,https://arxiv.org/abs/2510.16144,Press,Auto-Discovery,,,,2025-10-21
AsyncVoice Agent: Real-Time Explanation for LLM Planning and Reasoning,asyncvoice-agent-real-time-explanation-for-llm-planning-and-reasoning,Article,Minor,❌,,HTML/Blog,,,,,,https://arxiv.org/abs/2510.16156,Press,Auto-Discovery,,,,2025-10-21
SentinelNet: Safeguarding Multi-Agent Collaboration Through Credit-Based Dynamic Threat Detection,sentinelnet-safeguarding-multi-agent-collaboration-through-credit-based-dynamic-threat-detection,Article,Minor,❌,,HTML/Blog,,,,,,https://arxiv.org/abs/2510.16219,Press,Auto-Discovery,,,,2025-10-21
Detecting Adversarial Fine-tuning with Auditing Agents,detecting-adversarial-fine-tuning-with-auditing-agents,Article,Minor,❌,,HTML/Blog,,,,,,https://arxiv.org/abs/2510.16255,Press,Auto-Discovery,,,,2025-10-21
NEBULA: Do We Evaluate Vision-Language-Action Agents Correctly?,nebula-do-we-evaluate-vision-language-action-agents-correctly,Article,Minor,❌,,HTML/Blog,,,,,,https://arxiv.org/abs/2510.16263,Press,Auto-Discovery,,,,2025-10-21
"Cataract-LMM: Large-Scale, Multi-Source, Multi-Task Benchmark for Deep Learning in Surgical Video Analysis",cataract-lmm-large-scale-multi-source-multi-task-benchmark-for-deep-learning-in-surgical-video-analysis,Article,Minor,❌,,HTML/Blog,,,,,,https://arxiv.org/abs/2510.16371,Press,Auto-Discovery,,,,2025-10-21
ATA: A Neuro-Symbolic Approach to Implement Autonomous and Trustworthy Agents,ata-a-neuro-symbolic-approach-to-implement-autonomous-and-trustworthy-agents,Article,Minor,❌,,HTML/Blog,,,,,,https://arxiv.org/abs/2510.16381,Press,Auto-Discovery,,,,2025-10-21
EDVD-LLaMA: Explainable Deepfake Video Detection via Multimodal Large Language Model Reasoning,edvd-llama-explainable-deepfake-video-detection-via-multimodal-large-language-model-reasoning,Article,Minor,❌,,HTML/Blog,,,,,,https://arxiv.org/abs/2510.16442,Press,Auto-Discovery,,,,2025-10-21
Automated Composition of Agents: A Knapsack Approach for Agentic Component Selection,automated-composition-of-agents-a-knapsack-approach-for-agentic-component-selection,Article,Minor,❌,,HTML/Blog,,,,,,https://arxiv.org/abs/2510.16499,Press,Auto-Discovery,,,,2025-10-21
Prompt Optimization via Retrieved Reasoning Assets and Multi-Agent Analysis,prompt-optimization-via-retrieved-reasoning-assets-and-multi-agent-analysis,Article,Minor,❌,,HTML/Blog,,,,,,https://arxiv.org/abs/2510.16635,Press,Auto-Discovery,,,,2025-10-21
Unleashing Diverse Thinking Modes in LLMs through Multi-Agent Collaboration,unleashing-diverse-thinking-modes-in-llms-through-multi-agent-collaboration,Article,Minor,❌,,HTML/Blog,,,,,,https://arxiv.org/abs/2510.16645,Press,Auto-Discovery,,,,2025-10-21
On the Granularity of Causal Effect Identifiability,on-the-granularity-of-causal-effect-identifiability,Article,Minor,❌,,HTML/Blog,,,,,,https://arxiv.org/abs/2510.16703,Press,Auto-Discovery,,,,2025-10-21
Natural Language Processing Applications in Cardiology: A Narrative Review,natural-language-processing-applications-in-cardiology-a-narrative-review,Article,Minor,❌,,HTML/Blog,,,,,,https://arxiv.org/abs/2510.16708,Press,Auto-Discovery,,,,2025-10-21
Learning to play: A Multimodal Agent for 3D Game-Play,learning-to-play-a-multimodal-agent-for-3d-game-play,Article,Minor,❌,,HTML/Blog,,,,,,https://arxiv.org/abs/2510.16774,Press,Auto-Discovery,,,,2025-10-21
Xiaoice: Training-Free Video Understanding via Self-Supervised Spatio-Temporal Clustering of Semantic Features,xiaoice-training-free-video-understanding-via-self-supervised-spatio-temporal-clustering-of-semantic-features,Article,Minor,❌,,HTML/Blog,,,,,,https://arxiv.org/abs/2510.16781,Press,Auto-Discovery,,,,2025-10-21
More with Less: An Empirical Study of Turn-Control Strategies for Efficient Coding Agents,more-with-less-an-empirical-study-of-turn-control-strategies-for-efficient-coding-agents,Article,Minor,❌,,HTML/Blog,,,,,,https://arxiv.org/abs/2510.16786,Press,Auto-Discovery,,,,2025-10-21
Agentic Inequality,agentic-inequality,Article,Minor,❌,,HTML/Blog,,,,,,https://arxiv.org/abs/2510.16853,Press,Auto-Discovery,,,,2025-10-21
Peering Inside the Black Box: Uncovering LLM Errors in Optimization Modelling through Component-Level Evaluation,peering-inside-the-black-box-uncovering-llm-errors-in-optimization-modelling-through-component-level-evaluation,Article,Minor,❌,,HTML/Blog,,,,,,https://arxiv.org/abs/2510.16943,Press,Auto-Discovery,,,,2025-10-21
Foundation Models in Medical Image Analysis: A Systematic Review and Meta-Analysis,foundation-models-in-medical-image-analysis-a-systematic-review-and-meta-analysis,Article,Minor,❌,,HTML/Blog,,,,,,https://arxiv.org/abs/2510.16973,Press,Auto-Discovery,,,,2025-10-21
ReclAIm: A multi-agent framework for degradation-aware performance tuning of medical imaging AI,reclaim-a-multi-agent-framework-for-degradation-aware-performance-tuning-of-medical-imaging-ai,Article,Minor,❌,,HTML/Blog,,,,,,https://arxiv.org/abs/2510.17004,Press,Auto-Discovery,,,,2025-10-21
Video Reasoning without Training,video-reasoning-without-training,Article,Minor,❌,,HTML/Blog,,,,,,https://arxiv.org/abs/2510.17045,Press,Auto-Discovery,,,,2025-10-21
Can Transformer Memory Be Corrupted? Investigating Cache-Side Vulnerabilities in Large Language Models,can-transformer-memory-be-corrupted-investigating-cache-side-vulnerabilities-in-large-language-models,Article,Minor,❌,,HTML/Blog,,,,,,https://arxiv.org/abs/2510.17098,Press,Auto-Discovery,,,,2025-10-21
Verification-Aware Planning for Multi-Agent Systems,verification-aware-planning-for-multi-agent-systems,Article,Minor,❌,,HTML/Blog,,,,,,https://arxiv.org/abs/2510.17109,Press,Auto-Discovery,,,,2025-10-21
GOOD: Training-Free Guided Diffusion Sampling for Out-of-Distribution Detection,good-training-free-guided-diffusion-sampling-for-out-of-distribution-detection,Article,Minor,❌,,HTML/Blog,,,,,,https://arxiv.org/abs/2510.17131,Press,Auto-Discovery,,,,2025-10-21
Round Outcome Prediction in VALORANT Using Tactical Features from Video Analysis,round-outcome-prediction-in-valorant-using-tactical-features-from-video-analysis,Article,Minor,❌,,HTML/Blog,,,,,,https://arxiv.org/abs/2510.17199,Press,Auto-Discovery,,,,2025-10-21
Optimizing Energy Management of Smart Grid using Reinforcement Learning aided by Surrogate models built using Physics-informed Neural Networks,optimizing-energy-management-of-smart-grid-using-reinforcement-learning-aided-by-surrogate-models-built-using-physics-informed-neural-networks,Article,Minor,❌,,HTML/Blog,,,,,,https://arxiv.org/abs/2510.17380,Press,Auto-Discovery,,,,2025-10-21
Context-Aware Pseudo-Label Scoring for Zero-Shot Video Summarization,context-aware-pseudo-label-scoring-for-zero-shot-video-summarization,Article,Minor,❌,,HTML/Blog,,,,,,https://arxiv.org/abs/2510.17501,Press,Auto-Discovery,,,,2025-10-21
MUG-V 10B: High-efficiency Training Pipeline for Large Video Generation Models,mug-v-10b-high-efficiency-training-pipeline-for-large-video-generation-models,Article,Minor,❌,,HTML/Blog,,,,,,https://arxiv.org/abs/2510.17519,Press,Auto-Discovery,,,,2025-10-21
GUIDE: Enhancing Gradient Inversion Attacks in Federated Learning with Denoising Models,guide-enhancing-gradient-inversion-attacks-in-federated-learning-with-denoising-models,Article,Minor,❌,,HTML/Blog,,,,,,https://arxiv.org/abs/2510.17621,Press,Auto-Discovery,,,,2025-10-21
MT-Video-Bench: A Holistic Video Understanding Benchmark for Evaluating Multimodal LLMs in Multi-Turn Dialogues,mt-video-bench-a-holistic-video-understanding-benchmark-for-evaluating-multimodal-llms-in-multi-turn-dialogues,Article,Minor,❌,,HTML/Blog,,,,,,https://arxiv.org/abs/2510.17722,Press,Auto-Discovery,,,,2025-10-21
Enterprise Deep Research: Steerable Multi-Agent Deep Research for Enterprise Analytics,enterprise-deep-research-steerable-multi-agent-deep-research-for-enterprise-analytics,Article,Minor,❌,,HTML/Blog,,,,,,https://arxiv.org/abs/2510.17797,Press,Auto-Discovery,,,,2025-10-21
Whose Journey Matters? Investigating Identity Biases in Large Language Models (LLMs) for Travel Planning Assistance,whose-journey-matters-investigating-identity-biases-in-large-language-models-llms-for-travel-planning-assistance,Article,Minor,❌,,HTML/Blog,,,,,,https://arxiv.org/abs/2410.17333,Press,Auto-Discovery,,,,2025-10-21
Fully Autonomous AI Agents Should Not be Developed,fully-autonomous-ai-agents-should-not-be-developed,Article,Minor,❌,,HTML/Blog,,,,,,https://arxiv.org/abs/2502.02649,Press,Auto-Discovery,,,,2025-10-21
AgentAuditor: Human-Level Safety and Security Evaluation for LLM Agents,agentauditor-human-level-safety-and-security-evaluation-for-llm-agents,Article,Minor,❌,,HTML/Blog,,,,,,https://arxiv.org/abs/2506.00641,Press,Auto-Discovery,,,,2025-10-21
General agents contain world models,general-agents-contain-world-models,Article,Minor,❌,,HTML/Blog,,,,,,https://arxiv.org/abs/2506.01622,Press,Auto-Discovery,,,,2025-10-21
macOSWorld: A Multilingual Interactive Benchmark for GUI Agents,macosworld-a-multilingual-interactive-benchmark-for-gui-agents,Article,Minor,❌,,HTML/Blog,,,,,,https://arxiv.org/abs/2506.04135,Press,Auto-Discovery,,,,2025-10-21
The Gauss-Markov Adjunction Provides Categorical Semantics of Residuals in Supervised Learning,the-gauss-markov-adjunction-provides-categorical-semantics-of-residuals-in-supervised-learning,Article,Minor,❌,,HTML/Blog,,,,,,https://arxiv.org/abs/2507.02442,Press,Auto-Discovery,,,,2025-10-21
LLM Collaboration With Multi-Agent Reinforcement Learning,llm-collaboration-with-multi-agent-reinforcement-learning,Article,Minor,❌,,HTML/Blog,,,,,,https://arxiv.org/abs/2508.04652,Press,Auto-Discovery,,,,2025-10-21
Agentic System with Modal Logic for Autonomous Diagnostics,agentic-system-with-modal-logic-for-autonomous-diagnostics,Article,Minor,❌,,HTML/Blog,,,,,,https://arxiv.org/abs/2509.11943,Press,Auto-Discovery,,,,2025-10-21
Programmable Cognitive Bias in Social Agents,programmable-cognitive-bias-in-social-agents,Article,Minor,❌,,HTML/Blog,,,,,,https://arxiv.org/abs/2509.13588,Press,Auto-Discovery,,,,2025-10-21
DualTune: Decoupled Fine-Tuning for On-Device Agentic Systems,dualtune-decoupled-fine-tuning-for-on-device-agentic-systems,Article,Minor,❌,,HTML/Blog,,,,,,https://arxiv.org/abs/2510.00229,Press,Auto-Discovery,,,,2025-10-21
Familiarity-Aware Evidence Compression for Retrieval-Augmented Generation,familiarity-aware-evidence-compression-for-retrieval-augmented-generation,Article,Minor,❌,,HTML/Blog,,,,,,https://arxiv.org/abs/2409.12468,Press,Auto-Discovery,,,,2025-10-21
An Empirical Study on LLM-based Agents for Automated Bug Fixing,an-empirical-study-on-llm-based-agents-for-automated-bug-fixing,Article,Minor,❌,,HTML/Blog,,,,,,https://arxiv.org/abs/2411.10213,Press,Auto-Discovery,,,,2025-10-21
Free$^2$Guide: Training-Free Text-to-Video Alignment using Image LVLM,free-2-guide-training-free-text-to-video-alignment-using-image-lvlm,Article,Minor,❌,,HTML/Blog,,,,,,https://arxiv.org/abs/2411.17041,Press,Auto-Discovery,,,,2025-10-21
Seeing in the Dark: A Teacher-Student Framework for Dark Video Action Recognition via Knowledge Distillation and Contrastive Learning,seeing-in-the-dark-a-teacher-student-framework-for-dark-video-action-recognition-via-knowledge-distillation-and-contrastive-learning,Article,Minor,❌,,HTML/Blog,,,,,,https://arxiv.org/abs/2502.03724,Press,Auto-Discovery,,,,2025-10-21
Towards Principled Unsupervised Multi-Agent Reinforcement Learning,towards-principled-unsupervised-multi-agent-reinforcement-learning,Article,Minor,❌,,HTML/Blog,,,,,,https://arxiv.org/abs/2502.08365,Press,Auto-Discovery,,,,2025-10-21
Cross-Domain Graph Anomaly Detection via Test-Time Training with Homophily-Guided Self-Supervision,cross-domain-graph-anomaly-detection-via-test-time-training-with-homophily-guided-self-supervision,Article,Minor,❌,,HTML/Blog,,,,,,https://arxiv.org/abs/2502.14293,Press,Auto-Discovery,,,,2025-10-21
CodeVisionary: An Agent-based Framework for Evaluating Large Language Models in Code Generation,codevisionary-an-agent-based-framework-for-evaluating-large-language-models-in-code-generation,Article,Minor,❌,,HTML/Blog,,,,,,https://arxiv.org/abs/2504.13472,Press,Auto-Discovery,,,,2025-10-21
RocqStar: Leveraging Similarity-driven Retrieval and Agentic Systems for Rocq generation,rocqstar-leveraging-similarity-driven-retrieval-and-agentic-systems-for-rocq-generation,Article,Minor,❌,,HTML/Blog,,,,,,https://arxiv.org/abs/2505.22846,Press,Auto-Discovery,,,,2025-10-21
From Cradle to Cane: A Two-Pass Framework for High-Fidelity Lifespan Face Aging,from-cradle-to-cane-a-two-pass-framework-for-high-fidelity-lifespan-face-aging,Article,Minor,❌,,HTML/Blog,,,,,,https://arxiv.org/abs/2506.20977,Press,Auto-Discovery,,,,2025-10-21
AI-Generated Video Detection via Perceptual Straightening,ai-generated-video-detection-via-perceptual-straightening,Article,Minor,❌,,HTML/Blog,,,,,,https://arxiv.org/abs/2507.00583,Press,Auto-Discovery,,,,2025-10-21
SketchMind: A Multi-Agent Cognitive Framework for Assessing Student-Drawn Scientific Sketches,sketchmind-a-multi-agent-cognitive-framework-for-assessing-student-drawn-scientific-sketches,Article,Minor,❌,,HTML/Blog,,,,,,https://arxiv.org/abs/2507.22904,Press,Auto-Discovery,,,,2025-10-21
VimoRAG: Video-based Retrieval-augmented 3D Motion Generation for Motion Language Models,vimorag-video-based-retrieval-augmented-3d-motion-generation-for-motion-language-models,Article,Minor,❌,,HTML/Blog,,,,,,https://arxiv.org/abs/2508.12081,Press,Auto-Discovery,,,,2025-10-21
A Survey of Scientific Large Language Models: From Data Foundations to Agent Frontiers,a-survey-of-scientific-large-language-models-from-data-foundations-to-agent-frontiers,Article,Minor,❌,,HTML/Blog,,,,,,https://arxiv.org/abs/2508.21148,Press,Auto-Discovery,,,,2025-10-21
Show HN: Customer Support AI Agent with Memory,show-hn-customer-support-ai-agent-with-memory,Article,Minor,❌,,HTML/Blog,,,,,,https://www.gibsonai.com/use-cases/customer-support,Press,Auto-Discovery,,,,2025-10-22
Show HN: I built a browser-based video editor for making social media reels,show-hn-i-built-a-browser-based-video-editor-for-making-social-media-reels,Article,Minor,❌,,HTML/Blog,,,,,,https://www.reelleer.com/,Press,Auto-Discovery,,,,2025-10-22
Show HN: Confidential AI browser extension – alternative to OpenAI Atlas,show-hn-confidential-ai-browser-extension-alternative-to-openai-atlas,Article,Minor,❌,,HTML/Blog,,,,,,https://github.com/edgelesssys/privatemode-for-chrome-demo,Press,Auto-Discovery,,,,2025-10-22
Idempotency in System Design: Full example,idempotency-in-system-design-full-example,Article,Minor,❌,,HTML/Blog,,,,,,https://www.reddit.com/r/programming/comments/1od451a/idempotency_in_system_design_full_example/,Press,Auto-Discovery,,,,2025-10-22
[R] We figured out how to predict 32B model reasoning performance with a 1B model. 100x cheaper. Paper inside.,r-we-figured-out-how-to-predict-32b-model-reasoning-performance-with-a-1b-model-100x-cheaper-paper-inside,Article,Minor,❌,,HTML/Blog,,,,,,https://www.reddit.com/r/LocalLLaMA/comments/1od0jw1/r_we_figured_out_how_to_predict_32b_model/,Press,Auto-Discovery,,,,2025-10-22
[P] Getting purely curiosity driven agents to complete Doom E1M1,p-getting-purely-curiosity-driven-agents-to-complete-doom-e1m1,Article,Minor,❌,,HTML/Blog,,,,,,https://www.reddit.com/r/MachineLearning/comments/1od0v4o/p_getting_purely_curiosity_driven_agents_to/,Press,Auto-Discovery,,,,2025-10-22
Inside the archives of the NASA Ames Research Center,inside-the-archives-of-the-nasa-ames-research-center,Article,Minor,❌,,HTML/Blog,,,,,,https://www.technologyreview.com/2025/10/22/1125378/nasa-ames-research-center-archives/,Press,Auto-Discovery,,,,2025-10-22
bioguider 0.2.34,bioguider-0-2-34,Article,Minor,❌,,HTML/Blog,,,,,,https://pypi.org/project/bioguider/0.2.34/,Press,Auto-Discovery,,,,2025-10-22
FABRIC: Framework for Agent-Based Realistic Intelligence Creation,fabric-framework-for-agent-based-realistic-intelligence-creation,Article,Minor,❌,,HTML/Blog,,,,,,https://arxiv.org/abs/2510.17995,Press,Auto-Discovery,,,,2025-10-22
OPTAGENT: Optimizing Multi-Agent LLM Interactions Through Verbal Reinforcement Learning for Enhanced Reasoning,optagent-optimizing-multi-agent-llm-interactions-through-verbal-reinforcement-learning-for-enhanced-reasoning,Article,Minor,❌,,HTML/Blog,,,,,,https://arxiv.org/abs/2510.18032,Press,Auto-Discovery,,,,2025-10-22
LLM-Based Multi-Agent System for Simulating and Analyzing Marketing and Consumer Behavior,llm-based-multi-agent-system-for-simulating-and-analyzing-marketing-and-consumer-behavior,Article,Minor,❌,,HTML/Blog,,,,,,https://arxiv.org/abs/2510.18155,Press,Auto-Discovery,,,,2025-10-22
AgentChangeBench: A Multi-Dimensional Evaluation Framework for Goal-Shift Robustness in Conversational AI,agentchangebench-a-multi-dimensional-evaluation-framework-for-goal-shift-robustness-in-conversational-ai,Article,Minor,❌,,HTML/Blog,,,,,,https://arxiv.org/abs/2510.18170,Press,Auto-Discovery,,,,2025-10-22
Genesis: Evolving Attack Strategies for LLM Web Agent Red-Teaming,genesis-evolving-attack-strategies-for-llm-web-agent-red-teaming,Article,Minor,❌,,HTML/Blog,,,,,,https://arxiv.org/abs/2510.18314,Press,Auto-Discovery,,,,2025-10-22
Memory-Augmented State Machine Prompting: A Novel LLM Agent Framework for Real-Time Strategy Games,memory-augmented-state-machine-prompting-a-novel-llm-agent-framework-for-real-time-strategy-games,Article,Minor,❌,,HTML/Blog,,,,,,https://arxiv.org/abs/2510.18395,Press,Auto-Discovery,,,,2025-10-22
Med-VRAgent: A Framework for Medical Visual Reasoning-Enhanced Agents,med-vragent-a-framework-for-medical-visual-reasoning-enhanced-agents,Article,Minor,❌,,HTML/Blog,,,,,,https://arxiv.org/abs/2510.18424,Press,Auto-Discovery,,,,2025-10-22
Probabilistic Modeling of Intentions in Socially Intelligent LLM Agents,probabilistic-modeling-of-intentions-in-socially-intelligent-llm-agents,Article,Minor,❌,,HTML/Blog,,,,,,https://arxiv.org/abs/2510.18476,Press,Auto-Discovery,,,,2025-10-22
LAFA: Agentic LLM-Driven Federated Analytics over Decentralized Data Sources,lafa-agentic-llm-driven-federated-analytics-over-decentralized-data-sources,Article,Minor,❌,,HTML/Blog,,,,,,https://arxiv.org/abs/2510.18477,Press,Auto-Discovery,,,,2025-10-22
StarBench: A Turn-Based RPG Benchmark for Agentic Multimodal Decision-Making and Information Seeking,starbench-a-turn-based-rpg-benchmark-for-agentic-multimodal-decision-making-and-information-seeking,Article,Minor,❌,,HTML/Blog,,,,,,https://arxiv.org/abs/2510.18483,Press,Auto-Discovery,,,,2025-10-22
AndroidControl-Curated: Revealing the True Potential of GUI Agents through Benchmark Purification,androidcontrol-curated-revealing-the-true-potential-of-gui-agents-through-benchmark-purification,Article,Minor,❌,,HTML/Blog,,,,,,https://arxiv.org/abs/2510.18488,Press,Auto-Discovery,,,,2025-10-22
Crucible: Quantifying the Potential of Control Algorithms through LLM Agents,crucible-quantifying-the-potential-of-control-algorithms-through-llm-agents,Article,Minor,❌,,HTML/Blog,,,,,,https://arxiv.org/abs/2510.18491,Press,Auto-Discovery,,,,2025-10-22
Physics-guided Emulators Reveal Resilience and Fragility under Operational Latencies and Outages,physics-guided-emulators-reveal-resilience-and-fragility-under-operational-latencies-and-outages,Article,Minor,❌,,HTML/Blog,,,,,,https://arxiv.org/abs/2510.18535,Press,Auto-Discovery,,,,2025-10-22
SOCIA-Nabla: Textual Gradient Meets Multi-Agent Orchestration for Automated Simulator Generation,socia-nabla-textual-gradient-meets-multi-agent-orchestration-for-automated-simulator-generation,Article,Minor,❌,,HTML/Blog,,,,,,https://arxiv.org/abs/2510.18551,Press,Auto-Discovery,,,,2025-10-22
QuantEvolve: Automating Quantitative Strategy Discovery through Multi-Agent Evolutionary Framework,quantevolve-automating-quantitative-strategy-discovery-through-multi-agent-evolutionary-framework,Article,Minor,❌,,HTML/Blog,,,,,,https://arxiv.org/abs/2510.18569,Press,Auto-Discovery,,,,2025-10-22
Seg the HAB: Language-Guided Geospatial Algae Bloom Reasoning and Segmentation,seg-the-hab-language-guided-geospatial-algae-bloom-reasoning-and-segmentation,Article,Minor,❌,,HTML/Blog,,,,,,https://arxiv.org/abs/2510.18751,Press,Auto-Discovery,,,,2025-10-22
"LLM Assisted Alpha Fairness for 6 GHz WiFi and NR_U Coexistence: An Agentic Orchestrator for Throughput, Energy, and SLA",llm-assisted-alpha-fairness-for-6-ghz-wifi-and-nr-u-coexistence-an-agentic-orchestrator-for-throughput-energy-and-sla,Article,Minor,❌,,HTML/Blog,,,,,,https://arxiv.org/abs/2510.17814,Press,Auto-Discovery,,,,2025-10-22
Carbon-Aware Orchestration of Integrated Satellite Aerial Terrestrial Networks via Digital Twin,carbon-aware-orchestration-of-integrated-satellite-aerial-terrestrial-networks-via-digital-twin,Article,Minor,❌,,HTML/Blog,,,,,,https://arxiv.org/abs/2510.17825,Press,Auto-Discovery,,,,2025-10-22
Multi-Agent Design Assistant for the Simulation of Inertial Fusion Energy,multi-agent-design-assistant-for-the-simulation-of-inertial-fusion-energy,Article,Minor,❌,,HTML/Blog,,,,,,https://arxiv.org/abs/2510.17830,Press,Auto-Discovery,,,,2025-10-22
Modeling Layered Consciousness with Multi-Agent Large Language Models,modeling-layered-consciousness-with-multi-agent-large-language-models,Article,Minor,❌,,HTML/Blog,,,,,,https://arxiv.org/abs/2510.17844,Press,Auto-Discovery,,,,2025-10-22
MAT-Agent: Adaptive Multi-Agent Training Optimization,mat-agent-adaptive-multi-agent-training-optimization,Article,Minor,❌,,HTML/Blog,,,,,,https://arxiv.org/abs/2510.17845,Press,Auto-Discovery,,,,2025-10-22
3D Weakly Supervised Semantic Segmentation via Class-Aware and Geometry-Guided Pseudo-Label Refinement,3d-weakly-supervised-semantic-segmentation-via-class-aware-and-geometry-guided-pseudo-label-refinement,Article,Minor,❌,,HTML/Blog,,,,,,https://arxiv.org/abs/2510.17875,Press,Auto-Discovery,,,,2025-10-22
Decoding Listeners Identity: Person Identification from EEG Signals Using a Lightweight Spiking Transformer,decoding-listeners-identity-person-identification-from-eeg-signals-using-a-lightweight-spiking-transformer,Article,Minor,❌,,HTML/Blog,,,,,,https://arxiv.org/abs/2510.17879,Press,Auto-Discovery,,,,2025-10-22
