Tool,Moniker,Category,Severity,RSS Available,Feed URL,Tracking Method,Repo URL,Repo Status,Stars,Contributors,Docs URL,Website URL,Source Type,Discovery Method,Launch Status,Last Seen Update,Status,Date Added
Jotform Instagram Agent,jotform-instagram-agent,Article,Minor,❌,,HTML/Blog,,,,,,https://www.producthunt.com/posts/jotform-instagram-agent,Press,Auto-Discovery,,,,2025-08-26
MCP Builder,mcp-builder,Article,Minor,❌,,HTML/Blog,,,,,,https://www.producthunt.com/posts/mcp-builder,Press,Auto-Discovery,,,,2025-08-26
Show HN: Hound – AI agents that find deep logic bugs in codebases,show-hn-hound-ai-agents-that-find-deep-logic-bugs-in-codebases,Article,Minor,❌,,HTML/Blog,,,,,,https://github.com/muellerberndt/hound,Press,Auto-Discovery,,,,2025-08-26
What are metrics in OpenTelemetry: A Complete Guide,what-are-metrics-in-opentelemetry-a-complete-guide,Article,Minor,❌,,HTML/Blog,,,,,,https://www.reddit.com/r/programming/comments/1n0liu3/what_are_metrics_in_opentelemetry_a_complete_guide/,Press,Auto-Discovery,,,,2025-08-26
An illustrated guide to OAuth,an-illustrated-guide-to-oauth,Article,Minor,❌,,HTML/Blog,,,,,,https://www.reddit.com/r/programming/comments/1n05sy9/an_illustrated_guide_to_oauth/,Press,Auto-Discovery,,,,2025-08-26
SSD-iq: Uncovering the Hidden Side of SSD Performance,ssd-iq-uncovering-the-hidden-side-of-ssd-performance,Article,Minor,❌,,HTML/Blog,,,,,,https://www.reddit.com/r/programming/comments/1n04snk/ssdiq_uncovering_the_hidden_side_of_ssd/,Press,Auto-Discovery,,,,2025-08-26
[P] Exosphere: an open source runtime for dynamic agentic graphs with durable state. results from running parallel agents on 20k+ items,p-exosphere-an-open-source-runtime-for-dynamic-agentic-graphs-with-durable-state-results-from-running-parallel-agents-on-20k-items,Article,Minor,❌,,HTML/Blog,,,,,,https://www.reddit.com/r/MachineLearning/comments/1n0eyrb/p_exosphere_an_open_source_runtime_for_dynamic/,Press,Auto-Discovery,,,,2025-08-26
"The Download: America’s drone brothers, and an upside of AI doomerism",the-download-america-s-drone-brothers-and-an-upside-of-ai-doomerism,Article,Minor,❌,,HTML/Blog,,,,,,https://www.technologyreview.com/2025/08/26/1122511/the-download-americas-drone-brothers-and-an-upside-of-ai-doomerism/,Press,Auto-Discovery,,,,2025-08-26
Evaluation and LLM-Guided Learning of ICD Coding Rationales,evaluation-and-llm-guided-learning-of-icd-coding-rationales,Article,Minor,❌,,HTML/Blog,,,,,,https://arxiv.org/abs/2508.16777,Press,Auto-Discovery,,,,2025-08-26
RADAR: A Reasoning-Guided Attribution Framework for Explainable Visual Data Analysis,radar-a-reasoning-guided-attribution-framework-for-explainable-visual-data-analysis,Article,Minor,❌,,HTML/Blog,,,,,,https://arxiv.org/abs/2508.16850,Press,Auto-Discovery,,,,2025-08-26
WebSight: A Vision-First Architecture for Robust Web Agents,websight-a-vision-first-architecture-for-robust-web-agents,Article,Minor,❌,,HTML/Blog,,,,,,https://arxiv.org/abs/2508.16987,Press,Auto-Discovery,,,,2025-08-26
PowerChain: Automating Distribution Grid Analysis with Agentic AI Workflows,powerchain-automating-distribution-grid-analysis-with-agentic-ai-workflows,Article,Minor,❌,,HTML/Blog,,,,,,https://arxiv.org/abs/2508.17094,Press,Auto-Discovery,,,,2025-08-26
PosterGen: Aesthetic-Aware Paper-to-Poster Generation via Multi-Agent LLMs,postergen-aesthetic-aware-paper-to-poster-generation-via-multi-agent-llms,Article,Minor,❌,,HTML/Blog,,,,,,https://arxiv.org/abs/2508.17188,Press,Auto-Discovery,,,,2025-08-26
From reactive to cognitive: brain-inspired spatial intelligence for embodied agents,from-reactive-to-cognitive-brain-inspired-spatial-intelligence-for-embodied-agents,Article,Minor,❌,,HTML/Blog,,,,,,https://arxiv.org/abs/2508.17198,Press,Auto-Discovery,,,,2025-08-26
Evolving Collective Cognition in Human-Agent Hybrid Societies: How Agents Form Stances and Boundaries,evolving-collective-cognition-in-human-agent-hybrid-societies-how-agents-form-stances-and-boundaries,Article,Minor,❌,,HTML/Blog,,,,,,https://arxiv.org/abs/2508.17366,Press,Auto-Discovery,,,,2025-08-26
TradingGroup: A Multi-Agent Trading System with Self-Reflection and Data-Synthesis,tradinggroup-a-multi-agent-trading-system-with-self-reflection-and-data-synthesis,Article,Minor,❌,,HTML/Blog,,,,,,https://arxiv.org/abs/2508.17565,Press,Auto-Discovery,,,,2025-08-26
LLM-based Agentic Reasoning Frameworks: A Survey from Methods to Scenarios,llm-based-agentic-reasoning-frameworks-a-survey-from-methods-to-scenarios,Article,Minor,❌,,HTML/Blog,,,,,,https://arxiv.org/abs/2508.17692,Press,Auto-Discovery,,,,2025-08-26
AgentRAN: An Agentic AI Architecture for Autonomous Control of Open 6G Networks,agentran-an-agentic-ai-architecture-for-autonomous-control-of-open-6g-networks,Article,Minor,❌,,HTML/Blog,,,,,,https://arxiv.org/abs/2508.17778,Press,Auto-Discovery,,,,2025-08-26
FAIRGAMER: Evaluating Biases in the Application of Large Language Models to Video Games,fairgamer-evaluating-biases-in-the-application-of-large-language-models-to-video-games,Article,Minor,❌,,HTML/Blog,,,,,,https://arxiv.org/abs/2508.17825,Press,Auto-Discovery,,,,2025-08-26
Neural Algorithmic Reasoners informed Large Language Model for Multi-Agent Path Finding,neural-algorithmic-reasoners-informed-large-language-model-for-multi-agent-path-finding,Article,Minor,❌,,HTML/Blog,,,,,,https://arxiv.org/abs/2508.17971,Press,Auto-Discovery,,,,2025-08-26
PerPilot: Personalizing VLM-based Mobile Agents via Memory and Exploration,perpilot-personalizing-vlm-based-mobile-agents-via-memory-and-exploration,Article,Minor,❌,,HTML/Blog,,,,,,https://arxiv.org/abs/2508.18040,Press,Auto-Discovery,,,,2025-08-26
Confidence-Modulated Speculative Decoding for Large Language Models,confidence-modulated-speculative-decoding-for-large-language-models,Article,Minor,❌,,HTML/Blog,,,,,,https://arxiv.org/abs/2508.15371,Press,Auto-Discovery,,,,2025-08-26
An Embodied AR Navigation Agent: Integrating BIM with Retrieval-Augmented Generation for Language Guidance,an-embodied-ar-navigation-agent-integrating-bim-with-retrieval-augmented-generation-for-language-guidance,Article,Minor,❌,,HTML/Blog,,,,,,https://arxiv.org/abs/2508.16602,Press,Auto-Discovery,,,,2025-08-26
Social Identity in Human-Agent Interaction: A Primer,social-identity-in-human-agent-interaction-a-primer,Article,Minor,❌,,HTML/Blog,,,,,,https://arxiv.org/abs/2508.16609,Press,Auto-Discovery,,,,2025-08-26
Learn to Memorize: Optimizing LLM-based Agents with Adaptive Memory Framework,learn-to-memorize-optimizing-llm-based-agents-with-adaptive-memory-framework,Article,Minor,❌,,HTML/Blog,,,,,,https://arxiv.org/abs/2508.16629,Press,Auto-Discovery,,,,2025-08-26
Enabling Multi-Agent Systems as Learning Designers: Applying Learning Sciences to AI Instructional Design,enabling-multi-agent-systems-as-learning-designers-applying-learning-sciences-to-ai-instructional-design,Article,Minor,❌,,HTML/Blog,,,,,,https://arxiv.org/abs/2508.16659,Press,Auto-Discovery,,,,2025-08-26
Generative Artificial Intelligence and Agents in Research and Teaching,generative-artificial-intelligence-and-agents-in-research-and-teaching,Article,Minor,❌,,HTML/Blog,,,,,,https://arxiv.org/abs/2508.16701,Press,Auto-Discovery,,,,2025-08-26
HumanoidVerse: A Versatile Humanoid for Vision-Language Guided Multi-Object Rearrangement,humanoidverse-a-versatile-humanoid-for-vision-language-guided-multi-object-rearrangement,Article,Minor,❌,,HTML/Blog,,,,,,https://arxiv.org/abs/2508.16943,Press,Auto-Discovery,,,,2025-08-26
SSG-Dit: A Spatial Signal Guided Framework for Controllable Video Generation,ssg-dit-a-spatial-signal-guided-framework-for-controllable-video-generation,Article,Minor,❌,,HTML/Blog,,,,,,https://arxiv.org/abs/2508.17062,Press,Auto-Discovery,,,,2025-08-26
Mind the Gap: Time-of-Check to Time-of-Use Vulnerabilities in LLM-Enabled Agents,mind-the-gap-time-of-check-to-time-of-use-vulnerabilities-in-llm-enabled-agents,Article,Minor,❌,,HTML/Blog,,,,,,https://arxiv.org/abs/2508.17155,Press,Auto-Discovery,,,,2025-08-26
Beyond Play and Pause: Turning GPT-4o Spatial Weakness into a Strength for In-Depth Interactive Video Learning,beyond-play-and-pause-turning-gpt-4o-spatial-weakness-into-a-strength-for-in-depth-interactive-video-learning,Article,Minor,❌,,HTML/Blog,,,,,,https://arxiv.org/abs/2508.17160,Press,Auto-Discovery,,,,2025-08-26
Multi-Agent Visual-Language Reasoning for Comprehensive Highway Scene Understanding,multi-agent-visual-language-reasoning-for-comprehensive-highway-scene-understanding,Article,Minor,❌,,HTML/Blog,,,,,,https://arxiv.org/abs/2508.17205,Press,Auto-Discovery,,,,2025-08-26
Chinese Court Simulation with LLM-Based Agent System,chinese-court-simulation-with-llm-based-agent-system,Article,Minor,❌,,HTML/Blog,,,,,,https://arxiv.org/abs/2508.17322,Press,Auto-Discovery,,,,2025-08-26
Agentic AI for Software: thoughts from Software Engineering community,agentic-ai-for-software-thoughts-from-software-engineering-community,Article,Minor,❌,,HTML/Blog,,,,,,https://arxiv.org/abs/2508.17343,Press,Auto-Discovery,,,,2025-08-26
Agent-Testing Agent: A Meta-Agent for Automated Testing and Evaluation of Conversational AI Agents,agent-testing-agent-a-meta-agent-for-automated-testing-and-evaluation-of-conversational-ai-agents,Article,Minor,❌,,HTML/Blog,,,,,,https://arxiv.org/abs/2508.17393,Press,Auto-Discovery,,,,2025-08-26
FedKLPR: Personalized Federated Learning for Person Re-Identification with Adaptive Pruning,fedklpr-personalized-federated-learning-for-person-re-identification-with-adaptive-pruning,Article,Minor,❌,,HTML/Blog,,,,,,https://arxiv.org/abs/2508.17431,Press,Auto-Discovery,,,,2025-08-26
TANDEM: Temporal Attention-guided Neural Differential Equations for Missingness in Time Series Classification,tandem-temporal-attention-guided-neural-differential-equations-for-missingness-in-time-series-classification,Article,Minor,❌,,HTML/Blog,,,,,,https://arxiv.org/abs/2508.17519,Press,Auto-Discovery,,,,2025-08-26
RubikSQL: Lifelong Learning Agentic Knowledge Base as an Industrial NL2SQL System,rubiksql-lifelong-learning-agentic-knowledge-base-as-an-industrial-nl2sql-system,Article,Minor,❌,,HTML/Blog,,,,,,https://arxiv.org/abs/2508.17590,Press,Auto-Discovery,,,,2025-08-26
ControlEchoSynth: Boosting Ejection Fraction Estimation Models via Controlled Video Diffusion,controlechosynth-boosting-ejection-fraction-estimation-models-via-controlled-video-diffusion,Article,Minor,❌,,HTML/Blog,,,,,,https://arxiv.org/abs/2508.17631,Press,Auto-Discovery,,,,2025-08-26
Attacking LLMs and AI Agents: Advertisement Embedding Attacks Against Large Language Models,attacking-llms-and-ai-agents-advertisement-embedding-attacks-against-large-language-models,Article,Minor,❌,,HTML/Blog,,,,,,https://arxiv.org/abs/2508.17674,Press,Auto-Discovery,,,,2025-08-26
Previously on... Automating Code Review,previously-on-automating-code-review,Article,Minor,❌,,HTML/Blog,,,,,,https://arxiv.org/abs/2508.18003,Press,Auto-Discovery,,,,2025-08-26
Deep Learning and Matrix Completion-aided IoT Network Localization in the Outlier Scenarios,deep-learning-and-matrix-completion-aided-iot-network-localization-in-the-outlier-scenarios,Article,Minor,❌,,HTML/Blog,,,,,,https://arxiv.org/abs/2508.18225,Press,Auto-Discovery,,,,2025-08-26
Evasive Active Hypothesis Testing with Deep Neuroevolution: The Single- and Multi-Agent Cases,evasive-active-hypothesis-testing-with-deep-neuroevolution-the-single-and-multi-agent-cases,Article,Minor,❌,,HTML/Blog,,,,,,https://arxiv.org/abs/2403.10112,Press,Auto-Discovery,,,,2025-08-26
Task Memory Engine (TME): Enhancing State Awareness for Multi-Step LLM Agent Tasks,task-memory-engine-tme-enhancing-state-awareness-for-multi-step-llm-agent-tasks,Article,Minor,❌,,HTML/Blog,,,,,,https://arxiv.org/abs/2504.08525,Press,Auto-Discovery,,,,2025-08-26
"Toward Knowledge-Guided AI for Inverse Design in Manufacturing: A Perspective on Domain, Physics, and Human-AI Synergy",toward-knowledge-guided-ai-for-inverse-design-in-manufacturing-a-perspective-on-domain-physics-and-human-ai-synergy,Article,Minor,❌,,HTML/Blog,,,,,,https://arxiv.org/abs/2506.00056,Press,Auto-Discovery,,,,2025-08-26
Architecting Clinical Collaboration: Multi-Agent Reasoning Systems for Multimodal Medical VQA,architecting-clinical-collaboration-multi-agent-reasoning-systems-for-multimodal-medical-vqa,Article,Minor,❌,,HTML/Blog,,,,,,https://arxiv.org/abs/2507.05520,Press,Auto-Discovery,,,,2025-08-26
When Developer Aid Becomes Security Debt: A Systematic Analysis of Insecure Behaviors in LLM Coding Agents,when-developer-aid-becomes-security-debt-a-systematic-analysis-of-insecure-behaviors-in-llm-coding-agents,Article,Minor,❌,,HTML/Blog,,,,,,https://arxiv.org/abs/2507.09329,Press,Auto-Discovery,,,,2025-08-26
SE-Agent: Self-Evolution Trajectory Optimization in Multi-Step Reasoning with LLM-Based Agents,se-agent-self-evolution-trajectory-optimization-in-multi-step-reasoning-with-llm-based-agents,Article,Minor,❌,,HTML/Blog,,,,,,https://arxiv.org/abs/2508.02085,Press,Auto-Discovery,,,,2025-08-26
EGOILLUSION: Benchmarking Hallucinations in Egocentric Video Understanding,egoillusion-benchmarking-hallucinations-in-egocentric-video-understanding,Article,Minor,❌,,HTML/Blog,,,,,,https://arxiv.org/abs/2508.12687,Press,Auto-Discovery,,,,2025-08-26
Towards Identifiable Unsupervised Domain Translation: A Diversified Distribution Matching Approach,towards-identifiable-unsupervised-domain-translation-a-diversified-distribution-matching-approach,Article,Minor,❌,,HTML/Blog,,,,,,https://arxiv.org/abs/2401.09671,Press,Auto-Discovery,,,,2025-08-26
Visual Evaluative AI: A Hypothesis-Driven Tool with Concept-Based Explanations and Weight of Evidence,visual-evaluative-ai-a-hypothesis-driven-tool-with-concept-based-explanations-and-weight-of-evidence,Article,Minor,❌,,HTML/Blog,,,,,,https://arxiv.org/abs/2407.04710,Press,Auto-Discovery,,,,2025-08-26
Interaction-Data-guided Conditional Instrumental Variables for Debiasing Recommender Systems,interaction-data-guided-conditional-instrumental-variables-for-debiasing-recommender-systems,Article,Minor,❌,,HTML/Blog,,,,,,https://arxiv.org/abs/2408.09651,Press,Auto-Discovery,,,,2025-08-26
MALMM: Multi-Agent Large Language Models for Zero-Shot Robotics Manipulation,malmm-multi-agent-large-language-models-for-zero-shot-robotics-manipulation,Article,Minor,❌,,HTML/Blog,,,,,,https://arxiv.org/abs/2411.17636,Press,Auto-Discovery,,,,2025-08-26
TombRaider: Entering the Vault of History to Jailbreak Large Language Models,tombraider-entering-the-vault-of-history-to-jailbreak-large-language-models,Article,Minor,❌,,HTML/Blog,,,,,,https://arxiv.org/abs/2501.18628,Press,Auto-Discovery,,,,2025-08-26
AutoMisty: A Multi-Agent LLM Framework for Automated Code Generation in the Misty Social Robot,automisty-a-multi-agent-llm-framework-for-automated-code-generation-in-the-misty-social-robot,Article,Minor,❌,,HTML/Blog,,,,,,https://arxiv.org/abs/2503.06791,Press,Auto-Discovery,,,,2025-08-26
X-Teaming: Multi-Turn Jailbreaks and Defenses with Adaptive Multi-Agents,x-teaming-multi-turn-jailbreaks-and-defenses-with-adaptive-multi-agents,Article,Minor,❌,,HTML/Blog,,,,,,https://arxiv.org/abs/2504.13203,Press,Auto-Discovery,,,,2025-08-26
A Survey on the Safety and Security Threats of Computer-Using Agents: JARVIS or Ultron?,a-survey-on-the-safety-and-security-threats-of-computer-using-agents-jarvis-or-ultron,Article,Minor,❌,,HTML/Blog,,,,,,https://arxiv.org/abs/2505.10924,Press,Auto-Discovery,,,,2025-08-26
An Outlook on the Opportunities and Challenges of Multi-Agent AI Systems,an-outlook-on-the-opportunities-and-challenges-of-multi-agent-ai-systems,Article,Minor,❌,,HTML/Blog,,,,,,https://arxiv.org/abs/2505.18397,Press,Auto-Discovery,,,,2025-08-26
Rethinking Gating Mechanism in Sparse MoE: Handling Arbitrary Modality Inputs with Confidence-Guided Gate,rethinking-gating-mechanism-in-sparse-moe-handling-arbitrary-modality-inputs-with-confidence-guided-gate,Article,Minor,❌,,HTML/Blog,,,,,,https://arxiv.org/abs/2505.19525,Press,Auto-Discovery,,,,2025-08-26
EPFL-Smart-Kitchen-30: Densely annotated cooking dataset with 3D kinematics to challenge video and language models,epfl-smart-kitchen-30-densely-annotated-cooking-dataset-with-3d-kinematics-to-challenge-video-and-language-models,Article,Minor,❌,,HTML/Blog,,,,,,https://arxiv.org/abs/2506.01608,Press,Auto-Discovery,,,,2025-08-26
Effective Red-Teaming of Policy-Adherent Agents,effective-red-teaming-of-policy-adherent-agents,Article,Minor,❌,,HTML/Blog,,,,,,https://arxiv.org/abs/2506.09600,Press,Auto-Discovery,,,,2025-08-26
Controllable Hybrid Captioner for Improved Long-form Video Understanding,controllable-hybrid-captioner-for-improved-long-form-video-understanding,Article,Minor,❌,,HTML/Blog,,,,,,https://arxiv.org/abs/2507.17047,Press,Auto-Discovery,,,,2025-08-26
MemoryTalker: Personalized Speech-Driven 3D Facial Animation via Audio-Guided Stylization,memorytalker-personalized-speech-driven-3d-facial-animation-via-audio-guided-stylization,Article,Minor,❌,,HTML/Blog,,,,,,https://arxiv.org/abs/2507.20562,Press,Auto-Discovery,,,,2025-08-26
Agentic large language models improve retrieval-based radiology question answering,agentic-large-language-models-improve-retrieval-based-radiology-question-answering,Article,Minor,❌,,HTML/Blog,,,,,,https://arxiv.org/abs/2508.00743,Press,Auto-Discovery,,,,2025-08-26
Enhancing material behavior discovery using embedding-oriented Physically-Guided Neural Networks with Internal Variables,enhancing-material-behavior-discovery-using-embedding-oriented-physically-guided-neural-networks-with-internal-variables,Article,Minor,❌,,HTML/Blog,,,,,,https://arxiv.org/abs/2508.00959,Press,Auto-Discovery,,,,2025-08-26
MagicGUI: A Foundational Mobile GUI Agent with Scalable Data Pipeline and Reinforcement Fine-tuning,magicgui-a-foundational-mobile-gui-agent-with-scalable-data-pipeline-and-reinforcement-fine-tuning,Article,Minor,❌,,HTML/Blog,,,,,,https://arxiv.org/abs/2508.03700,Press,Auto-Discovery,,,,2025-08-26
Evaluating Contrast Localizer for Identifying Causal Units in Social & Mathematical Tasks in Language Models,evaluating-contrast-localizer-for-identifying-causal-units-in-social-mathematical-tasks-in-language-models,Article,Minor,❌,,HTML/Blog,,,,,,https://arxiv.org/abs/2508.08276,Press,Auto-Discovery,,,,2025-08-26
Fourier-Guided Attention Upsampling for Image Super-Resolution,fourier-guided-attention-upsampling-for-image-super-resolution,Article,Minor,❌,,HTML/Blog,,,,,,https://arxiv.org/abs/2508.10616,Press,Auto-Discovery,,,,2025-08-26
CURE: Critical-Token-Guided Re-Concatenation for Entropy-Collapse Prevention,cure-critical-token-guided-re-concatenation-for-entropy-collapse-prevention,Article,Minor,❌,,HTML/Blog,,,,,,https://arxiv.org/abs/2508.11016,Press,Auto-Discovery,,,,2025-08-26
Trustworthy AI Psychotherapy: Multi-Agent LLM Workflow for Counseling and Explainable Mental Disorder Diagnosis,trustworthy-ai-psychotherapy-multi-agent-llm-workflow-for-counseling-and-explainable-mental-disorder-diagnosis,Article,Minor,❌,,HTML/Blog,,,,,,https://arxiv.org/abs/2508.11398,Press,Auto-Discovery,,,,2025-08-26
