Tool,Moniker,Category,Severity,RSS Available,Feed URL,Tracking Method,Repo URL,Repo Status,Stars,Contributors,Docs URL,Website URL,Source Type,Discovery Method,Launch Status,Last Seen Update,Status,Date Added
ReflAct: World-Grounded Decision Making in LLM Agents via Goal-State Reflection,reflact-world-grounded-decision-making-in-llm-agents-via-goal-state-reflection,Article,Minor,❌,,HTML/Blog,,,,,,https://arxiv.org/abs/2505.15182,Press,Auto-Discovery,,,,2025-09-30
Any-to-Bokeh: Arbitrary-Subject Video Refocusing with Video Diffusion Model,any-to-bokeh-arbitrary-subject-video-refocusing-with-video-diffusion-model,Article,Minor,❌,,HTML/Blog,,,,,,https://arxiv.org/abs/2505.21593,Press,Auto-Discovery,,,,2025-09-30
Communication-Efficient Desire Alignment for Embodied Agent-Human Adaptation,communication-efficient-desire-alignment-for-embodied-agent-human-adaptation,Article,Minor,❌,,HTML/Blog,,,,,,https://arxiv.org/abs/2505.22503,Press,Auto-Discovery,,,,2025-09-30
When Is Diversity Rewarded in Cooperative Multi-Agent Learning?,when-is-diversity-rewarded-in-cooperative-multi-agent-learning,Article,Minor,❌,,HTML/Blog,,,,,,https://arxiv.org/abs/2506.09434,Press,Auto-Discovery,,,,2025-09-30
Beyond Jailbreaking: Auditing Contextual Privacy in LLM Agents,beyond-jailbreaking-auditing-contextual-privacy-in-llm-agents,Article,Minor,❌,,HTML/Blog,,,,,,https://arxiv.org/abs/2506.10171,Press,Auto-Discovery,,,,2025-09-30
StorySage: Conversational Autobiography Writing Powered by a Multi-Agent Framework,storysage-conversational-autobiography-writing-powered-by-a-multi-agent-framework,Article,Minor,❌,,HTML/Blog,,,,,,https://arxiv.org/abs/2506.14159,Press,Auto-Discovery,,,,2025-09-30
Semantic-guided Diverse Decoding for Large Language Model,semantic-guided-diverse-decoding-for-large-language-model,Article,Minor,❌,,HTML/Blog,,,,,,https://arxiv.org/abs/2506.23601,Press,Auto-Discovery,,,,2025-09-30
Vidar: Embodied Video Diffusion Model for Generalist Manipulation,vidar-embodied-video-diffusion-model-for-generalist-manipulation,Article,Minor,❌,,HTML/Blog,,,,,,https://arxiv.org/abs/2507.12898,Press,Auto-Discovery,,,,2025-09-30
When Engineering Outruns Intelligence: Rethinking Instruction-Guided Navigation,when-engineering-outruns-intelligence-rethinking-instruction-guided-navigation,Article,Minor,❌,,HTML/Blog,,,,,,https://arxiv.org/abs/2507.20021,Press,Auto-Discovery,,,,2025-09-30
"Communicating Plans, Not Percepts: Scalable Multi-Agent Coordination with Embodied World Models",communicating-plans-not-percepts-scalable-multi-agent-coordination-with-embodied-world-models,Article,Minor,❌,,HTML/Blog,,,,,,https://arxiv.org/abs/2508.02912,Press,Auto-Discovery,,,,2025-09-30
AttriLens-Mol: Attribute Guided Reinforcement Learning for Molecular Property Prediction with Large Language Models,attrilens-mol-attribute-guided-reinforcement-learning-for-molecular-property-prediction-with-large-language-models,Article,Minor,❌,,HTML/Blog,,,,,,https://arxiv.org/abs/2508.04748,Press,Auto-Discovery,,,,2025-09-30
BLADE: Block-Sparse Attention Meets Step Distillation for Efficient Video Generation,blade-block-sparse-attention-meets-step-distillation-for-efficient-video-generation,Article,Minor,❌,,HTML/Blog,,,,,,https://arxiv.org/abs/2508.10774,Press,Auto-Discovery,,,,2025-09-30
G-CUT3R: Guided 3D Reconstruction with Camera and Depth Prior Integration,g-cut3r-guided-3d-reconstruction-with-camera-and-depth-prior-integration,Article,Minor,❌,,HTML/Blog,,,,,,https://arxiv.org/abs/2508.11379,Press,Auto-Discovery,,,,2025-09-30
Semantic Discrepancy-aware Detector for Image Forgery Identification,semantic-discrepancy-aware-detector-for-image-forgery-identification,Article,Minor,❌,,HTML/Blog,,,,,,https://arxiv.org/abs/2508.12341,Press,Auto-Discovery,,,,2025-09-30
"Evaluating the Effectiveness of Transformer Layers in Wav2Vec 2.0, XLS-R, and Whisper for Speaker Identification Tasks",evaluating-the-effectiveness-of-transformer-layers-in-wav2vec-2-0-xls-r-and-whisper-for-speaker-identification-tasks,Article,Minor,❌,,HTML/Blog,,,,,,https://arxiv.org/abs/2509.00230,Press,Auto-Discovery,,,,2025-09-30
DEPFusion: Dual-Domain Enhancement and Priority-Guided Mamba Fusion for UAV Multispectral Object Detection,depfusion-dual-domain-enhancement-and-priority-guided-mamba-fusion-for-uav-multispectral-object-detection,Article,Minor,❌,,HTML/Blog,,,,,,https://arxiv.org/abs/2509.07327,Press,Auto-Discovery,,,,2025-09-30
"Show HN: Comexp RVS–First real-time video-to-video search,TV monitoring and more",show-hn-comexp-rvs-first-real-time-video-to-video-search-tv-monitoring-and-more,Article,Minor,❌,,HTML/Blog,,,,,,https://chromewebstore.google.com/detail/comexp-rvs/dnpncabgkaikkflcpgddeemaohhcbnfm,Press,Auto-Discovery,,,,2025-10-01
❌Spent ~$3K building the open source models you asked for. Need to abort Art-1-20B and shut down AGI-0. Ideas?❌,spent-3k-building-the-open-source-models-you-asked-for-need-to-abort-art-1-20b-and-shut-down-agi-0-ideas,Article,Minor,❌,,HTML/Blog,,,,,,https://www.reddit.com/r/LocalLLaMA/comments/1nuq4tr/spent_3k_building_the_open_source_models_you/,Press,Auto-Discovery,,,,2025-10-01
"I spent a few hours prompting LLMs for a pilot study of the ""Confidence profile"" of GPT-5 vs Qwen3-Max. Findings: GPT-5 is ""cosmetically tuned"" for confidence. Qwen3, despite meta awareness of its own precision level, defaults towards underconfidence without access to tools.",i-spent-a-few-hours-prompting-llms-for-a-pilot-study-of-the-confidence-profile-of-gpt-5-vs-qwen3-max-findings-gpt-5-is-cosmetically-tuned-for-confidence-qwen3-despite-meta-awareness-of-its-own-precision-level-defaults-towards-underconfidence-without-access-to-tools,Article,Minor,❌,,HTML/Blog,,,,,,https://www.reddit.com/r/LocalLLaMA/comments/1nv7quz/i_spent_a_few_hours_prompting_llms_for_a_pilot/,Press,Auto-Discovery,,,,2025-10-01
Can anyone help me understand the difference between GLM 4.6 and GLM 4.5? Shall I switch to the new model? Anyone tried both the models side by side,can-anyone-help-me-understand-the-difference-between-glm-4-6-and-glm-4-5-shall-i-switch-to-the-new-model-anyone-tried-both-the-models-side-by-side,Article,Minor,❌,,HTML/Blog,,,,,,https://www.reddit.com/r/LocalLLaMA/comments/1nv6msf/can_anyone_help_me_understand_the_difference/,Press,Auto-Discovery,,,,2025-10-01
Uncensored models providers,uncensored-models-providers,Article,Minor,❌,,HTML/Blog,,,,,,https://www.reddit.com/r/LocalLLaMA/comments/1nv1spp/uncensored_models_providers/,Press,Auto-Discovery,,,,2025-10-01
Adobe’s video editing app Premiere arrives on iPhones,adobe-s-video-editing-app-premiere-arrives-on-iphones,Article,Minor,❌,,HTML/Blog,,,,,,https://techcrunch.com/2025/09/30/adobes-video-editing-app-premiere-arrives-on-iphones/,Press,Auto-Discovery,,,,2025-10-01
"The Download: OpenAI’s caste bias problem, and how AI videos are made",the-download-openai-s-caste-bias-problem-and-how-ai-videos-are-made,Article,Minor,❌,,HTML/Blog,,,,,,https://www.technologyreview.com/2025/10/01/1124630/the-download-openais-caste-bias-problem-and-how-ai-videos-are-made/,Press,Auto-Discovery,,,,2025-10-01
"Blueprint-Bench: Comparing spatial intelligence of LLMs, agents and image models",blueprint-bench-comparing-spatial-intelligence-of-llms-agents-and-image-models,Article,Minor,❌,,HTML/Blog,,,,,,https://arxiv.org/abs/2509.25229,Press,Auto-Discovery,,,,2025-10-01
Neo-Grounded Theory: A Methodological Innovation Integrating High-Dimensional Vector Clustering and Multi-Agent Collaboration for Qualitative Research,neo-grounded-theory-a-methodological-innovation-integrating-high-dimensional-vector-clustering-and-multi-agent-collaboration-for-qualitative-research,Article,Minor,❌,,HTML/Blog,,,,,,https://arxiv.org/abs/2509.25244,Press,Auto-Discovery,,,,2025-10-01
Memory Management and Contextual Consistency for Long-Running Low-Code Agents,memory-management-and-contextual-consistency-for-long-running-low-code-agents,Article,Minor,❌,,HTML/Blog,,,,,,https://arxiv.org/abs/2509.25250,Press,Auto-Discovery,,,,2025-10-01
RADAR: A Risk-Aware Dynamic Multi-Agent Framework for LLM Safety Evaluation via Role-Specialized Collaboration,radar-a-risk-aware-dynamic-multi-agent-framework-for-llm-safety-evaluation-via-role-specialized-collaboration,Article,Minor,❌,,HTML/Blog,,,,,,https://arxiv.org/abs/2509.25271,Press,Auto-Discovery,,,,2025-10-01
Toward Causal-Visual Programming: Enhancing Agentic Reasoning in Low-Code Environments,toward-causal-visual-programming-enhancing-agentic-reasoning-in-low-code-environments,Article,Minor,❌,,HTML/Blog,,,,,,https://arxiv.org/abs/2509.25282,Press,Auto-Discovery,,,,2025-10-01
ID-RAG: Identity Retrieval-Augmented Generation for Long-Horizon Persona Coherence in Generative Agents,id-rag-identity-retrieval-augmented-generation-for-long-horizon-persona-coherence-in-generative-agents,Article,Minor,❌,,HTML/Blog,,,,,,https://arxiv.org/abs/2509.25299,Press,Auto-Discovery,,,,2025-10-01
Flash-Searcher: Fast and Effective Web Agents via DAG-Based Parallel Execution,flash-searcher-fast-and-effective-web-agents-via-dag-based-parallel-execution,Article,Minor,❌,,HTML/Blog,,,,,,https://arxiv.org/abs/2509.25301,Press,Auto-Discovery,,,,2025-10-01
Dive into the Agent Matrix: A Realistic Evaluation of Self-Replication Risk in LLM Agents,dive-into-the-agent-matrix-a-realistic-evaluation-of-self-replication-risk-in-llm-agents,Article,Minor,❌,,HTML/Blog,,,,,,https://arxiv.org/abs/2509.25302,Press,Auto-Discovery,,,,2025-10-01
Where LLM Agents Fail and How They can Learn From Failures,where-llm-agents-fail-and-how-they-can-learn-from-failures,Article,Minor,❌,,HTML/Blog,,,,,,https://arxiv.org/abs/2509.25370,Press,Auto-Discovery,,,,2025-10-01
Saliency Guided Longitudinal Medical Visual Question Answering,saliency-guided-longitudinal-medical-visual-question-answering,Article,Minor,❌,,HTML/Blog,,,,,,https://arxiv.org/abs/2509.25374,Press,Auto-Discovery,,,,2025-10-01
Adaptive Test-Time Reasoning via Reward-Guided Dual-Phase Search,adaptive-test-time-reasoning-via-reward-guided-dual-phase-search,Article,Minor,❌,,HTML/Blog,,,,,,https://arxiv.org/abs/2509.25420,Press,Auto-Discovery,,,,2025-10-01
Message passing-based inference in an autoregressive active inference agent,message-passing-based-inference-in-an-autoregressive-active-inference-agent,Article,Minor,❌,,HTML/Blog,,,,,,https://arxiv.org/abs/2509.25482,Press,Auto-Discovery,,,,2025-10-01
RadOnc-GPT: An Autonomous LLM Agent for Real-Time Patient Outcomes Labeling at Scale,radonc-gpt-an-autonomous-llm-agent-for-real-time-patient-outcomes-labeling-at-scale,Article,Minor,❌,,HTML/Blog,,,,,,https://arxiv.org/abs/2509.25540,Press,Auto-Discovery,,,,2025-10-01
ATLAS: Constraints-Aware Multi-Agent Collaboration for Real-World Travel Planning,atlas-constraints-aware-multi-agent-collaboration-for-real-world-travel-planning,Article,Minor,❌,,HTML/Blog,,,,,,https://arxiv.org/abs/2509.25586,Press,Auto-Discovery,,,,2025-10-01
Causal Autoencoder-like Generation of Feedback Fuzzy Cognitive Maps with an LLM Agent,causal-autoencoder-like-generation-of-feedback-fuzzy-cognitive-maps-with-an-llm-agent,Article,Minor,❌,,HTML/Blog,,,,,,https://arxiv.org/abs/2509.25593,Press,Auto-Discovery,,,,2025-10-01
Hybrid Reward Normalization for Process-supervised Non-verifiable Agentic Tasks,hybrid-reward-normalization-for-process-supervised-non-verifiable-agentic-tasks,Article,Minor,❌,,HTML/Blog,,,,,,https://arxiv.org/abs/2509.25598,Press,Auto-Discovery,,,,2025-10-01
A Framework for Studying AI Agent Behavior: Evidence from Consumer Choice Experiments,a-framework-for-studying-ai-agent-behavior-evidence-from-consumer-choice-experiments,Article,Minor,❌,,HTML/Blog,,,,,,https://arxiv.org/abs/2509.25609,Press,Auto-Discovery,,,,2025-10-01
AutoLabs: Cognitive Multi-Agent Systems with Self-Correction for Autonomous Chemical Experimentation,autolabs-cognitive-multi-agent-systems-with-self-correction-for-autonomous-chemical-experimentation,Article,Minor,❌,,HTML/Blog,,,,,,https://arxiv.org/abs/2509.25651,Press,Auto-Discovery,,,,2025-10-01
Landmark-Guided Knowledge for Vision-and-Language Navigation,landmark-guided-knowledge-for-vision-and-language-navigation,Article,Minor,❌,,HTML/Blog,,,,,,https://arxiv.org/abs/2509.25655,Press,Auto-Discovery,,,,2025-10-01
ScheduleMe: Multi-Agent Calendar Assistant,scheduleme-multi-agent-calendar-assistant,Article,Minor,❌,,HTML/Blog,,,,,,https://arxiv.org/abs/2509.25693,Press,Auto-Discovery,,,,2025-10-01
Planner-R1: Reward Shaping Enables Efficient Agentic RL with Smaller LLMs,planner-r1-reward-shaping-enables-efficient-agentic-rl-with-smaller-llms,Article,Minor,❌,,HTML/Blog,,,,,,https://arxiv.org/abs/2509.25779,Press,Auto-Discovery,,,,2025-10-01
HiStyle: Hierarchical Style Embedding Predictor for Text-Prompt-Guided Controllable Speech Synthesis,histyle-hierarchical-style-embedding-predictor-for-text-prompt-guided-controllable-speech-synthesis,Article,Minor,❌,,HTML/Blog,,,,,,https://arxiv.org/abs/2509.25842,Press,Auto-Discovery,,,,2025-10-01
Lita: Light Agent Uncovers the Agentic Coding Capabilities of LLMs,lita-light-agent-uncovers-the-agentic-coding-capabilities-of-llms,Article,Minor,❌,,HTML/Blog,,,,,,https://arxiv.org/abs/2509.25873,Press,Auto-Discovery,,,,2025-10-01
SafeMind: Benchmarking and Mitigating Safety Risks in Embodied LLM Agents,safemind-benchmarking-and-mitigating-safety-risks-in-embodied-llm-agents,Article,Minor,❌,,HTML/Blog,,,,,,https://arxiv.org/abs/2509.25885,Press,Auto-Discovery,,,,2025-10-01
NuRisk: A Visual Question Answering Dataset for Agent-Level Risk Assessment in Autonomous Driving,nurisk-a-visual-question-answering-dataset-for-agent-level-risk-assessment-in-autonomous-driving,Article,Minor,❌,,HTML/Blog,,,,,,https://arxiv.org/abs/2509.25944,Press,Auto-Discovery,,,,2025-10-01
CoLLM-NAS: Collaborative Large Language Models for Efficient Knowledge-Guided Neural Architecture Search,collm-nas-collaborative-large-language-models-for-efficient-knowledge-guided-neural-architecture-search,Article,Minor,❌,,HTML/Blog,,,,,,https://arxiv.org/abs/2509.26037,Press,Auto-Discovery,,,,2025-10-01
Evaluating the Use of Large Language Models as Synthetic Social Agents in Social Science Research,evaluating-the-use-of-large-language-models-as-synthetic-social-agents-in-social-science-research,Article,Minor,❌,,HTML/Blog,,,,,,https://arxiv.org/abs/2509.26080,Press,Auto-Discovery,,,,2025-10-01
SafeEvalAgent: Toward Agentic and Self-Evolving Safety Evaluation of LLMs,safeevalagent-toward-agentic-and-self-evolving-safety-evaluation-of-llms,Article,Minor,❌,,HTML/Blog,,,,,,https://arxiv.org/abs/2509.26100,Press,Auto-Discovery,,,,2025-10-01
Beyond the Algorithm: A Field Guide to Deploying AI Agents in Clinical Practice,beyond-the-algorithm-a-field-guide-to-deploying-ai-agents-in-clinical-practice,Article,Minor,❌,,HTML/Blog,,,,,,https://arxiv.org/abs/2509.26153,Press,Auto-Discovery,,,,2025-10-01
LLM Agents for Knowledge Discovery in Atomic Layer Processing,llm-agents-for-knowledge-discovery-in-atomic-layer-processing,Article,Minor,❌,,HTML/Blog,,,,,,https://arxiv.org/abs/2509.26201,Press,Auto-Discovery,,,,2025-10-01
Your Agent May Misevolve: Emergent Risks in Self-evolving LLM Agents,your-agent-may-misevolve-emergent-risks-in-self-evolving-llm-agents,Article,Minor,❌,,HTML/Blog,,,,,,https://arxiv.org/abs/2509.26354,Press,Auto-Discovery,,,,2025-10-01
TVS Sidekick: Challenges and Practical Insights from Deploying Large Language Models in the Enterprise,tvs-sidekick-challenges-and-practical-insights-from-deploying-large-language-models-in-the-enterprise,Article,Minor,❌,,HTML/Blog,,,,,,https://arxiv.org/abs/2509.26482,Press,Auto-Discovery,,,,2025-10-01
TimeRewarder: Learning Dense Reward from Passive Videos via Frame-wise Temporal Distance,timerewarder-learning-dense-reward-from-passive-videos-via-frame-wise-temporal-distance,Article,Minor,❌,,HTML/Blog,,,,,,https://arxiv.org/abs/2509.26627,Press,Auto-Discovery,,,,2025-10-01
Devstral: Fine-tuning Language Models for Coding Agent Applications,devstral-fine-tuning-language-models-for-coding-agent-applications,Article,Minor,❌,,HTML/Blog,,,,,,https://arxiv.org/abs/2509.25193,Press,Auto-Discovery,,,,2025-10-01
Energy Guided Geometric Flow Matching,energy-guided-geometric-flow-matching,Article,Minor,❌,,HTML/Blog,,,,,,https://arxiv.org/abs/2509.25230,Press,Auto-Discovery,,,,2025-10-01
PALADIN: Self-Correcting Language Model Agents to Cure Tool-Failure Cases,paladin-self-correcting-language-model-agents-to-cure-tool-failure-cases,Article,Minor,❌,,HTML/Blog,,,,,,https://arxiv.org/abs/2509.25238,Press,Auto-Discovery,,,,2025-10-01
Reinforcement Learning-Guided Chain-of-Draft for Token-Efficient Code Generation,reinforcement-learning-guided-chain-of-draft-for-token-efficient-code-generation,Article,Minor,❌,,HTML/Blog,,,,,,https://arxiv.org/abs/2509.25243,Press,Auto-Discovery,,,,2025-10-01
BuildBench: Benchmarking LLM Agents on Compiling Real-World Open-Source Software,buildbench-benchmarking-llm-agents-on-compiling-real-world-open-source-software,Article,Minor,❌,,HTML/Blog,,,,,,https://arxiv.org/abs/2509.25248,Press,Auto-Discovery,,,,2025-10-01
Automatically Generating Web Applications from Requirements Via Multi-Agent Test-Driven Development,automatically-generating-web-applications-from-requirements-via-multi-agent-test-driven-development,Article,Minor,❌,,HTML/Blog,,,,,,https://arxiv.org/abs/2509.25297,Press,Auto-Discovery,,,,2025-10-01
Uncertainty-Aware Generative Oversampling Using an Entropy-Guided Conditional Variational Autoencoder,uncertainty-aware-generative-oversampling-using-an-entropy-guided-conditional-variational-autoencoder,Article,Minor,❌,,HTML/Blog,,,,,,https://arxiv.org/abs/2509.25334,Press,Auto-Discovery,,,,2025-10-01
Let Physics Guide Your Protein Flows: Topology-aware Unfolding and Generation,let-physics-guide-your-protein-flows-topology-aware-unfolding-and-generation,Article,Minor,❌,,HTML/Blog,,,,,,https://arxiv.org/abs/2509.25379,Press,Auto-Discovery,,,,2025-10-01
Emotion-Aligned Generation in Diffusion Text to Speech Models via Preference-Guided Optimization,emotion-aligned-generation-in-diffusion-text-to-speech-models-via-preference-guided-optimization,Article,Minor,❌,,HTML/Blog,,,,,,https://arxiv.org/abs/2509.25416,Press,Auto-Discovery,,,,2025-10-01
Multi-patch isogeometric neural solver for partial differential equations on computer-aided design domains,multi-patch-isogeometric-neural-solver-for-partial-differential-equations-on-computer-aided-design-domains,Article,Minor,❌,,HTML/Blog,,,,,,https://arxiv.org/abs/2509.25450,Press,Auto-Discovery,,,,2025-10-01
"Not Wrong, But Untrue: LLM Overconfidence in Document-Based Queries",not-wrong-but-untrue-llm-overconfidence-in-document-based-queries,Article,Minor,❌,,HTML/Blog,,,,,,https://arxiv.org/abs/2509.25498,Press,Auto-Discovery,,,,2025-10-01
DeepFake Detection in Dyadic Video Calls using Point of Gaze Tracking,deepfake-detection-in-dyadic-video-calls-using-point-of-gaze-tracking,Article,Minor,❌,,HTML/Blog,,,,,,https://arxiv.org/abs/2509.25503,Press,Auto-Discovery,,,,2025-10-01
Calibrating Verbalized Confidence with Self-Generated Distractors,calibrating-verbalized-confidence-with-self-generated-distractors,Article,Minor,❌,,HTML/Blog,,,,,,https://arxiv.org/abs/2509.25532,Press,Auto-Discovery,,,,2025-10-01
K-Prism: A Knowledge-Guided and Prompt Integrated Universal Medical Image Segmentation Model,k-prism-a-knowledge-guided-and-prompt-integrated-universal-medical-image-segmentation-model,Article,Minor,❌,,HTML/Blog,,,,,,https://arxiv.org/abs/2509.25594,Press,Auto-Discovery,,,,2025-10-01
STAC: When Innocent Tools Form Dangerous Chains to Jailbreak LLM Agents,stac-when-innocent-tools-form-dangerous-chains-to-jailbreak-llm-agents,Article,Minor,❌,,HTML/Blog,,,,,,https://arxiv.org/abs/2509.25624,Press,Auto-Discovery,,,,2025-10-01
Deep Reinforcement Learning-Based Precoding for Multi-RIS-Aided Multiuser Downlink Systems with Practical Phase Shift,deep-reinforcement-learning-based-precoding-for-multi-ris-aided-multiuser-downlink-systems-with-practical-phase-shift,Article,Minor,❌,,HTML/Blog,,,,,,https://arxiv.org/abs/2509.25661,Press,Auto-Discovery,,,,2025-10-01
V-HUB: A Visual-Centric Humor Understanding Benchmark for Video LLMs,v-hub-a-visual-centric-humor-understanding-benchmark-for-video-llms,Article,Minor,❌,,HTML/Blog,,,,,,https://arxiv.org/abs/2509.25773,Press,Auto-Discovery,,,,2025-10-01
Editable Noise Map Inversion: Encoding Target-image into Noise For High-Fidelity Image Manipulation,editable-noise-map-inversion-encoding-target-image-into-noise-for-high-fidelity-image-manipulation,Article,Minor,❌,,HTML/Blog,,,,,,https://arxiv.org/abs/2509.25776,Press,Auto-Discovery,,,,2025-10-01
CardioForest: An Explainable Ensemble Learning Model for Automatic Wide QRS Complex Tachycardia Diagnosis from ECG,cardioforest-an-explainable-ensemble-learning-model-for-automatic-wide-qrs-complex-tachycardia-diagnosis-from-ecg,Article,Minor,❌,,HTML/Blog,,,,,,https://arxiv.org/abs/2509.25804,Press,Auto-Discovery,,,,2025-10-01
Training-Free Reward-Guided Image Editing via Trajectory Optimal Control,training-free-reward-guided-image-editing-via-trajectory-optimal-control,Article,Minor,❌,,HTML/Blog,,,,,,https://arxiv.org/abs/2509.25845,Press,Auto-Discovery,,,,2025-10-01
VRWKV-Editor: Reducing quadratic complexity in transformer-based video editing,vrwkv-editor-reducing-quadratic-complexity-in-transformer-based-video-editing,Article,Minor,❌,,HTML/Blog,,,,,,https://arxiv.org/abs/2509.25998,Press,Auto-Discovery,,,,2025-10-01
End-to-End Aspect-Guided Review Summarization at Scale,end-to-end-aspect-guided-review-summarization-at-scale,Article,Minor,❌,,HTML/Blog,,,,,,https://arxiv.org/abs/2509.26103,Press,Auto-Discovery,,,,2025-10-01
"Bubble, Bubble, AI's Rumble: Why Global Financial Regulatory Incident Reporting is Our Shield Against Systemic Stumbles",bubble-bubble-ai-s-rumble-why-global-financial-regulatory-incident-reporting-is-our-shield-against-systemic-stumbles,Article,Minor,❌,,HTML/Blog,,,,,,https://arxiv.org/abs/2509.26150,Press,Auto-Discovery,,,,2025-10-01
EntroPE: Entropy-Guided Dynamic Patch Encoder for Time Series Forecasting,entrope-entropy-guided-dynamic-patch-encoder-for-time-series-forecasting,Article,Minor,❌,,HTML/Blog,,,,,,https://arxiv.org/abs/2509.26157,Press,Auto-Discovery,,,,2025-10-01
Towards Continual Expansion of Data Coverage: Automatic Text-guided Edge-case Synthesis,towards-continual-expansion-of-data-coverage-automatic-text-guided-edge-case-synthesis,Article,Minor,❌,,HTML/Blog,,,,,,https://arxiv.org/abs/2509.26158,Press,Auto-Discovery,,,,2025-10-01
Toward an Unbiased Collective Memory for Efficient LLM-Based Agentic 6G Cross-Domain Management,toward-an-unbiased-collective-memory-for-efficient-llm-based-agentic-6g-cross-domain-management,Article,Minor,❌,,HTML/Blog,,,,,,https://arxiv.org/abs/2509.26200,Press,Auto-Discovery,,,,2025-10-01
An Experimental Study on Generating Plausible Textual Explanations for Video Summarization,an-experimental-study-on-generating-plausible-textual-explanations-for-video-summarization,Article,Minor,❌,,HTML/Blog,,,,,,https://arxiv.org/abs/2509.26225,Press,Auto-Discovery,,,,2025-10-01
Noise-Guided Transport for Imitation Learning,noise-guided-transport-for-imitation-learning,Article,Minor,❌,,HTML/Blog,,,,,,https://arxiv.org/abs/2509.26294,Press,Auto-Discovery,,,,2025-10-01
EditReward: A Human-Aligned Reward Model for Instruction-Guided Image Editing,editreward-a-human-aligned-reward-model-for-instruction-guided-image-editing,Article,Minor,❌,,HTML/Blog,,,,,,https://arxiv.org/abs/2509.26346,Press,Auto-Discovery,,,,2025-10-01
TimeScope: Towards Task-Oriented Temporal Grounding In Long Videos,timescope-towards-task-oriented-temporal-grounding-in-long-videos,Article,Minor,❌,,HTML/Blog,,,,,,https://arxiv.org/abs/2509.26360,Press,Auto-Discovery,,,,2025-10-01
Efficient and Transferable Agentic Knowledge Graph RAG via Reinforcement Learning,efficient-and-transferable-agentic-knowledge-graph-rag-via-reinforcement-learning,Article,Minor,❌,,HTML/Blog,,,,,,https://arxiv.org/abs/2509.26383,Press,Auto-Discovery,,,,2025-10-01
ACT: Agentic Classification Tree,act-agentic-classification-tree,Article,Minor,❌,,HTML/Blog,,,,,,https://arxiv.org/abs/2509.26433,Press,Auto-Discovery,,,,2025-10-01
VitaBench: Benchmarking LLM Agents with Versatile Interactive Tasks in Real-world Applications,vitabench-benchmarking-llm-agents-with-versatile-interactive-tasks-in-real-world-applications,Article,Minor,❌,,HTML/Blog,,,,,,https://arxiv.org/abs/2509.26490,Press,Auto-Discovery,,,,2025-10-01
OceanGym: A Benchmark Environment for Underwater Embodied Agents,oceangym-a-benchmark-environment-for-underwater-embodied-agents,Article,Minor,❌,,HTML/Blog,,,,,,https://arxiv.org/abs/2509.26536,Press,Auto-Discovery,,,,2025-10-01
TAMO: Fine-Grained Root Cause Analysis via Tool-Assisted LLM Agent with Multi-Modality Observation Data in Cloud-Native Systems,tamo-fine-grained-root-cause-analysis-via-tool-assisted-llm-agent-with-multi-modality-observation-data-in-cloud-native-systems,Article,Minor,❌,,HTML/Blog,,,,,,https://arxiv.org/abs/2504.20462,Press,Auto-Discovery,,,,2025-10-01
"AI Agents vs. Agentic AI: A Conceptual Taxonomy, Applications and Challenges",ai-agents-vs-agentic-ai-a-conceptual-taxonomy-applications-and-challenges,Article,Minor,❌,,HTML/Blog,,,,,,https://arxiv.org/abs/2505.10468,Press,Auto-Discovery,,,,2025-10-01
VS-Bench: Evaluating VLMs for Strategic Abilities in Multi-Agent Environments,vs-bench-evaluating-vlms-for-strategic-abilities-in-multi-agent-environments,Article,Minor,❌,,HTML/Blog,,,,,,https://arxiv.org/abs/2506.02387,Press,Auto-Discovery,,,,2025-10-01
