Tool,Moniker,Category,Severity,RSS Available,Feed URL,Tracking Method,Repo URL,Repo Status,Stars,Contributors,Docs URL,Website URL,Source Type,Discovery Method,Launch Status,Last Seen Update,Status,Date Added
ProfileSpider,profilespider,Article,Minor,❌,,HTML/Blog,,,,,,https://www.producthunt.com/posts/profilespider,Press,Auto-Discovery,,,,2025-08-22
NeuralSide,neuralside,Article,Minor,❌,,HTML/Blog,,,,,,https://www.producthunt.com/posts/neuralside,Press,Auto-Discovery,,,,2025-08-22
"AgentCraft. Like Cursor, but for n8n",agentcraft-like-cursor-but-for-n8n,Article,Minor,❌,,HTML/Blog,,,,,,https://www.producthunt.com/posts/agentcraft-like-cursor-but-for-n8n,Press,Auto-Discovery,,,,2025-08-22
AGENTS.md,agents-md,Article,Minor,❌,,HTML/Blog,,,,,,https://www.producthunt.com/posts/agents-md,Press,Auto-Discovery,,,,2025-08-22
VideoRecall,videorecall,Article,Minor,❌,,HTML/Blog,,,,,,https://www.producthunt.com/posts/videorecall,Press,Auto-Discovery,,,,2025-08-22
Show HN: PDJsonEditor – JSON editor with code↔graph sync and API fetch (OSS),show-hn-pdjsoneditor-json-editor-with-code-graph-sync-and-api-fetch-oss,Article,Minor,❌,,HTML/Blog,,,,,,https://json.podosoft.io,Press,Auto-Discovery,,,,2025-08-22
Show HN: An Agent that adds AI Powered actions to your website,show-hn-an-agent-that-adds-ai-powered-actions-to-your-website,Article,Minor,❌,,HTML/Blog,,,,,,https://www.instein.ai/,Press,Auto-Discovery,,,,2025-08-22
Show HN: Happiness Mantra – A 33-page guide to lasting joy,show-hn-happiness-mantra-a-33-page-guide-to-lasting-joy,Article,Minor,❌,,HTML/Blog,,,,,,https://bookbitehub.gumroad.com/l/HappinessMantra,Press,Auto-Discovery,,,,2025-08-22
Show HN: USB Device Identifier – Identify USB Devices in the Browser,show-hn-usb-device-identifier-identify-usb-devices-in-the-browser,Article,Minor,❌,,HTML/Blog,,,,,,https://nodeloop.org/projects/usb-identifier,Press,Auto-Discovery,,,,2025-08-22
Built a YAML-to-RESUME Editor,built-a-yaml-to-resume-editor,Article,Minor,❌,,HTML/Blog,,,,,,https://www.reddit.com/r/programming/comments/1mx53ei/built_a_yamltoresume_editor/,Press,Auto-Discovery,,,,2025-08-22
What’s Telematics? Your Guide to Connected Vehicles and IoT,what-s-telematics-your-guide-to-connected-vehicles-and-iot,Article,Minor,❌,,HTML/Blog,,,,,,https://www.reddit.com/r/programming/comments/1mx4utf/whats_telematics_your_guide_to_connected_vehicles/,Press,Auto-Discovery,,,,2025-08-22
Transforming Ideas into Scalable Digital Solutions – The Skyappz Way,transforming-ideas-into-scalable-digital-solutions-the-skyappz-way,Article,Minor,❌,,HTML/Blog,,,,,,https://www.reddit.com/r/programming/comments/1mx46ca/transforming_ideas_into_scalable_digital/,Press,Auto-Discovery,,,,2025-08-22
Why do my agents always break at the worst possible time?,why-do-my-agents-always-break-at-the-worst-possible-time,Article,Minor,❌,,HTML/Blog,,,,,,https://www.reddit.com/r/LocalLLaMA/comments/1mwx9y5/why_do_my_agents_always_break_at_the_worst/,Press,Auto-Discovery,,,,2025-08-22
Why low-bit models aren't totally braindead: A guide from 1-bit meme to FP16 research,why-low-bit-models-aren-t-totally-braindead-a-guide-from-1-bit-meme-to-fp16-research,Article,Minor,❌,,HTML/Blog,,,,,,https://www.reddit.com/r/LocalLLaMA/comments/1mwevt4/why_lowbit_models_arent_totally_braindead_a_guide/,Press,Auto-Discovery,,,,2025-08-22
"How much token per second is considered as ""usable""?",how-much-token-per-second-is-considered-as-usable,Article,Minor,❌,,HTML/Blog,,,,,,https://www.reddit.com/r/LocalLLaMA/comments/1mx1nmq/how_much_token_per_second_is_considered_as_usable/,Press,Auto-Discovery,,,,2025-08-22
[R] Is data the bottleneck for video/audio generation?,r-is-data-the-bottleneck-for-video-audio-generation,Article,Minor,❌,,HTML/Blog,,,,,,https://www.reddit.com/r/MachineLearning/comments/1mv5ls0/r_is_data_the_bottleneck_for_videoaudio_generation/,Press,Auto-Discovery,,,,2025-08-22
[D] ACL Rolling Review (ARR) 2025 May (EMNLP 2025) Stats,d-acl-rolling-review-arr-2025-may-emnlp-2025-stats,Article,Minor,❌,,HTML/Blog,,,,,,https://www.reddit.com/r/MachineLearning/comments/1mtoewm/d_acl_rolling_review_arr_2025_may_emnlp_2025_stats/,Press,Auto-Discovery,,,,2025-08-22
Why Paradigm built a spreadsheet with an AI agent in every cell,why-paradigm-built-a-spreadsheet-with-an-ai-agent-in-every-cell,Article,Minor,❌,,HTML/Blog,,,,,,https://techcrunch.com/2025/08/18/why-paradigm-built-a-spreadsheet-with-an-ai-agent-in-every-cell/,Press,Auto-Discovery,,,,2025-08-22
Google’s new Web Guide search experiment organizes results with AI,google-s-new-web-guide-search-experiment-organizes-results-with-ai,Article,Minor,❌,,HTML/Blog,,,,,,https://techcrunch.com/2025/07/24/googles-new-web-guide-search-experiment-organizes-results-with-ai/,Press,Auto-Discovery,,,,2025-08-22
Google made it easier to edit your Drive videos,google-made-it-easier-to-edit-your-drive-videos,Article,Minor,❌,,HTML/Blog,,,,,,https://www.theverge.com/news/764221/google-drive-video-editing-vids-shortcut,Press,Auto-Discovery,,,,2025-08-22
Inside Walmart’s AI security stack: How a startup mentality is hardening enterprise-scale defense,inside-walmart-s-ai-security-stack-how-a-startup-mentality-is-hardening-enterprise-scale-defense,Article,Minor,❌,,HTML/Blog,,,,,,https://venturebeat.com/security/exclusive-walmarts-ciso-is-rebuilding-identity-security-for-ai-age/,Press,Auto-Discovery,,,,2025-08-22
LLMs generate ‘fluent nonsense’ when reasoning outside their training zone,llms-generate-fluent-nonsense-when-reasoning-outside-their-training-zone,Article,Minor,❌,,HTML/Blog,,,,,,https://venturebeat.com/ai/llms-generate-fluent-nonsense-when-reasoning-outside-their-training-zone/,Press,Auto-Discovery,,,,2025-08-22
VB AI Impact Series: Can you really govern multi-agent AI?,vb-ai-impact-series-can-you-really-govern-multi-agent-ai,Article,Minor,❌,,HTML/Blog,,,,,,https://venturebeat.com/ai/vb-ai-impact-series-can-you-really-govern-multi-agent-ai/,Press,Auto-Discovery,,,,2025-08-22
Adult sites are stashing exploit code inside racy .svg files,adult-sites-are-stashing-exploit-code-inside-racy-svg-files,Article,Minor,❌,,HTML/Blog,,,,,,https://arstechnica.com/security/2025/08/adult-sites-use-malicious-svg-files-to-rack-up-likes-on-facebook/,Press,Auto-Discovery,,,,2025-08-22
AI in Wyoming may soon use more electricity than state’s human residents,ai-in-wyoming-may-soon-use-more-electricity-than-state-s-human-residents,Article,Minor,❌,,HTML/Blog,,,,,,https://arstechnica.com/information-technology/2025/07/ai-in-wyoming-may-soon-use-more-electricity-than-states-human-residents/,Press,Auto-Discovery,,,,2025-08-22
Can coding agents self-improve?,can-coding-agents-self-improve,Article,Minor,❌,,HTML/Blog,,,,,,https://www.latent.space/p/self-improving,Press,Auto-Discovery,,,,2025-08-22
Cline: The Open Source Code Agent — with Saoud Rizwan and Nik Pash,cline-the-open-source-code-agent-with-saoud-rizwan-and-nik-pash,Article,Minor,❌,,HTML/Blog,,,,,,https://www.latent.space/p/cline,Press,Auto-Discovery,,,,2025-08-22
Scaling Test Time Compute to Multi-Agent Civilizations: Noam Brown,scaling-test-time-compute-to-multi-agent-civilizations-noam-brown,Article,Minor,❌,,HTML/Blog,,,,,,https://www.latent.space/p/noam-brown,Press,Auto-Discovery,,,,2025-08-22
AIEWF 2025 Online! (and Attendee Guide),aiewf-2025-online-and-attendee-guide,Article,Minor,❌,,HTML/Blog,,,,,,https://www.latent.space/p/aiewf-2025,Press,Auto-Discovery,,,,2025-08-22
"SWE Agents Too Cheap To Meter, The Token Data War, and the rise of Tiny Teams",swe-agents-too-cheap-to-meter-the-token-data-war-and-the-rise-of-tiny-teams,Article,Minor,❌,,HTML/Blog,,,,,,https://www.latent.space/p/token-data-war,Press,Auto-Discovery,,,,2025-08-22
"⚡️Multi-Turn RL for Multi-Hour Agents — with Will Brown, Prime Intellect",multi-turn-rl-for-multi-hour-agents-with-will-brown-prime-intellect,Article,Minor,❌,,HTML/Blog,,,,,,https://www.latent.space/p/willccbb,Press,Auto-Discovery,,,,2025-08-22
Claude Code: Anthropic's Agent in Your Terminal,claude-code-anthropic-s-agent-in-your-terminal,Article,Minor,❌,,HTML/Blog,,,,,,https://www.latent.space/p/claude-code,Press,Auto-Discovery,,,,2025-08-22
From Zero to GPU: A Guide to Building and Scaling Production-Ready CUDA Kernels,from-zero-to-gpu-a-guide-to-building-and-scaling-production-ready-cuda-kernels,Article,Minor,❌,,HTML/Blog,,,,,,https://huggingface.co/blog/kernel-builder,Press,Auto-Discovery,,,,2025-08-22
MCP for Research: How to Connect AI to Research Tools,mcp-for-research-how-to-connect-ai-to-research-tools,Article,Minor,❌,,HTML/Blog,,,,,,https://huggingface.co/blog/mcp-for-research,Press,Auto-Discovery,,,,2025-08-22
TextQuests: How Good are LLMs at Text-Based Video Games?,textquests-how-good-are-llms-at-text-based-video-games,Article,Minor,❌,,HTML/Blog,,,,,,https://huggingface.co/blog/textquests,Press,Auto-Discovery,,,,2025-08-22
Accelerate ND-Parallel: A Guide to Efficient Multi-GPU Training,accelerate-nd-parallel-a-guide-to-efficient-multi-gpu-training,Article,Minor,❌,,HTML/Blog,,,,,,https://huggingface.co/blog/accelerate-nd-parallel,Press,Auto-Discovery,,,,2025-08-22
Build an AI Shopping Assistant with Gradio MCP Servers,build-an-ai-shopping-assistant-with-gradio-mcp-servers,Article,Minor,❌,,HTML/Blog,,,,,,https://huggingface.co/blog/gradio-vton-mcp,Press,Auto-Discovery,,,,2025-08-22
TimeScope: How Long Can Your Video Large Multimodal Model Go?,timescope-how-long-can-your-video-large-multimodal-model-go,Article,Minor,❌,,HTML/Blog,,,,,,https://huggingface.co/blog/timescope-video-lmm-benchmark,Press,Auto-Discovery,,,,2025-08-22
Back to The Future: Evaluating AI Agents on Predicting Future Events,back-to-the-future-evaluating-ai-agents-on-predicting-future-events,Article,Minor,❌,,HTML/Blog,,,,,,https://huggingface.co/blog/futurebench,Press,Auto-Discovery,,,,2025-08-22
Five Big Improvements to Gradio MCP Servers,five-big-improvements-to-gradio-mcp-servers,Article,Minor,❌,,HTML/Blog,,,,,,https://huggingface.co/blog/gradio-mcp-updates,Press,Auto-Discovery,,,,2025-08-22
ScreenEnv: Deploy your full stack Desktop Agent,screenenv-deploy-your-full-stack-desktop-agent,Article,Minor,❌,,HTML/Blog,,,,,,https://huggingface.co/blog/screenenv,Press,Auto-Discovery,,,,2025-08-22
Building the Hugging Face MCP Server,building-the-hugging-face-mcp-server,Article,Minor,❌,,HTML/Blog,,,,,,https://huggingface.co/blog/building-hf-mcp,Press,Auto-Discovery,,,,2025-08-22
Upskill your LLMs with Gradio MCP Servers,upskill-your-llms-with-gradio-mcp-servers,Article,Minor,❌,,HTML/Blog,,,,,,https://huggingface.co/blog/gradio-mcp-servers,Press,Auto-Discovery,,,,2025-08-22
Groq on Hugging Face Inference Providers 🔥,groq-on-hugging-face-inference-providers,Article,Minor,❌,,HTML/Blog,,,,,,https://huggingface.co/blog/inference-providers-groq,Press,Auto-Discovery,,,,2025-08-22
Featherless AI on Hugging Face Inference Providers 🔥,featherless-ai-on-hugging-face-inference-providers,Article,Minor,❌,,HTML/Blog,,,,,,https://huggingface.co/blog/inference-providers-featherless,Press,Auto-Discovery,,,,2025-08-22
ScreenSuite - The most comprehensive evaluation suite for GUI Agents!,screensuite-the-most-comprehensive-evaluation-suite-for-gui-agents,Article,Minor,❌,,HTML/Blog,,,,,,https://huggingface.co/blog/screensuite,Press,Auto-Discovery,,,,2025-08-22
CodeAgents + Structure: A Better Way to Execute Actions,codeagents-structure-a-better-way-to-execute-actions,Article,Minor,❌,,HTML/Blog,,,,,,https://huggingface.co/blog/structured-codeagent,Press,Auto-Discovery,,,,2025-08-22
Tiny Agents in Python: a MCP-powered agent in ~70 lines of code,tiny-agents-in-python-a-mcp-powered-agent-in-70-lines-of-code,Article,Minor,❌,,HTML/Blog,,,,,,https://huggingface.co/blog/python-tiny-agents,Press,Auto-Discovery,,,,2025-08-22
How to Build an MCP Server with Gradio,how-to-build-an-mcp-server-with-gradio,Article,Minor,❌,,HTML/Blog,,,,,,https://huggingface.co/blog/gradio-mcp,Press,Auto-Discovery,,,,2025-08-22
Tiny Agents: a MCP-powered agent in 50 lines of code,tiny-agents-a-mcp-powered-agent-in-50-lines-of-code,Article,Minor,❌,,HTML/Blog,,,,,,https://huggingface.co/blog/tiny-agents,Press,Auto-Discovery,,,,2025-08-22
Cohere on Hugging Face Inference Providers 🔥,cohere-on-hugging-face-inference-providers,Article,Minor,❌,,HTML/Blog,,,,,,https://huggingface.co/blog/inference-providers-cohere,Press,Auto-Discovery,,,,2025-08-22
Hugging Face and Cloudflare Partner to Make Real-Time Speech and Video Seamless with FastRTC,hugging-face-and-cloudflare-partner-to-make-real-time-speech-and-video-seamless-with-fastrtc,Article,Minor,❌,,HTML/Blog,,,,,,https://huggingface.co/blog/fastrtc-cloudflare,Press,Auto-Discovery,,,,2025-08-22
LLM Inference on Edge: A Fun and Easy Guide to run LLMs via React Native on your Phone!,llm-inference-on-edge-a-fun-and-easy-guide-to-run-llms-via-react-native-on-your-phone,Article,Minor,❌,,HTML/Blog,,,,,,https://huggingface.co/blog/llm-inference-on-edge,Press,Auto-Discovery,,,,2025-08-22
Trace & Evaluate your Agent with Arize Phoenix,trace-evaluate-your-agent-with-arize-phoenix,Article,Minor,❌,,HTML/Blog,,,,,,https://huggingface.co/blog/smolagents-phoenix,Press,Auto-Discovery,,,,2025-08-22
SmolVLM2: Bringing Video Understanding to Every Device,smolvlm2-bringing-video-understanding-to-every-device,Article,Minor,❌,,HTML/Blog,,,,,,https://huggingface.co/blog/smolvlm2,Press,Auto-Discovery,,,,2025-08-22
"Introducing Three New Serverless Inference Providers: Hyperbolic, Nebius AI Studio, and Novita 🔥",introducing-three-new-serverless-inference-providers-hyperbolic-nebius-ai-studio-and-novita,Article,Minor,❌,,HTML/Blog,,,,,,https://huggingface.co/blog/inference-providers-nebius-novita-hyperbolic,Press,Auto-Discovery,,,,2025-08-22
Build awesome datasets for video generation,build-awesome-datasets-for-video-generation,Article,Minor,❌,,HTML/Blog,,,,,,https://huggingface.co/blog/vid_ds_scripts,Press,Auto-Discovery,,,,2025-08-22
Open-source DeepResearch – Freeing our search agents,open-source-deepresearch-freeing-our-search-agents,Article,Minor,❌,,HTML/Blog,,,,,,https://huggingface.co/blog/open-deep-research,Press,Auto-Discovery,,,,2025-08-22
DABStep: Data Agent Benchmark for Multi-step Reasoning,dabstep-data-agent-benchmark-for-multi-step-reasoning,Article,Minor,❌,,HTML/Blog,,,,,,https://huggingface.co/blog/dabstep,Press,Auto-Discovery,,,,2025-08-22
Welcome to Inference Providers on the Hub 🔥,welcome-to-inference-providers-on-the-hub,Article,Minor,❌,,HTML/Blog,,,,,,https://huggingface.co/blog/inference-providers,Press,Auto-Discovery,,,,2025-08-22
State of open video generation models in Diffusers,state-of-open-video-generation-models-in-diffusers,Article,Minor,❌,,HTML/Blog,,,,,,https://huggingface.co/blog/video_gen,Press,Auto-Discovery,,,,2025-08-22
We now support VLMs in smolagents!,we-now-support-vlms-in-smolagents,Article,Minor,❌,,HTML/Blog,,,,,,https://huggingface.co/blog/smolagents-can-see,Press,Auto-Discovery,,,,2025-08-22
AI Agents Are Here. What Now?,ai-agents-are-here-what-now,Article,Minor,❌,,HTML/Blog,,,,,,https://huggingface.co/blog/ethics-soc-7,Press,Auto-Discovery,,,,2025-08-22
Introducing smolagents: simple agents that write actions in code.,introducing-smolagents-simple-agents-that-write-actions-in-code,Article,Minor,❌,,HTML/Blog,,,,,,https://huggingface.co/blog/smolagents,Press,Auto-Discovery,,,,2025-08-22
Open Source Developers Guide to the EU AI Act,open-source-developers-guide-to-the-eu-ai-act,Article,Minor,❌,,HTML/Blog,,,,,,https://huggingface.co/blog/eu-ai-act-for-oss-developers,Press,Auto-Discovery,,,,2025-08-22
A Security Review of Gradio 5,a-security-review-of-gradio-5,Article,Minor,❌,,HTML/Blog,,,,,,https://huggingface.co/blog/gradio-5-security,Press,Auto-Discovery,,,,2025-08-22
FineVideo: behind the scenes,finevideo-behind-the-scenes,Article,Minor,❌,,HTML/Blog,,,,,,https://huggingface.co/blog/fine-video,Press,Auto-Discovery,,,,2025-08-22
Scaling robotics datasets with video encoding,scaling-robotics-datasets-with-video-encoding,Article,Minor,❌,,HTML/Blog,,,,,,https://huggingface.co/blog/video-encoding,Press,Auto-Discovery,,,,2025-08-22
Our Transformers Code Agent beats the GAIA benchmark!,our-transformers-code-agent-beats-the-gaia-benchmark,Article,Minor,❌,,HTML/Blog,,,,,,https://huggingface.co/blog/beating-gaia,Press,Auto-Discovery,,,,2025-08-22
License to Call: Introducing Transformers Agents 2.0,license-to-call-introducing-transformers-agents-2-0,Article,Minor,❌,,HTML/Blog,,,,,,https://huggingface.co/blog/agents,Press,Auto-Discovery,,,,2025-08-22
"Jack of All Trades, Master of Some, a Multi-Purpose Transformer Agent",jack-of-all-trades-master-of-some-a-multi-purpose-transformer-agent,Article,Minor,❌,,HTML/Blog,,,,,,https://huggingface.co/blog/jat,Press,Auto-Discovery,,,,2025-08-22
Introducing Idefics2: A Powerful 8B Vision-Language Model for the community,introducing-idefics2-a-powerful-8b-vision-language-model-for-the-community,Article,Minor,❌,,HTML/Blog,,,,,,https://huggingface.co/blog/idefics2,Press,Auto-Discovery,,,,2025-08-22
Open-source LLMs as LangChain Agents,open-source-llms-as-langchain-agents,Article,Minor,❌,,HTML/Blog,,,,,,https://huggingface.co/blog/open-source-llms-as-agents,Press,Auto-Discovery,,,,2025-08-22
A guide to setting up your own Hugging Face leaderboard: an end-to-end example with Vectara's hallucination leaderboard,a-guide-to-setting-up-your-own-hugging-face-leaderboard-an-end-to-end-example-with-vectara-s-hallucination-leaderboard,Article,Minor,❌,,HTML/Blog,,,,,,https://huggingface.co/blog/leaderboard-vectara,Press,Auto-Discovery,,,,2025-08-22
Non-engineers guide: Train a LLaMA 2 chatbot,non-engineers-guide-train-a-llama-2-chatbot,Article,Minor,❌,,HTML/Blog,,,,,,https://huggingface.co/blog/Llama2-for-non-engineers,Press,Auto-Discovery,,,,2025-08-22
Introducing IDEFICS: An Open Reproduction of State-of-the-art Visual Language Model,introducing-idefics-an-open-reproduction-of-state-of-the-art-visual-language-model,Article,Minor,❌,,HTML/Blog,,,,,,https://huggingface.co/blog/idefics,Press,Auto-Discovery,,,,2025-08-22
Practical 3D Asset Generation: A Step-by-Step Guide,practical-3d-asset-generation-a-step-by-step-guide,Article,Minor,❌,,HTML/Blog,,,,,,https://huggingface.co/blog/3d-assets,Press,Auto-Discovery,,,,2025-08-22
AI Policy @🤗: Open ML Considerations in the EU AI Act,ai-policy-open-ml-considerations-in-the-eu-ai-act,Article,Minor,❌,,HTML/Blog,,,,,,https://huggingface.co/blog/eu-ai-act-oss,Press,Auto-Discovery,,,,2025-08-22
Introducing Agents.js: Give tools to your LLMs using JavaScript,introducing-agents-js-give-tools-to-your-llms-using-javascript,Article,Minor,❌,,HTML/Blog,,,,,,https://huggingface.co/blog/agents-js,Press,Auto-Discovery,,,,2025-08-22
Announcing our new Content Guidelines and Policy,announcing-our-new-content-guidelines-and-policy,Article,Minor,❌,,HTML/Blog,,,,,,https://huggingface.co/blog/content-guidelines-update,Press,Auto-Discovery,,,,2025-08-22
A Dive into Text-to-Video Models,a-dive-into-text-to-video-models,Article,Minor,❌,,HTML/Blog,,,,,,https://huggingface.co/blog/text-to-video,Press,Auto-Discovery,,,,2025-08-22
StackLLaMA: A hands-on guide to train LLaMA with RLHF,stackllama-a-hands-on-guide-to-train-llama-with-rlhf,Article,Minor,❌,,HTML/Blog,,,,,,https://huggingface.co/blog/stackllama,Press,Auto-Discovery,,,,2025-08-22
Ethical guidelines for developing the Diffusers library,ethical-guidelines-for-developing-the-diffusers-library,Article,Minor,❌,,HTML/Blog,,,,,,https://huggingface.co/blog/ethics-diffusers,Press,Auto-Discovery,,,,2025-08-22
Introducing ⚔️ AI vs. AI ⚔️ a deep reinforcement learning multi-agents competition system,introducing-ai-vs-ai-a-deep-reinforcement-learning-multi-agents-competition-system,Article,Minor,❌,,HTML/Blog,,,,,,https://huggingface.co/blog/aivsai,Press,Auto-Discovery,,,,2025-08-22
What Makes a Dialog Agent Useful?,what-makes-a-dialog-agent-useful,Article,Minor,❌,,HTML/Blog,,,,,,https://huggingface.co/blog/dialog-agents,Press,Auto-Discovery,,,,2025-08-22
A Complete Guide to Audio Datasets,a-complete-guide-to-audio-datasets,Article,Minor,❌,,HTML/Blog,,,,,,https://huggingface.co/blog/audio-datasets,Press,Auto-Discovery,,,,2025-08-22
Introducing DOI: the Digital Object Identifier to Datasets and Models,introducing-doi-the-digital-object-identifier-to-datasets-and-models,Article,Minor,❌,,HTML/Blog,,,,,,https://huggingface.co/blog/introducing-doi,Press,Auto-Discovery,,,,2025-08-22
Announcing the 🤗 AI Research Residency Program,announcing-the-ai-research-residency-program,Article,Minor,❌,,HTML/Blog,,,,,,https://huggingface.co/blog/ai-residency,Press,Auto-Discovery,,,,2025-08-22
"Introducing Snowball Fight ☃️, our First ML-Agents Environment",introducing-snowball-fight-our-first-ml-agents-environment,Article,Minor,❌,,HTML/Blog,,,,,,https://huggingface.co/blog/snowball-fight,Press,Auto-Discovery,,,,2025-08-22
Simple considerations for simple people building fancy neural networks,simple-considerations-for-simple-people-building-fancy-neural-networks,Article,Minor,❌,,HTML/Blog,,,,,,https://huggingface.co/blog/simple-considerations,Press,Auto-Discovery,,,,2025-08-22
Collab-REC: An LLM-based Agentic Framework for Balancing Recommendations in Tourism,collab-rec-an-llm-based-agentic-framework-for-balancing-recommendations-in-tourism,Article,Minor,❌,,HTML/Blog,,,,,,https://arxiv.org/abs/2508.15030,Press,Auto-Discovery,,,,2025-08-22
Emergent Crowds Dynamics from Language-Driven Multi-Agent Interactions,emergent-crowds-dynamics-from-language-driven-multi-agent-interactions,Article,Minor,❌,,HTML/Blog,,,,,,https://arxiv.org/abs/2508.15047,Press,Auto-Discovery,,,,2025-08-22
Don't Think Twice! Over-Reasoning Impairs Confidence Calibration,don-t-think-twice-over-reasoning-impairs-confidence-calibration,Article,Minor,❌,,HTML/Blog,,,,,,https://arxiv.org/abs/2508.15050,Press,Auto-Discovery,,,,2025-08-22
S3LoRA: Safe Spectral Sharpness-Guided Pruning in Adaptation of Agent Planner,s3lora-safe-spectral-sharpness-guided-pruning-in-adaptation-of-agent-planner,Article,Minor,❌,,HTML/Blog,,,,,,https://arxiv.org/abs/2508.15068,Press,Auto-Discovery,,,,2025-08-22
Mobile-Agent-v3: Foundamental Agents for GUI Automation,mobile-agent-v3-foundamental-agents-for-gui-automation,Article,Minor,❌,,HTML/Blog,,,,,,https://arxiv.org/abs/2508.15144,Press,Auto-Discovery,,,,2025-08-22
See it. Say it. Sorted: Agentic System for Compositional Diagram Generation,see-it-say-it-sorted-agentic-system-for-compositional-diagram-generation,Article,Minor,❌,,HTML/Blog,,,,,,https://arxiv.org/abs/2508.15222,Press,Auto-Discovery,,,,2025-08-22
Multiple Memory Systems for Enhancing the Long-term Memory of Agent,multiple-memory-systems-for-enhancing-the-long-term-memory-of-agent,Article,Minor,❌,,HTML/Blog,,,,,,https://arxiv.org/abs/2508.15294,Press,Auto-Discovery,,,,2025-08-22
Coarse-to-Fine Grounded Memory for LLM Agent Planning,coarse-to-fine-grounded-memory-for-llm-agent-planning,Article,Minor,❌,,HTML/Blog,,,,,,https://arxiv.org/abs/2508.15305,Press,Auto-Discovery,,,,2025-08-22
From Bits to Boardrooms: A Cutting-Edge Multi-Agent LLM Framework for Business Excellence,from-bits-to-boardrooms-a-cutting-edge-multi-agent-llm-framework-for-business-excellence,Article,Minor,❌,,HTML/Blog,,,,,,https://arxiv.org/abs/2508.15447,Press,Auto-Discovery,,,,2025-08-22
Super-additive Cooperation in Language Model Agents,super-additive-cooperation-in-language-model-agents,Article,Minor,❌,,HTML/Blog,,,,,,https://arxiv.org/abs/2508.15510,Press,Auto-Discovery,,,,2025-08-22
Understanding Action Effects through Instrumental Empowerment in Multi-Agent Reinforcement Learning,understanding-action-effects-through-instrumental-empowerment-in-multi-agent-reinforcement-learning,Article,Minor,❌,,HTML/Blog,,,,,,https://arxiv.org/abs/2508.15652,Press,Auto-Discovery,,,,2025-08-22
Language-Guided Tuning: Enhancing Numeric Optimization with Textual Feedback,language-guided-tuning-enhancing-numeric-optimization-with-textual-feedback,Article,Minor,❌,,HTML/Blog,,,,,,https://arxiv.org/abs/2508.15757,Press,Auto-Discovery,,,,2025-08-22
Efficient Switchable Safety Control in LLMs via Magic-Token-Guided Co-Training,efficient-switchable-safety-control-in-llms-via-magic-token-guided-co-training,Article,Minor,❌,,HTML/Blog,,,,,,https://arxiv.org/abs/2508.14904,Press,Auto-Discovery,,,,2025-08-22
Can synthetic data reproduce real-world findings in epidemiology? A replication study using tree-based generative AI,can-synthetic-data-reproduce-real-world-findings-in-epidemiology-a-replication-study-using-tree-based-generative-ai,Article,Minor,❌,,HTML/Blog,,,,,,https://arxiv.org/abs/2508.14936,Press,Auto-Discovery,,,,2025-08-22
"Quantized Neural Networks for Microcontrollers: A Comprehensive Review of Methods, Platforms, and Applications",quantized-neural-networks-for-microcontrollers-a-comprehensive-review-of-methods-platforms-and-applications,Article,Minor,❌,,HTML/Blog,,,,,,https://arxiv.org/abs/2508.15008,Press,Auto-Discovery,,,,2025-08-22
MoEcho: Exploiting Side-Channel Attacks to Compromise User Privacy in Mixture-of-Experts LLMs,moecho-exploiting-side-channel-attacks-to-compromise-user-privacy-in-mixture-of-experts-llms,Article,Minor,❌,,HTML/Blog,,,,,,https://arxiv.org/abs/2508.15036,Press,Auto-Discovery,,,,2025-08-22
IPIGuard: A Novel Tool Dependency Graph-Based Defense Against Indirect Prompt Injection in LLM Agents,ipiguard-a-novel-tool-dependency-graph-based-defense-against-indirect-prompt-injection-in-llm-agents,Article,Minor,❌,,HTML/Blog,,,,,,https://arxiv.org/abs/2508.15310,Press,Auto-Discovery,,,,2025-08-22
