Tool,Moniker,Category,Severity,RSS Available,Feed URL,Tracking Method,Repo URL,Repo Status,Stars,Contributors,Docs URL,Website URL,Source Type,Discovery Method,Launch Status,Last Seen Update,Status,Date Added
Show HN: Play with an AI agent that debugs incidents in our sandbox,show-hn-play-with-an-ai-agent-that-debugs-incidents-in-our-sandbox,Article,Minor,❌,,HTML/Blog,,,,,,https://sandbox.syn-cause.com,Press,Auto-Discovery,,,,2025-09-12
Show HN: Infinite Talk AI – Create Realistic AI Videos with No Time Limit,show-hn-infinite-talk-ai-create-realistic-ai-videos-with-no-time-limit,Article,Minor,❌,,HTML/Blog,,,,,,https://www.infinitetalkai.com,Press,Auto-Discovery,,,,2025-09-12
Qwen Next Is A Preview Of Qwen3.5👀,qwen-next-is-a-preview-of-qwen3-5,Article,Minor,❌,,HTML/Blog,,,,,,https://www.reddit.com/r/LocalLLaMA/comments/1nejluw/qwen_next_is_a_preview_of_qwen35/,Press,Auto-Discovery,,,,2025-09-12
"The Download: America’s gun crisis, and how AI video models work",the-download-america-s-gun-crisis-and-how-ai-video-models-work,Article,Minor,❌,,HTML/Blog,,,,,,https://www.technologyreview.com/2025/09/12/1123577/the-download-americas-gun-crisis-and-how-ai-video-models-work/,Press,Auto-Discovery,,,,2025-09-12
How do AI models generate videos?,how-do-ai-models-generate-videos,Article,Minor,❌,,HTML/Blog,,,,,,https://www.technologyreview.com/2025/09/12/1123562/how-do-ai-models-generate-videos/,Press,Auto-Discovery,,,,2025-09-12
An Interval Type-2 Version of Bayes Theorem Derived from Interval Probability Range Estimates Provided by Subject Matter Experts,an-interval-type-2-version-of-bayes-theorem-derived-from-interval-probability-range-estimates-provided-by-subject-matter-experts,Article,Minor,❌,,HTML/Blog,,,,,,https://arxiv.org/abs/2509.08834,Press,Auto-Discovery,,,,2025-09-12
Global Constraint LLM Agents for Text-to-Model Translation,global-constraint-llm-agents-for-text-to-model-translation,Article,Minor,❌,,HTML/Blog,,,,,,https://arxiv.org/abs/2509.08970,Press,Auto-Discovery,,,,2025-09-12
Understanding Economic Tradeoffs Between Human and AI Agents in Bargaining Games,understanding-economic-tradeoffs-between-human-and-ai-agents-in-bargaining-games,Article,Minor,❌,,HTML/Blog,,,,,,https://arxiv.org/abs/2509.09071,Press,Auto-Discovery,,,,2025-09-12
Anti-Money Laundering Machine Learning Pipelines; A Technical Analysis on Identifying High-risk Bank Clients with Supervised Learning,anti-money-laundering-machine-learning-pipelines-a-technical-analysis-on-identifying-high-risk-bank-clients-with-supervised-learning,Article,Minor,❌,,HTML/Blog,,,,,,https://arxiv.org/abs/2509.09127,Press,Auto-Discovery,,,,2025-09-12
Mind Meets Space: Rethinking Agentic Spatial Intelligence from a Neuroscience-inspired Perspective,mind-meets-space-rethinking-agentic-spatial-intelligence-from-a-neuroscience-inspired-perspective,Article,Minor,❌,,HTML/Blog,,,,,,https://arxiv.org/abs/2509.09154,Press,Auto-Discovery,,,,2025-09-12
ProgD: Progressive Multi-scale Decoding with Dynamic Graphs for Joint Multi-agent Motion Forecasting,progd-progressive-multi-scale-decoding-with-dynamic-graphs-for-joint-multi-agent-motion-forecasting,Article,Minor,❌,,HTML/Blog,,,,,,https://arxiv.org/abs/2509.09210,Press,Auto-Discovery,,,,2025-09-12
"Enabling Regulatory Multi-Agent Collaboration: Architecture, Challenges, and Solutions",enabling-regulatory-multi-agent-collaboration-architecture-challenges-and-solutions,Article,Minor,❌,,HTML/Blog,,,,,,https://arxiv.org/abs/2509.09215,Press,Auto-Discovery,,,,2025-09-12
Jupiter: Enhancing LLM Data Analysis Capabilities via Notebook and Inference-Time Value-Guided Search,jupiter-enhancing-llm-data-analysis-capabilities-via-notebook-and-inference-time-value-guided-search,Article,Minor,❌,,HTML/Blog,,,,,,https://arxiv.org/abs/2509.09245,Press,Auto-Discovery,,,,2025-09-12
Tree-OPO: Off-policy Monte Carlo Tree-Guided Advantage Optimization for Multistep Reasoning,tree-opo-off-policy-monte-carlo-tree-guided-advantage-optimization-for-multistep-reasoning,Article,Minor,❌,,HTML/Blog,,,,,,https://arxiv.org/abs/2509.09284,Press,Auto-Discovery,,,,2025-09-12
LightAgent: Production-level Open-source Agentic AI Framework,lightagent-production-level-open-source-agentic-ai-framework,Article,Minor,❌,,HTML/Blog,,,,,,https://arxiv.org/abs/2509.09292,Press,Auto-Discovery,,,,2025-09-12
"Towards Adaptive ML Benchmarks: Web-Agent-Driven Construction, Domain Expansion, and Metric Optimization",towards-adaptive-ml-benchmarks-web-agent-driven-construction-domain-expansion-and-metric-optimization,Article,Minor,❌,,HTML/Blog,,,,,,https://arxiv.org/abs/2509.09321,Press,Auto-Discovery,,,,2025-09-12
SEDM: Scalable Self-Evolving Distributed Memory for Agents,sedm-scalable-self-evolving-distributed-memory-for-agents,Article,Minor,❌,,HTML/Blog,,,,,,https://arxiv.org/abs/2509.09498,Press,Auto-Discovery,,,,2025-09-12
Boosting Embodied AI Agents through Perception-Generation Disaggregation and Asynchronous Pipeline Execution,boosting-embodied-ai-agents-through-perception-generation-disaggregation-and-asynchronous-pipeline-execution,Article,Minor,❌,,HTML/Blog,,,,,,https://arxiv.org/abs/2509.09560,Press,Auto-Discovery,,,,2025-09-12
"PromptGuard: An Orchestrated Prompting Framework for Principled Synthetic Text Generation for Vulnerable Populations using LLMs with Enhanced Safety, Fairness, and Controllability",promptguard-an-orchestrated-prompting-framework-for-principled-synthetic-text-generation-for-vulnerable-populations-using-llms-with-enhanced-safety-fairness-and-controllability,Article,Minor,❌,,HTML/Blog,,,,,,https://arxiv.org/abs/2509.08910,Press,Auto-Discovery,,,,2025-09-12
Similarity-based Outlier Detection for Noisy Object Re-Identification Using Beta Mixtures,similarity-based-outlier-detection-for-noisy-object-re-identification-using-beta-mixtures,Article,Minor,❌,,HTML/Blog,,,,,,https://arxiv.org/abs/2509.08926,Press,Auto-Discovery,,,,2025-09-12
A Scoping Review of Machine Learning Applications in Power System Protection and Disturbance Management,a-scoping-review-of-machine-learning-applications-in-power-system-protection-and-disturbance-management,Article,Minor,❌,,HTML/Blog,,,,,,https://arxiv.org/abs/2509.09053,Press,Auto-Discovery,,,,2025-09-12
STRIDE: Scalable and Interpretable XAI via Subset-Free Functional Decomposition,stride-scalable-and-interpretable-xai-via-subset-free-functional-decomposition,Article,Minor,❌,,HTML/Blog,,,,,,https://arxiv.org/abs/2509.09070,Press,Auto-Discovery,,,,2025-09-12
Towards Confidential and Efficient LLM Inference with Dual Privacy Protection,towards-confidential-and-efficient-llm-inference-with-dual-privacy-protection,Article,Minor,❌,,HTML/Blog,,,,,,https://arxiv.org/abs/2509.09091,Press,Auto-Discovery,,,,2025-09-12
Objectness Similarity: Capturing Object-Level Fidelity in 3D Scene Evaluation,objectness-similarity-capturing-object-level-fidelity-in-3d-scene-evaluation,Article,Minor,❌,,HTML/Blog,,,,,,https://arxiv.org/abs/2509.09143,Press,Auto-Discovery,,,,2025-09-12
Video Understanding by Design: How Datasets Shape Architectures and Insights,video-understanding-by-design-how-datasets-shape-architectures-and-insights,Article,Minor,❌,,HTML/Blog,,,,,,https://arxiv.org/abs/2509.09151,Press,Auto-Discovery,,,,2025-09-12
"Probing Pre-trained Language Models on Code Changes: Insights from ReDef, a High-Confidence Just-in-Time Defect Prediction Dataset",probing-pre-trained-language-models-on-code-changes-insights-from-redef-a-high-confidence-just-in-time-defect-prediction-dataset,Article,Minor,❌,,HTML/Blog,,,,,,https://arxiv.org/abs/2509.09192,Press,Auto-Discovery,,,,2025-09-12
Bona fide Cross Testing Reveals Weak Spot in Audio Deepfake Detection Systems,bona-fide-cross-testing-reveals-weak-spot-in-audio-deepfake-detection-systems,Article,Minor,❌,,HTML/Blog,,,,,,https://arxiv.org/abs/2509.09204,Press,Auto-Discovery,,,,2025-09-12
MetaLLMix : An XAI Aided LLM-Meta-learning Based Approach for Hyper-parameters Optimization,metallmix-an-xai-aided-llm-meta-learning-based-approach-for-hyper-parameters-optimization,Article,Minor,❌,,HTML/Blog,,,,,,https://arxiv.org/abs/2509.09387,Press,Auto-Discovery,,,,2025-09-12
Incorporating AI Incident Reporting into Telecommunications Law and Policy: Insights from India,incorporating-ai-incident-reporting-into-telecommunications-law-and-policy-insights-from-india,Article,Minor,❌,,HTML/Blog,,,,,,https://arxiv.org/abs/2509.09508,Press,Auto-Discovery,,,,2025-09-12
Explainable AI for Accelerated Microstructure Imaging: A SHAP-Guided Protocol on the Connectome 2.0 scanner,explainable-ai-for-accelerated-microstructure-imaging-a-shap-guided-protocol-on-the-connectome-2-0-scanner,Article,Minor,❌,,HTML/Blog,,,,,,https://arxiv.org/abs/2509.09513,Press,Auto-Discovery,,,,2025-09-12
Improving Video Diffusion Transformer Training by Multi-Feature Fusion and Alignment from Self-Supervised Vision Encoders,improving-video-diffusion-transformer-training-by-multi-feature-fusion-and-alignment-from-self-supervised-vision-encoders,Article,Minor,❌,,HTML/Blog,,,,,,https://arxiv.org/abs/2509.09547,Press,Auto-Discovery,,,,2025-09-12
Mechanistic Learning with Guided Diffusion Models to Predict Spatio-Temporal Brain Tumor Growth,mechanistic-learning-with-guided-diffusion-models-to-predict-spatio-temporal-brain-tumor-growth,Article,Minor,❌,,HTML/Blog,,,,,,https://arxiv.org/abs/2509.09610,Press,Auto-Discovery,,,,2025-09-12
Feasibility-Guided Fair Adaptive Offline Reinforcement Learning for Medicaid Care Management,feasibility-guided-fair-adaptive-offline-reinforcement-learning-for-medicaid-care-management,Article,Minor,❌,,HTML/Blog,,,,,,https://arxiv.org/abs/2509.09655,Press,Auto-Discovery,,,,2025-09-12
IDEATOR: Jailbreaking and Benchmarking Large Vision-Language Models Using Themselves,ideator-jailbreaking-and-benchmarking-large-vision-language-models-using-themselves,Article,Minor,❌,,HTML/Blog,,,,,,https://arxiv.org/abs/2411.00827,Press,Auto-Discovery,,,,2025-09-12
Knowledge-Guided Biomarker Identification for Label-Free Single-Cell RNA-Seq Data: A Reinforcement Learning Perspective,knowledge-guided-biomarker-identification-for-label-free-single-cell-rna-seq-data-a-reinforcement-learning-perspective,Article,Minor,❌,,HTML/Blog,,,,,,https://arxiv.org/abs/2501.04718,Press,Auto-Discovery,,,,2025-09-12
EgoAgent: A Joint Predictive Agent Model in Egocentric Worlds,egoagent-a-joint-predictive-agent-model-in-egocentric-worlds,Article,Minor,❌,,HTML/Blog,,,,,,https://arxiv.org/abs/2502.05857,Press,Auto-Discovery,,,,2025-09-12
MIND: Towards Immersive Psychological Healing with Multi-agent Inner Dialogue,mind-towards-immersive-psychological-healing-with-multi-agent-inner-dialogue,Article,Minor,❌,,HTML/Blog,,,,,,https://arxiv.org/abs/2502.19860,Press,Auto-Discovery,,,,2025-09-12
VeriSafe Agent: Safeguarding Mobile GUI Agent via Logic-based Action Verification,verisafe-agent-safeguarding-mobile-gui-agent-via-logic-based-action-verification,Article,Minor,❌,,HTML/Blog,,,,,,https://arxiv.org/abs/2503.18492,Press,Auto-Discovery,,,,2025-09-12
Critical Challenges and Guidelines in Evaluating Synthetic Tabular Data: A Systematic Review,critical-challenges-and-guidelines-in-evaluating-synthetic-tabular-data-a-systematic-review,Article,Minor,❌,,HTML/Blog,,,,,,https://arxiv.org/abs/2504.18544,Press,Auto-Discovery,,,,2025-09-12
Early Exit and Multi Stage Knowledge Distillation in VLMs for Video Summarization,early-exit-and-multi-stage-knowledge-distillation-in-vlms-for-video-summarization,Article,Minor,❌,,HTML/Blog,,,,,,https://arxiv.org/abs/2504.21831,Press,Auto-Discovery,,,,2025-09-12
Combating Falsification of Speech Videos with Live Optical Signatures (Extended Version),combating-falsification-of-speech-videos-with-live-optical-signatures-extended-version,Article,Minor,❌,,HTML/Blog,,,,,,https://arxiv.org/abs/2504.21846,Press,Auto-Discovery,,,,2025-09-12
MagicGUI: A Foundational Mobile GUI Agent with Scalable Data Pipeline and Reinforcement Fine-tuning,magicgui-a-foundational-mobile-gui-agent-with-scalable-data-pipeline-and-reinforcement-fine-tuning,Article,Minor,❌,,HTML/Blog,,,,,,https://arxiv.org/abs/2508.03700,Press,Auto-Discovery,,,,2025-09-12
Symmetry-Guided Multi-Agent Inverse Reinforcement Learning,symmetry-guided-multi-agent-inverse-reinforcement-learning,Article,Minor,❌,,HTML/Blog,,,,,,https://arxiv.org/abs/2509.08257,Press,Auto-Discovery,,,,2025-09-12
Show HN: A local MCP server that wraps Swarmia's Export API,show-hn-a-local-mcp-server-that-wraps-swarmia-s-export-api,Article,Minor,❌,,HTML/Blog,,,,,,https://github.com/mattjegan/swarmia-mcp,Press,Auto-Discovery,,,,2025-09-13
Building a Personal AI Assistant Without the Cloud (2025 Guide),building-a-personal-ai-assistant-without-the-cloud-2025-guide,Article,Minor,❌,,HTML/Blog,,,,,,https://www.reddit.com/r/LocalLLaMA/comments/1nfo1j4/building_a_personal_ai_assistant_without_the/,Press,Auto-Discovery,,,,2025-09-13
Qwen3 Next and DeepSeek V3.1 share an identical Artificial Analysis Intelligence Index Score for both their reasoning and non-reasoning modes.,qwen3-next-and-deepseek-v3-1-share-an-identical-artificial-analysis-intelligence-index-score-for-both-their-reasoning-and-non-reasoning-modes,Article,Minor,❌,,HTML/Blog,,,,,,https://www.reddit.com/r/LocalLLaMA/comments/1nf6s0w/qwen3_next_and_deepseek_v31_share_an_identical/,Press,Auto-Discovery,,,,2025-09-13
"[R] New ""Illusion"" Paper Just Dropped For Long Horizon Agents",r-new-illusion-paper-just-dropped-for-long-horizon-agents,Article,Minor,❌,,HTML/Blog,,,,,,https://www.reddit.com/r/MachineLearning/comments/1nfrpvz/r_new_illusion_paper_just_dropped_for_long/,Press,Auto-Discovery,,,,2025-09-13
[P] Training an ML model to detect fake product reviews,p-training-an-ml-model-to-detect-fake-product-reviews,Article,Minor,❌,,HTML/Blog,,,,,,https://www.reddit.com/r/MachineLearning/comments/1nfpusc/p_training_an_ml_model_to_detect_fake_product/,Press,Auto-Discovery,,,,2025-09-13
Show HN: Deep Water Sleep 1hr generative underwater in SuperCollider,show-hn-deep-water-sleep-1hr-generative-underwater-in-supercollider,Article,Minor,❌,,HTML/Blog,,,,,,https://dethbird.com/deep-water-sleep/,Press,Auto-Discovery,,,,2025-09-14
Show HN: Kodosumi – Open-source runtime for AI agents,show-hn-kodosumi-open-source-runtime-for-ai-agents,Article,Minor,❌,,HTML/Blog,,,,,,https://www.kodosumi.io/,Press,Auto-Discovery,,,,2025-09-14
"I have tried AI-assisted reviews, let's look at the numbers.",i-have-tried-ai-assisted-reviews-let-s-look-at-the-numbers,Article,Minor,❌,,HTML/Blog,,,,,,https://www.reddit.com/r/programming/comments/1ngm7fa/i_have_tried_aiassisted_reviews_lets_look_at_the/,Press,Auto-Discovery,,,,2025-09-14
Qwen-Image-Edit is the real deal! Case + simple guide,qwen-image-edit-is-the-real-deal-case-simple-guide,Article,Minor,❌,,HTML/Blog,,,,,,https://www.reddit.com/r/LocalLLaMA/comments/1ng6fg2/qwenimageedit_is_the_real_deal_case_simple_guide/,Press,Auto-Discovery,,,,2025-09-14
Guide: running Qwen3 Next on Windows using vLLM + Docker+ WSL2,guide-running-qwen3-next-on-windows-using-vllm-docker-wsl2,Article,Minor,❌,,HTML/Blog,,,,,,https://www.reddit.com/r/LocalLLaMA/comments/1ng5kfb/guide_running_qwen3_next_on_windows_using_vllm/,Press,Auto-Discovery,,,,2025-09-14
"[Release] GraphBit — Rust-core, Python-first Agentic AI with lock-free multi-agent graphs for enterprise scale",release-graphbit-rust-core-python-first-agentic-ai-with-lock-free-multi-agent-graphs-for-enterprise-scale,Article,Minor,❌,,HTML/Blog,,,,,,https://www.reddit.com/r/LocalLLaMA/comments/1ngrbdn/release_graphbit_rustcore_pythonfirst_agentic_ai/,Press,Auto-Discovery,,,,2025-09-14
New Free AI Agent Framework,new-free-ai-agent-framework,Article,Minor,❌,,HTML/Blog,,,,,,https://www.reddit.com/r/LocalLLaMA/comments/1ngaalz/new_free_ai_agent_framework/,Press,Auto-Discovery,,,,2025-09-14
Google warns that mass data theft hitting Salesloft AI agent has grown bigger,google-warns-that-mass-data-theft-hitting-salesloft-ai-agent-has-grown-bigger,Article,Minor,❌,,HTML/Blog,,,,,,https://arstechnica.com/security/2025/08/google-warns-that-mass-data-theft-hitting-salesloft-ai-agent-has-grown-bigger/,Press,Auto-Discovery,,,,2025-09-14
"Show HN: Wordspike–AI spikes from any YouTube video (multilang, Kindle export)",show-hn-wordspike-ai-spikes-from-any-youtube-video-multilang-kindle-export,Article,Minor,❌,,HTML/Blog,,,,,,https://wordspike.com/,Press,Auto-Discovery,,,,2025-09-15
A Comprehensive Guide on Builder Design Pattern with all Flavors & Examples,a-comprehensive-guide-on-builder-design-pattern-with-all-flavors-examples,Article,Minor,❌,,HTML/Blog,,,,,,https://www.reddit.com/r/programming/comments/1nhf754/a_comprehensive_guide_on_builder_design_pattern/,Press,Auto-Discovery,,,,2025-09-15
Your Complete Guide to the Best AI Web Scrapers in 2025,your-complete-guide-to-the-best-ai-web-scrapers-in-2025,Article,Minor,❌,,HTML/Blog,,,,,,https://www.reddit.com/r/programming/comments/1nhl5e2/your_complete_guide_to_the_best_ai_web_scrapers/,Press,Auto-Discovery,,,,2025-09-15
Lessons from real aviation accidents for better software engineering (5 you can use this week),lessons-from-real-aviation-accidents-for-better-software-engineering-5-you-can-use-this-week,Article,Minor,❌,,HTML/Blog,,,,,,https://www.reddit.com/r/programming/comments/1nhh5z3/lessons_from_real_aviation_accidents_for_better/,Press,Auto-Discovery,,,,2025-09-15
BEEP-8: Running C/C++20 on an emulated ARM v4a CPU inside the browser,beep-8-running-c-c-20-on-an-emulated-arm-v4a-cpu-inside-the-browser,Article,Minor,❌,,HTML/Blog,,,,,,https://www.reddit.com/r/programming/comments/1ngrh2h/beep8_running_cc20_on_an_emulated_arm_v4a_cpu/,Press,Auto-Discovery,,,,2025-09-15
Engineer's Guide to Local LLMs with LLaMA.cpp and QwenCode on Linux,engineer-s-guide-to-local-llms-with-llama-cpp-and-qwencode-on-linux,Article,Minor,❌,,HTML/Blog,,,,,,https://www.reddit.com/r/LocalLLaMA/comments/1nhh1v1/engineers_guide_to_local_llms_with_llamacpp_and/,Press,Auto-Discovery,,,,2025-09-15
"Thank you r/LocalLLaMA for your feedback and support. I'm finally proud to show you how simple it is to use Observer (OSS and 100% Local)! Agents can now store images in their memory, unlocking a lot of new use cases!",thank-you-r-localllama-for-your-feedback-and-support-i-m-finally-proud-to-show-you-how-simple-it-is-to-use-observer-oss-and-100-local-agents-can-now-store-images-in-their-memory-unlocking-a-lot-of-new-use-cases,Article,Minor,❌,,HTML/Blog,,,,,,https://www.reddit.com/r/LocalLLaMA/comments/1nh3ngq/thank_you_rlocalllama_for_your_feedback_and/,Press,Auto-Discovery,,,,2025-09-15
AirPods Pro 3 review: tripling down on a good thing,airpods-pro-3-review-tripling-down-on-a-good-thing,Article,Minor,❌,,HTML/Blog,,,,,,https://www.theverge.com/headphone-review/777798/airpods-pro-3-review-active-noise-cancelling-live-translation-headphones,Press,Auto-Discovery,,,,2025-09-15
How well can LLMs provide planning feedback in grounded environments?,how-well-can-llms-provide-planning-feedback-in-grounded-environments,Article,Minor,❌,,HTML/Blog,,,,,,https://arxiv.org/abs/2509.09790,Press,Auto-Discovery,,,,2025-09-15
LLMs as Agentic Cooperative Players in Multiplayer UNO,llms-as-agentic-cooperative-players-in-multiplayer-uno,Article,Minor,❌,,HTML/Blog,,,,,,https://arxiv.org/abs/2509.09867,Press,Auto-Discovery,,,,2025-09-15
The (R)evolution of Scientific Workflows in the Agentic AI Era: Towards Autonomous Science,the-r-evolution-of-scientific-workflows-in-the-agentic-ai-era-towards-autonomous-science,Article,Minor,❌,,HTML/Blog,,,,,,https://arxiv.org/abs/2509.09915,Press,Auto-Discovery,,,,2025-09-15
GAMA: A General Anonymizing Multi-Agent System for Privacy Preservation Enhanced by Domain Rules and Disproof Method,gama-a-general-anonymizing-multi-agent-system-for-privacy-preservation-enhanced-by-domain-rules-and-disproof-method,Article,Minor,❌,,HTML/Blog,,,,,,https://arxiv.org/abs/2509.10018,Press,Auto-Discovery,,,,2025-09-15
XAgents: A Unified Framework for Multi-Agent Cooperation via IF-THEN Rules and Multipolar Task Processing Graph,xagents-a-unified-framework-for-multi-agent-cooperation-via-if-then-rules-and-multipolar-task-processing-graph,Article,Minor,❌,,HTML/Blog,,,,,,https://arxiv.org/abs/2509.10054,Press,Auto-Discovery,,,,2025-09-15
Virtual Agent Economies,virtual-agent-economies,Article,Minor,❌,,HTML/Blog,,,,,,https://arxiv.org/abs/2509.10147,Press,Auto-Discovery,,,,2025-09-15
Towards Fully Automated Molecular Simulations: Multi-Agent Framework for Simulation Setup and Force Field Extraction,towards-fully-automated-molecular-simulations-multi-agent-framework-for-simulation-setup-and-force-field-extraction,Article,Minor,❌,,HTML/Blog,,,,,,https://arxiv.org/abs/2509.10210,Press,Auto-Discovery,,,,2025-09-15
Compartmentalised Agentic Reasoning for Clinical NLI,compartmentalised-agentic-reasoning-for-clinical-nli,Article,Minor,❌,,HTML/Blog,,,,,,https://arxiv.org/abs/2509.10222,Press,Auto-Discovery,,,,2025-09-15
"Abduct, Act, Predict: Scaffolding Causal Inference for Automated Failure Attribution in Multi-Agent Systems",abduct-act-predict-scaffolding-causal-inference-for-automated-failure-attribution-in-multi-agent-systems,Article,Minor,❌,,HTML/Blog,,,,,,https://arxiv.org/abs/2509.10401,Press,Auto-Discovery,,,,2025-09-15
AEGIS: An Agent for Extraction and Geographic Identification in Scholarly Proceedings,aegis-an-agent-for-extraction-and-geographic-identification-in-scholarly-proceedings,Article,Minor,❌,,HTML/Blog,,,,,,https://arxiv.org/abs/2509.09470,Press,Auto-Discovery,,,,2025-09-15
TalkPlayData 2: An Agentic Synthetic Data Pipeline for Multimodal Conversational Music Recommendation,talkplaydata-2-an-agentic-synthetic-data-pipeline-for-multimodal-conversational-music-recommendation,Article,Minor,❌,,HTML/Blog,,,,,,https://arxiv.org/abs/2509.09685,Press,Auto-Discovery,,,,2025-09-15
The Non-Determinism of Small LLMs: Evidence of Low Answer Consistency in Repetition Trials of Standard Multiple-Choice Benchmarks,the-non-determinism-of-small-llms-evidence-of-low-answer-consistency-in-repetition-trials-of-standard-multiple-choice-benchmarks,Article,Minor,❌,,HTML/Blog,,,,,,https://arxiv.org/abs/2509.09705,Press,Auto-Discovery,,,,2025-09-15
MCP-AgentBench: Evaluating Real-World Language Agent Performance with MCP-Mediated Tools,mcp-agentbench-evaluating-real-world-language-agent-performance-with-mcp-mediated-tools,Article,Minor,❌,,HTML/Blog,,,,,,https://arxiv.org/abs/2509.09734,Press,Auto-Discovery,,,,2025-09-15
HypoGeneAgent: A Hypothesis Language Agent for Gene-Set Cluster Resolution Selection Using Perturb-seq Datasets,hypogeneagent-a-hypothesis-language-agent-for-gene-set-cluster-resolution-selection-using-perturb-seq-datasets,Article,Minor,❌,,HTML/Blog,,,,,,https://arxiv.org/abs/2509.09740,Press,Auto-Discovery,,,,2025-09-15
SWE-Effi: Re-Evaluating Software AI Agent System Effectiveness Under Resource Constraints,swe-effi-re-evaluating-software-ai-agent-system-effectiveness-under-resource-constraints,Article,Minor,❌,,HTML/Blog,,,,,,https://arxiv.org/abs/2509.09853,Press,Auto-Discovery,,,,2025-09-15
Vibe Check: Understanding the Effects of LLM-Based Conversational Agents' Personality and Alignment on User Perceptions in Goal-Oriented Tasks,vibe-check-understanding-the-effects-of-llm-based-conversational-agents-personality-and-alignment-on-user-perceptions-in-goal-oriented-tasks,Article,Minor,❌,,HTML/Blog,,,,,,https://arxiv.org/abs/2509.09870,Press,Auto-Discovery,,,,2025-09-15
Securing LLM-Generated Embedded Firmware through AI Agent-Driven Validation and Patching,securing-llm-generated-embedded-firmware-through-ai-agent-driven-validation-and-patching,Article,Minor,❌,,HTML/Blog,,,,,,https://arxiv.org/abs/2509.09970,Press,Auto-Discovery,,,,2025-09-15
Intrinsic Dimension Estimating Autoencoder (IDEA) Using CancelOut Layer and a Projected Loss,intrinsic-dimension-estimating-autoencoder-idea-using-cancelout-layer-and-a-projected-loss,Article,Minor,❌,,HTML/Blog,,,,,,https://arxiv.org/abs/2509.10011,Press,Auto-Discovery,,,,2025-09-15
"TwinTac: A Wide-Range, Highly Sensitive Tactile Sensor with Real-to-Sim Digital Twin Sensor Model",twintac-a-wide-range-highly-sensitive-tactile-sensor-with-real-to-sim-digital-twin-sensor-model,Article,Minor,❌,,HTML/Blog,,,,,,https://arxiv.org/abs/2509.10063,Press,Auto-Discovery,,,,2025-09-15
We Need a New Ethics for a World of AI Agents,we-need-a-new-ethics-for-a-world-of-ai-agents,Article,Minor,❌,,HTML/Blog,,,,,,https://arxiv.org/abs/2509.10289,Press,Auto-Discovery,,,,2025-09-15
GLAM: Geometry-Guided Local Alignment for Multi-View VLP in Mammography,glam-geometry-guided-local-alignment-for-multi-view-vlp-in-mammography,Article,Minor,❌,,HTML/Blog,,,,,,https://arxiv.org/abs/2509.10344,Press,Auto-Discovery,,,,2025-09-15
Building Self-Evolving Agents via Experience-Driven Lifelong Learning: A Framework and Benchmark,building-self-evolving-agents-via-experience-driven-lifelong-learning-a-framework-and-benchmark,Article,Minor,❌,,HTML/Blog,,,,,,https://arxiv.org/abs/2508.19005,Press,Auto-Discovery,,,,2025-09-15
The Precautionary Principle and the Innovation Principle: Incompatible Guides for AI Innovation Governance?,the-precautionary-principle-and-the-innovation-principle-incompatible-guides-for-ai-innovation-governance,Article,Minor,❌,,HTML/Blog,,,,,,https://arxiv.org/abs/2505.02846,Press,Auto-Discovery,,,,2025-09-15
OMGM: Orchestrate Multiple Granularities and Modalities for Efficient Multimodal Retrieval,omgm-orchestrate-multiple-granularities-and-modalities-for-efficient-multimodal-retrieval,Article,Minor,❌,,HTML/Blog,,,,,,https://arxiv.org/abs/2505.07879,Press,Auto-Discovery,,,,2025-09-15
