Tool,Moniker,Category,Severity,RSS Available,Feed URL,Tracking Method,Repo URL,Repo Status,Stars,Contributors,Docs URL,Website URL,Source Type,Discovery Method,Launch Status,Last Seen Update,Status,Date Added
MIDOG 2025: Mitotic Figure Detection with Attention-Guided False Positive Correction,midog-2025-mitotic-figure-detection-with-attention-guided-false-positive-correction,Article,Minor,❌,,HTML/Blog,,,,,,https://arxiv.org/abs/2509.02598,Press,Auto-Discovery,,,,2025-09-22
On the Security of Tool-Invocation Prompts for LLM-Based Agentic Systems: An Empirical Risk Assessment,on-the-security-of-tool-invocation-prompts-for-llm-based-agentic-systems-an-empirical-risk-assessment,Article,Minor,❌,,HTML/Blog,,,,,,https://arxiv.org/abs/2509.05755,Press,Auto-Discovery,,,,2025-09-22
Show HN: Open-Source TypeScript Framework for AI Agents – VoltAgent,show-hn-open-source-typescript-framework-for-ai-agents-voltagent,Article,Minor,❌,,HTML/Blog,,,,,,https://voltagent.dev/,Press,Auto-Discovery,,,,2025-09-23
Show HN: Snapdeck – Build slides with open-source LLMs and agent routing,show-hn-snapdeck-build-slides-with-open-source-llms-and-agent-routing,Article,Minor,❌,,HTML/Blog,,,,,,https://www.snapdeck.site/,Press,Auto-Discovery,,,,2025-09-23
Show HN: ToolJet AI – Collaborative agents that build internal tools,show-hn-tooljet-ai-collaborative-agents-that-build-internal-tools,Article,Minor,❌,,HTML/Blog,,,,,,https://www.tooljet.ai,Press,Auto-Discovery,,,,2025-09-23
AI-Powered CLI Tool That Converts Long Videos to YouTube Shorts - Open Source,ai-powered-cli-tool-that-converts-long-videos-to-youtube-shorts-open-source,Article,Minor,❌,,HTML/Blog,,,,,,https://www.reddit.com/r/programming/comments/1nogzgb/aipowered_cli_tool_that_converts_long_videos_to/,Press,Auto-Discovery,,,,2025-09-23
JEP draft: Lazy Constants (Second Preview),jep-draft-lazy-constants-second-preview,Article,Minor,❌,,HTML/Blog,,,,,,https://www.reddit.com/r/programming/comments/1no3fgv/jep_draft_lazy_constants_second_preview/,Press,Auto-Discovery,,,,2025-09-23
[D] NeurIPS 2025 : How can we submit the camera-ready version to OpenReview for NeurIPS 2025? I don’t see any submit button — could you let me know how to proceed?,d-neurips-2025-how-can-we-submit-the-camera-ready-version-to-openreview-for-neurips-2025-i-don-t-see-any-submit-button-could-you-let-me-know-how-to-proceed,Article,Minor,❌,,HTML/Blog,,,,,,https://www.reddit.com/r/MachineLearning/comments/1no9pun/d_neurips_2025_how_can_we_submit_the_cameraready/,Press,Auto-Discovery,,,,2025-09-23
Can coding agents self-improve?,can-coding-agents-self-improve,Article,Minor,❌,,HTML/Blog,,,,,,https://www.latent.space/p/self-improving,Press,Auto-Discovery,,,,2025-09-23
Cline: The Open Source Code Agent — with Saoud Rizwan and Nik Pash,cline-the-open-source-code-agent-with-saoud-rizwan-and-nik-pash,Article,Minor,❌,,HTML/Blog,,,,,,https://www.latent.space/p/cline,Press,Auto-Discovery,,,,2025-09-23
Scaling Test Time Compute to Multi-Agent Civilizations: Noam Brown,scaling-test-time-compute-to-multi-agent-civilizations-noam-brown,Article,Minor,❌,,HTML/Blog,,,,,,https://www.latent.space/p/noam-brown,Press,Auto-Discovery,,,,2025-09-23
AIEWF 2025 Online! (and Attendee Guide),aiewf-2025-online-and-attendee-guide,Article,Minor,❌,,HTML/Blog,,,,,,https://www.latent.space/p/aiewf-2025,Press,Auto-Discovery,,,,2025-09-23
"SWE Agents Too Cheap To Meter, The Token Data War, and the rise of Tiny Teams",swe-agents-too-cheap-to-meter-the-token-data-war-and-the-rise-of-tiny-teams,Article,Minor,❌,,HTML/Blog,,,,,,https://www.latent.space/p/token-data-war,Press,Auto-Discovery,,,,2025-09-23
"⚡️Multi-Turn RL for Multi-Hour Agents — with Will Brown, Prime Intellect",multi-turn-rl-for-multi-hour-agents-with-will-brown-prime-intellect,Article,Minor,❌,,HTML/Blog,,,,,,https://www.latent.space/p/willccbb,Press,Auto-Discovery,,,,2025-09-23
Smol2Operator: Post-Training GUI Agents for Computer Use,smol2operator-post-training-gui-agents-for-computer-use,Article,Minor,❌,,HTML/Blog,,,,,,https://huggingface.co/blog/smol2operator,Press,Auto-Discovery,,,,2025-09-23
From Zero to GPU: A Guide to Building and Scaling Production-Ready CUDA Kernels,from-zero-to-gpu-a-guide-to-building-and-scaling-production-ready-cuda-kernels,Article,Minor,❌,,HTML/Blog,,,,,,https://huggingface.co/blog/kernel-builder,Press,Auto-Discovery,,,,2025-09-23
MCP for Research: How to Connect AI to Research Tools,mcp-for-research-how-to-connect-ai-to-research-tools,Article,Minor,❌,,HTML/Blog,,,,,,https://huggingface.co/blog/mcp-for-research,Press,Auto-Discovery,,,,2025-09-23
TextQuests: How Good are LLMs at Text-Based Video Games?,textquests-how-good-are-llms-at-text-based-video-games,Article,Minor,❌,,HTML/Blog,,,,,,https://huggingface.co/blog/textquests,Press,Auto-Discovery,,,,2025-09-23
Accelerate ND-Parallel: A Guide to Efficient Multi-GPU Training,accelerate-nd-parallel-a-guide-to-efficient-multi-gpu-training,Article,Minor,❌,,HTML/Blog,,,,,,https://huggingface.co/blog/accelerate-nd-parallel,Press,Auto-Discovery,,,,2025-09-23
Build an AI Shopping Assistant with Gradio MCP Servers,build-an-ai-shopping-assistant-with-gradio-mcp-servers,Article,Minor,❌,,HTML/Blog,,,,,,https://huggingface.co/blog/gradio-vton-mcp,Press,Auto-Discovery,,,,2025-09-23
TimeScope: How Long Can Your Video Large Multimodal Model Go?,timescope-how-long-can-your-video-large-multimodal-model-go,Article,Minor,❌,,HTML/Blog,,,,,,https://huggingface.co/blog/timescope-video-lmm-benchmark,Press,Auto-Discovery,,,,2025-09-23
Back to The Future: Evaluating AI Agents on Predicting Future Events,back-to-the-future-evaluating-ai-agents-on-predicting-future-events,Article,Minor,❌,,HTML/Blog,,,,,,https://huggingface.co/blog/futurebench,Press,Auto-Discovery,,,,2025-09-23
Five Big Improvements to Gradio MCP Servers,five-big-improvements-to-gradio-mcp-servers,Article,Minor,❌,,HTML/Blog,,,,,,https://huggingface.co/blog/gradio-mcp-updates,Press,Auto-Discovery,,,,2025-09-23
ScreenEnv: Deploy your full stack Desktop Agent,screenenv-deploy-your-full-stack-desktop-agent,Article,Minor,❌,,HTML/Blog,,,,,,https://huggingface.co/blog/screenenv,Press,Auto-Discovery,,,,2025-09-23
Building the Hugging Face MCP Server,building-the-hugging-face-mcp-server,Article,Minor,❌,,HTML/Blog,,,,,,https://huggingface.co/blog/building-hf-mcp,Press,Auto-Discovery,,,,2025-09-23
Upskill your LLMs with Gradio MCP Servers,upskill-your-llms-with-gradio-mcp-servers,Article,Minor,❌,,HTML/Blog,,,,,,https://huggingface.co/blog/gradio-mcp-servers,Press,Auto-Discovery,,,,2025-09-23
Groq on Hugging Face Inference Providers 🔥,groq-on-hugging-face-inference-providers,Article,Minor,❌,,HTML/Blog,,,,,,https://huggingface.co/blog/inference-providers-groq,Press,Auto-Discovery,,,,2025-09-23
Featherless AI on Hugging Face Inference Providers 🔥,featherless-ai-on-hugging-face-inference-providers,Article,Minor,❌,,HTML/Blog,,,,,,https://huggingface.co/blog/inference-providers-featherless,Press,Auto-Discovery,,,,2025-09-23
ScreenSuite - The most comprehensive evaluation suite for GUI Agents!,screensuite-the-most-comprehensive-evaluation-suite-for-gui-agents,Article,Minor,❌,,HTML/Blog,,,,,,https://huggingface.co/blog/screensuite,Press,Auto-Discovery,,,,2025-09-23
CodeAgents + Structure: A Better Way to Execute Actions,codeagents-structure-a-better-way-to-execute-actions,Article,Minor,❌,,HTML/Blog,,,,,,https://huggingface.co/blog/structured-codeagent,Press,Auto-Discovery,,,,2025-09-23
Tiny Agents in Python: a MCP-powered agent in ~70 lines of code,tiny-agents-in-python-a-mcp-powered-agent-in-70-lines-of-code,Article,Minor,❌,,HTML/Blog,,,,,,https://huggingface.co/blog/python-tiny-agents,Press,Auto-Discovery,,,,2025-09-23
How to Build an MCP Server with Gradio,how-to-build-an-mcp-server-with-gradio,Article,Minor,❌,,HTML/Blog,,,,,,https://huggingface.co/blog/gradio-mcp,Press,Auto-Discovery,,,,2025-09-23
Tiny Agents: a MCP-powered agent in 50 lines of code,tiny-agents-a-mcp-powered-agent-in-50-lines-of-code,Article,Minor,❌,,HTML/Blog,,,,,,https://huggingface.co/blog/tiny-agents,Press,Auto-Discovery,,,,2025-09-23
Cohere on Hugging Face Inference Providers 🔥,cohere-on-hugging-face-inference-providers,Article,Minor,❌,,HTML/Blog,,,,,,https://huggingface.co/blog/inference-providers-cohere,Press,Auto-Discovery,,,,2025-09-23
Hugging Face and Cloudflare Partner to Make Real-Time Speech and Video Seamless with FastRTC,hugging-face-and-cloudflare-partner-to-make-real-time-speech-and-video-seamless-with-fastrtc,Article,Minor,❌,,HTML/Blog,,,,,,https://huggingface.co/blog/fastrtc-cloudflare,Press,Auto-Discovery,,,,2025-09-23
LLM Inference on Edge: A Fun and Easy Guide to run LLMs via React Native on your Phone!,llm-inference-on-edge-a-fun-and-easy-guide-to-run-llms-via-react-native-on-your-phone,Article,Minor,❌,,HTML/Blog,,,,,,https://huggingface.co/blog/llm-inference-on-edge,Press,Auto-Discovery,,,,2025-09-23
Trace & Evaluate your Agent with Arize Phoenix,trace-evaluate-your-agent-with-arize-phoenix,Article,Minor,❌,,HTML/Blog,,,,,,https://huggingface.co/blog/smolagents-phoenix,Press,Auto-Discovery,,,,2025-09-23
SmolVLM2: Bringing Video Understanding to Every Device,smolvlm2-bringing-video-understanding-to-every-device,Article,Minor,❌,,HTML/Blog,,,,,,https://huggingface.co/blog/smolvlm2,Press,Auto-Discovery,,,,2025-09-23
"Introducing Three New Serverless Inference Providers: Hyperbolic, Nebius AI Studio, and Novita 🔥",introducing-three-new-serverless-inference-providers-hyperbolic-nebius-ai-studio-and-novita,Article,Minor,❌,,HTML/Blog,,,,,,https://huggingface.co/blog/inference-providers-nebius-novita-hyperbolic,Press,Auto-Discovery,,,,2025-09-23
Build awesome datasets for video generation,build-awesome-datasets-for-video-generation,Article,Minor,❌,,HTML/Blog,,,,,,https://huggingface.co/blog/vid_ds_scripts,Press,Auto-Discovery,,,,2025-09-23
Open-source DeepResearch – Freeing our search agents,open-source-deepresearch-freeing-our-search-agents,Article,Minor,❌,,HTML/Blog,,,,,,https://huggingface.co/blog/open-deep-research,Press,Auto-Discovery,,,,2025-09-23
DABStep: Data Agent Benchmark for Multi-step Reasoning,dabstep-data-agent-benchmark-for-multi-step-reasoning,Article,Minor,❌,,HTML/Blog,,,,,,https://huggingface.co/blog/dabstep,Press,Auto-Discovery,,,,2025-09-23
Welcome to Inference Providers on the Hub 🔥,welcome-to-inference-providers-on-the-hub,Article,Minor,❌,,HTML/Blog,,,,,,https://huggingface.co/blog/inference-providers,Press,Auto-Discovery,,,,2025-09-23
State of open video generation models in Diffusers,state-of-open-video-generation-models-in-diffusers,Article,Minor,❌,,HTML/Blog,,,,,,https://huggingface.co/blog/video_gen,Press,Auto-Discovery,,,,2025-09-23
We now support VLMs in smolagents!,we-now-support-vlms-in-smolagents,Article,Minor,❌,,HTML/Blog,,,,,,https://huggingface.co/blog/smolagents-can-see,Press,Auto-Discovery,,,,2025-09-23
AI Agents Are Here. What Now?,ai-agents-are-here-what-now,Article,Minor,❌,,HTML/Blog,,,,,,https://huggingface.co/blog/ethics-soc-7,Press,Auto-Discovery,,,,2025-09-23
Introducing smolagents: simple agents that write actions in code.,introducing-smolagents-simple-agents-that-write-actions-in-code,Article,Minor,❌,,HTML/Blog,,,,,,https://huggingface.co/blog/smolagents,Press,Auto-Discovery,,,,2025-09-23
Open Source Developers Guide to the EU AI Act,open-source-developers-guide-to-the-eu-ai-act,Article,Minor,❌,,HTML/Blog,,,,,,https://huggingface.co/blog/eu-ai-act-for-oss-developers,Press,Auto-Discovery,,,,2025-09-23
A Security Review of Gradio 5,a-security-review-of-gradio-5,Article,Minor,❌,,HTML/Blog,,,,,,https://huggingface.co/blog/gradio-5-security,Press,Auto-Discovery,,,,2025-09-23
FineVideo: behind the scenes,finevideo-behind-the-scenes,Article,Minor,❌,,HTML/Blog,,,,,,https://huggingface.co/blog/fine-video,Press,Auto-Discovery,,,,2025-09-23
Scaling robotics datasets with video encoding,scaling-robotics-datasets-with-video-encoding,Article,Minor,❌,,HTML/Blog,,,,,,https://huggingface.co/blog/video-encoding,Press,Auto-Discovery,,,,2025-09-23
Our Transformers Code Agent beats the GAIA benchmark!,our-transformers-code-agent-beats-the-gaia-benchmark,Article,Minor,❌,,HTML/Blog,,,,,,https://huggingface.co/blog/beating-gaia,Press,Auto-Discovery,,,,2025-09-23
License to Call: Introducing Transformers Agents 2.0,license-to-call-introducing-transformers-agents-2-0,Article,Minor,❌,,HTML/Blog,,,,,,https://huggingface.co/blog/agents,Press,Auto-Discovery,,,,2025-09-23
"Jack of All Trades, Master of Some, a Multi-Purpose Transformer Agent",jack-of-all-trades-master-of-some-a-multi-purpose-transformer-agent,Article,Minor,❌,,HTML/Blog,,,,,,https://huggingface.co/blog/jat,Press,Auto-Discovery,,,,2025-09-23
Introducing Idefics2: A Powerful 8B Vision-Language Model for the community,introducing-idefics2-a-powerful-8b-vision-language-model-for-the-community,Article,Minor,❌,,HTML/Blog,,,,,,https://huggingface.co/blog/idefics2,Press,Auto-Discovery,,,,2025-09-23
Open-source LLMs as LangChain Agents,open-source-llms-as-langchain-agents,Article,Minor,❌,,HTML/Blog,,,,,,https://huggingface.co/blog/open-source-llms-as-agents,Press,Auto-Discovery,,,,2025-09-23
A guide to setting up your own Hugging Face leaderboard: an end-to-end example with Vectara's hallucination leaderboard,a-guide-to-setting-up-your-own-hugging-face-leaderboard-an-end-to-end-example-with-vectara-s-hallucination-leaderboard,Article,Minor,❌,,HTML/Blog,,,,,,https://huggingface.co/blog/leaderboard-vectara,Press,Auto-Discovery,,,,2025-09-23
Non-engineers guide: Train a LLaMA 2 chatbot,non-engineers-guide-train-a-llama-2-chatbot,Article,Minor,❌,,HTML/Blog,,,,,,https://huggingface.co/blog/Llama2-for-non-engineers,Press,Auto-Discovery,,,,2025-09-23
Introducing IDEFICS: An Open Reproduction of State-of-the-art Visual Language Model,introducing-idefics-an-open-reproduction-of-state-of-the-art-visual-language-model,Article,Minor,❌,,HTML/Blog,,,,,,https://huggingface.co/blog/idefics,Press,Auto-Discovery,,,,2025-09-23
Practical 3D Asset Generation: A Step-by-Step Guide,practical-3d-asset-generation-a-step-by-step-guide,Article,Minor,❌,,HTML/Blog,,,,,,https://huggingface.co/blog/3d-assets,Press,Auto-Discovery,,,,2025-09-23
AI Policy @🤗: Open ML Considerations in the EU AI Act,ai-policy-open-ml-considerations-in-the-eu-ai-act,Article,Minor,❌,,HTML/Blog,,,,,,https://huggingface.co/blog/eu-ai-act-oss,Press,Auto-Discovery,,,,2025-09-23
Introducing Agents.js: Give tools to your LLMs using JavaScript,introducing-agents-js-give-tools-to-your-llms-using-javascript,Article,Minor,❌,,HTML/Blog,,,,,,https://huggingface.co/blog/agents-js,Press,Auto-Discovery,,,,2025-09-23
Announcing our new Content Guidelines and Policy,announcing-our-new-content-guidelines-and-policy,Article,Minor,❌,,HTML/Blog,,,,,,https://huggingface.co/blog/content-guidelines-update,Press,Auto-Discovery,,,,2025-09-23
A Dive into Text-to-Video Models,a-dive-into-text-to-video-models,Article,Minor,❌,,HTML/Blog,,,,,,https://huggingface.co/blog/text-to-video,Press,Auto-Discovery,,,,2025-09-23
StackLLaMA: A hands-on guide to train LLaMA with RLHF,stackllama-a-hands-on-guide-to-train-llama-with-rlhf,Article,Minor,❌,,HTML/Blog,,,,,,https://huggingface.co/blog/stackllama,Press,Auto-Discovery,,,,2025-09-23
Ethical guidelines for developing the Diffusers library,ethical-guidelines-for-developing-the-diffusers-library,Article,Minor,❌,,HTML/Blog,,,,,,https://huggingface.co/blog/ethics-diffusers,Press,Auto-Discovery,,,,2025-09-23
Introducing ⚔️ AI vs. AI ⚔️ a deep reinforcement learning multi-agents competition system,introducing-ai-vs-ai-a-deep-reinforcement-learning-multi-agents-competition-system,Article,Minor,❌,,HTML/Blog,,,,,,https://huggingface.co/blog/aivsai,Press,Auto-Discovery,,,,2025-09-23
What Makes a Dialog Agent Useful?,what-makes-a-dialog-agent-useful,Article,Minor,❌,,HTML/Blog,,,,,,https://huggingface.co/blog/dialog-agents,Press,Auto-Discovery,,,,2025-09-23
A Complete Guide to Audio Datasets,a-complete-guide-to-audio-datasets,Article,Minor,❌,,HTML/Blog,,,,,,https://huggingface.co/blog/audio-datasets,Press,Auto-Discovery,,,,2025-09-23
Introducing DOI: the Digital Object Identifier to Datasets and Models,introducing-doi-the-digital-object-identifier-to-datasets-and-models,Article,Minor,❌,,HTML/Blog,,,,,,https://huggingface.co/blog/introducing-doi,Press,Auto-Discovery,,,,2025-09-23
Announcing the 🤗 AI Research Residency Program,announcing-the-ai-research-residency-program,Article,Minor,❌,,HTML/Blog,,,,,,https://huggingface.co/blog/ai-residency,Press,Auto-Discovery,,,,2025-09-23
"Introducing Snowball Fight ☃️, our First ML-Agents Environment",introducing-snowball-fight-our-first-ml-agents-environment,Article,Minor,❌,,HTML/Blog,,,,,,https://huggingface.co/blog/snowball-fight,Press,Auto-Discovery,,,,2025-09-23
Simple considerations for simple people building fancy neural networks,simple-considerations-for-simple-people-building-fancy-neural-networks,Article,Minor,❌,,HTML/Blog,,,,,,https://huggingface.co/blog/simple-considerations,Press,Auto-Discovery,,,,2025-09-23
Identifying Critical Pathways in Coronary Heart Disease via Fuzzy Subgraph Connectivity,identifying-critical-pathways-in-coronary-heart-disease-via-fuzzy-subgraph-connectivity,Article,Minor,❌,,HTML/Blog,,,,,,https://arxiv.org/abs/2509.16288,Press,Auto-Discovery,,,,2025-09-23
Generalizability of Large Language Model-Based Agents: A Comprehensive Survey,generalizability-of-large-language-model-based-agents-a-comprehensive-survey,Article,Minor,❌,,HTML/Blog,,,,,,https://arxiv.org/abs/2509.16330,Press,Auto-Discovery,,,,2025-09-23
VORTEX: Aligning Task Utility and Human Preferences through LLM-Guided Reward Shaping,vortex-aligning-task-utility-and-human-preferences-through-llm-guided-reward-shaping,Article,Minor,❌,,HTML/Blog,,,,,,https://arxiv.org/abs/2509.16399,Press,Auto-Discovery,,,,2025-09-23
Automated Procedural Analysis via Video-Language Models for AI-assisted Nursing Skills Assessment,automated-procedural-analysis-via-video-language-models-for-ai-assisted-nursing-skills-assessment,Article,Minor,❌,,HTML/Blog,,,,,,https://arxiv.org/abs/2509.16810,Press,Auto-Discovery,,,,2025-09-23
"Prompt-Driven Agentic Video Editing System: Autonomous Comprehension of Long-Form, Story-Driven Media",prompt-driven-agentic-video-editing-system-autonomous-comprehension-of-long-form-story-driven-media,Article,Minor,❌,,HTML/Blog,,,,,,https://arxiv.org/abs/2509.16811,Press,Auto-Discovery,,,,2025-09-23
Roundtable Policy: Improving Scientific Reasoning and Narratives through Confidence-Weighted Consensus of LLMs,roundtable-policy-improving-scientific-reasoning-and-narratives-through-confidence-weighted-consensus-of-llms,Article,Minor,❌,,HTML/Blog,,,,,,https://arxiv.org/abs/2509.16839,Press,Auto-Discovery,,,,2025-09-23
Audio-Guided Dynamic Modality Fusion with Stereo-Aware Attention for Audio-Visual Navigation,audio-guided-dynamic-modality-fusion-with-stereo-aware-attention-for-audio-visual-navigation,Article,Minor,❌,,HTML/Blog,,,,,,https://arxiv.org/abs/2509.16924,Press,Auto-Discovery,,,,2025-09-23
ARE: Scaling Up Agent Environments and Evaluations,are-scaling-up-agent-environments-and-evaluations,Article,Minor,❌,,HTML/Blog,,,,,,https://arxiv.org/abs/2509.17158,Press,Auto-Discovery,,,,2025-09-23
Can Agents Judge Systematic Reviews Like Humans? Evaluating SLRs with LLM-based Multi-Agent System,can-agents-judge-systematic-reviews-like-humans-evaluating-slrs-with-llm-based-multi-agent-system,Article,Minor,❌,,HTML/Blog,,,,,,https://arxiv.org/abs/2509.17240,Press,Auto-Discovery,,,,2025-09-23
Mind the Gap: Comparing Model- vs Agentic-Level Red Teaming with Action-Graph Observability on GPT-OSS-20B,mind-the-gap-comparing-model-vs-agentic-level-red-teaming-with-action-graph-observability-on-gpt-oss-20b,Article,Minor,❌,,HTML/Blog,,,,,,https://arxiv.org/abs/2509.17259,Press,Auto-Discovery,,,,2025-09-23
Medical AI Consensus: A Multi-Agent Framework for Radiology Report Generation and Evaluation,medical-ai-consensus-a-multi-agent-framework-for-radiology-report-generation-and-evaluation,Article,Minor,❌,,HTML/Blog,,,,,,https://arxiv.org/abs/2509.17353,Press,Auto-Discovery,,,,2025-09-23
Table2LaTeX-RL: High-Fidelity LaTeX Code Generation from Table Images via Reinforced Multimodal Language Models,table2latex-rl-high-fidelity-latex-code-generation-from-table-images-via-reinforced-multimodal-language-models,Article,Minor,❌,,HTML/Blog,,,,,,https://arxiv.org/abs/2509.17589,Press,Auto-Discovery,,,,2025-09-23
Orcust: Stepwise-Feedback Reinforcement Learning for GUI Agent,orcust-stepwise-feedback-reinforcement-learning-for-gui-agent,Article,Minor,❌,,HTML/Blog,,,,,,https://arxiv.org/abs/2509.17917,Press,Auto-Discovery,,,,2025-09-23
The STAR-XAI Protocol: An Interactive Framework for Inducing Second-Order Agency in AI Agents,the-star-xai-protocol-an-interactive-framework-for-inducing-second-order-agency-in-ai-agents,Article,Minor,❌,,HTML/Blog,,,,,,https://arxiv.org/abs/2509.17978,Press,Auto-Discovery,,,,2025-09-23
Improving Large Language Models Function Calling and Interpretability via Guided-Structured Templates,improving-large-language-models-function-calling-and-interpretability-via-guided-structured-templates,Article,Minor,❌,,HTML/Blog,,,,,,https://arxiv.org/abs/2509.18076,Press,Auto-Discovery,,,,2025-09-23
HausaMovieReview: A Benchmark Dataset for Sentiment Analysis in Low-Resource African Language,hausamoviereview-a-benchmark-dataset-for-sentiment-analysis-in-low-resource-african-language,Article,Minor,❌,,HTML/Blog,,,,,,https://arxiv.org/abs/2509.16256,Press,Auto-Discovery,,,,2025-09-23
SecureFixAgent: A Hybrid LLM Agent for Automated Python Static Vulnerability Repair,securefixagent-a-hybrid-llm-agent-for-automated-python-static-vulnerability-repair,Article,Minor,❌,,HTML/Blog,,,,,,https://arxiv.org/abs/2509.16275,Press,Auto-Discovery,,,,2025-09-23
"Overhearing LLM Agents: A Survey, Taxonomy, and Roadmap",overhearing-llm-agents-a-survey-taxonomy-and-roadmap,Article,Minor,❌,,HTML/Blog,,,,,,https://arxiv.org/abs/2509.16325,Press,Auto-Discovery,,,,2025-09-23
Agentic Reasoning for Robust Vision Systems via Increased Test-Time Compute,agentic-reasoning-for-robust-vision-systems-via-increased-test-time-compute,Article,Minor,❌,,HTML/Blog,,,,,,https://arxiv.org/abs/2509.16343,Press,Auto-Discovery,,,,2025-09-23
Secure Confidential Business Information When Sharing Machine Learning Models,secure-confidential-business-information-when-sharing-machine-learning-models,Article,Minor,❌,,HTML/Blog,,,,,,https://arxiv.org/abs/2509.16352,Press,Auto-Discovery,,,,2025-09-23
Enhancing Financial RAG with Agentic AI and Multi-HyDE: A Novel Approach to Knowledge Retrieval and Hallucination Reduction,enhancing-financial-rag-with-agentic-ai-and-multi-hyde-a-novel-approach-to-knowledge-retrieval-and-hallucination-reduction,Article,Minor,❌,,HTML/Blog,,,,,,https://arxiv.org/abs/2509.16369,Press,Auto-Discovery,,,,2025-09-23
Evaluating Behavioral Alignment in Conflict Dialogue: A Multi-Dimensional Comparison of LLM Agents and Humans,evaluating-behavioral-alignment-in-conflict-dialogue-a-multi-dimensional-comparison-of-llm-agents-and-humans,Article,Minor,❌,,HTML/Blog,,,,,,https://arxiv.org/abs/2509.16394,Press,Auto-Discovery,,,,2025-09-23
Implicit Behavioral Alignment of Language Agents in High-Stakes Crowd Simulations,implicit-behavioral-alignment-of-language-agents-in-high-stakes-crowd-simulations,Article,Minor,❌,,HTML/Blog,,,,,,https://arxiv.org/abs/2509.16457,Press,Auto-Discovery,,,,2025-09-23
Entropic Causal Inference: Graph Identifiability,entropic-causal-inference-graph-identifiability,Article,Minor,❌,,HTML/Blog,,,,,,https://arxiv.org/abs/2509.16463,Press,Auto-Discovery,,,,2025-09-23
Can an Individual Manipulate the Collective Decisions of Multi-Agents?,can-an-individual-manipulate-the-collective-decisions-of-multi-agents,Article,Minor,❌,,HTML/Blog,,,,,,https://arxiv.org/abs/2509.16494,Press,Auto-Discovery,,,,2025-09-23
From Scores to Steps: Diagnosing and Improving LLM Performance in Evidence-Based Medical Calculations,from-scores-to-steps-diagnosing-and-improving-llm-performance-in-evidence-based-medical-calculations,Article,Minor,❌,,HTML/Blog,,,,,,https://arxiv.org/abs/2509.16584,Press,Auto-Discovery,,,,2025-09-23
Governed By Agents: A Survey On The Role Of Agentic AI In Future Computing Environments,governed-by-agents-a-survey-on-the-role-of-agentic-ai-in-future-computing-environments,Article,Minor,❌,,HTML/Blog,,,,,,https://arxiv.org/abs/2509.16676,Press,Auto-Discovery,,,,2025-09-23
Cross-Attention with Confidence Weighting for Multi-Channel Audio Alignment,cross-attention-with-confidence-weighting-for-multi-channel-audio-alignment,Article,Minor,❌,,HTML/Blog,,,,,,https://arxiv.org/abs/2509.16926,Press,Auto-Discovery,,,,2025-09-23
Prompt-with-Me: in-IDE Structured Prompt Management for LLM-Driven Software Engineering,prompt-with-me-in-ide-structured-prompt-management-for-llm-driven-software-engineering,Article,Minor,❌,,HTML/Blog,,,,,,https://arxiv.org/abs/2509.17096,Press,Auto-Discovery,,,,2025-09-23
Echo-Path: Pathology-Conditioned Echo Video Generation,echo-path-pathology-conditioned-echo-video-generation,Article,Minor,❌,,HTML/Blog,,,,,,https://arxiv.org/abs/2509.17190,Press,Auto-Discovery,,,,2025-09-23
SignalLLM: A General-Purpose LLM Agent Framework for Automated Signal Processing,signalllm-a-general-purpose-llm-agent-framework-for-automated-signal-processing,Article,Minor,❌,,HTML/Blog,,,,,,https://arxiv.org/abs/2509.17197,Press,Auto-Discovery,,,,2025-09-23
