Tool,Moniker,Category,Severity,RSS Available,Feed URL,Tracking Method,Repo URL,Repo Status,Stars,Contributors,Docs URL,Website URL,Source Type,Discovery Method,Launch Status,Last Seen Update,Status,Date Added
Show HN: I made a tool to turn anxiety-inducing news into short narrated videos,show-hn-i-made-a-tool-to-turn-anxiety-inducing-news-into-short-narrated-videos,Article,Minor,❌,,HTML/Blog,,,,,,https://explainerslop.xyz/,Press,Auto-Discovery,,,,2025-09-08
Show HN: Side Space – An Arc-like sidebar tabs manager for Chrome,show-hn-side-space-an-arc-like-sidebar-tabs-manager-for-chrome,Article,Minor,❌,,HTML/Blog,,,,,,https://chromewebstore.google.com/detail/side-space-ai-powered-ver/ipcmlnjbpgmnpahkkboglidcbkndekjj,Press,Auto-Discovery,,,,2025-09-08
Show HN: Liquid Glass for Flutter with pixel-perfect fidelity,show-hn-liquid-glass-for-flutter-with-pixel-perfect-fidelity,Article,Minor,❌,,HTML/Blog,,,,,,https://medium.com/serverpod/is-it-time-for-flutter-to-leave-the-uncanny-valley-b7f2cdb834ae,Press,Auto-Discovery,,,,2025-09-08
Just use SQL they say... Or how accidental complexity piles on,just-use-sql-they-say-or-how-accidental-complexity-piles-on,Article,Minor,❌,,HTML/Blog,,,,,,https://www.reddit.com/r/programming/comments/1nbl3vj/just_use_sql_they_say_or_how_accidental/,Press,Auto-Discovery,,,,2025-09-08
[OSS] Beelzebub — “Canary tools” for AI Agents via MCP,oss-beelzebub-canary-tools-for-ai-agents-via-mcp,Article,Minor,❌,,HTML/Blog,,,,,,https://www.reddit.com/r/LocalLLaMA/comments/1navxod/oss_beelzebub_canary_tools_for_ai_agents_via_mcp/,Press,Auto-Discovery,,,,2025-09-08
"Searching for a local, efficient coding agent with capabilities of Cursor",searching-for-a-local-efficient-coding-agent-with-capabilities-of-cursor,Article,Minor,❌,,HTML/Blog,,,,,,https://www.reddit.com/r/LocalLLaMA/comments/1nbgdic/searching_for_a_local_efficient_coding_agent_with/,Press,Auto-Discovery,,,,2025-09-08
College student’s “time travel” AI experiment accidentally outputs real 1834 history,college-student-s-time-travel-ai-experiment-accidentally-outputs-real-1834-history,Article,Minor,❌,,HTML/Blog,,,,,,https://arstechnica.com/information-technology/2025/08/ai-built-from-1800s-texts-surprises-creator-by-mentioning-real-1834-london-protests/,Press,Auto-Discovery,,,,2025-09-08
Maestro: Joint Graph & Config Optimization for Reliable AI Agents,maestro-joint-graph-config-optimization-for-reliable-ai-agents,Article,Minor,❌,,HTML/Blog,,,,,,https://arxiv.org/abs/2509.04642,Press,Auto-Discovery,,,,2025-09-08
Language-Driven Hierarchical Task Structures as Explicit World Models for Multi-Agent Learning,language-driven-hierarchical-task-structures-as-explicit-world-models-for-multi-agent-learning,Article,Minor,❌,,HTML/Blog,,,,,,https://arxiv.org/abs/2509.04731,Press,Auto-Discovery,,,,2025-09-08
TalkToAgent: A Human-centric Explanation of Reinforcement Learning Agents with Large Language Models,talktoagent-a-human-centric-explanation-of-reinforcement-learning-agents-with-large-language-models,Article,Minor,❌,,HTML/Blog,,,,,,https://arxiv.org/abs/2509.04809,Press,Auto-Discovery,,,,2025-09-08
"Cloning a Conversational Voice AI Agent from Call\,Recording Datasets for Telesales",cloning-a-conversational-voice-ai-agent-from-call-recording-datasets-for-telesales,Article,Minor,❌,,HTML/Blog,,,,,,https://arxiv.org/abs/2509.04871,Press,Auto-Discovery,,,,2025-09-08
OSC: Cognitive Orchestration through Dynamic Knowledge Alignment in Multi-Agent LLM Collaboration,osc-cognitive-orchestration-through-dynamic-knowledge-alignment-in-multi-agent-llm-collaboration,Article,Minor,❌,,HTML/Blog,,,,,,https://arxiv.org/abs/2509.04876,Press,Auto-Discovery,,,,2025-09-08
Internet 3.0: Architecture for a Web-of-Agents with it's Algorithm for Ranking Agents,internet-3-0-architecture-for-a-web-of-agents-with-it-s-algorithm-for-ranking-agents,Article,Minor,❌,,HTML/Blog,,,,,,https://arxiv.org/abs/2509.04979,Press,Auto-Discovery,,,,2025-09-08
CoCoNUTS: Concentrating on Content while Neglecting Uninformative Textual Styles for AI-Generated Peer Review Detection,coconuts-concentrating-on-content-while-neglecting-uninformative-textual-styles-for-ai-generated-peer-review-detection,Article,Minor,❌,,HTML/Blog,,,,,,https://arxiv.org/abs/2509.04460,Press,Auto-Discovery,,,,2025-09-08
Emotionally-Aware Agents for Dispute Resolution,emotionally-aware-agents-for-dispute-resolution,Article,Minor,❌,,HTML/Blog,,,,,,https://arxiv.org/abs/2509.04465,Press,Auto-Discovery,,,,2025-09-08
RECAP: REwriting Conversations for Intent Understanding in Agentic Planning,recap-rewriting-conversations-for-intent-understanding-in-agentic-planning,Article,Minor,❌,,HTML/Blog,,,,,,https://arxiv.org/abs/2509.04472,Press,Auto-Discovery,,,,2025-09-08
"The Good, the Bad and the Constructive: Automatically Measuring Peer Review's Utility for Authors",the-good-the-bad-and-the-constructive-automatically-measuring-peer-review-s-utility-for-authors,Article,Minor,❌,,HTML/Blog,,,,,,https://arxiv.org/abs/2509.04484,Press,Auto-Discovery,,,,2025-09-08
Where Should I Study? Biased Language Models Decide! Evaluating Fairness in LMs for Academic Recommendations,where-should-i-study-biased-language-models-decide-evaluating-fairness-in-lms-for-academic-recommendations,Article,Minor,❌,,HTML/Blog,,,,,,https://arxiv.org/abs/2509.04498,Press,Auto-Discovery,,,,2025-09-08
DeepTRACE: Auditing Deep Research AI Systems for Tracking Reliability Across Citations and Evidence,deeptrace-auditing-deep-research-ai-systems-for-tracking-reliability-across-citations-and-evidence,Article,Minor,❌,,HTML/Blog,,,,,,https://arxiv.org/abs/2509.04499,Press,Auto-Discovery,,,,2025-09-08
Emergent Social Dynamics of LLM Agents in the El Farol Bar Problem,emergent-social-dynamics-of-llm-agents-in-the-el-farol-bar-problem,Article,Minor,❌,,HTML/Blog,,,,,,https://arxiv.org/abs/2509.04537,Press,Auto-Discovery,,,,2025-09-08
Toward Faithfulness-guided Ensemble Interpretation of Neural Network,toward-faithfulness-guided-ensemble-interpretation-of-neural-network,Article,Minor,❌,,HTML/Blog,,,,,,https://arxiv.org/abs/2509.04588,Press,Auto-Discovery,,,,2025-09-08
ODKE+: Ontology-Guided Open-Domain Knowledge Extraction with LLMs,odke-ontology-guided-open-domain-knowledge-extraction-with-llms,Article,Minor,❌,,HTML/Blog,,,,,,https://arxiv.org/abs/2509.04696,Press,Auto-Discovery,,,,2025-09-08
SePA: A Search-enhanced Predictive Agent for Personalized Health Coaching,sepa-a-search-enhanced-predictive-agent-for-personalized-health-coaching,Article,Minor,❌,,HTML/Blog,,,,,,https://arxiv.org/abs/2509.04752,Press,Auto-Discovery,,,,2025-09-08
The LLM Has Left The Chat: Evidence of Bail Preferences in Large Language Models,the-llm-has-left-the-chat-evidence-of-bail-preferences-in-large-language-models,Article,Minor,❌,,HTML/Blog,,,,,,https://arxiv.org/abs/2509.04781,Press,Auto-Discovery,,,,2025-09-08
AI-Driven Fronthaul Link Compression in Wireless Communication Systems: Review and Method Design,ai-driven-fronthaul-link-compression-in-wireless-communication-systems-review-and-method-design,Article,Minor,❌,,HTML/Blog,,,,,,https://arxiv.org/abs/2509.04805,Press,Auto-Discovery,,,,2025-09-08
SpiderNets: Estimating Fear Ratings of Spider-Related Images with Vision Models,spidernets-estimating-fear-ratings-of-spider-related-images-with-vision-models,Article,Minor,❌,,HTML/Blog,,,,,,https://arxiv.org/abs/2509.04889,Press,Auto-Discovery,,,,2025-09-08
DeGuV: Depth-Guided Visual Reinforcement Learning for Generalization and Interpretability in Manipulation,deguv-depth-guided-visual-reinforcement-learning-for-generalization-and-interpretability-in-manipulation,Article,Minor,❌,,HTML/Blog,,,,,,https://arxiv.org/abs/2509.04970,Press,Auto-Discovery,,,,2025-09-08
LLM Enabled Multi-Agent System for 6G Networks: Framework and Method of Dual-Loop Edge-Terminal Collaboration,llm-enabled-multi-agent-system-for-6g-networks-framework-and-method-of-dual-loop-edge-terminal-collaboration,Article,Minor,❌,,HTML/Blog,,,,,,https://arxiv.org/abs/2509.04993,Press,Auto-Discovery,,,,2025-09-08
Pointing-Guided Target Estimation via Transformer-Based Attention,pointing-guided-target-estimation-via-transformer-based-attention,Article,Minor,❌,,HTML/Blog,,,,,,https://arxiv.org/abs/2509.05031,Press,Auto-Discovery,,,,2025-09-08
AI Agents for Web Testing: A Case Study in the Wild,ai-agents-for-web-testing-a-case-study-in-the-wild,Article,Minor,❌,,HTML/Blog,,,,,,https://arxiv.org/abs/2509.05197,Press,Auto-Discovery,,,,2025-09-08
Recomposer: Event-roll-guided generative audio editing,recomposer-event-roll-guided-generative-audio-editing,Article,Minor,❌,,HTML/Blog,,,,,,https://arxiv.org/abs/2509.05256,Press,Auto-Discovery,,,,2025-09-08
GUI Agents: A Survey,gui-agents-a-survey,Article,Minor,❌,,HTML/Blog,,,,,,https://arxiv.org/abs/2412.13501,Press,Auto-Discovery,,,,2025-09-08
Advancing Mobile GUI Agents: A Verifier-Driven Approach to Practical Deployment,advancing-mobile-gui-agents-a-verifier-driven-approach-to-practical-deployment,Article,Minor,❌,,HTML/Blog,,,,,,https://arxiv.org/abs/2503.15937,Press,Auto-Discovery,,,,2025-09-08
Conversational Education at Scale: A Multi-LLM Agent Workflow for Procedural Learning and Pedagogic Quality Assessment,conversational-education-at-scale-a-multi-llm-agent-workflow-for-procedural-learning-and-pedagogic-quality-assessment,Article,Minor,❌,,HTML/Blog,,,,,,https://arxiv.org/abs/2507.05528,Press,Auto-Discovery,,,,2025-09-08
FutureX: An Advanced Live Benchmark for LLM Agents in Future Prediction,futurex-an-advanced-live-benchmark-for-llm-agents-in-future-prediction,Article,Minor,❌,,HTML/Blog,,,,,,https://arxiv.org/abs/2508.11987,Press,Auto-Discovery,,,,2025-09-08
PersonaGym: Evaluating Persona Agents and LLMs,personagym-evaluating-persona-agents-and-llms,Article,Minor,❌,,HTML/Blog,,,,,,https://arxiv.org/abs/2407.18416,Press,Auto-Discovery,,,,2025-09-08
HyperAgent: Generalist Software Engineering Agents to Solve Coding Tasks at Scale,hyperagent-generalist-software-engineering-agents-to-solve-coding-tasks-at-scale,Article,Minor,❌,,HTML/Blog,,,,,,https://arxiv.org/abs/2409.16299,Press,Auto-Discovery,,,,2025-09-08
PromptGuard: Soft Prompt-Guided Unsafe Content Moderation for Text-to-Image Models,promptguard-soft-prompt-guided-unsafe-content-moderation-for-text-to-image-models,Article,Minor,❌,,HTML/Blog,,,,,,https://arxiv.org/abs/2501.03544,Press,Auto-Discovery,,,,2025-09-08
AutoPDL: Automatic Prompt Optimization for LLM Agents,autopdl-automatic-prompt-optimization-for-llm-agents,Article,Minor,❌,,HTML/Blog,,,,,,https://arxiv.org/abs/2504.04365,Press,Auto-Discovery,,,,2025-09-08
First Steps Towards Overhearing LLM Agents: A Case Study With Dungeons & Dragons Gameplay,first-steps-towards-overhearing-llm-agents-a-case-study-with-dungeons-dragons-gameplay,Article,Minor,❌,,HTML/Blog,,,,,,https://arxiv.org/abs/2505.22809,Press,Auto-Discovery,,,,2025-09-08
AgentArmor: Enforcing Program Analysis on Agent Runtime Trace to Defend Against Prompt Injection,agentarmor-enforcing-program-analysis-on-agent-runtime-trace-to-defend-against-prompt-injection,Article,Minor,❌,,HTML/Blog,,,,,,https://arxiv.org/abs/2508.01249,Press,Auto-Discovery,,,,2025-09-08
Show HN: I built an operating file system for my agent (CRUD),show-hn-i-built-an-operating-file-system-for-my-agent-crud,Article,Minor,❌,,HTML/Blog,,,,,,https://www.youtube.com/watch?v=apDrReT-Ry0,Press,Auto-Discovery,,,,2025-09-09
Show HN: Bootstrapped Terraform Orchestration in OCaml,show-hn-bootstrapped-terraform-orchestration-in-ocaml,Article,Minor,❌,,HTML/Blog,,,,,,https://news.ycombinator.com/item?id=45180661,Press,Auto-Discovery,,,,2025-09-09
Show HN: Pinterest Video Downloader-The Best Free Downloader for Pinterest,show-hn-pinterest-video-downloader-the-best-free-downloader-for-pinterest,Article,Minor,❌,,HTML/Blog,,,,,,https://pinterestvideodownload.org,Press,Auto-Discovery,,,,2025-09-09
Show HN: Kaset — Embed Coding Agents Directly in Your Web App,show-hn-kaset-embed-coding-agents-directly-in-your-web-app,Article,Minor,❌,,HTML/Blog,,,,,,https://medium.com/@a.franky/introducing-kaset-a-toolkit-to-embed-coding-agents-in-web-apps-94f531538156,Press,Auto-Discovery,,,,2025-09-09
Flow-Run System Design: Building an LLM Orchestration Platform,flow-run-system-design-building-an-llm-orchestration-platform,Article,Minor,❌,,HTML/Blog,,,,,,https://www.reddit.com/r/programming/comments/1nccxwt/flowrun_system_design_building_an_llm/,Press,Auto-Discovery,,,,2025-09-09
Windows 11 SSD issues blamed on reviewers using &#8216;early versions of firmware&#8217;,windows-11-ssd-issues-blamed-on-reviewers-using-8216-early-versions-of-firmware-8217,Article,Minor,❌,,HTML/Blog,,,,,,https://www.theverge.com/report/774201/phison-windows-11-ssd-issues-early-firmware,Press,Auto-Discovery,,,,2025-09-09
Attention of a Kiss: Exploring Attention Maps in Video Diffusion for XAIxArts,attention-of-a-kiss-exploring-attention-maps-in-video-diffusion-for-xaixarts,Article,Minor,❌,,HTML/Blog,,,,,,https://arxiv.org/abs/2509.05323,Press,Auto-Discovery,,,,2025-09-09
SasAgent: Multi-Agent AI System for Small-Angle Scattering Data Analysis,sasagent-multi-agent-ai-system-for-small-angle-scattering-data-analysis,Article,Minor,❌,,HTML/Blog,,,,,,https://arxiv.org/abs/2509.05363,Press,Auto-Discovery,,,,2025-09-09
Code Like Humans: A Multi-Agent Solution for Medical Coding,code-like-humans-a-multi-agent-solution-for-medical-coding,Article,Minor,❌,,HTML/Blog,,,,,,https://arxiv.org/abs/2509.05378,Press,Auto-Discovery,,,,2025-09-09
From Image Generation to Infrastructure Design: a Multi-agent Pipeline for Street Design Generation,from-image-generation-to-infrastructure-design-a-multi-agent-pipeline-for-street-design-generation,Article,Minor,❌,,HTML/Blog,,,,,,https://arxiv.org/abs/2509.05469,Press,Auto-Discovery,,,,2025-09-09
DRF: LLM-AGENT Dynamic Reputation Filtering Framework,drf-llm-agent-dynamic-reputation-filtering-framework,Article,Minor,❌,,HTML/Blog,,,,,,https://arxiv.org/abs/2509.05764,Press,Auto-Discovery,,,,2025-09-09
MapAgent: A Hierarchical Agent for Geospatial Reasoning with Dynamic Map Tool Integration,mapagent-a-hierarchical-agent-for-geospatial-reasoning-with-dynamic-map-tool-integration,Article,Minor,❌,,HTML/Blog,,,,,,https://arxiv.org/abs/2509.05933,Press,Auto-Discovery,,,,2025-09-09
PillagerBench: Benchmarking LLM-Based Agents in Competitive Minecraft Team Environments,pillagerbench-benchmarking-llm-based-agents-in-competitive-minecraft-team-environments,Article,Minor,❌,,HTML/Blog,,,,,,https://arxiv.org/abs/2509.06235,Press,Auto-Discovery,,,,2025-09-09
REMI: A Novel Causal Schema Memory Architecture for Personalized Lifestyle Recommendation Agents,remi-a-novel-causal-schema-memory-architecture-for-personalized-lifestyle-recommendation-agents,Article,Minor,❌,,HTML/Blog,,,,,,https://arxiv.org/abs/2509.06269,Press,Auto-Discovery,,,,2025-09-09
TableMind: An Autonomous Programmatic Agent for Tool-Augmented Table Reasoning,tablemind-an-autonomous-programmatic-agent-for-tool-augmented-table-reasoning,Article,Minor,❌,,HTML/Blog,,,,,,https://arxiv.org/abs/2509.06278,Press,Auto-Discovery,,,,2025-09-09
SFR-DeepResearch: Towards Effective Reinforcement Learning for Autonomously Reasoning Single Agents,sfr-deepresearch-towards-effective-reinforcement-learning-for-autonomously-reasoning-single-agents,Article,Minor,❌,,HTML/Blog,,,,,,https://arxiv.org/abs/2509.06283,Press,Auto-Discovery,,,,2025-09-09
From Implicit Exploration to Structured Reasoning: Leveraging Guideline and Refinement for LLMs,from-implicit-exploration-to-structured-reasoning-leveraging-guideline-and-refinement-for-llms,Article,Minor,❌,,HTML/Blog,,,,,,https://arxiv.org/abs/2509.06284,Press,Auto-Discovery,,,,2025-09-09
Evaluating Multi-Turn Bargain Skills in LLM-Based Seller Agent,evaluating-multi-turn-bargain-skills-in-llm-based-seller-agent,Article,Minor,❌,,HTML/Blog,,,,,,https://arxiv.org/abs/2509.06341,Press,Auto-Discovery,,,,2025-09-09
A data-driven discretized CS:GO simulation environment to facilitate strategic multi-agent planning research,a-data-driven-discretized-cs-go-simulation-environment-to-facilitate-strategic-multi-agent-planning-research,Article,Minor,❌,,HTML/Blog,,,,,,https://arxiv.org/abs/2509.06355,Press,Auto-Discovery,,,,2025-09-09
Teaching AI Stepwise Diagnostic Reasoning with Report-Guided Chain-of-Thought Learning,teaching-ai-stepwise-diagnostic-reasoning-with-report-guided-chain-of-thought-learning,Article,Minor,❌,,HTML/Blog,,,,,,https://arxiv.org/abs/2509.06409,Press,Auto-Discovery,,,,2025-09-09
Tree of Agents: Improving Long-Context Capabilities of Large Language Models through Multi-Perspective Reasoning,tree-of-agents-improving-long-context-capabilities-of-large-language-models-through-multi-perspective-reasoning,Article,Minor,❌,,HTML/Blog,,,,,,https://arxiv.org/abs/2509.06436,Press,Auto-Discovery,,,,2025-09-09
MAS-Bench: A Unified Benchmark for Shortcut-Augmented Hybrid Mobile GUI Agents,mas-bench-a-unified-benchmark-for-shortcut-augmented-hybrid-mobile-gui-agents,Article,Minor,❌,,HTML/Blog,,,,,,https://arxiv.org/abs/2509.06477,Press,Auto-Discovery,,,,2025-09-09
Scaling up Multi-Turn Off-Policy RL and Multi-Agent Tree Search for LLM Step-Provers,scaling-up-multi-turn-off-policy-rl-and-multi-agent-tree-search-for-llm-step-provers,Article,Minor,❌,,HTML/Blog,,,,,,https://arxiv.org/abs/2509.06493,Press,Auto-Discovery,,,,2025-09-09
CogGuide: Human-Like Guidance for Zero-Shot Omni-Modal Reasoning,cogguide-human-like-guidance-for-zero-shot-omni-modal-reasoning,Article,Minor,❌,,HTML/Blog,,,,,,https://arxiv.org/abs/2509.06641,Press,Auto-Discovery,,,,2025-09-09
Paper2Agent: Reimagining Research Papers As Interactive and Reliable AI Agents,paper2agent-reimagining-research-papers-as-interactive-and-reliable-ai-agents,Article,Minor,❌,,HTML/Blog,,,,,,https://arxiv.org/abs/2509.06917,Press,Auto-Discovery,,,,2025-09-09
Livia: An Emotion-Aware AR Companion Powered by Modular AI Agents and Progressive Memory Compression,livia-an-emotion-aware-ar-companion-powered-by-modular-ai-agents-and-progressive-memory-compression,Article,Minor,❌,,HTML/Blog,,,,,,https://arxiv.org/abs/2509.05298,Press,Auto-Discovery,,,,2025-09-09
Towards Log Analysis with AI Agents: Cowrie Case Study,towards-log-analysis-with-ai-agents-cowrie-case-study,Article,Minor,❌,,HTML/Blog,,,,,,https://arxiv.org/abs/2509.05306,Press,Auto-Discovery,,,,2025-09-09
ProtSAE: Disentangling and Interpreting Protein Language Models via Semantically-Guided Sparse Autoencoders,protsae-disentangling-and-interpreting-protein-language-models-via-semantically-guided-sparse-autoencoders,Article,Minor,❌,,HTML/Blog,,,,,,https://arxiv.org/abs/2509.05309,Press,Auto-Discovery,,,,2025-09-09
ManipDreamer3D : Synthesizing Plausible Robotic Manipulation Video with Occupancy-aware 3D Trajectory,manipdreamer3d-synthesizing-plausible-robotic-manipulation-video-with-occupancy-aware-3d-trajectory,Article,Minor,❌,,HTML/Blog,,,,,,https://arxiv.org/abs/2509.05314,Press,Auto-Discovery,,,,2025-09-09
A Dataset Generation Scheme Based on Video2EEG-SPGN-Diffusion for SEED-VD,a-dataset-generation-scheme-based-on-video2eeg-spgn-diffusion-for-seed-vd,Article,Minor,❌,,HTML/Blog,,,,,,https://arxiv.org/abs/2509.05321,Press,Auto-Discovery,,,,2025-09-09
Plantbot: Integrating Plant and Robot through LLM Modular Agent Networks,plantbot-integrating-plant-and-robot-through-llm-modular-agent-networks,Article,Minor,❌,,HTML/Blog,,,,,,https://arxiv.org/abs/2509.05338,Press,Auto-Discovery,,,,2025-09-09
Privacy Preservation and Identity Tracing Prevention in AI-Driven Eye Tracking for Interactive Learning Environments,privacy-preservation-and-identity-tracing-prevention-in-ai-driven-eye-tracking-for-interactive-learning-environments,Article,Minor,❌,,HTML/Blog,,,,,,https://arxiv.org/abs/2509.05376,Press,Auto-Discovery,,,,2025-09-09
ThreatGPT: An Agentic AI Framework for Enhancing Public Safety through Threat Modeling,threatgpt-an-agentic-ai-framework-for-enhancing-public-safety-through-threat-modeling,Article,Minor,❌,,HTML/Blog,,,,,,https://arxiv.org/abs/2509.05379,Press,Auto-Discovery,,,,2025-09-09
A Lightweight Framework for Trigger-Guided LoRA-Based Self-Adaptation in LLMs,a-lightweight-framework-for-trigger-guided-lora-based-self-adaptation-in-llms,Article,Minor,❌,,HTML/Blog,,,,,,https://arxiv.org/abs/2509.05385,Press,Auto-Discovery,,,,2025-09-09
Talk Isn't Always Cheap: Understanding Failure Modes in Multi-Agent Debate,talk-isn-t-always-cheap-understanding-failure-modes-in-multi-agent-debate,Article,Minor,❌,,HTML/Blog,,,,,,https://arxiv.org/abs/2509.05396,Press,Auto-Discovery,,,,2025-09-09
Language-guided Recursive Spatiotemporal Graph Modeling for Video Summarization,language-guided-recursive-spatiotemporal-graph-modeling-for-video-summarization,Article,Minor,❌,,HTML/Blog,,,,,,https://arxiv.org/abs/2509.05604,Press,Auto-Discovery,,,,2025-09-09
Orchestrator: Active Inference for Multi-Agent Systems in Long-Horizon Tasks,orchestrator-active-inference-for-multi-agent-systems-in-long-horizon-tasks,Article,Minor,❌,,HTML/Blog,,,,,,https://arxiv.org/abs/2509.05651,Press,Auto-Discovery,,,,2025-09-09
Unleashing Hierarchical Reasoning: An LLM-Driven Framework for Training-Free Referring Video Object Segmentation,unleashing-hierarchical-reasoning-an-llm-driven-framework-for-training-free-referring-video-object-segmentation,Article,Minor,❌,,HTML/Blog,,,,,,https://arxiv.org/abs/2509.05751,Press,Auto-Discovery,,,,2025-09-09
Exploit Tool Invocation Prompt for Tool Behavior Hijacking in LLM-Based Agentic System,exploit-tool-invocation-prompt-for-tool-behavior-hijacking-in-llm-based-agentic-system,Article,Minor,❌,,HTML/Blog,,,,,,https://arxiv.org/abs/2509.05755,Press,Auto-Discovery,,,,2025-09-09
Quantum spatial best-arm identification via quantum walks,quantum-spatial-best-arm-identification-via-quantum-walks,Article,Minor,❌,,HTML/Blog,,,,,,https://arxiv.org/abs/2509.05890,Press,Auto-Discovery,,,,2025-09-09
"Operationalising AI Regulatory Sandboxes under the EU AI Act: The Triple Challenge of Capacity, Coordination and Attractiveness to Providers",operationalising-ai-regulatory-sandboxes-under-the-eu-ai-act-the-triple-challenge-of-capacity-coordination-and-attractiveness-to-providers,Article,Minor,❌,,HTML/Blog,,,,,,https://arxiv.org/abs/2509.05985,Press,Auto-Discovery,,,,2025-09-09
S-LAM3D: Segmentation-Guided Monocular 3D Object Detection via Feature Space Fusion,s-lam3d-segmentation-guided-monocular-3d-object-detection-via-feature-space-fusion,Article,Minor,❌,,HTML/Blog,,,,,,https://arxiv.org/abs/2509.05999,Press,Auto-Discovery,,,,2025-09-09
Teaching Precommitted Agents: Model-Free Policy Evaluation and Control in Quasi-Hyperbolic Discounted MDPs,teaching-precommitted-agents-model-free-policy-evaluation-and-control-in-quasi-hyperbolic-discounted-mdps,Article,Minor,❌,,HTML/Blog,,,,,,https://arxiv.org/abs/2509.06094,Press,Auto-Discovery,,,,2025-09-09
UNO: Unifying One-stage Video Scene Graph Generation via Object-Centric Visual Representation Learning,uno-unifying-one-stage-video-scene-graph-generation-via-object-centric-visual-representation-learning,Article,Minor,❌,,HTML/Blog,,,,,,https://arxiv.org/abs/2509.06165,Press,Auto-Discovery,,,,2025-09-09
"AI Governance in Higher Education: A course design exploring regulatory, ethical and practical considerations",ai-governance-in-higher-education-a-course-design-exploring-regulatory-ethical-and-practical-considerations,Article,Minor,❌,,HTML/Blog,,,,,,https://arxiv.org/abs/2509.06176,Press,Auto-Discovery,,,,2025-09-09
Grasp-MPC: Closed-Loop Visual Grasping via Value-Guided Model Predictive Control,grasp-mpc-closed-loop-visual-grasping-via-value-guided-model-predictive-control,Article,Minor,❌,,HTML/Blog,,,,,,https://arxiv.org/abs/2509.06201,Press,Auto-Discovery,,,,2025-09-09
Agentic Software Engineering: Foundational Pillars and a Research Roadmap,agentic-software-engineering-foundational-pillars-and-a-research-roadmap,Article,Minor,❌,,HTML/Blog,,,,,,https://arxiv.org/abs/2509.06216,Press,Auto-Discovery,,,,2025-09-09
MRD-LiNet: A Novel Lightweight Hybrid CNN with Gradient-Guided Unlearning for Improved Drought Stress Identification,mrd-linet-a-novel-lightweight-hybrid-cnn-with-gradient-guided-unlearning-for-improved-drought-stress-identification,Article,Minor,❌,,HTML/Blog,,,,,,https://arxiv.org/abs/2509.06367,Press,Auto-Discovery,,,,2025-09-09
MeanFlow-Accelerated Multimodal Video-to-Audio Synthesis via One-Step Generation,meanflow-accelerated-multimodal-video-to-audio-synthesis-via-one-step-generation,Article,Minor,❌,,HTML/Blog,,,,,,https://arxiv.org/abs/2509.06389,Press,Auto-Discovery,,,,2025-09-09
HECATE: An ECS-based Framework for Teaching and Developing Multi-Agent Systems,hecate-an-ecs-based-framework-for-teaching-and-developing-multi-agent-systems,Article,Minor,❌,,HTML/Blog,,,,,,https://arxiv.org/abs/2509.06431,Press,Auto-Discovery,,,,2025-09-09
Integrating Spatial and Semantic Embeddings for Stereo Sound Event Localization in Videos,integrating-spatial-and-semantic-embeddings-for-stereo-sound-event-localization-in-videos,Article,Minor,❌,,HTML/Blog,,,,,,https://arxiv.org/abs/2509.06598,Press,Auto-Discovery,,,,2025-09-09
Demo: Healthcare Agent Orchestrator (HAO) for Patient Summarization in Molecular Tumor Boards,demo-healthcare-agent-orchestrator-hao-for-patient-summarization-in-molecular-tumor-boards,Article,Minor,❌,,HTML/Blog,,,,,,https://arxiv.org/abs/2509.06602,Press,Auto-Discovery,,,,2025-09-09
Probabilistic Modeling of Latent Agentic Substructures in Deep Neural Networks,probabilistic-modeling-of-latent-agentic-substructures-in-deep-neural-networks,Article,Minor,❌,,HTML/Blog,,,,,,https://arxiv.org/abs/2509.06701,Press,Auto-Discovery,,,,2025-09-09
