Tool,Moniker,Category,Severity,RSS Available,Feed URL,Tracking Method,Repo URL,Repo Status,Stars,Contributors,Docs URL,Website URL,Source Type,Discovery Method,Launch Status,Last Seen Update,Status,Date Added
"TwinTac: A Wide-Range, Highly Sensitive Tactile Sensor with Real-to-Sim Digital Twin Sensor Model",twintac-a-wide-range-highly-sensitive-tactile-sensor-with-real-to-sim-digital-twin-sensor-model,Article,Minor,❌,,HTML/Blog,,,,,,https://arxiv.org/abs/2509.10063,Press,Auto-Discovery,,,,2025-09-15
We Need a New Ethics for a World of AI Agents,we-need-a-new-ethics-for-a-world-of-ai-agents,Article,Minor,❌,,HTML/Blog,,,,,,https://arxiv.org/abs/2509.10289,Press,Auto-Discovery,,,,2025-09-15
GLAM: Geometry-Guided Local Alignment for Multi-View VLP in Mammography,glam-geometry-guided-local-alignment-for-multi-view-vlp-in-mammography,Article,Minor,❌,,HTML/Blog,,,,,,https://arxiv.org/abs/2509.10344,Press,Auto-Discovery,,,,2025-09-15
Building Self-Evolving Agents via Experience-Driven Lifelong Learning: A Framework and Benchmark,building-self-evolving-agents-via-experience-driven-lifelong-learning-a-framework-and-benchmark,Article,Minor,❌,,HTML/Blog,,,,,,https://arxiv.org/abs/2508.19005,Press,Auto-Discovery,,,,2025-09-15
The Precautionary Principle and the Innovation Principle: Incompatible Guides for AI Innovation Governance?,the-precautionary-principle-and-the-innovation-principle-incompatible-guides-for-ai-innovation-governance,Article,Minor,❌,,HTML/Blog,,,,,,https://arxiv.org/abs/2505.02846,Press,Auto-Discovery,,,,2025-09-15
OMGM: Orchestrate Multiple Granularities and Modalities for Efficient Multimodal Retrieval,omgm-orchestrate-multiple-granularities-and-modalities-for-efficient-multimodal-retrieval,Article,Minor,❌,,HTML/Blog,,,,,,https://arxiv.org/abs/2505.07879,Press,Auto-Discovery,,,,2025-09-15
"Web3 x AI Agents: Landscape, Integrations, and Foundational Challenges",web3-x-ai-agents-landscape-integrations-and-foundational-challenges,Article,Minor,❌,,HTML/Blog,,,,,,https://arxiv.org/abs/2508.02773,Press,Auto-Discovery,,,,2025-09-15
Bridging the Gap: A Framework for Real-World Video Deepfake Detection via Social Network Compression Emulation,bridging-the-gap-a-framework-for-real-world-video-deepfake-detection-via-social-network-compression-emulation,Article,Minor,❌,,HTML/Blog,,,,,,https://arxiv.org/abs/2508.08765,Press,Auto-Discovery,,,,2025-09-15
Show HN: Preview ePub/MOBI/CBZ (and more) with a spacebar tap [macOS],show-hn-preview-epub-mobi-cbz-and-more-with-a-spacebar-tap-macos,Article,Minor,❌,,HTML/Blog,,,,,,https://apps.apple.com/us/app/book-preview/id6744098874?mt=12,Press,Auto-Discovery,,,,2025-09-16
Show HN: Generic client-side scripting language,show-hn-generic-client-side-scripting-language,Article,Minor,❌,,HTML/Blog,,,,,,https://xoscript.com/,Press,Auto-Discovery,,,,2025-09-16
Show HN: OSS SDK for Digital Identity,show-hn-oss-sdk-for-digital-identity,Article,Minor,❌,,HTML/Blog,,,,,,https://ssi-sdk.blockialabs.com,Press,Auto-Discovery,,,,2025-09-16
Show HN: A place where you can easily turn your ideas into images,show-hn-a-place-where-you-can-easily-turn-your-ideas-into-images,Article,Minor,❌,,HTML/Blog,,,,,,https://pixee.lat,Press,Auto-Discovery,,,,2025-09-16
"Anyone else have small models just ""forget"" MCP tools exist?",anyone-else-have-small-models-just-forget-mcp-tools-exist,Article,Minor,❌,,HTML/Blog,,,,,,https://www.reddit.com/r/LocalLLaMA/comments/1ni1uw3/anyone_else_have_small_models_just_forget_mcp/,Press,Auto-Discovery,,,,2025-09-16
[D] The conference reviewing system is trash.,d-the-conference-reviewing-system-is-trash,Article,Minor,❌,,HTML/Blog,,,,,,https://www.reddit.com/r/MachineLearning/comments/1nhzngh/d_the_conference_reviewing_system_is_trash/,Press,Auto-Discovery,,,,2025-09-16
[D] The quality of AAAI reviews is atrocious,d-the-quality-of-aaai-reviews-is-atrocious,Article,Minor,❌,,HTML/Blog,,,,,,https://www.reddit.com/r/MachineLearning/comments/1nhvv90/d_the_quality_of_aaai_reviews_is_atrocious/,Press,Auto-Discovery,,,,2025-09-16
[D] Any comments of AAAI Review process?,d-any-comments-of-aaai-review-process,Article,Minor,❌,,HTML/Blog,,,,,,https://www.reddit.com/r/MachineLearning/comments/1nhyanm/d_any_comments_of_aaai_review_process/,Press,Auto-Discovery,,,,2025-09-16
[D] Running confidential AI inference on client data without exposing the model or the data - what's actually production-ready?,d-running-confidential-ai-inference-on-client-data-without-exposing-the-model-or-the-data-what-s-actually-production-ready,Article,Minor,❌,,HTML/Blog,,,,,,https://www.reddit.com/r/MachineLearning/comments/1ni24y3/d_running_confidential_ai_inference_on_client/,Press,Auto-Discovery,,,,2025-09-16
Apple Watch Series 11 review: stuck in the middle,apple-watch-series-11-review-stuck-in-the-middle,Article,Minor,❌,,HTML/Blog,,,,,,https://www.theverge.com/smartwatch-review/778012/apple-watch-series-11-review-hypertension-5g-sleep-score-wearables-smartwatch,Press,Auto-Discovery,,,,2025-09-16
"How GPT5 + Codex took over Agentic Coding — ft. Greg Brockman, OpenAI",how-gpt5-codex-took-over-agentic-coding-ft-greg-brockman-openai,Article,Minor,❌,,HTML/Blog,,,,,,https://www.latent.space/p/gpt5-codex,Press,Auto-Discovery,,,,2025-09-16
Maestro: Self-Improving Text-to-Image Generation via Agent Orchestration,maestro-self-improving-text-to-image-generation-via-agent-orchestration,Article,Minor,❌,,HTML/Blog,,,,,,https://arxiv.org/abs/2509.10704,Press,Auto-Discovery,,,,2025-09-16
AgentArch: A Comprehensive Benchmark to Evaluate Agent Architectures in Enterprise,agentarch-a-comprehensive-benchmark-to-evaluate-agent-architectures-in-enterprise,Article,Minor,❌,,HTML/Blog,,,,,,https://arxiv.org/abs/2509.10769,Press,Auto-Discovery,,,,2025-09-16
Is the `Agent' Paradigm a Limiting Framework for Next-Generation Intelligent Systems?,is-the-agent-paradigm-a-limiting-framework-for-next-generation-intelligent-systems,Article,Minor,❌,,HTML/Blog,,,,,,https://arxiv.org/abs/2509.10875,Press,Auto-Discovery,,,,2025-09-16
Free-MAD: Consensus-Free Multi-Agent Debate,free-mad-consensus-free-multi-agent-debate,Article,Minor,❌,,HTML/Blog,,,,,,https://arxiv.org/abs/2509.11035,Press,Auto-Discovery,,,,2025-09-16
Agentic Lybic: Multi-Agent Execution System with Tiered Reasoning and Orchestration,agentic-lybic-multi-agent-execution-system-with-tiered-reasoning-and-orchestration,Article,Minor,❌,,HTML/Blog,,,,,,https://arxiv.org/abs/2509.11067,Press,Auto-Discovery,,,,2025-09-16
Patient-Zero: A Unified Framework for Real-Record-Free Patient Agent Generation,patient-zero-a-unified-framework-for-real-record-free-patient-agent-generation,Article,Minor,❌,,HTML/Blog,,,,,,https://arxiv.org/abs/2509.11078,Press,Auto-Discovery,,,,2025-09-16
Difficulty-Aware Agent Orchestration in LLM-Powered Workflows,difficulty-aware-agent-orchestration-in-llm-powered-workflows,Article,Minor,❌,,HTML/Blog,,,,,,https://arxiv.org/abs/2509.11079,Press,Auto-Discovery,,,,2025-09-16
AlignKT: Explicitly Modeling Knowledge State for Knowledge Tracing with Ideal State Alignment,alignkt-explicitly-modeling-knowledge-state-for-knowledge-tracing-with-ideal-state-alignment,Article,Minor,❌,,HTML/Blog,,,,,,https://arxiv.org/abs/2509.11135,Press,Auto-Discovery,,,,2025-09-16
VideoAgent: Personalized Synthesis of Scientific Videos,videoagent-personalized-synthesis-of-scientific-videos,Article,Minor,❌,,HTML/Blog,,,,,,https://arxiv.org/abs/2509.11253,Press,Auto-Discovery,,,,2025-09-16
MAPGD: Multi-Agent Prompt Gradient Descent for Collaborative Prompt Optimization,mapgd-multi-agent-prompt-gradient-descent-for-collaborative-prompt-optimization,Article,Minor,❌,,HTML/Blog,,,,,,https://arxiv.org/abs/2509.11361,Press,Auto-Discovery,,,,2025-09-16
Securing AI Agents: Implementing Role-Based Access Control for Industrial Applications,securing-ai-agents-implementing-role-based-access-control-for-industrial-applications,Article,Minor,❌,,HTML/Blog,,,,,,https://arxiv.org/abs/2509.11431,Press,Auto-Discovery,,,,2025-09-16
Knowledge-Guided Adaptive Mixture of Experts for Precipitation Prediction,knowledge-guided-adaptive-mixture-of-experts-for-precipitation-prediction,Article,Minor,❌,,HTML/Blog,,,,,,https://arxiv.org/abs/2509.11459,Press,Auto-Discovery,,,,2025-09-16
MedicalOS: An LLM Agent based Operating System for Digital Healthcare,medicalos-an-llm-agent-based-operating-system-for-digital-healthcare,Article,Minor,❌,,HTML/Blog,,,,,,https://arxiv.org/abs/2509.11507,Press,Auto-Discovery,,,,2025-09-16
A Survey of Reasoning and Agentic Systems in Time Series with Large Language Models,a-survey-of-reasoning-and-agentic-systems-in-time-series-with-large-language-models,Article,Minor,❌,,HTML/Blog,,,,,,https://arxiv.org/abs/2509.11575,Press,Auto-Discovery,,,,2025-09-16
AMLNet: A Knowledge-Based Multi-Agent Framework to Generate and Detect Realistic Money Laundering Transactions,amlnet-a-knowledge-based-multi-agent-framework-to-generate-and-detect-realistic-money-laundering-transactions,Article,Minor,❌,,HTML/Blog,,,,,,https://arxiv.org/abs/2509.11595,Press,Auto-Discovery,,,,2025-09-16
Adapting and Evaluating Multimodal Large Language Models for Adolescent Idiopathic Scoliosis Self-Management: A Divide and Conquer Framework,adapting-and-evaluating-multimodal-large-language-models-for-adolescent-idiopathic-scoliosis-self-management-a-divide-and-conquer-framework,Article,Minor,❌,,HTML/Blog,,,,,,https://arxiv.org/abs/2509.11645,Press,Auto-Discovery,,,,2025-09-16
Learning Representations in Video Game Agents with Supervised Contrastive Imitation Learning,learning-representations-in-video-game-agents-with-supervised-contrastive-imitation-learning,Article,Minor,❌,,HTML/Blog,,,,,,https://arxiv.org/abs/2509.11880,Press,Auto-Discovery,,,,2025-09-16
EgoMem: Lifelong Memory Agent for Full-duplex Omnimodal Models,egomem-lifelong-memory-agent-for-full-duplex-omnimodal-models,Article,Minor,❌,,HTML/Blog,,,,,,https://arxiv.org/abs/2509.11914,Press,Auto-Discovery,,,,2025-09-16
Neuro-Symbolic Agents with Modal Logic for Autonomous Diagnostics,neuro-symbolic-agents-with-modal-logic-for-autonomous-diagnostics,Article,Minor,❌,,HTML/Blog,,,,,,https://arxiv.org/abs/2509.11943,Press,Auto-Discovery,,,,2025-09-16
Agentic Temporal Graph of Reasoning with Multimodal Language Models: A Potential AI Aid to Healthcare,agentic-temporal-graph-of-reasoning-with-multimodal-language-models-a-potential-ai-aid-to-healthcare,Article,Minor,❌,,HTML/Blog,,,,,,https://arxiv.org/abs/2509.11944,Press,Auto-Discovery,,,,2025-09-16
Human-AI Use Patterns for Decision-Making in Disaster Scenarios: A Systematic Review,human-ai-use-patterns-for-decision-making-in-disaster-scenarios-a-systematic-review,Article,Minor,❌,,HTML/Blog,,,,,,https://arxiv.org/abs/2509.12034,Press,Auto-Discovery,,,,2025-09-16
When Safe Unimodal Inputs Collide: Optimizing Reasoning Chains for Cross-Modal Safety in Multimodal Large Language Models,when-safe-unimodal-inputs-collide-optimizing-reasoning-chains-for-cross-modal-safety-in-multimodal-large-language-models,Article,Minor,❌,,HTML/Blog,,,,,,https://arxiv.org/abs/2509.12060,Press,Auto-Discovery,,,,2025-09-16
Real-Time RAG for the Identification of Supply Chain Vulnerabilities,real-time-rag-for-the-identification-of-supply-chain-vulnerabilities,Article,Minor,❌,,HTML/Blog,,,,,,https://arxiv.org/abs/2509.10469,Press,Auto-Discovery,,,,2025-09-16
CAR-BRAINet: Sub-6GHz Aided Spatial Adaptive Beam Prediction with Multi Head Attention for Heterogeneous Vehicular Networks,car-brainet-sub-6ghz-aided-spatial-adaptive-beam-prediction-with-multi-head-attention-for-heterogeneous-vehicular-networks,Article,Minor,❌,,HTML/Blog,,,,,,https://arxiv.org/abs/2509.10508,Press,Auto-Discovery,,,,2025-09-16
From Predictions to Explanations: Explainable AI for Autism Diagnosis and Identification of Critical Brain Regions,from-predictions-to-explanations-explainable-ai-for-autism-diagnosis-and-identification-of-critical-brain-regions,Article,Minor,❌,,HTML/Blog,,,,,,https://arxiv.org/abs/2509.10523,Press,Auto-Discovery,,,,2025-09-16
Semantic-guided LoRA Parameters Generation,semantic-guided-lora-parameters-generation,Article,Minor,❌,,HTML/Blog,,,,,,https://arxiv.org/abs/2509.10535,Press,Auto-Discovery,,,,2025-09-16
ASL360: AI-Enabled Adaptive Streaming of Layered 360{\deg} Video over UAV-assisted Wireless Networks,asl360-ai-enabled-adaptive-streaming-of-layered-360-deg-video-over-uav-assisted-wireless-networks,Article,Minor,❌,,HTML/Blog,,,,,,https://arxiv.org/abs/2509.10544,Press,Auto-Discovery,,,,2025-09-16
Aesthetic Experience and Educational Value in Co-creating Art with Generative AI: Evidence from a Survey of Young Learners,aesthetic-experience-and-educational-value-in-co-creating-art-with-generative-ai-evidence-from-a-survey-of-young-learners,Article,Minor,❌,,HTML/Blog,,,,,,https://arxiv.org/abs/2509.10576,Press,Auto-Discovery,,,,2025-09-16
Self-Supervised Goal-Reaching Results in Multi-Agent Cooperation and Exploration,self-supervised-goal-reaching-results-in-multi-agent-cooperation-and-exploration,Article,Minor,❌,,HTML/Blog,,,,,,https://arxiv.org/abs/2509.10656,Press,Auto-Discovery,,,,2025-09-16
LLM in the Middle: A Systematic Review of Threats and Mitigations to Real-World LLM-based Systems,llm-in-the-middle-a-systematic-review-of-threats-and-mitigations-to-real-world-llm-based-systems,Article,Minor,❌,,HTML/Blog,,,,,,https://arxiv.org/abs/2509.10682,Press,Auto-Discovery,,,,2025-09-16
Dark Patterns Meet GUI Agents: LLM Agent Susceptibility to Manipulative Interfaces and the Role of Human Oversight,dark-patterns-meet-gui-agents-llm-agent-susceptibility-to-manipulative-interfaces-and-the-role-of-human-oversight,Article,Minor,❌,,HTML/Blog,,,,,,https://arxiv.org/abs/2509.10723,Press,Auto-Discovery,,,,2025-09-16
CultureSynth: A Hierarchical Taxonomy-Guided and Retrieval-Augmented Framework for Cultural Question-Answer Synthesis,culturesynth-a-hierarchical-taxonomy-guided-and-retrieval-augmented-framework-for-cultural-question-answer-synthesis,Article,Minor,❌,,HTML/Blog,,,,,,https://arxiv.org/abs/2509.10886,Press,Auto-Discovery,,,,2025-09-16
PanoLora: Bridging Perspective and Panoramic Video Generation with LoRA Adaptation,panolora-bridging-perspective-and-panoramic-video-generation-with-lora-adaptation,Article,Minor,❌,,HTML/Blog,,,,,,https://arxiv.org/abs/2509.11092,Press,Auto-Discovery,,,,2025-09-16
Multi-Modal Sensing Aided mmWave Beamforming for V2V Communications with Transformers,multi-modal-sensing-aided-mmwave-beamforming-for-v2v-communications-with-transformers,Article,Minor,❌,,HTML/Blog,,,,,,https://arxiv.org/abs/2509.11112,Press,Auto-Discovery,,,,2025-09-16
Agentic Username Suggestion and Multimodal Gender Detection in Online Platforms: Introducing the PNGT-26K Dataset,agentic-username-suggestion-and-multimodal-gender-detection-in-online-platforms-introducing-the-pngt-26k-dataset,Article,Minor,❌,,HTML/Blog,,,,,,https://arxiv.org/abs/2509.11136,Press,Auto-Discovery,,,,2025-09-16
An Entropy-Guided Curriculum Learning Strategy for Data-Efficient Acoustic Scene Classification under Domain Shift,an-entropy-guided-curriculum-learning-strategy-for-data-efficient-acoustic-scene-classification-under-domain-shift,Article,Minor,❌,,HTML/Blog,,,,,,https://arxiv.org/abs/2509.11168,Press,Auto-Discovery,,,,2025-09-16
Designing and Evaluating a Conversational Agent for Early Detection of Alzheimer's Disease and Related Dementias,designing-and-evaluating-a-conversational-agent-for-early-detection-of-alzheimer-s-disease-and-related-dementias,Article,Minor,❌,,HTML/Blog,,,,,,https://arxiv.org/abs/2509.11478,Press,Auto-Discovery,,,,2025-09-16
Dstack: A Zero Trust Framework for Confidential Containers,dstack-a-zero-trust-framework-for-confidential-containers,Article,Minor,❌,,HTML/Blog,,,,,,https://arxiv.org/abs/2509.11555,Press,Auto-Discovery,,,,2025-09-16
Hierarchical Identity Learning for Unsupervised Visible-Infrared Person Re-Identification,hierarchical-identity-learning-for-unsupervised-visible-infrared-person-re-identification,Article,Minor,❌,,HTML/Blog,,,,,,https://arxiv.org/abs/2509.11587,Press,Auto-Discovery,,,,2025-09-16
MALLM: Multi-Agent Large Language Models Framework,mallm-multi-agent-large-language-models-framework,Article,Minor,❌,,HTML/Blog,,,,,,https://arxiv.org/abs/2509.11656,Press,Auto-Discovery,,,,2025-09-16
Bridging Vision Language Models and Symbolic Grounding for Video Question Answering,bridging-vision-language-models-and-symbolic-grounding-for-video-question-answering,Article,Minor,❌,,HTML/Blog,,,,,,https://arxiv.org/abs/2509.11862,Press,Auto-Discovery,,,,2025-09-16
VisDocSketcher: Towards Scalable Visual Documentation with Agentic Systems,visdocsketcher-towards-scalable-visual-documentation-with-agentic-systems,Article,Minor,❌,,HTML/Blog,,,,,,https://arxiv.org/abs/2509.11942,Press,Auto-Discovery,,,,2025-09-16
Interaction-Driven Browsing: A Human-in-the-Loop Conceptual Framework Informed by Human Web Browsing for Browser-Using Agents,interaction-driven-browsing-a-human-in-the-loop-conceptual-framework-informed-by-human-web-browsing-for-browser-using-agents,Article,Minor,❌,,HTML/Blog,,,,,,https://arxiv.org/abs/2509.12049,Press,Auto-Discovery,,,,2025-09-16
Is 'Hope' a person or an idea? A pilot benchmark for NER: comparing traditional NLP tools and large language models on ambiguous entities,is-hope-a-person-or-an-idea-a-pilot-benchmark-for-ner-comparing-traditional-nlp-tools-and-large-language-models-on-ambiguous-entities,Article,Minor,❌,,HTML/Blog,,,,,,https://arxiv.org/abs/2509.12098,Press,Auto-Discovery,,,,2025-09-16
$K$-Level Policy Gradients for Multi-Agent Reinforcement Learning,k-level-policy-gradients-for-multi-agent-reinforcement-learning,Article,Minor,❌,,HTML/Blog,,,,,,https://arxiv.org/abs/2509.12117,Press,Auto-Discovery,,,,2025-09-16
Foundations and Recent Trends in Multimodal Mobile Agents: A Survey,foundations-and-recent-trends-in-multimodal-mobile-agents-a-survey,Article,Minor,❌,,HTML/Blog,,,,,,https://arxiv.org/abs/2411.02006,Press,Auto-Discovery,,,,2025-09-16
A Survey on Large Language Model-based Agents for Statistics and Data Science,a-survey-on-large-language-model-based-agents-for-statistics-and-data-science,Article,Minor,❌,,HTML/Blog,,,,,,https://arxiv.org/abs/2412.14222,Press,Auto-Discovery,,,,2025-09-16
Towards LLM Agents for Earth Observation,towards-llm-agents-for-earth-observation,Article,Minor,❌,,HTML/Blog,,,,,,https://arxiv.org/abs/2504.12110,Press,Auto-Discovery,,,,2025-09-16
MultiMind: Enhancing Werewolf Agents with Multimodal Reasoning and Theory of Mind,multimind-enhancing-werewolf-agents-with-multimodal-reasoning-and-theory-of-mind,Article,Minor,❌,,HTML/Blog,,,,,,https://arxiv.org/abs/2504.18039,Press,Auto-Discovery,,,,2025-09-16
Plugging Schema Graph into Multi-Table QA: A Human-Guided Framework for Reducing LLM Reliance,plugging-schema-graph-into-multi-table-qa-a-human-guided-framework-for-reducing-llm-reliance,Article,Minor,❌,,HTML/Blog,,,,,,https://arxiv.org/abs/2506.04427,Press,Auto-Discovery,,,,2025-09-16
Hide-and-Shill: A Reinforcement Learning Framework for Market Manipulation Detection in Symphony-a Decentralized Multi-Agent System,hide-and-shill-a-reinforcement-learning-framework-for-market-manipulation-detection-in-symphony-a-decentralized-multi-agent-system,Article,Minor,❌,,HTML/Blog,,,,,,https://arxiv.org/abs/2507.09179,Press,Auto-Discovery,,,,2025-09-16
Strategic Tradeoffs Between Humans and AI in Multi-Agent Bargaining,strategic-tradeoffs-between-humans-and-ai-in-multi-agent-bargaining,Article,Minor,❌,,HTML/Blog,,,,,,https://arxiv.org/abs/2509.09071,Press,Auto-Discovery,,,,2025-09-16
Through the Theory of Mind's Eye: Reading Minds with Multimodal Video Large Language Models,through-the-theory-of-mind-s-eye-reading-minds-with-multimodal-video-large-language-models,Article,Minor,❌,,HTML/Blog,,,,,,https://arxiv.org/abs/2406.13763,Press,Auto-Discovery,,,,2025-09-16
Assessing Consistency and Reproducibility in the Outputs of Large Language Models: Evidence Across Diverse Finance and Accounting Tasks,assessing-consistency-and-reproducibility-in-the-outputs-of-large-language-models-evidence-across-diverse-finance-and-accounting-tasks,Article,Minor,❌,,HTML/Blog,,,,,,https://arxiv.org/abs/2503.16974,Press,Auto-Discovery,,,,2025-09-16
AgentDynEx: Nudging the Mechanics and Dynamics of Multi-Agent Simulations,agentdynex-nudging-the-mechanics-and-dynamics-of-multi-agent-simulations,Article,Minor,❌,,HTML/Blog,,,,,,https://arxiv.org/abs/2504.09662,Press,Auto-Discovery,,,,2025-09-16
High-Fidelity Scientific Simulation Surrogates via Adaptive Implicit Neural Representations,high-fidelity-scientific-simulation-surrogates-via-adaptive-implicit-neural-representations,Article,Minor,❌,,HTML/Blog,,,,,,https://arxiv.org/abs/2506.06858,Press,Auto-Discovery,,,,2025-09-16
Critical Nodes Identification in Complex Networks: A Survey,critical-nodes-identification-in-complex-networks-a-survey,Article,Minor,❌,,HTML/Blog,,,,,,https://arxiv.org/abs/2507.06164,Press,Auto-Discovery,,,,2025-09-16
"A Human-Centered Approach to Identifying Promises, Risks, & Challenges of Text-to-Image Generative AI in Radiology",a-human-centered-approach-to-identifying-promises-risks-challenges-of-text-to-image-generative-ai-in-radiology,Article,Minor,❌,,HTML/Blog,,,,,,https://arxiv.org/abs/2507.16207,Press,Auto-Discovery,,,,2025-09-16
"Quantized Neural Networks for Microcontrollers: A Comprehensive Review of Methods, Platforms, and Applications",quantized-neural-networks-for-microcontrollers-a-comprehensive-review-of-methods-platforms-and-applications,Article,Minor,❌,,HTML/Blog,,,,,,https://arxiv.org/abs/2508.15008,Press,Auto-Discovery,,,,2025-09-16
GitTaskBench: A Benchmark for Code Agents Solving Real-World Tasks Through Code Repository Leveraging,gittaskbench-a-benchmark-for-code-agents-solving-real-world-tasks-through-code-repository-leveraging,Article,Minor,❌,,HTML/Blog,,,,,,https://arxiv.org/abs/2508.18993,Press,Auto-Discovery,,,,2025-09-16
STRIDE: Subset-Free Functional Decomposition for XAI in Tabular Settings,stride-subset-free-functional-decomposition-for-xai-in-tabular-settings,Article,Minor,❌,,HTML/Blog,,,,,,https://arxiv.org/abs/2509.09070,Press,Auto-Discovery,,,,2025-09-16
Show HN: Coding AI Agent API for Developers,show-hn-coding-ai-agent-api-for-developers,Article,Minor,❌,,HTML/Blog,,,,,,https://workser.ai,Press,Auto-Discovery,,,,2025-09-17
"Show HN: HuMo AI – Create Realistic Videos with Text, Image, and Audio Inputs",show-hn-humo-ai-create-realistic-videos-with-text-image-and-audio-inputs,Article,Minor,❌,,HTML/Blog,,,,,,https://www.humoai.co,Press,Auto-Discovery,,,,2025-09-17
Alibaba Tongyi released open-source (Deep Research) Web Agent,alibaba-tongyi-released-open-source-deep-research-web-agent,Article,Minor,❌,,HTML/Blog,,,,,,https://www.reddit.com/r/LocalLLaMA/comments/1nis417/alibaba_tongyi_released_opensource_deep_research/,Press,Auto-Discovery,,,,2025-09-17
Can I use Cursor Agent (or similar) with a local LLM setup (8B / 13B)?,can-i-use-cursor-agent-or-similar-with-a-local-llm-setup-8b-13b,Article,Minor,❌,,HTML/Blog,,,,,,https://www.reddit.com/r/LocalLLaMA/comments/1nj758c/can_i_use_cursor_agent_or_similar_with_a_local/,Press,Auto-Discovery,,,,2025-09-17
Ok put your guesses what will meta release or launch beside smart glasses in Wednesday event?..,ok-put-your-guesses-what-will-meta-release-or-launch-beside-smart-glasses-in-wednesday-event,Article,Minor,❌,,HTML/Blog,,,,,,https://www.reddit.com/r/LocalLLaMA/comments/1njc5zs/ok_put_your_guesses_what_will_meta_release_or/,Press,Auto-Discovery,,,,2025-09-17
[D] WACV round 1 revised papers for round 2 -- rebuttal guidelines,d-wacv-round-1-revised-papers-for-round-2-rebuttal-guidelines,Article,Minor,❌,,HTML/Blog,,,,,,https://www.reddit.com/r/MachineLearning/comments/1nj76ch/d_wacv_round_1_revised_papers_for_round_2/,Press,Auto-Discovery,,,,2025-09-17
Why I’m going back to the AI Agent Security Research Summit [R],why-i-m-going-back-to-the-ai-agent-security-research-summit-r,Article,Minor,❌,,HTML/Blog,,,,,,https://www.reddit.com/r/MachineLearning/comments/1niyhch/why_im_going_back_to_the_ai_agent_security/,Press,Auto-Discovery,,,,2025-09-17
"[P] I build a completely free website to help patients to get secondary opinion on mammogram, loading AI model inside browser and completely local inference without data transfer. Optional LLM-based radiology report generation if needed.",p-i-build-a-completely-free-website-to-help-patients-to-get-secondary-opinion-on-mammogram-loading-ai-model-inside-browser-and-completely-local-inference-without-data-transfer-optional-llm-based-radiology-report-generation-if-needed,Article,Minor,❌,,HTML/Blog,,,,,,https://www.reddit.com/r/MachineLearning/comments/1nirhbj/p_i_build_a_completely_free_website_to_help/,Press,Auto-Discovery,,,,2025-09-17
V-Math: An Agentic Approach to the Vietnamese National High School Graduation Mathematics Exams,v-math-an-agentic-approach-to-the-vietnamese-national-high-school-graduation-mathematics-exams,Article,Minor,❌,,HTML/Blog,,,,,,https://arxiv.org/abs/2509.12251,Press,Auto-Discovery,,,,2025-09-17
AIssistant: An Agentic Approach for Human--AI Collaborative Scientific Work on Reviews and Perspectives in Machine Learning,aissistant-an-agentic-approach-for-human-ai-collaborative-scientific-work-on-reviews-and-perspectives-in-machine-learning,Article,Minor,❌,,HTML/Blog,,,,,,https://arxiv.org/abs/2509.12282,Press,Auto-Discovery,,,,2025-09-17
Building Coding Agents via Entropy-Enhanced Multi-Turn Preference Optimization,building-coding-agents-via-entropy-enhanced-multi-turn-preference-optimization,Article,Minor,❌,,HTML/Blog,,,,,,https://arxiv.org/abs/2509.12434,Press,Auto-Discovery,,,,2025-09-17
