Tool,Moniker,Category,Severity,RSS Available,Feed URL,Tracking Method,Repo URL,Repo Status,Stars,Contributors,Docs URL,Website URL,Source Type,Discovery Method,Launch Status,Last Seen Update,Status,Date Added
Genspark Custom Super Agent,genspark-custom-super-agent,Article,Minor,❌,,HTML/Blog,,,,,,https://www.producthunt.com/products/genspark,Press,Auto-Discovery,,,,2025-10-17
"Show HN: Agentset – Open-source RAG with vector DB, embeddings, and API built-in",show-hn-agentset-open-source-rag-with-vector-db-embeddings-and-api-built-in,Article,Minor,❌,,HTML/Blog,,,,,,https://github.com/agentset-ai/agentset,Press,Auto-Discovery,,,,2025-10-17
Show HN: OnlyJPG – Client-Side PNG/HEIC/AVIF/PDF/etc to JPG,show-hn-onlyjpg-client-side-png-heic-avif-pdf-etc-to-jpg,Article,Minor,❌,,HTML/Blog,,,,,,https://onlyjpg.com,Press,Auto-Discovery,,,,2025-10-17
Show HN: SlideGauge – Static analyzer for Marp Markdown decks,show-hn-slidegauge-static-analyzer-for-marp-markdown-decks,Article,Minor,❌,,HTML/Blog,,,,,,https://github.com/nibzard/slidegauge,Press,Auto-Discovery,,,,2025-10-17
Show HN: FullHunt Agentic AI – Discover Any Org's Attack Surface in Seconds,show-hn-fullhunt-agentic-ai-discover-any-org-s-attack-surface-in-seconds,Article,Minor,❌,,HTML/Blog,,,,,,https://fullhunt.io/blog/2025/10/16/fullhunt-releases-agentic-ai-for-attack-surface-intelligence.html,Press,Auto-Discovery,,,,2025-10-17
API design principle: Don't tempt people to divide by zero,api-design-principle-don-t-tempt-people-to-divide-by-zero,Article,Minor,❌,,HTML/Blog,,,,,,https://www.reddit.com/r/programming/comments/1o8hl8s/api_design_principle_dont_tempt_people_to_divide/,Press,Auto-Discovery,,,,2025-10-17
We built an open-source coding agent CLI that can be run locally,we-built-an-open-source-coding-agent-cli-that-can-be-run-locally,Article,Minor,❌,,HTML/Blog,,,,,,https://www.reddit.com/r/LocalLLaMA/comments/1o8n9ym/we_built_an_opensource_coding_agent_cli_that_can/,Press,Auto-Discovery,,,,2025-10-17
Adobe’s video editing app Premiere arrives on iPhones,adobe-s-video-editing-app-premiere-arrives-on-iphones,Article,Minor,❌,,HTML/Blog,,,,,,https://techcrunch.com/2025/09/30/adobes-video-editing-app-premiere-arrives-on-iphones/,Press,Auto-Discovery,,,,2025-10-17
"World's largest open-source multimodal dataset delivers 17x training efficiency, unlocking enterprise AI that connects documents, audio and video",world-s-largest-open-source-multimodal-dataset-delivers-17x-training-efficiency-unlocking-enterprise-ai-that-connects-documents-audio-and-video,Article,Minor,❌,,HTML/Blog,,,,,,https://venturebeat.com/data-infrastructure/worlds-largest-open-source-multimodal-dataset-delivers-17x-training,Press,Auto-Discovery,,,,2025-10-17
ACE prevents context collapse with âevolving playbooksâ for self-improving AI agents,ace-prevents-context-collapse-with-evolving-playbooks-for-self-improving-ai-agents,Article,Minor,❌,,HTML/Blog,,,,,,https://venturebeat.com/ai/ace-prevents-context-collapse-with-evolving-playbooks-for-self-improving-ai,Press,Auto-Discovery,,,,2025-10-17
Google vs. OpenAI vs. Visa: competing agent protocols threaten the future of AI commerce,google-vs-openai-vs-visa-competing-agent-protocols-threaten-the-future-of-ai-commerce,Article,Minor,❌,,HTML/Blog,,,,,,https://venturebeat.com/ai/google-vs-openai-vs-visa-competing-agent-protocols-threaten-the-future-of-ai,Press,Auto-Discovery,,,,2025-10-17
Under the hood of AI agents: A technical guide to the next frontier of gen AI,under-the-hood-of-ai-agents-a-technical-guide-to-the-next-frontier-of-gen-ai,Article,Minor,❌,,HTML/Blog,,,,,,https://venturebeat.com/ai/under-the-hood-of-ai-agents-a-technical-guide-to-the-next-frontier-of-gen-ai,Press,Auto-Discovery,,,,2025-10-17
Do Slides Help? Multi-modal Context for Automatic Transcription of Conference Talks,do-slides-help-multi-modal-context-for-automatic-transcription-of-conference-talks,Article,Minor,❌,,HTML/Blog,,,,,,https://arxiv.org/abs/2510.13979,Press,Auto-Discovery,,,,2025-10-17
GammaZero: Learning To Guide POMDP Belief Space Search With Graph Representations,gammazero-learning-to-guide-pomdp-belief-space-search-with-graph-representations,Article,Minor,❌,,HTML/Blog,,,,,,https://arxiv.org/abs/2510.14035,Press,Auto-Discovery,,,,2025-10-17
STEMS: Spatial-Temporal Enhanced Safe Multi-Agent Coordination for Building Energy Management,stems-spatial-temporal-enhanced-safe-multi-agent-coordination-for-building-energy-management,Article,Minor,❌,,HTML/Blog,,,,,,https://arxiv.org/abs/2510.14112,Press,Auto-Discovery,,,,2025-10-17
"Formalizing the Safety, Security, and Functional Properties of Agentic AI Systems",formalizing-the-safety-security-and-functional-properties-of-agentic-ai-systems,Article,Minor,❌,,HTML/Blog,,,,,,https://arxiv.org/abs/2510.14133,Press,Auto-Discovery,,,,2025-10-17
CodeEvolve: An open source evolutionary coding agent for algorithm discovery and optimization,codeevolve-an-open-source-evolutionary-coding-agent-for-algorithm-discovery-and-optimization,Article,Minor,❌,,HTML/Blog,,,,,,https://arxiv.org/abs/2510.14150,Press,Auto-Discovery,,,,2025-10-17
Combining Reinforcement Learning and Behavior Trees for NPCs in Video Games with AMD Schola,combining-reinforcement-learning-and-behavior-trees-for-npcs-in-video-games-with-amd-schola,Article,Minor,❌,,HTML/Blog,,,,,,https://arxiv.org/abs/2510.14154,Press,Auto-Discovery,,,,2025-10-17
Echoes of Human Malice in Agents: Benchmarking LLMs for Multi-Turn Online Harassment Attacks,echoes-of-human-malice-in-agents-benchmarking-llms-for-multi-turn-online-harassment-attacks,Article,Minor,❌,,HTML/Blog,,,,,,https://arxiv.org/abs/2510.14207,Press,Auto-Discovery,,,,2025-10-17
Towards Agentic Self-Learning LLMs in Search Environment,towards-agentic-self-learning-llms-in-search-environment,Article,Minor,❌,,HTML/Blog,,,,,,https://arxiv.org/abs/2510.14253,Press,Auto-Discovery,,,,2025-10-17
"Terrarium: Revisiting the Blackboard for Multi-Agent Safety, Privacy, and Security Studies",terrarium-revisiting-the-blackboard-for-multi-agent-safety-privacy-and-security-studies,Article,Minor,❌,,HTML/Blog,,,,,,https://arxiv.org/abs/2510.14312,Press,Auto-Discovery,,,,2025-10-17
Metacognitive Self-Correction for Multi-Agent System via Prototype-Guided Next-Execution Reconstruction,metacognitive-self-correction-for-multi-agent-system-via-prototype-guided-next-execution-reconstruction,Article,Minor,❌,,HTML/Blog,,,,,,https://arxiv.org/abs/2510.14319,Press,Auto-Discovery,,,,2025-10-17
Hi-Agent: Hierarchical Vision-Language Agents for Mobile Device Control,hi-agent-hierarchical-vision-language-agents-for-mobile-device-control,Article,Minor,❌,,HTML/Blog,,,,,,https://arxiv.org/abs/2510.14388,Press,Auto-Discovery,,,,2025-10-17
IMAGINE: Integrating Multi-Agent System into One Model for Complex Reasoning and Planning,imagine-integrating-multi-agent-system-into-one-model-for-complex-reasoning-and-planning,Article,Minor,❌,,HTML/Blog,,,,,,https://arxiv.org/abs/2510.14406,Press,Auto-Discovery,,,,2025-10-17
Helmsman: Autonomous Synthesis of Federated Learning Systems via Multi-Agent Collaboration,helmsman-autonomous-synthesis-of-federated-learning-systems-via-multi-agent-collaboration,Article,Minor,❌,,HTML/Blog,,,,,,https://arxiv.org/abs/2510.14512,Press,Auto-Discovery,,,,2025-10-17
LLM Agents Beyond Utility: An Open-Ended Perspective,llm-agents-beyond-utility-an-open-ended-perspective,Article,Minor,❌,,HTML/Blog,,,,,,https://arxiv.org/abs/2510.14548,Press,Auto-Discovery,,,,2025-10-17
ColorBench: Benchmarking Mobile Agents with Graph-Structured Framework for Complex Long-Horizon Tasks,colorbench-benchmarking-mobile-agents-with-graph-structured-framework-for-complex-long-horizon-tasks,Article,Minor,❌,,HTML/Blog,,,,,,https://arxiv.org/abs/2510.14621,Press,Auto-Discovery,,,,2025-10-17
Machine Learning and Public Health: Identifying and Mitigating Algorithmic Bias through a Systematic Review,machine-learning-and-public-health-identifying-and-mitigating-algorithmic-bias-through-a-systematic-review,Article,Minor,❌,,HTML/Blog,,,,,,https://arxiv.org/abs/2510.14669,Press,Auto-Discovery,,,,2025-10-17
Agentic NL2SQL to Reduce Computational Costs,agentic-nl2sql-to-reduce-computational-costs,Article,Minor,❌,,HTML/Blog,,,,,,https://arxiv.org/abs/2510.14808,Press,Auto-Discovery,,,,2025-10-17
Where to Search: Measure the Prior-Structured Search Space of LLM Agents,where-to-search-measure-the-prior-structured-search-space-of-llm-agents,Article,Minor,❌,,HTML/Blog,,,,,,https://arxiv.org/abs/2510.14846,Press,Auto-Discovery,,,,2025-10-17
"Mapping Smarter, Not Harder: A Test-Time Reinforcement Learning Agent That Improves Without Labels or Model Updates",mapping-smarter-not-harder-a-test-time-reinforcement-learning-agent-that-improves-without-labels-or-model-updates,Article,Minor,❌,,HTML/Blog,,,,,,https://arxiv.org/abs/2510.14900,Press,Auto-Discovery,,,,2025-10-17
Stable but Miscalibrated: A Kantian View on Overconfidence from Filters to Large Language Models,stable-but-miscalibrated-a-kantian-view-on-overconfidence-from-filters-to-large-language-models,Article,Minor,❌,,HTML/Blog,,,,,,https://arxiv.org/abs/2510.14925,Press,Auto-Discovery,,,,2025-10-17
GroundedPRM: Tree-Guided and Fidelity-Aware Process Reward Modeling for Step-Level Reasoning,groundedprm-tree-guided-and-fidelity-aware-process-reward-modeling-for-step-level-reasoning,Article,Minor,❌,,HTML/Blog,,,,,,https://arxiv.org/abs/2510.14942,Press,Auto-Discovery,,,,2025-10-17
Agentic Design of Compositional Machines,agentic-design-of-compositional-machines,Article,Minor,❌,,HTML/Blog,,,,,,https://arxiv.org/abs/2510.14980,Press,Auto-Discovery,,,,2025-10-17
A2AS: Agentic AI Runtime Security and Self-Defense,a2as-agentic-ai-runtime-security-and-self-defense,Article,Minor,❌,,HTML/Blog,,,,,,https://arxiv.org/abs/2510.13825,Press,Auto-Discovery,,,,2025-10-17
From Craft to Constitution: A Governance-First Paradigm for Principled Agent Engineering,from-craft-to-constitution-a-governance-first-paradigm-for-principled-agent-engineering,Article,Minor,❌,,HTML/Blog,,,,,,https://arxiv.org/abs/2510.13857,Press,Auto-Discovery,,,,2025-10-17
K-frames: Scene-Driven Any-k Keyframe Selection for long video understanding,k-frames-scene-driven-any-k-keyframe-selection-for-long-video-understanding,Article,Minor,❌,,HTML/Blog,,,,,,https://arxiv.org/abs/2510.13891,Press,Auto-Discovery,,,,2025-10-17
"GenCellAgent: Generalizable, Training-Free Cellular Image Segmentation via Large Language Model Agents",gencellagent-generalizable-training-free-cellular-image-segmentation-via-large-language-model-agents,Article,Minor,❌,,HTML/Blog,,,,,,https://arxiv.org/abs/2510.13896,Press,Auto-Discovery,,,,2025-10-17
Benefits and Limitations of Communication in Multi-Agent Reasoning,benefits-and-limitations-of-communication-in-multi-agent-reasoning,Article,Minor,❌,,HTML/Blog,,,,,,https://arxiv.org/abs/2510.13903,Press,Auto-Discovery,,,,2025-10-17
Synthesizing Agentic Data for Web Agents with Progressive Difficulty Enhancement Mechanisms,synthesizing-agentic-data-for-web-agents-with-progressive-difficulty-enhancement-mechanisms,Article,Minor,❌,,HTML/Blog,,,,,,https://arxiv.org/abs/2510.13913,Press,Auto-Discovery,,,,2025-10-17
Static Sandboxes Are Inadequate: Modeling Societal Complexity Requires Open-Ended Co-Evolution in LLM-Based Multi-Agent Simulations,static-sandboxes-are-inadequate-modeling-societal-complexity-requires-open-ended-co-evolution-in-llm-based-multi-agent-simulations,Article,Minor,❌,,HTML/Blog,,,,,,https://arxiv.org/abs/2510.13982,Press,Auto-Discovery,,,,2025-10-17
Cyber-Resilient System Identification for Power Grid through Bayesian Integration,cyber-resilient-system-identification-for-power-grid-through-bayesian-integration,Article,Minor,❌,,HTML/Blog,,,,,,https://arxiv.org/abs/2510.14043,Press,Auto-Discovery,,,,2025-10-17
"Optical Computation-in-Communication enables low-latency, high-fidelity perception in telesurgery",optical-computation-in-communication-enables-low-latency-high-fidelity-perception-in-telesurgery,Article,Minor,❌,,HTML/Blog,,,,,,https://arxiv.org/abs/2510.14058,Press,Auto-Discovery,,,,2025-10-17
Virtually Being: Customizing Camera-Controllable Video Diffusion Models with Multi-View Performance Captures,virtually-being-customizing-camera-controllable-video-diffusion-models-with-multi-view-performance-captures,Article,Minor,❌,,HTML/Blog,,,,,,https://arxiv.org/abs/2510.14179,Press,Auto-Discovery,,,,2025-10-17
MAFA: A Multi-Agent Framework for Enterprise-Scale Annotation with Configurable Task Adaptation,mafa-a-multi-agent-framework-for-enterprise-scale-annotation-with-configurable-task-adaptation,Article,Minor,❌,,HTML/Blog,,,,,,https://arxiv.org/abs/2510.14184,Press,Auto-Discovery,,,,2025-10-17
DPRF: A Generalizable Dynamic Persona Refinement Framework for Optimizing Behavior Alignment Between Personalized LLM Role-Playing Agents and Humans,dprf-a-generalizable-dynamic-persona-refinement-framework-for-optimizing-behavior-alignment-between-personalized-llm-role-playing-agents-and-humans,Article,Minor,❌,,HTML/Blog,,,,,,https://arxiv.org/abs/2510.14205,Press,Auto-Discovery,,,,2025-10-17
PRISM: Agentic Retrieval with LLMs for Multi-Hop Question Answering,prism-agentic-retrieval-with-llms-for-multi-hop-question-answering,Article,Minor,❌,,HTML/Blog,,,,,,https://arxiv.org/abs/2510.14278,Press,Auto-Discovery,,,,2025-10-17
CURE: Confidence-driven Unified Reasoning Ensemble Framework for Medical Question Answering,cure-confidence-driven-unified-reasoning-ensemble-framework-for-medical-question-answering,Article,Minor,❌,,HTML/Blog,,,,,,https://arxiv.org/abs/2510.14353,Press,Auto-Discovery,,,,2025-10-17
MedTrust-RAG: Evidence Verification and Trust Alignment for Biomedical Question Answering,medtrust-rag-evidence-verification-and-trust-alignment-for-biomedical-question-answering,Article,Minor,❌,,HTML/Blog,,,,,,https://arxiv.org/abs/2510.14400,Press,Auto-Discovery,,,,2025-10-17
The Role of Social Learning and Collective Norm Formation in Fostering Cooperation in LLM Multi-Agent Systems,the-role-of-social-learning-and-collective-norm-formation-in-fostering-cooperation-in-llm-multi-agent-systems,Article,Minor,❌,,HTML/Blog,,,,,,https://arxiv.org/abs/2510.14401,Press,Auto-Discovery,,,,2025-10-17
Agentic Entropy-Balanced Policy Optimization,agentic-entropy-balanced-policy-optimization,Article,Minor,❌,,HTML/Blog,,,,,,https://arxiv.org/abs/2510.14545,Press,Auto-Discovery,,,,2025-10-17
STANCE: Motion Coherent Video Generation Via Sparse-to-Dense Anchored Encoding,stance-motion-coherent-video-generation-via-sparse-to-dense-anchored-encoding,Article,Minor,❌,,HTML/Blog,,,,,,https://arxiv.org/abs/2510.14588,Press,Auto-Discovery,,,,2025-10-17
In-Context Learning with Unpaired Clips for Instruction-based Video Editing,in-context-learning-with-unpaired-clips-for-instruction-based-video-editing,Article,Minor,❌,,HTML/Blog,,,,,,https://arxiv.org/abs/2510.14648,Press,Auto-Discovery,,,,2025-10-17
"When Planners Meet Reality: How Learned, Reactive Traffic Agents Shift nuPlan Benchmarks",when-planners-meet-reality-how-learned-reactive-traffic-agents-shift-nuplan-benchmarks,Article,Minor,❌,,HTML/Blog,,,,,,https://arxiv.org/abs/2510.14677,Press,Auto-Discovery,,,,2025-10-17
Where are the Whales: A Human-in-the-loop Detection Method for Identifying Whales in High-resolution Satellite Imagery,where-are-the-whales-a-human-in-the-loop-detection-method-for-identifying-whales-in-high-resolution-satellite-imagery,Article,Minor,❌,,HTML/Blog,,,,,,https://arxiv.org/abs/2510.14709,Press,Auto-Discovery,,,,2025-10-17
Camera Movement Classification in Historical Footage: A Comparative Study of Deep Video Models,camera-movement-classification-in-historical-footage-a-comparative-study-of-deep-video-models,Article,Minor,❌,,HTML/Blog,,,,,,https://arxiv.org/abs/2510.14713,Press,Auto-Discovery,,,,2025-10-17
DEXTER: Diffusion-Guided EXplanations with TExtual Reasoning for Vision Models,dexter-diffusion-guided-explanations-with-textual-reasoning-for-vision-models,Article,Minor,❌,,HTML/Blog,,,,,,https://arxiv.org/abs/2510.14741,Press,Auto-Discovery,,,,2025-10-17
Morphology-Aware Prognostic model for Five-Year Survival Prediction in Colorectal Cancer from H&E Whole Slide Images,morphology-aware-prognostic-model-for-five-year-survival-prediction-in-colorectal-cancer-from-h-e-whole-slide-images,Article,Minor,❌,,HTML/Blog,,,,,,https://arxiv.org/abs/2510.14800,Press,Auto-Discovery,,,,2025-10-17
Detecting Early and Implicit Suicidal Ideation via Longitudinal and Information Environment Signals on Social Media,detecting-early-and-implicit-suicidal-ideation-via-longitudinal-and-information-environment-signals-on-social-media,Article,Minor,❌,,HTML/Blog,,,,,,https://arxiv.org/abs/2510.14889,Press,Auto-Discovery,,,,2025-10-17
MaskCaptioner : Learning to Jointly Segment and Caption Object Trajectories in Videos,maskcaptioner-learning-to-jointly-segment-and-caption-object-trajectories-in-videos,Article,Minor,❌,,HTML/Blog,,,,,,https://arxiv.org/abs/2510.14904,Press,Auto-Discovery,,,,2025-10-17
Information Gain-based Policy Optimization: A Simple and Effective Approach for Multi-Turn LLM Agents,information-gain-based-policy-optimization-a-simple-and-effective-approach-for-multi-turn-llm-agents,Article,Minor,❌,,HTML/Blog,,,,,,https://arxiv.org/abs/2510.14967,Press,Auto-Discovery,,,,2025-10-17
"LLMs as Scalable, General-Purpose Simulators For Evolving Digital Agent Training",llms-as-scalable-general-purpose-simulators-for-evolving-digital-agent-training,Article,Minor,❌,,HTML/Blog,,,,,,https://arxiv.org/abs/2510.14969,Press,Auto-Discovery,,,,2025-10-17
MAFA: A multi-agent framework for annotation,mafa-a-multi-agent-framework-for-annotation,Article,Minor,❌,,HTML/Blog,,,,,,https://arxiv.org/abs/2505.13668,Press,Auto-Discovery,,,,2025-10-17
EMAC+: Embodied Multimodal Agent for Collaborative Planning with VLM+LLM,emac-embodied-multimodal-agent-for-collaborative-planning-with-vlm-llm,Article,Minor,❌,,HTML/Blog,,,,,,https://arxiv.org/abs/2505.19905,Press,Auto-Discovery,,,,2025-10-17
Plugging Schema Graph into Multi-Table QA: A Human-Guided Framework for Reducing LLM Reliance,plugging-schema-graph-into-multi-table-qa-a-human-guided-framework-for-reducing-llm-reliance,Article,Minor,❌,,HTML/Blog,,,,,,https://arxiv.org/abs/2506.04427,Press,Auto-Discovery,,,,2025-10-17
Paper2Agent: Reimagining Research Papers As Interactive and Reliable AI Agents,paper2agent-reimagining-research-papers-as-interactive-and-reliable-ai-agents,Article,Minor,❌,,HTML/Blog,,,,,,https://arxiv.org/abs/2509.06917,Press,Auto-Discovery,,,,2025-10-17
RADAR: A Risk-Aware Dynamic Multi-Agent Framework for LLM Safety Evaluation via Role-Specialized Collaboration,radar-a-risk-aware-dynamic-multi-agent-framework-for-llm-safety-evaluation-via-role-specialized-collaboration,Article,Minor,❌,,HTML/Blog,,,,,,https://arxiv.org/abs/2509.25271,Press,Auto-Discovery,,,,2025-10-17
VoxelPrompt: A Vision Agent for End-to-End Medical Image Analysis,voxelprompt-a-vision-agent-for-end-to-end-medical-image-analysis,Article,Minor,❌,,HTML/Blog,,,,,,https://arxiv.org/abs/2410.08397,Press,Auto-Discovery,,,,2025-10-17
Moto: Latent Motion Token as the Bridging Language for Learning Robot Manipulation from Videos,moto-latent-motion-token-as-the-bridging-language-for-learning-robot-manipulation-from-videos,Article,Minor,❌,,HTML/Blog,,,,,,https://arxiv.org/abs/2412.04445,Press,Auto-Discovery,,,,2025-10-17
On Equivariance and Fast Sampling in Video Diffusion Models Trained with Warped Noise,on-equivariance-and-fast-sampling-in-video-diffusion-models-trained-with-warped-noise,Article,Minor,❌,,HTML/Blog,,,,,,https://arxiv.org/abs/2504.09789,Press,Auto-Discovery,,,,2025-10-17
LLMs' Suitability for Network Security: A Case Study of STRIDE Threat Modeling,llms-suitability-for-network-security-a-case-study-of-stride-threat-modeling,Article,Minor,❌,,HTML/Blog,,,,,,https://arxiv.org/abs/2505.04101,Press,Auto-Discovery,,,,2025-10-17
"Internet of Agents: Fundamentals, Applications, and Challenges",internet-of-agents-fundamentals-applications-and-challenges,Article,Minor,❌,,HTML/Blog,,,,,,https://arxiv.org/abs/2505.07176,Press,Auto-Discovery,,,,2025-10-17
Attention-Aided MMSE for OFDM Channel Estimation: Learning Linear Filters with Attention,attention-aided-mmse-for-ofdm-channel-estimation-learning-linear-filters-with-attention,Article,Minor,❌,,HTML/Blog,,,,,,https://arxiv.org/abs/2506.00452,Press,Auto-Discovery,,,,2025-10-17
iQUEST: An Iterative Question-Guided Framework for Knowledge Base Question Answering,iquest-an-iterative-question-guided-framework-for-knowledge-base-question-answering,Article,Minor,❌,,HTML/Blog,,,,,,https://arxiv.org/abs/2506.01784,Press,Auto-Discovery,,,,2025-10-17
TAI3: Testing Agent Integrity in Interpreting User Intent,tai3-testing-agent-integrity-in-interpreting-user-intent,Article,Minor,❌,,HTML/Blog,,,,,,https://arxiv.org/abs/2506.07524,Press,Auto-Discovery,,,,2025-10-17
LLM-guided Chemical Process Optimization with a Multi-Agent Approach,llm-guided-chemical-process-optimization-with-a-multi-agent-approach,Article,Minor,❌,,HTML/Blog,,,,,,https://arxiv.org/abs/2506.20921,Press,Auto-Discovery,,,,2025-10-17
"Gemini 2.5: Pushing the Frontier with Advanced Reasoning, Multimodality, Long Context, and Next Generation Agentic Capabilities",gemini-2-5-pushing-the-frontier-with-advanced-reasoning-multimodality-long-context-and-next-generation-agentic-capabilities,Article,Minor,❌,,HTML/Blog,,,,,,https://arxiv.org/abs/2507.06261,Press,Auto-Discovery,,,,2025-10-17
"EdiVal-Agent: An Object-Centric Framework for Automated, Fine-Grained Evaluation of Multi-Turn Editing",edival-agent-an-object-centric-framework-for-automated-fine-grained-evaluation-of-multi-turn-editing,Article,Minor,❌,,HTML/Blog,,,,,,https://arxiv.org/abs/2509.13399,Press,Auto-Discovery,,,,2025-10-17
PerfBench: Can Agents Resolve Real-World Performance Bugs?,perfbench-can-agents-resolve-real-world-performance-bugs,Article,Minor,❌,,HTML/Blog,,,,,,https://arxiv.org/abs/2509.24091,Press,Auto-Discovery,,,,2025-10-17
Ctrl-VI: Controllable Video Synthesis via Variational Inference,ctrl-vi-controllable-video-synthesis-via-variational-inference,Article,Minor,❌,,HTML/Blog,,,,,,https://arxiv.org/abs/2510.07670,Press,Auto-Discovery,,,,2025-10-17
A$^2$FM: An Adaptive Agent Foundation Model for Tool-Aware Hybrid Reasoning,a-2-fm-an-adaptive-agent-foundation-model-for-tool-aware-hybrid-reasoning,Article,Minor,❌,,HTML/Blog,,,,,,https://arxiv.org/abs/2510.12838,Press,Auto-Discovery,,,,2025-10-17
Show HN: I Built Videoyards to create professional demos videos,show-hn-i-built-videoyards-to-create-professional-demos-videos,Article,Minor,❌,,HTML/Blog,,,,,,https://videoyards.com,Press,Auto-Discovery,,,,2025-10-18
Show HN: Code review for AI native teams,show-hn-code-review-for-ai-native-teams,Article,Minor,❌,,HTML/Blog,,,,,,https://github.com/areibman/bottleneck,Press,Auto-Discovery,,,,2025-10-18
New model from inclusionAI - LLaDA2.0-mini-preview,new-model-from-inclusionai-llada2-0-mini-preview,Article,Minor,❌,,HTML/Blog,,,,,,https://www.reddit.com/r/LocalLLaMA/comments/1o9agyg/new_model_from_inclusionai_llada20minipreview/,Press,Auto-Discovery,,,,2025-10-18
[D] Review 0 paper in ICLR 2026?,d-review-0-paper-in-iclr-2026,Article,Minor,❌,,HTML/Blog,,,,,,https://www.reddit.com/r/MachineLearning/comments/1o9207g/d_review_0_paper_in_iclr_2026/,Press,Auto-Discovery,,,,2025-10-18
Fictional gadget reviews: exploring the latest in fantasy and sci-fi tech,fictional-gadget-reviews-exploring-the-latest-in-fantasy-and-sci-fi-tech,Article,Minor,❌,,HTML/Blog,,,,,,https://www.theverge.com/entertainment/801966/fictional-gadget-reviews,Press,Auto-Discovery,,,,2025-10-18
"Pokémon Legends: Z-A Rotom Phone review: better camera, higher jumps",pok-mon-legends-z-a-rotom-phone-review-better-camera-higher-jumps,Article,Minor,❌,,HTML/Blog,,,,,,https://www.theverge.com/games/801113/pokemon-legends-za-rotom-phone-pokedex-review,Press,Auto-Discovery,,,,2025-10-18
Amazon’s Ring now works with video surveillance company Flock,amazon-s-ring-now-works-with-video-surveillance-company-flock,Article,Minor,❌,,HTML/Blog,,,,,,https://www.theverge.com/news/801856/amazon-ring-partners-flock-video,Press,Auto-Discovery,,,,2025-10-18
Codev lets enterprises avoid vibe coding hangovers with a team of agents that generate and document code,codev-lets-enterprises-avoid-vibe-coding-hangovers-with-a-team-of-agents-that-generate-and-document-code,Article,Minor,❌,,HTML/Blog,,,,,,https://venturebeat.com/ai/codev-lets-enterprises-avoid-vibe-coding-hangovers-with-a-team-of-agents,Press,Auto-Discovery,,,,2025-10-18
"How GPT5 + Codex took over Agentic Coding — ft. Greg Brockman, OpenAI",how-gpt5-codex-took-over-agentic-coding-ft-greg-brockman-openai,Article,Minor,❌,,HTML/Blog,,,,,,https://www.latent.space/p/gpt5-codex,Press,Auto-Discovery,,,,2025-10-18
Show HN: Duck-UI – Browser-Based SQL IDE for DuckDB,show-hn-duck-ui-browser-based-sql-ide-for-duckdb,Article,Minor,❌,,HTML/Blog,,,,,,https://demo.duckui.com,Press,Auto-Discovery,,,,2025-10-19
Web Development Tutorials & Programming Guides - Comprehensive Resource,web-development-tutorials-programming-guides-comprehensive-resource,Article,Minor,❌,,HTML/Blog,,,,,,https://www.reddit.com/r/programming/comments/1oajkny/web_development_tutorials_programming_guides/,Press,Auto-Discovery,,,,2025-10-19
What is A2A (Agent to Agent) Protocol,what-is-a2a-agent-to-agent-protocol,Article,Minor,❌,,HTML/Blog,,,,,,https://www.reddit.com/r/programming/comments/1oakjb8/what_is_a2a_agent_to_agent_protocol/,Press,Auto-Discovery,,,,2025-10-19
