Tool,Moniker,Category,Severity,RSS Available,Feed URL,Tracking Method,Repo URL,Repo Status,Stars,Contributors,Docs URL,Website URL,Source Type,Discovery Method,Launch Status,Last Seen Update,Status,Date Added
Show HN: Shieldcode – Automated PR Code Reviews and Vulnerability Scanner,show-hn-shieldcode-automated-pr-code-reviews-and-vulnerability-scanner,Article,Minor,❌,,HTML/Blog,,,,,,https://shieldcode.space,Press,Auto-Discovery,,,,2025-09-21
Lucy-Edit : 1st Open-sourced model for Video editing,lucy-edit-1st-open-sourced-model-for-video-editing,Article,Minor,❌,,HTML/Blog,,,,,,https://www.reddit.com/r/LocalLLaMA/comments/1nmj3cr/lucyedit_1st_opensourced_model_for_video_editing/,Press,Auto-Discovery,,,,2025-09-21
Wan 2.2 Animate : Open-Sourced model for character replacement and animation in videos,wan-2-2-animate-open-sourced-model-for-character-replacement-and-animation-in-videos,Article,Minor,❌,,HTML/Blog,,,,,,https://www.reddit.com/r/LocalLLaMA/comments/1nmnmqh/wan_22_animate_opensourced_model_for_character/,Press,Auto-Discovery,,,,2025-09-21
[D] Is peer review overloaded due to rejecting too many papers?,d-is-peer-review-overloaded-due-to-rejecting-too-many-papers,Article,Minor,❌,,HTML/Blog,,,,,,https://www.reddit.com/r/MachineLearning/comments/1nmo57e/d_is_peer_review_overloaded_due_to_rejecting_too/,Press,Auto-Discovery,,,,2025-09-21
Show HN: AI provides real-time advice for offline two-person negotiations,show-hn-ai-provides-real-time-advice-for-offline-two-person-negotiations,Article,Minor,❌,,HTML/Blog,,,,,,https://negowiz.com,Press,Auto-Discovery,,,,2025-09-22
Show HN: Agentic Code – Make AI coding tools follow real workflows,show-hn-agentic-code-make-ai-coding-tools-follow-real-workflows,Article,Minor,❌,,HTML/Blog,,,,,,https://github.com/shinpr/agentic-code,Press,Auto-Discovery,,,,2025-09-22
Show HN: Coding Agents swarming your codebase,show-hn-coding-agents-swarming-your-codebase,Article,Minor,❌,,HTML/Blog,,,,,,https://infrastructureas.ai,Press,Auto-Discovery,,,,2025-09-22
"MemCP – A New In-Memory, Column-Oriented Database (Open Source, Go)",memcp-a-new-in-memory-column-oriented-database-open-source-go,Article,Minor,❌,,HTML/Blog,,,,,,https://www.reddit.com/r/programming/comments/1nnk9t7/memcp_a_new_inmemory_columnoriented_database_open/,Press,Auto-Discovery,,,,2025-09-22
Agentic feature flags,agentic-feature-flags,Article,Minor,❌,,HTML/Blog,,,,,,https://www.reddit.com/r/programming/comments/1nnkzdf/agentic_feature_flags/,Press,Auto-Discovery,,,,2025-09-22
A Developer's Guide to Negative API Testing,a-developer-s-guide-to-negative-api-testing,Article,Minor,❌,,HTML/Blog,,,,,,https://www.reddit.com/r/programming/comments/1nnkdz9/a_developers_guide_to_negative_api_testing/,Press,Auto-Discovery,,,,2025-09-22
Qwen3-Omni Promotional Video,qwen3-omni-promotional-video,Article,Minor,❌,,HTML/Blog,,,,,,https://www.reddit.com/r/LocalLLaMA/comments/1nncssq/qwen3omni_promotional_video/,Press,Auto-Discovery,,,,2025-09-22
Qwen3-Coder-480B on the M3 Ultra 512GB Mac Studio is perfect for agentic coding,qwen3-coder-480b-on-the-m3-ultra-512gb-mac-studio-is-perfect-for-agentic-coding,Article,Minor,❌,,HTML/Blog,,,,,,https://www.reddit.com/r/LocalLLaMA/comments/1nn01bj/qwen3coder480b_on_the_m3_ultra_512gb_mac_studio/,Press,Auto-Discovery,,,,2025-09-22
[D] Is it reasonable that reviewers aren’t required to read the appendix?,d-is-it-reasonable-that-reviewers-aren-t-required-to-read-the-appendix,Article,Minor,❌,,HTML/Blog,,,,,,https://www.reddit.com/r/MachineLearning/comments/1nnhkz8/d_is_it_reasonable_that_reviewers_arent_required/,Press,Auto-Discovery,,,,2025-09-22
[D] Best practice for providing code during review,d-best-practice-for-providing-code-during-review,Article,Minor,❌,,HTML/Blog,,,,,,https://www.reddit.com/r/MachineLearning/comments/1nni5ld/d_best_practice_for_providing_code_during_review/,Press,Auto-Discovery,,,,2025-09-22
[D] Missing AAAI Reviews,d-missing-aaai-reviews,Article,Minor,❌,,HTML/Blog,,,,,,https://www.reddit.com/r/MachineLearning/comments/1nmu1ad/d_missing_aaai_reviews/,Press,Auto-Discovery,,,,2025-09-22
[P] Video prediction pipeline using a frozen VAE and hierarchical LSTMs to learn latent dynamics,p-video-prediction-pipeline-using-a-frozen-vae-and-hierarchical-lstms-to-learn-latent-dynamics,Article,Minor,❌,,HTML/Blog,,,,,,https://www.reddit.com/r/MachineLearning/comments/1nlvvi1/p_video_prediction_pipeline_using_a_frozen_vae/,Press,Auto-Discovery,,,,2025-09-22
Windows 11 is getting a video wallpaper feature,windows-11-is-getting-a-video-wallpaper-feature,Article,Minor,❌,,HTML/Blog,,,,,,https://www.theverge.com/news/782383/microsoft-windows-11-video-wallpapers,Press,Auto-Discovery,,,,2025-09-22
Gaia2 and ARE: Empowering the community to study agents,gaia2-and-are-empowering-the-community-to-study-agents,Article,Minor,❌,,HTML/Blog,,,,,,https://huggingface.co/blog/gaia2,Press,Auto-Discovery,,,,2025-09-22
MICA: Multi-Agent Industrial Coordination Assistant,mica-multi-agent-industrial-coordination-assistant,Article,Minor,❌,,HTML/Blog,,,,,,https://arxiv.org/abs/2509.15237,Press,Auto-Discovery,,,,2025-09-22
Diagnostics of cognitive failures in multi-agent expert systems using dynamic evaluation protocols and subsequent mutation of the processing context,diagnostics-of-cognitive-failures-in-multi-agent-expert-systems-using-dynamic-evaluation-protocols-and-subsequent-mutation-of-the-processing-context,Article,Minor,❌,,HTML/Blog,,,,,,https://arxiv.org/abs/2509.15366,Press,Auto-Discovery,,,,2025-09-22
MicroRCA-Agent: Microservice Root Cause Analysis Method Based on Large Language Model Agents,microrca-agent-microservice-root-cause-analysis-method-based-on-large-language-model-agents,Article,Minor,❌,,HTML/Blog,,,,,,https://arxiv.org/abs/2509.15635,Press,Auto-Discovery,,,,2025-09-22
CCrepairBench: A High-Fidelity Benchmark and Reinforcement Learning Framework for C++ Compilation Repair,ccrepairbench-a-high-fidelity-benchmark-and-reinforcement-learning-framework-for-c-compilation-repair,Article,Minor,❌,,HTML/Blog,,,,,,https://arxiv.org/abs/2509.15690,Press,Auto-Discovery,,,,2025-09-22
Building Data-Driven Occupation Taxonomies: A Bottom-Up Multi-Stage Approach via Semantic Clustering and Multi-Agent Collaboration,building-data-driven-occupation-taxonomies-a-bottom-up-multi-stage-approach-via-semantic-clustering-and-multi-agent-collaboration,Article,Minor,❌,,HTML/Blog,,,,,,https://arxiv.org/abs/2509.15786,Press,Auto-Discovery,,,,2025-09-22
EHR-MCP: Real-world Evaluation of Clinical Information Retrieval by Large Language Models via Model Context Protocol,ehr-mcp-real-world-evaluation-of-clinical-information-retrieval-by-large-language-models-via-model-context-protocol,Article,Minor,❌,,HTML/Blog,,,,,,https://arxiv.org/abs/2509.15957,Press,Auto-Discovery,,,,2025-09-22
Generating Plans for Belief-Desire-Intention (BDI) Agents Using Alternating-Time Temporal Logic (ATL),generating-plans-for-belief-desire-intention-bdi-agents-using-alternating-time-temporal-logic-atl,Article,Minor,❌,,HTML/Blog,,,,,,https://arxiv.org/abs/2509.15238,Press,Auto-Discovery,,,,2025-09-22
IEFS-GMB: Gradient Memory Bank-Guided Feature Selection Based on Information Entropy for EEG Classification of Neurological Disorders,iefs-gmb-gradient-memory-bank-guided-feature-selection-based-on-information-entropy-for-eeg-classification-of-neurological-disorders,Article,Minor,❌,,HTML/Blog,,,,,,https://arxiv.org/abs/2509.15259,Press,Auto-Discovery,,,,2025-09-22
Autoguided Online Data Curation for Diffusion Model Training,autoguided-online-data-curation-for-diffusion-model-training,Article,Minor,❌,,HTML/Blog,,,,,,https://arxiv.org/abs/2509.15267,Press,Auto-Discovery,,,,2025-09-22
ORCA: Agentic Reasoning For Hallucination and Adversarial Robustness in Vision-Language Models,orca-agentic-reasoning-for-hallucination-and-adversarial-robustness-in-vision-language-models,Article,Minor,❌,,HTML/Blog,,,,,,https://arxiv.org/abs/2509.15435,Press,Auto-Discovery,,,,2025-09-22
Impact of Phonetics on Speaker Identity in Adversarial Voice Attack,impact-of-phonetics-on-speaker-identity-in-adversarial-voice-attack,Article,Minor,❌,,HTML/Blog,,,,,,https://arxiv.org/abs/2509.15437,Press,Auto-Discovery,,,,2025-09-22
Explainable AI-Enhanced Supervisory Control for Robust Multi-Agent Robotic Systems,explainable-ai-enhanced-supervisory-control-for-robust-multi-agent-robotic-systems,Article,Minor,❌,,HTML/Blog,,,,,,https://arxiv.org/abs/2509.15491,Press,Auto-Discovery,,,,2025-09-22
GUI-ARP: Enhancing Grounding with Adaptive Region Perception for GUI Agents,gui-arp-enhancing-grounding-with-adaptive-region-perception-for-gui-agents,Article,Minor,❌,,HTML/Blog,,,,,,https://arxiv.org/abs/2509.15532,Press,Auto-Discovery,,,,2025-09-22
BTL-UI: Blink-Think-Link Reasoning Model for GUI Agent,btl-ui-blink-think-link-reasoning-model-for-gui-agent,Article,Minor,❌,,HTML/Blog,,,,,,https://arxiv.org/abs/2509.15566,Press,Auto-Discovery,,,,2025-09-22
Multimodal Learning for Fake News Detection in Short Videos Using Linguistically Verified Data and Heterogeneous Modality Fusion,multimodal-learning-for-fake-news-detection-in-short-videos-using-linguistically-verified-data-and-heterogeneous-modality-fusion,Article,Minor,❌,,HTML/Blog,,,,,,https://arxiv.org/abs/2509.15578,Press,Auto-Discovery,,,,2025-09-22
FloorSAM: SAM-Guided Floorplan Reconstruction with Semantic-Geometric Fusion,floorsam-sam-guided-floorplan-reconstruction-with-semantic-geometric-fusion,Article,Minor,❌,,HTML/Blog,,,,,,https://arxiv.org/abs/2509.15750,Press,Auto-Discovery,,,,2025-09-22
Ideal Registration? Segmentation is All You Need,ideal-registration-segmentation-is-all-you-need,Article,Minor,❌,,HTML/Blog,,,,,,https://arxiv.org/abs/2509.15784,Press,Auto-Discovery,,,,2025-09-22
Hierarchical Reinforcement Learning with Low-Level MPC for Multi-Agent Control,hierarchical-reinforcement-learning-with-low-level-mpc-for-multi-agent-control,Article,Minor,❌,,HTML/Blog,,,,,,https://arxiv.org/abs/2509.15799,Press,Auto-Discovery,,,,2025-09-22
ChronoForge-RL: Chronological Forging through Reinforcement Learning for Enhanced Video Understanding,chronoforge-rl-chronological-forging-through-reinforcement-learning-for-enhanced-video-understanding,Article,Minor,❌,,HTML/Blog,,,,,,https://arxiv.org/abs/2509.15800,Press,Auto-Discovery,,,,2025-09-22
CIDER: A Causal Cure for Brand-Obsessed Text-to-Image Models,cider-a-causal-cure-for-brand-obsessed-text-to-image-models,Article,Minor,❌,,HTML/Blog,,,,,,https://arxiv.org/abs/2509.15803,Press,Auto-Discovery,,,,2025-09-22
Fed-PISA: Federated Voice Cloning via Personalized Identity-Style Adaptation,fed-pisa-federated-voice-cloning-via-personalized-identity-style-adaptation,Article,Minor,❌,,HTML/Blog,,,,,,https://arxiv.org/abs/2509.16010,Press,Auto-Discovery,,,,2025-09-22
FLARE: Faithful Logic-Aided Reasoning and Exploration,flare-faithful-logic-aided-reasoning-and-exploration,Article,Minor,❌,,HTML/Blog,,,,,,https://arxiv.org/abs/2410.11900,Press,Auto-Discovery,,,,2025-09-22
Watson: A Cognitive Observability Framework for the Reasoning of LLM-Powered Agents,watson-a-cognitive-observability-framework-for-the-reasoning-of-llm-powered-agents,Article,Minor,❌,,HTML/Blog,,,,,,https://arxiv.org/abs/2411.03455,Press,Auto-Discovery,,,,2025-09-22
DebFlow: Automating Agent Creation via Agent Debate,debflow-automating-agent-creation-via-agent-debate,Article,Minor,❌,,HTML/Blog,,,,,,https://arxiv.org/abs/2503.23781,Press,Auto-Discovery,,,,2025-09-22
World Modelling Improves Language Model Agents,world-modelling-improves-language-model-agents,Article,Minor,❌,,HTML/Blog,,,,,,https://arxiv.org/abs/2506.02918,Press,Auto-Discovery,,,,2025-09-22
The Anatomy of a Personal Health Agent,the-anatomy-of-a-personal-health-agent,Article,Minor,❌,,HTML/Blog,,,,,,https://arxiv.org/abs/2508.20148,Press,Auto-Discovery,,,,2025-09-22
The Great AI Witch Hunt: Reviewers Perception and (Mis)Conception of Generative AI in Research Writing,the-great-ai-witch-hunt-reviewers-perception-and-mis-conception-of-generative-ai-in-research-writing,Article,Minor,❌,,HTML/Blog,,,,,,https://arxiv.org/abs/2407.12015,Press,Auto-Discovery,,,,2025-09-22
G2D2: Gradient-Guided Discrete Diffusion for Inverse Problem Solving,g2d2-gradient-guided-discrete-diffusion-for-inverse-problem-solving,Article,Minor,❌,,HTML/Blog,,,,,,https://arxiv.org/abs/2410.14710,Press,Auto-Discovery,,,,2025-09-22
"Who is Responsible When AI Fails? Mapping Causes, Entities, and Consequences of AI Privacy and Ethical Incidents",who-is-responsible-when-ai-fails-mapping-causes-entities-and-consequences-of-ai-privacy-and-ethical-incidents,Article,Minor,❌,,HTML/Blog,,,,,,https://arxiv.org/abs/2504.01029,Press,Auto-Discovery,,,,2025-09-22
ConCISE: Confidence-guided Compression in Step-by-step Efficient Reasoning,concise-confidence-guided-compression-in-step-by-step-efficient-reasoning,Article,Minor,❌,,HTML/Blog,,,,,,https://arxiv.org/abs/2505.04881,Press,Auto-Discovery,,,,2025-09-22
StreamBridge: Turning Your Offline Video Large Language Model into a Proactive Streaming Assistant,streambridge-turning-your-offline-video-large-language-model-into-a-proactive-streaming-assistant,Article,Minor,❌,,HTML/Blog,,,,,,https://arxiv.org/abs/2505.05467,Press,Auto-Discovery,,,,2025-09-22
Spatial Understanding from Videos: Structured Prompts Meet Simulation Data,spatial-understanding-from-videos-structured-prompts-meet-simulation-data,Article,Minor,❌,,HTML/Blog,,,,,,https://arxiv.org/abs/2506.03642,Press,Auto-Discovery,,,,2025-09-22
MIDOG 2025: Mitotic Figure Detection with Attention-Guided False Positive Correction,midog-2025-mitotic-figure-detection-with-attention-guided-false-positive-correction,Article,Minor,❌,,HTML/Blog,,,,,,https://arxiv.org/abs/2509.02598,Press,Auto-Discovery,,,,2025-09-22
On the Security of Tool-Invocation Prompts for LLM-Based Agentic Systems: An Empirical Risk Assessment,on-the-security-of-tool-invocation-prompts-for-llm-based-agentic-systems-an-empirical-risk-assessment,Article,Minor,❌,,HTML/Blog,,,,,,https://arxiv.org/abs/2509.05755,Press,Auto-Discovery,,,,2025-09-22
Show HN: Open-Source TypeScript Framework for AI Agents – VoltAgent,show-hn-open-source-typescript-framework-for-ai-agents-voltagent,Article,Minor,❌,,HTML/Blog,,,,,,https://voltagent.dev/,Press,Auto-Discovery,,,,2025-09-23
Show HN: Snapdeck – Build slides with open-source LLMs and agent routing,show-hn-snapdeck-build-slides-with-open-source-llms-and-agent-routing,Article,Minor,❌,,HTML/Blog,,,,,,https://www.snapdeck.site/,Press,Auto-Discovery,,,,2025-09-23
Show HN: ToolJet AI – Collaborative agents that build internal tools,show-hn-tooljet-ai-collaborative-agents-that-build-internal-tools,Article,Minor,❌,,HTML/Blog,,,,,,https://www.tooljet.ai,Press,Auto-Discovery,,,,2025-09-23
AI-Powered CLI Tool That Converts Long Videos to YouTube Shorts - Open Source,ai-powered-cli-tool-that-converts-long-videos-to-youtube-shorts-open-source,Article,Minor,❌,,HTML/Blog,,,,,,https://www.reddit.com/r/programming/comments/1nogzgb/aipowered_cli_tool_that_converts_long_videos_to/,Press,Auto-Discovery,,,,2025-09-23
JEP draft: Lazy Constants (Second Preview),jep-draft-lazy-constants-second-preview,Article,Minor,❌,,HTML/Blog,,,,,,https://www.reddit.com/r/programming/comments/1no3fgv/jep_draft_lazy_constants_second_preview/,Press,Auto-Discovery,,,,2025-09-23
[D] NeurIPS 2025 : How can we submit the camera-ready version to OpenReview for NeurIPS 2025? I don’t see any submit button — could you let me know how to proceed?,d-neurips-2025-how-can-we-submit-the-camera-ready-version-to-openreview-for-neurips-2025-i-don-t-see-any-submit-button-could-you-let-me-know-how-to-proceed,Article,Minor,❌,,HTML/Blog,,,,,,https://www.reddit.com/r/MachineLearning/comments/1no9pun/d_neurips_2025_how_can_we_submit_the_cameraready/,Press,Auto-Discovery,,,,2025-09-23
Can coding agents self-improve?,can-coding-agents-self-improve,Article,Minor,❌,,HTML/Blog,,,,,,https://www.latent.space/p/self-improving,Press,Auto-Discovery,,,,2025-09-23
Cline: The Open Source Code Agent — with Saoud Rizwan and Nik Pash,cline-the-open-source-code-agent-with-saoud-rizwan-and-nik-pash,Article,Minor,❌,,HTML/Blog,,,,,,https://www.latent.space/p/cline,Press,Auto-Discovery,,,,2025-09-23
Scaling Test Time Compute to Multi-Agent Civilizations: Noam Brown,scaling-test-time-compute-to-multi-agent-civilizations-noam-brown,Article,Minor,❌,,HTML/Blog,,,,,,https://www.latent.space/p/noam-brown,Press,Auto-Discovery,,,,2025-09-23
AIEWF 2025 Online! (and Attendee Guide),aiewf-2025-online-and-attendee-guide,Article,Minor,❌,,HTML/Blog,,,,,,https://www.latent.space/p/aiewf-2025,Press,Auto-Discovery,,,,2025-09-23
"SWE Agents Too Cheap To Meter, The Token Data War, and the rise of Tiny Teams",swe-agents-too-cheap-to-meter-the-token-data-war-and-the-rise-of-tiny-teams,Article,Minor,❌,,HTML/Blog,,,,,,https://www.latent.space/p/token-data-war,Press,Auto-Discovery,,,,2025-09-23
"⚡️Multi-Turn RL for Multi-Hour Agents — with Will Brown, Prime Intellect",multi-turn-rl-for-multi-hour-agents-with-will-brown-prime-intellect,Article,Minor,❌,,HTML/Blog,,,,,,https://www.latent.space/p/willccbb,Press,Auto-Discovery,,,,2025-09-23
Smol2Operator: Post-Training GUI Agents for Computer Use,smol2operator-post-training-gui-agents-for-computer-use,Article,Minor,❌,,HTML/Blog,,,,,,https://huggingface.co/blog/smol2operator,Press,Auto-Discovery,,,,2025-09-23
From Zero to GPU: A Guide to Building and Scaling Production-Ready CUDA Kernels,from-zero-to-gpu-a-guide-to-building-and-scaling-production-ready-cuda-kernels,Article,Minor,❌,,HTML/Blog,,,,,,https://huggingface.co/blog/kernel-builder,Press,Auto-Discovery,,,,2025-09-23
MCP for Research: How to Connect AI to Research Tools,mcp-for-research-how-to-connect-ai-to-research-tools,Article,Minor,❌,,HTML/Blog,,,,,,https://huggingface.co/blog/mcp-for-research,Press,Auto-Discovery,,,,2025-09-23
TextQuests: How Good are LLMs at Text-Based Video Games?,textquests-how-good-are-llms-at-text-based-video-games,Article,Minor,❌,,HTML/Blog,,,,,,https://huggingface.co/blog/textquests,Press,Auto-Discovery,,,,2025-09-23
Accelerate ND-Parallel: A Guide to Efficient Multi-GPU Training,accelerate-nd-parallel-a-guide-to-efficient-multi-gpu-training,Article,Minor,❌,,HTML/Blog,,,,,,https://huggingface.co/blog/accelerate-nd-parallel,Press,Auto-Discovery,,,,2025-09-23
Build an AI Shopping Assistant with Gradio MCP Servers,build-an-ai-shopping-assistant-with-gradio-mcp-servers,Article,Minor,❌,,HTML/Blog,,,,,,https://huggingface.co/blog/gradio-vton-mcp,Press,Auto-Discovery,,,,2025-09-23
TimeScope: How Long Can Your Video Large Multimodal Model Go?,timescope-how-long-can-your-video-large-multimodal-model-go,Article,Minor,❌,,HTML/Blog,,,,,,https://huggingface.co/blog/timescope-video-lmm-benchmark,Press,Auto-Discovery,,,,2025-09-23
Back to The Future: Evaluating AI Agents on Predicting Future Events,back-to-the-future-evaluating-ai-agents-on-predicting-future-events,Article,Minor,❌,,HTML/Blog,,,,,,https://huggingface.co/blog/futurebench,Press,Auto-Discovery,,,,2025-09-23
Five Big Improvements to Gradio MCP Servers,five-big-improvements-to-gradio-mcp-servers,Article,Minor,❌,,HTML/Blog,,,,,,https://huggingface.co/blog/gradio-mcp-updates,Press,Auto-Discovery,,,,2025-09-23
ScreenEnv: Deploy your full stack Desktop Agent,screenenv-deploy-your-full-stack-desktop-agent,Article,Minor,❌,,HTML/Blog,,,,,,https://huggingface.co/blog/screenenv,Press,Auto-Discovery,,,,2025-09-23
Building the Hugging Face MCP Server,building-the-hugging-face-mcp-server,Article,Minor,❌,,HTML/Blog,,,,,,https://huggingface.co/blog/building-hf-mcp,Press,Auto-Discovery,,,,2025-09-23
Upskill your LLMs with Gradio MCP Servers,upskill-your-llms-with-gradio-mcp-servers,Article,Minor,❌,,HTML/Blog,,,,,,https://huggingface.co/blog/gradio-mcp-servers,Press,Auto-Discovery,,,,2025-09-23
Groq on Hugging Face Inference Providers 🔥,groq-on-hugging-face-inference-providers,Article,Minor,❌,,HTML/Blog,,,,,,https://huggingface.co/blog/inference-providers-groq,Press,Auto-Discovery,,,,2025-09-23
Featherless AI on Hugging Face Inference Providers 🔥,featherless-ai-on-hugging-face-inference-providers,Article,Minor,❌,,HTML/Blog,,,,,,https://huggingface.co/blog/inference-providers-featherless,Press,Auto-Discovery,,,,2025-09-23
ScreenSuite - The most comprehensive evaluation suite for GUI Agents!,screensuite-the-most-comprehensive-evaluation-suite-for-gui-agents,Article,Minor,❌,,HTML/Blog,,,,,,https://huggingface.co/blog/screensuite,Press,Auto-Discovery,,,,2025-09-23
CodeAgents + Structure: A Better Way to Execute Actions,codeagents-structure-a-better-way-to-execute-actions,Article,Minor,❌,,HTML/Blog,,,,,,https://huggingface.co/blog/structured-codeagent,Press,Auto-Discovery,,,,2025-09-23
Tiny Agents in Python: a MCP-powered agent in ~70 lines of code,tiny-agents-in-python-a-mcp-powered-agent-in-70-lines-of-code,Article,Minor,❌,,HTML/Blog,,,,,,https://huggingface.co/blog/python-tiny-agents,Press,Auto-Discovery,,,,2025-09-23
How to Build an MCP Server with Gradio,how-to-build-an-mcp-server-with-gradio,Article,Minor,❌,,HTML/Blog,,,,,,https://huggingface.co/blog/gradio-mcp,Press,Auto-Discovery,,,,2025-09-23
Tiny Agents: a MCP-powered agent in 50 lines of code,tiny-agents-a-mcp-powered-agent-in-50-lines-of-code,Article,Minor,❌,,HTML/Blog,,,,,,https://huggingface.co/blog/tiny-agents,Press,Auto-Discovery,,,,2025-09-23
Cohere on Hugging Face Inference Providers 🔥,cohere-on-hugging-face-inference-providers,Article,Minor,❌,,HTML/Blog,,,,,,https://huggingface.co/blog/inference-providers-cohere,Press,Auto-Discovery,,,,2025-09-23
Hugging Face and Cloudflare Partner to Make Real-Time Speech and Video Seamless with FastRTC,hugging-face-and-cloudflare-partner-to-make-real-time-speech-and-video-seamless-with-fastrtc,Article,Minor,❌,,HTML/Blog,,,,,,https://huggingface.co/blog/fastrtc-cloudflare,Press,Auto-Discovery,,,,2025-09-23
LLM Inference on Edge: A Fun and Easy Guide to run LLMs via React Native on your Phone!,llm-inference-on-edge-a-fun-and-easy-guide-to-run-llms-via-react-native-on-your-phone,Article,Minor,❌,,HTML/Blog,,,,,,https://huggingface.co/blog/llm-inference-on-edge,Press,Auto-Discovery,,,,2025-09-23
Trace & Evaluate your Agent with Arize Phoenix,trace-evaluate-your-agent-with-arize-phoenix,Article,Minor,❌,,HTML/Blog,,,,,,https://huggingface.co/blog/smolagents-phoenix,Press,Auto-Discovery,,,,2025-09-23
SmolVLM2: Bringing Video Understanding to Every Device,smolvlm2-bringing-video-understanding-to-every-device,Article,Minor,❌,,HTML/Blog,,,,,,https://huggingface.co/blog/smolvlm2,Press,Auto-Discovery,,,,2025-09-23
"Introducing Three New Serverless Inference Providers: Hyperbolic, Nebius AI Studio, and Novita 🔥",introducing-three-new-serverless-inference-providers-hyperbolic-nebius-ai-studio-and-novita,Article,Minor,❌,,HTML/Blog,,,,,,https://huggingface.co/blog/inference-providers-nebius-novita-hyperbolic,Press,Auto-Discovery,,,,2025-09-23
Build awesome datasets for video generation,build-awesome-datasets-for-video-generation,Article,Minor,❌,,HTML/Blog,,,,,,https://huggingface.co/blog/vid_ds_scripts,Press,Auto-Discovery,,,,2025-09-23
Open-source DeepResearch – Freeing our search agents,open-source-deepresearch-freeing-our-search-agents,Article,Minor,❌,,HTML/Blog,,,,,,https://huggingface.co/blog/open-deep-research,Press,Auto-Discovery,,,,2025-09-23
DABStep: Data Agent Benchmark for Multi-step Reasoning,dabstep-data-agent-benchmark-for-multi-step-reasoning,Article,Minor,❌,,HTML/Blog,,,,,,https://huggingface.co/blog/dabstep,Press,Auto-Discovery,,,,2025-09-23
Welcome to Inference Providers on the Hub 🔥,welcome-to-inference-providers-on-the-hub,Article,Minor,❌,,HTML/Blog,,,,,,https://huggingface.co/blog/inference-providers,Press,Auto-Discovery,,,,2025-09-23
State of open video generation models in Diffusers,state-of-open-video-generation-models-in-diffusers,Article,Minor,❌,,HTML/Blog,,,,,,https://huggingface.co/blog/video_gen,Press,Auto-Discovery,,,,2025-09-23
We now support VLMs in smolagents!,we-now-support-vlms-in-smolagents,Article,Minor,❌,,HTML/Blog,,,,,,https://huggingface.co/blog/smolagents-can-see,Press,Auto-Discovery,,,,2025-09-23
AI Agents Are Here. What Now?,ai-agents-are-here-what-now,Article,Minor,❌,,HTML/Blog,,,,,,https://huggingface.co/blog/ethics-soc-7,Press,Auto-Discovery,,,,2025-09-23
Introducing smolagents: simple agents that write actions in code.,introducing-smolagents-simple-agents-that-write-actions-in-code,Article,Minor,❌,,HTML/Blog,,,,,,https://huggingface.co/blog/smolagents,Press,Auto-Discovery,,,,2025-09-23
Open Source Developers Guide to the EU AI Act,open-source-developers-guide-to-the-eu-ai-act,Article,Minor,❌,,HTML/Blog,,,,,,https://huggingface.co/blog/eu-ai-act-for-oss-developers,Press,Auto-Discovery,,,,2025-09-23
A Security Review of Gradio 5,a-security-review-of-gradio-5,Article,Minor,❌,,HTML/Blog,,,,,,https://huggingface.co/blog/gradio-5-security,Press,Auto-Discovery,,,,2025-09-23
FineVideo: behind the scenes,finevideo-behind-the-scenes,Article,Minor,❌,,HTML/Blog,,,,,,https://huggingface.co/blog/fine-video,Press,Auto-Discovery,,,,2025-09-23
Scaling robotics datasets with video encoding,scaling-robotics-datasets-with-video-encoding,Article,Minor,❌,,HTML/Blog,,,,,,https://huggingface.co/blog/video-encoding,Press,Auto-Discovery,,,,2025-09-23
Our Transformers Code Agent beats the GAIA benchmark!,our-transformers-code-agent-beats-the-gaia-benchmark,Article,Minor,❌,,HTML/Blog,,,,,,https://huggingface.co/blog/beating-gaia,Press,Auto-Discovery,,,,2025-09-23
