Tool,Moniker,Category,Severity,RSS Available,Feed URL,Tracking Method,Repo URL,Repo Status,Stars,Contributors,Docs URL,Website URL,Source Type,Discovery Method,Launch Status,Last Seen Update,Status,Date Added
"Deepseek OCR : High Compression Focus, But Is the Core Idea New? + A Thought on LLM Context Compression[D]",deepseek-ocr-high-compression-focus-but-is-the-core-idea-new-a-thought-on-llm-context-compression-d,Article,Minor,❌,,HTML/Blog,,,,,,https://www.reddit.com/r/MachineLearning/comments/1oedumd/deepseek_ocr_high_compression_focus_but_is_the/,Press,Auto-Discovery,,,,2025-10-24
Building the Open Agent Ecosystem Together: Introducing OpenEnv,building-the-open-agent-ecosystem-together-introducing-openenv,Article,Minor,❌,,HTML/Blog,,,,,,https://huggingface.co/blog/openenv,Press,Auto-Discovery,,,,2025-10-24
Gaia2 and ARE: Empowering the community to study agents,gaia2-and-are-empowering-the-community-to-study-agents,Article,Minor,❌,,HTML/Blog,,,,,,https://huggingface.co/blog/gaia2,Press,Auto-Discovery,,,,2025-10-24
DAG-Math: Graph-Guided Mathematical Reasoning in LLMs,dag-math-graph-guided-mathematical-reasoning-in-llms,Article,Minor,❌,,HTML/Blog,,,,,,https://arxiv.org/abs/2510.19842,Press,Auto-Discovery,,,,2025-10-24
Surfer 2: The Next Generation of Cross-Platform Computer Use Agents,surfer-2-the-next-generation-of-cross-platform-computer-use-agents,Article,Minor,❌,,HTML/Blog,,,,,,https://arxiv.org/abs/2510.19949,Press,Auto-Discovery,,,,2025-10-24
LLMs can hide text in other text of the same length.ipynb,llms-can-hide-text-in-other-text-of-the-same-length-ipynb,Article,Minor,❌,,HTML/Blog,,,,,,https://arxiv.org/abs/2510.20075,Press,Auto-Discovery,,,,2025-10-24
AI PB: A Grounded Generative Agent for Personalized Investment Insights,ai-pb-a-grounded-generative-agent-for-personalized-investment-insights,Article,Minor,❌,,HTML/Blog,,,,,,https://arxiv.org/abs/2510.20099,Press,Auto-Discovery,,,,2025-10-24
Human-Centered LLM-Agent System for Detecting Anomalous Digital Asset Transactions,human-centered-llm-agent-system-for-detecting-anomalous-digital-asset-transactions,Article,Minor,❌,,HTML/Blog,,,,,,https://arxiv.org/abs/2510.20102,Press,Auto-Discovery,,,,2025-10-24
The Lock-In Phase Hypothesis: Identity Consolidation as a Precursor to AGI,the-lock-in-phase-hypothesis-identity-consolidation-as-a-precursor-to-agi,Article,Minor,❌,,HTML/Blog,,,,,,https://arxiv.org/abs/2510.20190,Press,Auto-Discovery,,,,2025-10-24
Integrating Machine Learning into Belief-Desire-Intention Agents: Current Advances and Open Challenges,integrating-machine-learning-into-belief-desire-intention-agents-current-advances-and-open-challenges,Article,Minor,❌,,HTML/Blog,,,,,,https://arxiv.org/abs/2510.20641,Press,Auto-Discovery,,,,2025-10-24
Plan Then Retrieve: Reinforcement Learning-Guided Complex Reasoning over Knowledge Graphs,plan-then-retrieve-reinforcement-learning-guided-complex-reasoning-over-knowledge-graphs,Article,Minor,❌,,HTML/Blog,,,,,,https://arxiv.org/abs/2510.20691,Press,Auto-Discovery,,,,2025-10-24
"CourtGuard: A Local, Multiagent Prompt Injection Classifier",courtguard-a-local-multiagent-prompt-injection-classifier,Article,Minor,❌,,HTML/Blog,,,,,,https://arxiv.org/abs/2510.19844,Press,Auto-Discovery,,,,2025-10-24
Learning from Supervision with Semantic and Episodic Memory: A Reflective Approach to Agent Adaptation,learning-from-supervision-with-semantic-and-episodic-memory-a-reflective-approach-to-agent-adaptation,Article,Minor,❌,,HTML/Blog,,,,,,https://arxiv.org/abs/2510.19897,Press,Auto-Discovery,,,,2025-10-24
A Tutorial on Cognitive Biases in Agentic AI-Driven 6G Autonomous Networks,a-tutorial-on-cognitive-biases-in-agentic-ai-driven-6g-autonomous-networks,Article,Minor,❌,,HTML/Blog,,,,,,https://arxiv.org/abs/2510.19973,Press,Auto-Discovery,,,,2025-10-24
Mixture-of-Minds: Multi-Agent Reinforcement Learning for Table Understanding,mixture-of-minds-multi-agent-reinforcement-learning-for-table-understanding,Article,Minor,❌,,HTML/Blog,,,,,,https://arxiv.org/abs/2510.20176,Press,Auto-Discovery,,,,2025-10-24
Automated Cloud Infrastructure-as-Code Reconciliation with AI Agents,automated-cloud-infrastructure-as-code-reconciliation-with-ai-agents,Article,Minor,❌,,HTML/Blog,,,,,,https://arxiv.org/abs/2510.20211,Press,Auto-Discovery,,,,2025-10-24
High-order Interactions Modeling for Interpretable Multi-Agent Q-Learning,high-order-interactions-modeling-for-interpretable-multi-agent-q-learning,Article,Minor,❌,,HTML/Blog,,,,,,https://arxiv.org/abs/2510.20218,Press,Auto-Discovery,,,,2025-10-24
FinCARE: Financial Causal Analysis with Reasoning and Evidence,fincare-financial-causal-analysis-with-reasoning-and-evidence,Article,Minor,❌,,HTML/Blog,,,,,,https://arxiv.org/abs/2510.20221,Press,Auto-Discovery,,,,2025-10-24
Towards AI Agents for Course Instruction in Higher Education: Early Experiences from the Field,towards-ai-agents-for-course-instruction-in-higher-education-early-experiences-from-the-field,Article,Minor,❌,,HTML/Blog,,,,,,https://arxiv.org/abs/2510.20255,Press,Auto-Discovery,,,,2025-10-24
Limits of PRM-Guided Tree Search for Mathematical Reasoning with LLMs,limits-of-prm-guided-tree-search-for-mathematical-reasoning-with-llms,Article,Minor,❌,,HTML/Blog,,,,,,https://arxiv.org/abs/2510.20272,Press,Auto-Discovery,,,,2025-10-24
Breakdance Video classification in the age of Generative AI,breakdance-video-classification-in-the-age-of-generative-ai,Article,Minor,❌,,HTML/Blog,,,,,,https://arxiv.org/abs/2510.20287,Press,Auto-Discovery,,,,2025-10-24
GhostEI-Bench: Do Mobile Agents Resilience to Environmental Injection in Dynamic On-Device Environments?,ghostei-bench-do-mobile-agents-resilience-to-environmental-injection-in-dynamic-on-device-environments,Article,Minor,❌,,HTML/Blog,,,,,,https://arxiv.org/abs/2510.20333,Press,Auto-Discovery,,,,2025-10-24
Balancing Specialization and Centralization: A Multi-Agent Reinforcement Learning Benchmark for Sequential Industrial Control,balancing-specialization-and-centralization-a-multi-agent-reinforcement-learning-benchmark-for-sequential-industrial-control,Article,Minor,❌,,HTML/Blog,,,,,,https://arxiv.org/abs/2510.20408,Press,Auto-Discovery,,,,2025-10-24
Structures generated in a multiagent system performing information fusion in peer-to-peer resource-constrained networks,structures-generated-in-a-multiagent-system-performing-information-fusion-in-peer-to-peer-resource-constrained-networks,Article,Minor,❌,,HTML/Blog,,,,,,https://arxiv.org/abs/2510.20469,Press,Auto-Discovery,,,,2025-10-24
Open-o3 Video: Grounded Video Reasoning with Explicit Spatio-Temporal Evidence,open-o3-video-grounded-video-reasoning-with-explicit-spatio-temporal-evidence,Article,Minor,❌,,HTML/Blog,,,,,,https://arxiv.org/abs/2510.20579,Press,Auto-Discovery,,,,2025-10-24
Can ChatGPT Code Communication Data Fairly?: Empirical Evidence from Multiple Collaborative Tasks,can-chatgpt-code-communication-data-fairly-empirical-evidence-from-multiple-collaborative-tasks,Article,Minor,❌,,HTML/Blog,,,,,,https://arxiv.org/abs/2510.20584,Press,Auto-Discovery,,,,2025-10-24
Black Box Absorption: LLMs Undermining Innovative Ideas,black-box-absorption-llms-undermining-innovative-ideas,Article,Minor,❌,,HTML/Blog,,,,,,https://arxiv.org/abs/2510.20612,Press,Auto-Discovery,,,,2025-10-24
"Deep Learning in Dental Image Analysis: A Systematic Review of Datasets, Methodologies, and Emerging Challenges",deep-learning-in-dental-image-analysis-a-systematic-review-of-datasets-methodologies-and-emerging-challenges,Article,Minor,❌,,HTML/Blog,,,,,,https://arxiv.org/abs/2510.20634,Press,Auto-Discovery,,,,2025-10-24
Co-Designing Quantum Codes with Transversal Diagonal Gates via Multi-Agent Systems,co-designing-quantum-codes-with-transversal-diagonal-gates-via-multi-agent-systems,Article,Minor,❌,,HTML/Blog,,,,,,https://arxiv.org/abs/2510.20728,Press,Auto-Discovery,,,,2025-10-24
Thought Communication in Multiagent Collaboration,thought-communication-in-multiagent-collaboration,Article,Minor,❌,,HTML/Blog,,,,,,https://arxiv.org/abs/2510.20733,Press,Auto-Discovery,,,,2025-10-24
FieldGen: From Teleoperated Pre-Manipulation Trajectories to Field-Guided Data Generation,fieldgen-from-teleoperated-pre-manipulation-trajectories-to-field-guided-data-generation,Article,Minor,❌,,HTML/Blog,,,,,,https://arxiv.org/abs/2510.20774,Press,Auto-Discovery,,,,2025-10-24
MindForge: Empowering Embodied Agents with Theory of Mind for Lifelong Cultural Learning,mindforge-empowering-embodied-agents-with-theory-of-mind-for-lifelong-cultural-learning,Article,Minor,❌,,HTML/Blog,,,,,,https://arxiv.org/abs/2411.12977,Press,Auto-Discovery,,,,2025-10-24
Privacy Risks and Preservation Methods in Explainable Artificial Intelligence: A Scoping Review,privacy-risks-and-preservation-methods-in-explainable-artificial-intelligence-a-scoping-review,Article,Minor,❌,,HTML/Blog,,,,,,https://arxiv.org/abs/2505.02828,Press,Auto-Discovery,,,,2025-10-24
Lessons Learned: A Multi-Agent Framework for Code LLMs to Learn and Improve,lessons-learned-a-multi-agent-framework-for-code-llms-to-learn-and-improve,Article,Minor,❌,,HTML/Blog,,,,,,https://arxiv.org/abs/2505.23946,Press,Auto-Discovery,,,,2025-10-24
Prover Agent: An Agent-Based Framework for Formal Mathematical Proofs,prover-agent-an-agent-based-framework-for-formal-mathematical-proofs,Article,Minor,❌,,HTML/Blog,,,,,,https://arxiv.org/abs/2506.19923,Press,Auto-Discovery,,,,2025-10-24
Adaptive Learning in Spatial Agent-Based Models for Climate Risk Assessment: A Geospatial Framework with Evolutionary Economic Agents,adaptive-learning-in-spatial-agent-based-models-for-climate-risk-assessment-a-geospatial-framework-with-evolutionary-economic-agents,Article,Minor,❌,,HTML/Blog,,,,,,https://arxiv.org/abs/2509.18633,Press,Auto-Discovery,,,,2025-10-24
Annotation Guidelines-Based Knowledge Augmentation: Towards Enhancing Large Language Models for Educational Text Classification,annotation-guidelines-based-knowledge-augmentation-towards-enhancing-large-language-models-for-educational-text-classification,Article,Minor,❌,,HTML/Blog,,,,,,https://arxiv.org/abs/2406.00954,Press,Auto-Discovery,,,,2025-10-24
Fine-Tuning Multilingual Language Models for Code Review: An Empirical Study on Industrial C# Projects,fine-tuning-multilingual-language-models-for-code-review-an-empirical-study-on-industrial-c-projects,Article,Minor,❌,,HTML/Blog,,,,,,https://arxiv.org/abs/2507.19271,Press,Auto-Discovery,,,,2025-10-24
Multi-Agent Reinforcement Learning for Task Offloading in Wireless Edge Networks,multi-agent-reinforcement-learning-for-task-offloading-in-wireless-edge-networks,Article,Minor,❌,,HTML/Blog,,,,,,https://arxiv.org/abs/2509.01257,Press,Auto-Discovery,,,,2025-10-24
"A New Digital Divide? Coder Worldviews, the Slop Economy, and Democracy in the Age of AI",a-new-digital-divide-coder-worldviews-the-slop-economy-and-democracy-in-the-age-of-ai,Article,Minor,❌,,HTML/Blog,,,,,,https://arxiv.org/abs/2510.04755,Press,Auto-Discovery,,,,2025-10-24
Show HN: Nano AI – Best All-in-One Nano Banana AI Image Editor 2025,show-hn-nano-ai-best-all-in-one-nano-banana-ai-image-editor-2025,Article,Minor,❌,,HTML/Blog,,,,,,https://nanoai.site/,Press,Auto-Discovery,,,,2025-10-25
I have made a terminal Editor.,i-have-made-a-terminal-editor,Article,Minor,❌,,HTML/Blog,,,,,,https://www.reddit.com/r/programming/comments/1ofojoh/i_have_made_a_terminal_editor/,Press,Auto-Discovery,,,,2025-10-25
meituan-longcat/LongCat-Video · Hugging Face,meituan-longcat-longcat-video-hugging-face,Article,Minor,❌,,HTML/Blog,,,,,,https://www.reddit.com/r/LocalLLaMA/comments/1ofn0nb/meituanlongcatlongcatvideo_hugging_face/,Press,Auto-Discovery,,,,2025-10-25
[Open Source] We deployed numerous agents in production and ended up building our own GenAI framework,open-source-we-deployed-numerous-agents-in-production-and-ended-up-building-our-own-genai-framework,Article,Minor,❌,,HTML/Blog,,,,,,https://www.reddit.com/r/LocalLLaMA/comments/1ofq2g3/open_source_we_deployed_numerous_agents_in/,Press,Auto-Discovery,,,,2025-10-25
[R] UFIPC: Physics-based AI Complexity Benchmark - Models with identical MMLU scores differ 29% in complexity,r-ufipc-physics-based-ai-complexity-benchmark-models-with-identical-mmlu-scores-differ-29-in-complexity,Article,Minor,❌,,HTML/Blog,,,,,,https://www.reddit.com/r/MachineLearning/comments/1of87n0/r_ufipc_physicsbased_ai_complexity_benchmark/,Press,Auto-Discovery,,,,2025-10-25
Zendesk says its new AI agent can solve 80% of support issues,zendesk-says-its-new-ai-agent-can-solve-80-of-support-issues,Article,Minor,❌,,HTML/Blog,,,,,,https://techcrunch.com/2025/10/08/zendesk-says-its-new-ai-agent-can-solve-80-of-support-issues/,Press,Auto-Discovery,,,,2025-10-25
Inside Ring-1T: Ant engineers solve reinforcement learning bottlenecks at trillion scale,inside-ring-1t-ant-engineers-solve-reinforcement-learning-bottlenecks-at-trillion-scale,Article,Minor,❌,,HTML/Blog,,,,,,https://venturebeat.com/ai/inside-ring-1t-ant-engineers-solve-reinforcement-learning-bottlenecks-at,Press,Auto-Discovery,,,,2025-10-25
Can coding agents self-improve?,can-coding-agents-self-improve,Article,Minor,❌,,HTML/Blog,,,,,,https://www.latent.space/p/self-improving,Press,Auto-Discovery,,,,2025-10-25
Cline: The Open Source Code Agent — with Saoud Rizwan and Nik Pash,cline-the-open-source-code-agent-with-saoud-rizwan-and-nik-pash,Article,Minor,❌,,HTML/Blog,,,,,,https://www.latent.space/p/cline,Press,Auto-Discovery,,,,2025-10-25
Scaling Test Time Compute to Multi-Agent Civilizations: Noam Brown,scaling-test-time-compute-to-multi-agent-civilizations-noam-brown,Article,Minor,❌,,HTML/Blog,,,,,,https://www.latent.space/p/noam-brown,Press,Auto-Discovery,,,,2025-10-25
AIEWF 2025 Online! (and Attendee Guide),aiewf-2025-online-and-attendee-guide,Article,Minor,❌,,HTML/Blog,,,,,,https://www.latent.space/p/aiewf-2025,Press,Auto-Discovery,,,,2025-10-25
Smol2Operator: Post-Training GUI Agents for Computer Use,smol2operator-post-training-gui-agents-for-computer-use,Article,Minor,❌,,HTML/Blog,,,,,,https://huggingface.co/blog/smol2operator,Press,Auto-Discovery,,,,2025-10-25
From Zero to GPU: A Guide to Building and Scaling Production-Ready CUDA Kernels,from-zero-to-gpu-a-guide-to-building-and-scaling-production-ready-cuda-kernels,Article,Minor,❌,,HTML/Blog,,,,,,https://huggingface.co/blog/kernel-builder,Press,Auto-Discovery,,,,2025-10-25
MCP for Research: How to Connect AI to Research Tools,mcp-for-research-how-to-connect-ai-to-research-tools,Article,Minor,❌,,HTML/Blog,,,,,,https://huggingface.co/blog/mcp-for-research,Press,Auto-Discovery,,,,2025-10-25
TextQuests: How Good are LLMs at Text-Based Video Games?,textquests-how-good-are-llms-at-text-based-video-games,Article,Minor,❌,,HTML/Blog,,,,,,https://huggingface.co/blog/textquests,Press,Auto-Discovery,,,,2025-10-25
Accelerate ND-Parallel: A Guide to Efficient Multi-GPU Training,accelerate-nd-parallel-a-guide-to-efficient-multi-gpu-training,Article,Minor,❌,,HTML/Blog,,,,,,https://huggingface.co/blog/accelerate-nd-parallel,Press,Auto-Discovery,,,,2025-10-25
Build an AI Shopping Assistant with Gradio MCP Servers,build-an-ai-shopping-assistant-with-gradio-mcp-servers,Article,Minor,❌,,HTML/Blog,,,,,,https://huggingface.co/blog/gradio-vton-mcp,Press,Auto-Discovery,,,,2025-10-25
TimeScope: How Long Can Your Video Large Multimodal Model Go?,timescope-how-long-can-your-video-large-multimodal-model-go,Article,Minor,❌,,HTML/Blog,,,,,,https://huggingface.co/blog/timescope-video-lmm-benchmark,Press,Auto-Discovery,,,,2025-10-25
Back to The Future: Evaluating AI Agents on Predicting Future Events,back-to-the-future-evaluating-ai-agents-on-predicting-future-events,Article,Minor,❌,,HTML/Blog,,,,,,https://huggingface.co/blog/futurebench,Press,Auto-Discovery,,,,2025-10-25
Five Big Improvements to Gradio MCP Servers,five-big-improvements-to-gradio-mcp-servers,Article,Minor,❌,,HTML/Blog,,,,,,https://huggingface.co/blog/gradio-mcp-updates,Press,Auto-Discovery,,,,2025-10-25
ScreenEnv: Deploy your full stack Desktop Agent,screenenv-deploy-your-full-stack-desktop-agent,Article,Minor,❌,,HTML/Blog,,,,,,https://huggingface.co/blog/screenenv,Press,Auto-Discovery,,,,2025-10-25
Building the Hugging Face MCP Server,building-the-hugging-face-mcp-server,Article,Minor,❌,,HTML/Blog,,,,,,https://huggingface.co/blog/building-hf-mcp,Press,Auto-Discovery,,,,2025-10-25
Upskill your LLMs with Gradio MCP Servers,upskill-your-llms-with-gradio-mcp-servers,Article,Minor,❌,,HTML/Blog,,,,,,https://huggingface.co/blog/gradio-mcp-servers,Press,Auto-Discovery,,,,2025-10-25
Groq on Hugging Face Inference Providers 🔥,groq-on-hugging-face-inference-providers,Article,Minor,❌,,HTML/Blog,,,,,,https://huggingface.co/blog/inference-providers-groq,Press,Auto-Discovery,,,,2025-10-25
Featherless AI on Hugging Face Inference Providers 🔥,featherless-ai-on-hugging-face-inference-providers,Article,Minor,❌,,HTML/Blog,,,,,,https://huggingface.co/blog/inference-providers-featherless,Press,Auto-Discovery,,,,2025-10-25
ScreenSuite - The most comprehensive evaluation suite for GUI Agents!,screensuite-the-most-comprehensive-evaluation-suite-for-gui-agents,Article,Minor,❌,,HTML/Blog,,,,,,https://huggingface.co/blog/screensuite,Press,Auto-Discovery,,,,2025-10-25
CodeAgents + Structure: A Better Way to Execute Actions,codeagents-structure-a-better-way-to-execute-actions,Article,Minor,❌,,HTML/Blog,,,,,,https://huggingface.co/blog/structured-codeagent,Press,Auto-Discovery,,,,2025-10-25
Tiny Agents in Python: a MCP-powered agent in ~70 lines of code,tiny-agents-in-python-a-mcp-powered-agent-in-70-lines-of-code,Article,Minor,❌,,HTML/Blog,,,,,,https://huggingface.co/blog/python-tiny-agents,Press,Auto-Discovery,,,,2025-10-25
How to Build an MCP Server with Gradio,how-to-build-an-mcp-server-with-gradio,Article,Minor,❌,,HTML/Blog,,,,,,https://huggingface.co/blog/gradio-mcp,Press,Auto-Discovery,,,,2025-10-25
Tiny Agents: a MCP-powered agent in 50 lines of code,tiny-agents-a-mcp-powered-agent-in-50-lines-of-code,Article,Minor,❌,,HTML/Blog,,,,,,https://huggingface.co/blog/tiny-agents,Press,Auto-Discovery,,,,2025-10-25
Cohere on Hugging Face Inference Providers 🔥,cohere-on-hugging-face-inference-providers,Article,Minor,❌,,HTML/Blog,,,,,,https://huggingface.co/blog/inference-providers-cohere,Press,Auto-Discovery,,,,2025-10-25
Hugging Face and Cloudflare Partner to Make Real-Time Speech and Video Seamless with FastRTC,hugging-face-and-cloudflare-partner-to-make-real-time-speech-and-video-seamless-with-fastrtc,Article,Minor,❌,,HTML/Blog,,,,,,https://huggingface.co/blog/fastrtc-cloudflare,Press,Auto-Discovery,,,,2025-10-25
LLM Inference on Edge: A Fun and Easy Guide to run LLMs via React Native on your Phone!,llm-inference-on-edge-a-fun-and-easy-guide-to-run-llms-via-react-native-on-your-phone,Article,Minor,❌,,HTML/Blog,,,,,,https://huggingface.co/blog/llm-inference-on-edge,Press,Auto-Discovery,,,,2025-10-25
Trace & Evaluate your Agent with Arize Phoenix,trace-evaluate-your-agent-with-arize-phoenix,Article,Minor,❌,,HTML/Blog,,,,,,https://huggingface.co/blog/smolagents-phoenix,Press,Auto-Discovery,,,,2025-10-25
SmolVLM2: Bringing Video Understanding to Every Device,smolvlm2-bringing-video-understanding-to-every-device,Article,Minor,❌,,HTML/Blog,,,,,,https://huggingface.co/blog/smolvlm2,Press,Auto-Discovery,,,,2025-10-25
"Introducing Three New Serverless Inference Providers: Hyperbolic, Nebius AI Studio, and Novita 🔥",introducing-three-new-serverless-inference-providers-hyperbolic-nebius-ai-studio-and-novita,Article,Minor,❌,,HTML/Blog,,,,,,https://huggingface.co/blog/inference-providers-nebius-novita-hyperbolic,Press,Auto-Discovery,,,,2025-10-25
Build awesome datasets for video generation,build-awesome-datasets-for-video-generation,Article,Minor,❌,,HTML/Blog,,,,,,https://huggingface.co/blog/vid_ds_scripts,Press,Auto-Discovery,,,,2025-10-25
Open-source DeepResearch – Freeing our search agents,open-source-deepresearch-freeing-our-search-agents,Article,Minor,❌,,HTML/Blog,,,,,,https://huggingface.co/blog/open-deep-research,Press,Auto-Discovery,,,,2025-10-25
DABStep: Data Agent Benchmark for Multi-step Reasoning,dabstep-data-agent-benchmark-for-multi-step-reasoning,Article,Minor,❌,,HTML/Blog,,,,,,https://huggingface.co/blog/dabstep,Press,Auto-Discovery,,,,2025-10-25
Welcome to Inference Providers on the Hub 🔥,welcome-to-inference-providers-on-the-hub,Article,Minor,❌,,HTML/Blog,,,,,,https://huggingface.co/blog/inference-providers,Press,Auto-Discovery,,,,2025-10-25
State of open video generation models in Diffusers,state-of-open-video-generation-models-in-diffusers,Article,Minor,❌,,HTML/Blog,,,,,,https://huggingface.co/blog/video_gen,Press,Auto-Discovery,,,,2025-10-25
We now support VLMs in smolagents!,we-now-support-vlms-in-smolagents,Article,Minor,❌,,HTML/Blog,,,,,,https://huggingface.co/blog/smolagents-can-see,Press,Auto-Discovery,,,,2025-10-25
AI Agents Are Here. What Now?,ai-agents-are-here-what-now,Article,Minor,❌,,HTML/Blog,,,,,,https://huggingface.co/blog/ethics-soc-7,Press,Auto-Discovery,,,,2025-10-25
Introducing smolagents: simple agents that write actions in code.,introducing-smolagents-simple-agents-that-write-actions-in-code,Article,Minor,❌,,HTML/Blog,,,,,,https://huggingface.co/blog/smolagents,Press,Auto-Discovery,,,,2025-10-25
Open Source Developers Guide to the EU AI Act,open-source-developers-guide-to-the-eu-ai-act,Article,Minor,❌,,HTML/Blog,,,,,,https://huggingface.co/blog/eu-ai-act-for-oss-developers,Press,Auto-Discovery,,,,2025-10-25
A Security Review of Gradio 5,a-security-review-of-gradio-5,Article,Minor,❌,,HTML/Blog,,,,,,https://huggingface.co/blog/gradio-5-security,Press,Auto-Discovery,,,,2025-10-25
FineVideo: behind the scenes,finevideo-behind-the-scenes,Article,Minor,❌,,HTML/Blog,,,,,,https://huggingface.co/blog/fine-video,Press,Auto-Discovery,,,,2025-10-25
Scaling robotics datasets with video encoding,scaling-robotics-datasets-with-video-encoding,Article,Minor,❌,,HTML/Blog,,,,,,https://huggingface.co/blog/video-encoding,Press,Auto-Discovery,,,,2025-10-25
Our Transformers Code Agent beats the GAIA benchmark!,our-transformers-code-agent-beats-the-gaia-benchmark,Article,Minor,❌,,HTML/Blog,,,,,,https://huggingface.co/blog/beating-gaia,Press,Auto-Discovery,,,,2025-10-25
License to Call: Introducing Transformers Agents 2.0,license-to-call-introducing-transformers-agents-2-0,Article,Minor,❌,,HTML/Blog,,,,,,https://huggingface.co/blog/agents,Press,Auto-Discovery,,,,2025-10-25
"Jack of All Trades, Master of Some, a Multi-Purpose Transformer Agent",jack-of-all-trades-master-of-some-a-multi-purpose-transformer-agent,Article,Minor,❌,,HTML/Blog,,,,,,https://huggingface.co/blog/jat,Press,Auto-Discovery,,,,2025-10-25
Introducing Idefics2: A Powerful 8B Vision-Language Model for the community,introducing-idefics2-a-powerful-8b-vision-language-model-for-the-community,Article,Minor,❌,,HTML/Blog,,,,,,https://huggingface.co/blog/idefics2,Press,Auto-Discovery,,,,2025-10-25
Open-source LLMs as LangChain Agents,open-source-llms-as-langchain-agents,Article,Minor,❌,,HTML/Blog,,,,,,https://huggingface.co/blog/open-source-llms-as-agents,Press,Auto-Discovery,,,,2025-10-25
A guide to setting up your own Hugging Face leaderboard: an end-to-end example with Vectara's hallucination leaderboard,a-guide-to-setting-up-your-own-hugging-face-leaderboard-an-end-to-end-example-with-vectara-s-hallucination-leaderboard,Article,Minor,❌,,HTML/Blog,,,,,,https://huggingface.co/blog/leaderboard-vectara,Press,Auto-Discovery,,,,2025-10-25
Non-engineers guide: Train a LLaMA 2 chatbot,non-engineers-guide-train-a-llama-2-chatbot,Article,Minor,❌,,HTML/Blog,,,,,,https://huggingface.co/blog/Llama2-for-non-engineers,Press,Auto-Discovery,,,,2025-10-25
Introducing IDEFICS: An Open Reproduction of State-of-the-art Visual Language Model,introducing-idefics-an-open-reproduction-of-state-of-the-art-visual-language-model,Article,Minor,❌,,HTML/Blog,,,,,,https://huggingface.co/blog/idefics,Press,Auto-Discovery,,,,2025-10-25
Practical 3D Asset Generation: A Step-by-Step Guide,practical-3d-asset-generation-a-step-by-step-guide,Article,Minor,❌,,HTML/Blog,,,,,,https://huggingface.co/blog/3d-assets,Press,Auto-Discovery,,,,2025-10-25
AI Policy @🤗: Open ML Considerations in the EU AI Act,ai-policy-open-ml-considerations-in-the-eu-ai-act,Article,Minor,❌,,HTML/Blog,,,,,,https://huggingface.co/blog/eu-ai-act-oss,Press,Auto-Discovery,,,,2025-10-25
Introducing Agents.js: Give tools to your LLMs using JavaScript,introducing-agents-js-give-tools-to-your-llms-using-javascript,Article,Minor,❌,,HTML/Blog,,,,,,https://huggingface.co/blog/agents-js,Press,Auto-Discovery,,,,2025-10-25
Announcing our new Content Guidelines and Policy,announcing-our-new-content-guidelines-and-policy,Article,Minor,❌,,HTML/Blog,,,,,,https://huggingface.co/blog/content-guidelines-update,Press,Auto-Discovery,,,,2025-10-25
A Dive into Text-to-Video Models,a-dive-into-text-to-video-models,Article,Minor,❌,,HTML/Blog,,,,,,https://huggingface.co/blog/text-to-video,Press,Auto-Discovery,,,,2025-10-25
StackLLaMA: A hands-on guide to train LLaMA with RLHF,stackllama-a-hands-on-guide-to-train-llama-with-rlhf,Article,Minor,❌,,HTML/Blog,,,,,,https://huggingface.co/blog/stackllama,Press,Auto-Discovery,,,,2025-10-25
Ethical guidelines for developing the Diffusers library,ethical-guidelines-for-developing-the-diffusers-library,Article,Minor,❌,,HTML/Blog,,,,,,https://huggingface.co/blog/ethics-diffusers,Press,Auto-Discovery,,,,2025-10-25
