Tool,Moniker,Category,Severity,RSS Available,Feed URL,Tracking Method,Repo URL,Repo Status,Stars,Contributors,Docs URL,Website URL,Source Type,Discovery Method,Launch Status,Last Seen Update,Status,Date Added
VideoEraser: Concept Erasure in Text-to-Video Diffusion Models,videoeraser-concept-erasure-in-text-to-video-diffusion-models,Article,Minor,❌,,HTML/Blog,,,,,,https://arxiv.org/abs/2508.15314,Press,Auto-Discovery,,,,2025-08-22
LoUQAL: Low-fidelity informed Uncertainty Quantification for Active Learning in the chemical configuration space,louqal-low-fidelity-informed-uncertainty-quantification-for-active-learning-in-the-chemical-configuration-space,Article,Minor,❌,,HTML/Blog,,,,,,https://arxiv.org/abs/2508.15577,Press,Auto-Discovery,,,,2025-08-22
StreamMem: Query-Agnostic KV Cache Memory for Streaming Video Understanding,streammem-query-agnostic-kv-cache-memory-for-streaming-video-understanding,Article,Minor,❌,,HTML/Blog,,,,,,https://arxiv.org/abs/2508.15717,Press,Auto-Discovery,,,,2025-08-22
End-to-End Agentic RAG System Training for Traceable Diagnostic Reasoning,end-to-end-agentic-rag-system-training-for-traceable-diagnostic-reasoning,Article,Minor,❌,,HTML/Blog,,,,,,https://arxiv.org/abs/2508.15746,Press,Auto-Discovery,,,,2025-08-22
"""Does the cafe entrance look accessible? Where is the door?"" Towards Geospatial AI Agents for Visual Inquiries",does-the-cafe-entrance-look-accessible-where-is-the-door-towards-geospatial-ai-agents-for-visual-inquiries,Article,Minor,❌,,HTML/Blog,,,,,,https://arxiv.org/abs/2508.15752,Press,Auto-Discovery,,,,2025-08-22
LiveMCP-101: Stress Testing and Diagnosing MCP-enabled Agents on Challenging Queries,livemcp-101-stress-testing-and-diagnosing-mcp-enabled-agents-on-challenging-queries,Article,Minor,❌,,HTML/Blog,,,,,,https://arxiv.org/abs/2508.15760,Press,Auto-Discovery,,,,2025-08-22
CRISPR-GPT for Agentic Automation of Gene-editing Experiments,crispr-gpt-for-agentic-automation-of-gene-editing-experiments,Article,Minor,❌,,HTML/Blog,,,,,,https://arxiv.org/abs/2404.18021,Press,Auto-Discovery,,,,2025-08-22
Prescriptive Agents based on RAG for Automated Maintenance (PARAM),prescriptive-agents-based-on-rag-for-automated-maintenance-param,Article,Minor,❌,,HTML/Blog,,,,,,https://arxiv.org/abs/2508.04714,Press,Auto-Discovery,,,,2025-08-22
"A ""good regulator theorem"" for embodied agents",a-good-regulator-theorem-for-embodied-agents,Article,Minor,❌,,HTML/Blog,,,,,,https://arxiv.org/abs/2508.06326,Press,Auto-Discovery,,,,2025-08-22
Using a cognitive architecture to consider antiBlackness in design and development of AI systems,using-a-cognitive-architecture-to-consider-antiblackness-in-design-and-development-of-ai-systems,Article,Minor,❌,,HTML/Blog,,,,,,https://arxiv.org/abs/2207.00644,Press,Auto-Discovery,,,,2025-08-22
Grounded-VideoLLM: Sharpening Fine-grained Temporal Grounding in Video Large Language Models,grounded-videollm-sharpening-fine-grained-temporal-grounding-in-video-large-language-models,Article,Minor,❌,,HTML/Blog,,,,,,https://arxiv.org/abs/2410.03290,Press,Auto-Discovery,,,,2025-08-22
Knowledge-Guided Prompt Learning for Request Quality Assurance in Public Code Review,knowledge-guided-prompt-learning-for-request-quality-assurance-in-public-code-review,Article,Minor,❌,,HTML/Blog,,,,,,https://arxiv.org/abs/2410.21673,Press,Auto-Discovery,,,,2025-08-22
Evaluation Agent: Efficient and Promptable Evaluation Framework for Visual Generative Models,evaluation-agent-efficient-and-promptable-evaluation-framework-for-visual-generative-models,Article,Minor,❌,,HTML/Blog,,,,,,https://arxiv.org/abs/2412.09645,Press,Auto-Discovery,,,,2025-08-22
"Large Language Models for Automated Literature Review: An Evaluation of Reference Generation, Abstract Writing, and Review Composition",large-language-models-for-automated-literature-review-an-evaluation-of-reference-generation-abstract-writing-and-review-composition,Article,Minor,❌,,HTML/Blog,,,,,,https://arxiv.org/abs/2412.13612,Press,Auto-Discovery,,,,2025-08-22
Ontology-Guided Reverse Thinking Makes Large Language Models Stronger on Knowledge Graph Question Answering,ontology-guided-reverse-thinking-makes-large-language-models-stronger-on-knowledge-graph-question-answering,Article,Minor,❌,,HTML/Blog,,,,,,https://arxiv.org/abs/2502.11491,Press,Auto-Discovery,,,,2025-08-22
VerifiAgent: a Unified Verification Agent in Language Model Reasoning,verifiagent-a-unified-verification-agent-in-language-model-reasoning,Article,Minor,❌,,HTML/Blog,,,,,,https://arxiv.org/abs/2504.00406,Press,Auto-Discovery,,,,2025-08-22
TextSplat: Text-Guided Semantic Fusion for Generalizable Gaussian Splatting,textsplat-text-guided-semantic-fusion-for-generalizable-gaussian-splatting,Article,Minor,❌,,HTML/Blog,,,,,,https://arxiv.org/abs/2504.09588,Press,Auto-Discovery,,,,2025-08-22
MuSeD: A Multimodal Spanish Dataset for Sexism Detection in Social Media Videos,mused-a-multimodal-spanish-dataset-for-sexism-detection-in-social-media-videos,Article,Minor,❌,,HTML/Blog,,,,,,https://arxiv.org/abs/2504.11169,Press,Auto-Discovery,,,,2025-08-22
Empirical Evidence for Alignment Faking in a Small LLM and Prompt-Based Mitigation Techniques,empirical-evidence-for-alignment-faking-in-a-small-llm-and-prompt-based-mitigation-techniques,Article,Minor,❌,,HTML/Blog,,,,,,https://arxiv.org/abs/2506.21584,Press,Auto-Discovery,,,,2025-08-22
Generation of structure-guided pMHC-I libraries using Diffusion Models,generation-of-structure-guided-pmhc-i-libraries-using-diffusion-models,Article,Minor,❌,,HTML/Blog,,,,,,https://arxiv.org/abs/2507.08902,Press,Auto-Discovery,,,,2025-08-22
Agoran: An Agentic Open Marketplace for 6G RAN Automation,agoran-an-agentic-open-marketplace-for-6g-ran-automation,Article,Minor,❌,,HTML/Blog,,,,,,https://arxiv.org/abs/2508.09159,Press,Auto-Discovery,,,,2025-08-22
Preacher: Paper-to-Video Agentic System,preacher-paper-to-video-agentic-system,Article,Minor,❌,,HTML/Blog,,,,,,https://arxiv.org/abs/2508.09632,Press,Auto-Discovery,,,,2025-08-22
Fortifying the Agentic Web: A Unified Zero-Trust Architecture Against Logic-layer Threats,fortifying-the-agentic-web-a-unified-zero-trust-architecture-against-logic-layer-threats,Article,Minor,❌,,HTML/Blog,,,,,,https://arxiv.org/abs/2508.12259,Press,Auto-Discovery,,,,2025-08-22
SecFSM: Knowledge Graph-Guided Verilog Code Generation for Secure Finite State Machines in Systems-on-Chip,secfsm-knowledge-graph-guided-verilog-code-generation-for-secure-finite-state-machines-in-systems-on-chip,Article,Minor,❌,,HTML/Blog,,,,,,https://arxiv.org/abs/2508.12910,Press,Auto-Discovery,,,,2025-08-22
VerilogLAVD: LLM-Aided Rule Generation for Vulnerability Detection in Verilog,veriloglavd-llm-aided-rule-generation-for-vulnerability-detection-in-verilog,Article,Minor,❌,,HTML/Blog,,,,,,https://arxiv.org/abs/2508.13092,Press,Auto-Discovery,,,,2025-08-22
FinAgentBench: A Benchmark Dataset for Agentic Retrieval in Financial Question Answering,finagentbench-a-benchmark-dataset-for-agentic-retrieval-in-financial-question-answering,Article,Minor,❌,,HTML/Blog,,,,,,https://arxiv.org/abs/2508.14052,Press,Auto-Discovery,,,,2025-08-22
Show HN: Review code in multiple passes with Git (git-cl),show-hn-review-code-in-multiple-passes-with-git-git-cl,Article,Minor,❌,,HTML/Blog,,,,,,https://news.ycombinator.com/item?id=44994603,Press,Auto-Discovery,,,,2025-08-23
"No, Google Did Not Unilaterally Decide to Kill XSLT",no-google-did-not-unilaterally-decide-to-kill-xslt,Article,Minor,❌,,HTML/Blog,,,,,,https://www.reddit.com/r/programming/comments/1mxswpp/no_google_did_not_unilaterally_decide_to_kill_xslt/,Press,Auto-Discovery,,,,2025-08-23
A World of Goo–style bridge simulator 🛢️ using WL + Canvas API. All inside a single notebook,a-world-of-goo-style-bridge-simulator-using-wl-canvas-api-all-inside-a-single-notebook,Article,Minor,❌,,HTML/Blog,,,,,,https://www.reddit.com/r/programming/comments/1my0icw/a_world_of_goostyle_bridge_simulator_using_wl/,Press,Auto-Discovery,,,,2025-08-23
NVIDIA new paper : Small Language Models are the Future of Agentic AI,nvidia-new-paper-small-language-models-are-the-future-of-agentic-ai,Article,Minor,❌,,HTML/Blog,,,,,,https://www.reddit.com/r/LocalLLaMA/comments/1mxrarl/nvidia_new_paper_small_language_models_are_the/,Press,Auto-Discovery,,,,2025-08-23
DINOv3 semantic video tracking running locally in your browser (WebGPU),dinov3-semantic-video-tracking-running-locally-in-your-browser-webgpu,Article,Minor,❌,,HTML/Blog,,,,,,https://www.reddit.com/r/LocalLLaMA/comments/1mx7q58/dinov3_semantic_video_tracking_running_locally_in/,Press,Auto-Discovery,,,,2025-08-23
Deep Research MCP Server,deep-research-mcp-server,Article,Minor,❌,,HTML/Blog,,,,,,https://www.reddit.com/r/LocalLLaMA/comments/1mxvp4q/deep_research_mcp_server/,Press,Auto-Discovery,,,,2025-08-23
[D] AAAI considered 2nd tier now?,d-aaai-considered-2nd-tier-now,Article,Minor,❌,,HTML/Blog,,,,,,https://www.reddit.com/r/MachineLearning/comments/1mxrt1y/d_aaai_considered_2nd_tier_now/,Press,Auto-Discovery,,,,2025-08-23
Ninja Gaiden: Ragebound is a perfect reimagining of the classic series,ninja-gaiden-ragebound-is-a-perfect-reimagining-of-the-classic-series,Article,Minor,❌,,HTML/Blog,,,,,,https://www.theverge.com/games-review/716421/ninja-gaiden-ragebound-review-nintendo-switch-playstation-xbox-pc,Press,Auto-Discovery,,,,2025-08-23
The power shift inside OpenAI,the-power-shift-inside-openai,Article,Minor,❌,,HTML/Blog,,,,,,https://www.theverge.com/command-line-newsletter/764650/openai-chatgpt-fidji-simo-sam-altman-power-shift,Press,Auto-Discovery,,,,2025-08-23
OpenCUA’s open source computer-use agents rival proprietary models from OpenAI and Anthropic,opencua-s-open-source-computer-use-agents-rival-proprietary-models-from-openai-and-anthropic,Article,Minor,❌,,HTML/Blog,,,,,,https://venturebeat.com/ai/opencuas-open-source-computer-use-agents-rival-proprietary-models-from-openai-and-anthropic/,Press,Auto-Discovery,,,,2025-08-23
MCP-Universe benchmark shows GPT-5 fails more than half of real-world orchestration tasks,mcp-universe-benchmark-shows-gpt-5-fails-more-than-half-of-real-world-orchestration-tasks,Article,Minor,❌,,HTML/Blog,,,,,,https://venturebeat.com/ai/mcp-universe-benchmark-shows-gpt-5-fails-more-than-half-of-real-world-orchestration-tasks/,Press,Auto-Discovery,,,,2025-08-23
"Four big enterprise lessons from Walmart’s AI security: agentic risks, identity reboot, velocity with governance, and AI vs. AI defense",four-big-enterprise-lessons-from-walmart-s-ai-security-agentic-risks-identity-reboot-velocity-with-governance-and-ai-vs-ai-defense,Article,Minor,❌,,HTML/Blog,,,,,,https://venturebeat.com/security/four-big-enterprise-lessons-from-walmart-ai-security-agentic-risks-identity-reboot-velocity-with-governance-and-ai-vs-ai-defense/,Press,Auto-Discovery,,,,2025-08-23
College student’s “time travel” AI experiment accidentally outputs real 1834 history,college-student-s-time-travel-ai-experiment-accidentally-outputs-real-1834-history,Article,Minor,❌,,HTML/Blog,,,,,,https://arstechnica.com/information-technology/2025/08/ai-built-from-1800s-texts-surprises-creator-by-mentioning-real-1834-london-protests/,Press,Auto-Discovery,,,,2025-08-23
"Show HN: I wanted AI in Slack, ended up making Basecase (AI agents in chat)",show-hn-i-wanted-ai-in-slack-ended-up-making-basecase-ai-agents-in-chat,Article,Minor,❌,,HTML/Blog,,,,,,https://basecase.ai/,Press,Auto-Discovery,,,,2025-08-24
Show HN: I built a Shazam for movies (identify films from clips in seconds),show-hn-i-built-a-shazam-for-movies-identify-films-from-clips-in-seconds,Article,Minor,❌,,HTML/Blog,,,,,,https://whatmovie.net/,Press,Auto-Discovery,,,,2025-08-24
"IEMidi-v2.0.0 · Cross-platform MIDI map editor for linux, win and macOS.",iemidi-v2-0-0-cross-platform-midi-map-editor-for-linux-win-and-macos,Article,Minor,❌,,HTML/Blog,,,,,,https://www.reddit.com/r/programming/comments/1mylsul/iemidiv200_crossplatform_midi_map_editor_for/,Press,Auto-Discovery,,,,2025-08-24
SXO :: Optimized Server-Side JSX. Build Simple. Build Fast,sxo-optimized-server-side-jsx-build-simple-build-fast,Article,Minor,❌,,HTML/Blog,,,,,,https://www.reddit.com/r/programming/comments/1my2ehr/sxo_optimized_serverside_jsx_build_simple_build/,Press,Auto-Discovery,,,,2025-08-24
2025 guide to Context Engineering for Software Engineers,2025-guide-to-context-engineering-for-software-engineers,Article,Minor,❌,,HTML/Blog,,,,,,https://www.reddit.com/r/programming/comments/1myqcvw/2025_guide_to_context_engineering_for_software/,Press,Auto-Discovery,,,,2025-08-24
What are my best options for using Video Understanding Vision Language Models?,what-are-my-best-options-for-using-video-understanding-vision-language-models,Article,Minor,❌,,HTML/Blog,,,,,,https://www.reddit.com/r/LocalLLaMA/comments/1mytilm/what_are_my_best_options_for_using_video/,Press,Auto-Discovery,,,,2025-08-24
[R] Building a deep learning image model system to identify BJJ positions in matches,r-building-a-deep-learning-image-model-system-to-identify-bjj-positions-in-matches,Article,Minor,❌,,HTML/Blog,,,,,,https://www.reddit.com/r/MachineLearning/comments/1mylqrb/r_building_a_deep_learning_image_model_system_to/,Press,Auto-Discovery,,,,2025-08-24
Show HN: Agent Key – OAuth for AI Agents,show-hn-agent-key-oauth-for-ai-agents,Article,Minor,❌,,HTML/Blog,,,,,,https://github.com/kagehq/keys,Press,Auto-Discovery,,,,2025-08-25
Show HN: Open-Source Agentic AI for Company Research,show-hn-open-source-agentic-ai-for-company-research,Article,Minor,❌,,HTML/Blog,,,,,,https://github.com/DimiMikadze/Mira,Press,Auto-Discovery,,,,2025-08-25
Show HN: Sidekick – AI Coding Assistant,show-hn-sidekick-ai-coding-assistant,Article,Minor,❌,,HTML/Blog,,,,,,https://sidekick.yugin.co/download,Press,Auto-Discovery,,,,2025-08-25
Show HN: Slack bot with Sentry MCP for error summaries,show-hn-slack-bot-with-sentry-mcp-for-error-summaries,Article,Minor,❌,,HTML/Blog,,,,,,https://runbear.io/a/slack/sentry-issue-radar,Press,Auto-Discovery,,,,2025-08-25
Show HN: Turn SpiderMonkey bytecode back into readable JavaScript,show-hn-turn-spidermonkey-bytecode-back-into-readable-javascript,Article,Minor,❌,,HTML/Blog,,,,,,https://github.com/zboralski/spidermonkey-dumper,Press,Auto-Discovery,,,,2025-08-25
Show HN: Mcp-plugins CLI/py equips your MCP with powerful prebuilt plugins,show-hn-mcp-plugins-cli-py-equips-your-mcp-with-powerful-prebuilt-plugins,Article,Minor,❌,,HTML/Blog,,,,,,https://github.com/zhjch05/mcp-plugins,Press,Auto-Discovery,,,,2025-08-25
Exactly-Once Processing Across Kafka and Databases: Using Kafka Transactions + Idempotent Writes,exactly-once-processing-across-kafka-and-databases-using-kafka-transactions-idempotent-writes,Article,Minor,❌,,HTML/Blog,,,,,,https://www.reddit.com/r/programming/comments/1mywhub/exactlyonce_processing_across_kafka_and_databases/,Press,Auto-Discovery,,,,2025-08-25
We put a coding agent in a while loop,we-put-a-coding-agent-in-a-while-loop,Article,Minor,❌,,HTML/Blog,,,,,,https://www.reddit.com/r/programming/comments/1mzqhru/we_put_a_coding_agent_in_a_while_loop/,Press,Auto-Discovery,,,,2025-08-25
Muhammad Azeez - The Agent Builder's Reading List: What Actually Matters,muhammad-azeez-the-agent-builder-s-reading-list-what-actually-matters,Article,Minor,❌,,HTML/Blog,,,,,,https://www.reddit.com/r/programming/comments/1mzngio/muhammad_azeez_the_agent_builders_reading_list/,Press,Auto-Discovery,,,,2025-08-25
Almost done with the dashboard for local llama.cpp agents,almost-done-with-the-dashboard-for-local-llama-cpp-agents,Article,Minor,❌,,HTML/Blog,,,,,,https://www.reddit.com/r/LocalLLaMA/comments/1mz6som/almost_done_with_the_dashboard_for_local_llamacpp/,Press,Auto-Discovery,,,,2025-08-25
InfiniteTalk: Audio-driven Video Generation for Sparse-Frame Video Dubbing,infinitetalk-audio-driven-video-generation-for-sparse-frame-video-dubbing,Article,Minor,❌,,HTML/Blog,,,,,,https://www.reddit.com/r/LocalLLaMA/comments/1mzaeee/infinitetalk_audiodriven_video_generation_for/,Press,Auto-Discovery,,,,2025-08-25
[P] Open-Source Agentic AI for Company Research,p-open-source-agentic-ai-for-company-research,Article,Minor,❌,,HTML/Blog,,,,,,https://www.reddit.com/r/MachineLearning/comments/1mzpoo4/p_opensource_agentic_ai_for_company_research/,Press,Auto-Discovery,,,,2025-08-25
[R] Review advice: Well-established work published years ago on Arxiv,r-review-advice-well-established-work-published-years-ago-on-arxiv,Article,Minor,❌,,HTML/Blog,,,,,,https://www.reddit.com/r/MachineLearning/comments/1mz70e2/r_review_advice_wellestablished_work_published/,Press,Auto-Discovery,,,,2025-08-25
[P] Yelp Dataset clarification: Is review_count colomn cheating?,p-yelp-dataset-clarification-is-review-count-colomn-cheating,Article,Minor,❌,,HTML/Blog,,,,,,https://www.reddit.com/r/MachineLearning/comments/1mzhsh7/p_yelp_dataset_clarification_is_review_count/,Press,Auto-Discovery,,,,2025-08-25
"Developers lose focus 1,200 times a day — how MCP could change that",developers-lose-focus-1-200-times-a-day-how-mcp-could-change-that,Article,Minor,❌,,HTML/Blog,,,,,,https://venturebeat.com/ai/developers-lose-focus-1200-times-a-day-how-mcp-could-change-that/,Press,Auto-Discovery,,,,2025-08-25
IR-Agent: Expert-Inspired LLM Agents for Structure Elucidation from Infrared Spectra,ir-agent-expert-inspired-llm-agents-for-structure-elucidation-from-infrared-spectra,Article,Minor,❌,,HTML/Blog,,,,,,https://arxiv.org/abs/2508.16112,Press,Auto-Discovery,,,,2025-08-25
Graph RAG as Human Choice Model: Building a Data-Driven Mobility Agent with Preference Chain,graph-rag-as-human-choice-model-building-a-data-driven-mobility-agent-with-preference-chain,Article,Minor,❌,,HTML/Blog,,,,,,https://arxiv.org/abs/2508.16172,Press,Auto-Discovery,,,,2025-08-25
AgentScope 1.0: A Developer-Centric Framework for Building Agentic Applications,agentscope-1-0-a-developer-centric-framework-for-building-agentic-applications,Article,Minor,❌,,HTML/Blog,,,,,,https://arxiv.org/abs/2508.16279,Press,Auto-Discovery,,,,2025-08-25
GLARE: Agentic Reasoning for Legal Judgment Prediction,glare-agentic-reasoning-for-legal-judgment-prediction,Article,Minor,❌,,HTML/Blog,,,,,,https://arxiv.org/abs/2508.16383,Press,Auto-Discovery,,,,2025-08-25
Constraints-Guided Diffusion Reasoner for Neuro-Symbolic Learning,constraints-guided-diffusion-reasoner-for-neuro-symbolic-learning,Article,Minor,❌,,HTML/Blog,,,,,,https://arxiv.org/abs/2508.16524,Press,Auto-Discovery,,,,2025-08-25
LLM-Based Agents for Competitive Landscape Mapping in Drug Asset Due Diligence,llm-based-agents-for-competitive-landscape-mapping-in-drug-asset-due-diligence,Article,Minor,❌,,HTML/Blog,,,,,,https://arxiv.org/abs/2508.16571,Press,Auto-Discovery,,,,2025-08-25
ReportBench: Evaluating Deep Research Agents via Academic Survey Tasks,reportbench-evaluating-deep-research-agents-via-academic-survey-tasks,Article,Minor,❌,,HTML/Blog,,,,,,https://arxiv.org/abs/2508.15804,Press,Auto-Discovery,,,,2025-08-25
ALAS: Autonomous Learning Agent for Self-Updating Language Models,alas-autonomous-learning-agent-for-self-updating-language-models,Article,Minor,❌,,HTML/Blog,,,,,,https://arxiv.org/abs/2508.15805,Press,Auto-Discovery,,,,2025-08-25
Chain-of-Query: Unleashing the Power of LLMs in SQL-Aided Table Understanding via Multi-Agent Collaboration,chain-of-query-unleashing-the-power-of-llms-in-sql-aided-table-understanding-via-multi-agent-collaboration,Article,Minor,❌,,HTML/Blog,,,,,,https://arxiv.org/abs/2508.15809,Press,Auto-Discovery,,,,2025-08-25
An Auditable Pipeline for Fuzzy Full-Text Screening in Systematic Reviews: Integrating Contrastive Semantic Highlighting and LLM Judgment,an-auditable-pipeline-for-fuzzy-full-text-screening-in-systematic-reviews-integrating-contrastive-semantic-highlighting-and-llm-judgment,Article,Minor,❌,,HTML/Blog,,,,,,https://arxiv.org/abs/2508.15822,Press,Auto-Discovery,,,,2025-08-25
A Functionality-Grounded Benchmark for Evaluating Web Agents in E-commerce Domains,a-functionality-grounded-benchmark-for-evaluating-web-agents-in-e-commerce-domains,Article,Minor,❌,,HTML/Blog,,,,,,https://arxiv.org/abs/2508.15832,Press,Auto-Discovery,,,,2025-08-25
DeepMEL: A Multi-Agent Collaboration Framework for Multimodal Entity Linking,deepmel-a-multi-agent-collaboration-framework-for-multimodal-entity-linking,Article,Minor,❌,,HTML/Blog,,,,,,https://arxiv.org/abs/2508.15876,Press,Auto-Discovery,,,,2025-08-25
Evaluating Structured Decoding for Text-to-Table Generation: Evidence from Three Datasets,evaluating-structured-decoding-for-text-to-table-generation-evidence-from-three-datasets,Article,Minor,❌,,HTML/Blog,,,,,,https://arxiv.org/abs/2508.15910,Press,Auto-Discovery,,,,2025-08-25
"Noise, Adaptation, and Strategy: Assessing LLM Fidelity in Decision-Making",noise-adaptation-and-strategy-assessing-llm-fidelity-in-decision-making,Article,Minor,❌,,HTML/Blog,,,,,,https://arxiv.org/abs/2508.15926,Press,Auto-Discovery,,,,2025-08-25
ASIC-Agent: An Autonomous Multi-Agent System for ASIC Design with Benchmark Evaluation,asic-agent-an-autonomous-multi-agent-system-for-asic-design-with-benchmark-evaluation,Article,Minor,❌,,HTML/Blog,,,,,,https://arxiv.org/abs/2508.15940,Press,Auto-Discovery,,,,2025-08-25
Time Series Based Network Intrusion Detection using MTF-Aided Transformer,time-series-based-network-intrusion-detection-using-mtf-aided-transformer,Article,Minor,❌,,HTML/Blog,,,,,,https://arxiv.org/abs/2508.16035,Press,Auto-Discovery,,,,2025-08-25
The Fools are Certain; the Wise are Doubtful: Exploring LLM Confidence in Code Completion,the-fools-are-certain-the-wise-are-doubtful-exploring-llm-confidence-in-code-completion,Article,Minor,❌,,HTML/Blog,,,,,,https://arxiv.org/abs/2508.16131,Press,Auto-Discovery,,,,2025-08-25
"Machine Learning in Micromobility: A Systematic Review of Datasets, Techniques, and Applications",machine-learning-in-micromobility-a-systematic-review-of-datasets-techniques-and-applications,Article,Minor,❌,,HTML/Blog,,,,,,https://arxiv.org/abs/2508.16135,Press,Auto-Discovery,,,,2025-08-25
Set Transformer Architectures and Synthetic Data Generation for Flow-Guided Nanoscale Localization,set-transformer-architectures-and-synthetic-data-generation-for-flow-guided-nanoscale-localization,Article,Minor,❌,,HTML/Blog,,,,,,https://arxiv.org/abs/2508.16200,Press,Auto-Discovery,,,,2025-08-25
SpecVLM: Enhancing Speculative Decoding of Video LLMs via Verifier-Guided Token Pruning,specvlm-enhancing-speculative-decoding-of-video-llms-via-verifier-guided-token-pruning,Article,Minor,❌,,HTML/Blog,,,,,,https://arxiv.org/abs/2508.16201,Press,Auto-Discovery,,,,2025-08-25
"MCPVerse: An Expansive, Real-World Benchmark for Agentic Tool Use",mcpverse-an-expansive-real-world-benchmark-for-agentic-tool-use,Article,Minor,❌,,HTML/Blog,,,,,,https://arxiv.org/abs/2508.16260,Press,Auto-Discovery,,,,2025-08-25
From Confidence to Collapse in LLM Factual Robustness,from-confidence-to-collapse-in-llm-factual-robustness,Article,Minor,❌,,HTML/Blog,,,,,,https://arxiv.org/abs/2508.16267,Press,Auto-Discovery,,,,2025-08-25
OPERA: A Reinforcement Learning--Enhanced Orchestrated Planner-Executor Architecture for Reasoning-Oriented Multi-Hop Retrieval,opera-a-reinforcement-learning-enhanced-orchestrated-planner-executor-architecture-for-reasoning-oriented-multi-hop-retrieval,Article,Minor,❌,,HTML/Blog,,,,,,https://arxiv.org/abs/2508.16438,Press,Auto-Discovery,,,,2025-08-25
Automated Optimization Modeling through Expert-Guided Large Language Model Reasoning,automated-optimization-modeling-through-expert-guided-large-language-model-reasoning,Article,Minor,❌,,HTML/Blog,,,,,,https://arxiv.org/abs/2508.14410,Press,Auto-Discovery,,,,2025-08-25
SIGMA: Sheaf-Informed Geometric Multi-Agent Pathfinding,sigma-sheaf-informed-geometric-multi-agent-pathfinding,Article,Minor,❌,,HTML/Blog,,,,,,https://arxiv.org/abs/2502.06440,Press,Auto-Discovery,,,,2025-08-25
Comparative Explanations: Explanation Guided Decision Making for Human-in-the-Loop Preference Selection,comparative-explanations-explanation-guided-decision-making-for-human-in-the-loop-preference-selection,Article,Minor,❌,,HTML/Blog,,,,,,https://arxiv.org/abs/2504.03744,Press,Auto-Discovery,,,,2025-08-25
CO-Bench: Benchmarking Language Model Agents in Algorithm Search for Combinatorial Optimization,co-bench-benchmarking-language-model-agents-in-algorithm-search-for-combinatorial-optimization,Article,Minor,❌,,HTML/Blog,,,,,,https://arxiv.org/abs/2504.04310,Press,Auto-Discovery,,,,2025-08-25
SPARE: Single-Pass Annotation with Reference-Guided Evaluation for Automatic Process Supervision and Reward Modelling,spare-single-pass-annotation-with-reference-guided-evaluation-for-automatic-process-supervision-and-reward-modelling,Article,Minor,❌,,HTML/Blog,,,,,,https://arxiv.org/abs/2506.15498,Press,Auto-Discovery,,,,2025-08-25
Neural-Network solver of ideal MHD equilibria,neural-network-solver-of-ideal-mhd-equilibria,Article,Minor,❌,,HTML/Blog,,,,,,https://arxiv.org/abs/2507.03119,Press,Auto-Discovery,,,,2025-08-25
Dynamically Adaptive Reasoning via LLM-Guided MCTS for Efficient and Context-Aware KGQA,dynamically-adaptive-reasoning-via-llm-guided-mcts-for-efficient-and-context-aware-kgqa,Article,Minor,❌,,HTML/Blog,,,,,,https://arxiv.org/abs/2508.00719,Press,Auto-Discovery,,,,2025-08-25
MCP-Guard: A Defense Framework for Model Context Protocol Integrity in Large Language Model Applications,mcp-guard-a-defense-framework-for-model-context-protocol-integrity-in-large-language-model-applications,Article,Minor,❌,,HTML/Blog,,,,,,https://arxiv.org/abs/2508.10991,Press,Auto-Discovery,,,,2025-08-25
LinkedIn MCP,linkedin-mcp,Article,Minor,❌,,HTML/Blog,,,,,,https://www.producthunt.com/posts/linkedin-mcp,Press,Auto-Discovery,,,,2025-08-26
