Tool,Moniker,Category,Severity,RSS Available,Feed URL,Tracking Method,Repo URL,Repo Status,Stars,Contributors,Docs URL,Website URL,Source Type,Discovery Method,Launch Status,Last Seen Update,Status,Date Added
MobiLLM: An Agentic AI Framework for Closed-Loop Threat Mitigation in 6G Open RANs,mobillm-an-agentic-ai-framework-for-closed-loop-threat-mitigation-in-6g-open-rans,Article,Minor,❌,,HTML/Blog,,,,,,https://arxiv.org/abs/2509.21634,Press,Auto-Discovery,,,,2025-09-29
"Not My Agent, Not My Boundary? Elicitation of Personal Privacy Boundaries in AI-Delegated Information Sharing",not-my-agent-not-my-boundary-elicitation-of-personal-privacy-boundaries-in-ai-delegated-information-sharing,Article,Minor,❌,,HTML/Blog,,,,,,https://arxiv.org/abs/2509.21712,Press,Auto-Discovery,,,,2025-09-29
POLO: Preference-Guided Multi-Turn Reinforcement Learning for Lead Optimization,polo-preference-guided-multi-turn-reinforcement-learning-for-lead-optimization,Article,Minor,❌,,HTML/Blog,,,,,,https://arxiv.org/abs/2509.21737,Press,Auto-Discovery,,,,2025-09-29
DiTraj: training-free trajectory control for video diffusion transformer,ditraj-training-free-trajectory-control-for-video-diffusion-transformer,Article,Minor,❌,,HTML/Blog,,,,,,https://arxiv.org/abs/2509.21839,Press,Auto-Discovery,,,,2025-09-29
Graph of Agents: Principled Long Context Modeling by Emergent Multi-Agent Collaboration,graph-of-agents-principled-long-context-modeling-by-emergent-multi-agent-collaboration,Article,Minor,❌,,HTML/Blog,,,,,,https://arxiv.org/abs/2509.21848,Press,Auto-Discovery,,,,2025-09-29
No Prompt Left Behind: Exploiting Zero-Variance Prompts in LLM Reinforcement Learning via Entropy-Guided Advantage Shaping,no-prompt-left-behind-exploiting-zero-variance-prompts-in-llm-reinforcement-learning-via-entropy-guided-advantage-shaping,Article,Minor,❌,,HTML/Blog,,,,,,https://arxiv.org/abs/2509.21880,Press,Auto-Discovery,,,,2025-09-29
AutoSCORE: Enhancing Automated Scoring with Multi-Agent Large Language Models via Structured Component Recognition,autoscore-enhancing-automated-scoring-with-multi-agent-large-language-models-via-structured-component-recognition,Article,Minor,❌,,HTML/Blog,,,,,,https://arxiv.org/abs/2509.21910,Press,Auto-Discovery,,,,2025-09-29
Developing Vision-Language-Action Model from Egocentric Videos,developing-vision-language-action-model-from-egocentric-videos,Article,Minor,❌,,HTML/Blog,,,,,,https://arxiv.org/abs/2509.21986,Press,Auto-Discovery,,,,2025-09-29
SecureAgentBench: Benchmarking Secure Code Generation under Realistic Vulnerability Scenarios,secureagentbench-benchmarking-secure-code-generation-under-realistic-vulnerability-scenarios,Article,Minor,❌,,HTML/Blog,,,,,,https://arxiv.org/abs/2509.22097,Press,Auto-Discovery,,,,2025-09-29
Multi-Agent Path Finding via Offline RL and LLM Collaboration,multi-agent-path-finding-via-offline-rl-and-llm-collaboration,Article,Minor,❌,,HTML/Blog,,,,,,https://arxiv.org/abs/2509.22130,Press,Auto-Discovery,,,,2025-09-29
Impact of Collective Behaviors of Autonomous Vehicles on Urban Traffic Dynamics: A Multi-Agent Reinforcement Learning Approach,impact-of-collective-behaviors-of-autonomous-vehicles-on-urban-traffic-dynamics-a-multi-agent-reinforcement-learning-approach,Article,Minor,❌,,HTML/Blog,,,,,,https://arxiv.org/abs/2509.22216,Press,Auto-Discovery,,,,2025-09-29
VizGen: Data Exploration and Visualization from Natural Language via a Multi-Agent AI Architecture,vizgen-data-exploration-and-visualization-from-natural-language-via-a-multi-agent-ai-architecture,Article,Minor,❌,,HTML/Blog,,,,,,https://arxiv.org/abs/2509.22218,Press,Auto-Discovery,,,,2025-09-29
FeatBench: Evaluating Coding Agents on Feature Implementation for Vibe Coding,featbench-evaluating-coding-agents-on-feature-implementation-for-vibe-coding,Article,Minor,❌,,HTML/Blog,,,,,,https://arxiv.org/abs/2509.22237,Press,Auto-Discovery,,,,2025-09-29
Secure and Efficient Access Control for Computer-Use Agents via Context Space,secure-and-efficient-access-control-for-computer-use-agents-via-context-space,Article,Minor,❌,,HTML/Blog,,,,,,https://arxiv.org/abs/2509.22256,Press,Auto-Discovery,,,,2025-09-29
Jailbreaking on Text-to-Video Models via Scene Splitting Strategy,jailbreaking-on-text-to-video-models-via-scene-splitting-strategy,Article,Minor,❌,,HTML/Blog,,,,,,https://arxiv.org/abs/2509.22292,Press,Auto-Discovery,,,,2025-09-29
HiGS: History-Guided Sampling for Plug-and-Play Enhancement of Diffusion Models,higs-history-guided-sampling-for-plug-and-play-enhancement-of-diffusion-models,Article,Minor,❌,,HTML/Blog,,,,,,https://arxiv.org/abs/2509.22300,Press,Auto-Discovery,,,,2025-09-29
"Learn the Ropes, Then Trust the Wins: Self-imitation with Progressive Exploration for Agentic Reinforcement Learning",learn-the-ropes-then-trust-the-wins-self-imitation-with-progressive-exploration-for-agentic-reinforcement-learning,Article,Minor,❌,,HTML/Blog,,,,,,https://arxiv.org/abs/2509.22601,Press,Auto-Discovery,,,,2025-09-29
WebGen-Agent: Enhancing Interactive Website Generation with Multi-Level Feedback and Step-Level Reinforcement Learning,webgen-agent-enhancing-interactive-website-generation-with-multi-level-feedback-and-step-level-reinforcement-learning,Article,Minor,❌,,HTML/Blog,,,,,,https://arxiv.org/abs/2509.22644,Press,Auto-Discovery,,,,2025-09-29
Learning Human-Perceived Fakeness in AI-Generated Videos via Multimodal LLMs,learning-human-perceived-fakeness-in-ai-generated-videos-via-multimodal-llms,Article,Minor,❌,,HTML/Blog,,,,,,https://arxiv.org/abs/2509.22646,Press,Auto-Discovery,,,,2025-09-29
A critical review of methods and challenges in large language models,a-critical-review-of-methods-and-challenges-in-large-language-models,Article,Minor,❌,,HTML/Blog,,,,,,https://arxiv.org/abs/2404.11973,Press,Auto-Discovery,,,,2025-09-29
Attributing Responsibility in AI-Induced Incidents: A Computational Reflective Equilibrium Framework for Accountability,attributing-responsibility-in-ai-induced-incidents-a-computational-reflective-equilibrium-framework-for-accountability,Article,Minor,❌,,HTML/Blog,,,,,,https://arxiv.org/abs/2404.16957,Press,Auto-Discovery,,,,2025-09-29
Grounding Multimodal LLMs to Embodied Agents that Ask for Help with Reinforcement Learning,grounding-multimodal-llms-to-embodied-agents-that-ask-for-help-with-reinforcement-learning,Article,Minor,❌,,HTML/Blog,,,,,,https://arxiv.org/abs/2504.00907,Press,Auto-Discovery,,,,2025-09-29
XBOUND: Exploring Capability Boundaries of Device-Control Agents at the State Level,xbound-exploring-capability-boundaries-of-device-control-agents-at-the-state-level,Article,Minor,❌,,HTML/Blog,,,,,,https://arxiv.org/abs/2505.21279,Press,Auto-Discovery,,,,2025-09-29
Darwin Godel Machine: Open-Ended Evolution of Self-Improving Agents,darwin-godel-machine-open-ended-evolution-of-self-improving-agents,Article,Minor,❌,,HTML/Blog,,,,,,https://arxiv.org/abs/2505.22954,Press,Auto-Discovery,,,,2025-09-29
AgentOrchestra: Orchestrating Hierarchical Multi-Agent Intelligence with the Tool-Environment-Agent(TEA) Protocol,agentorchestra-orchestrating-hierarchical-multi-agent-intelligence-with-the-tool-environment-agent-tea-protocol,Article,Minor,❌,,HTML/Blog,,,,,,https://arxiv.org/abs/2506.12508,Press,Auto-Discovery,,,,2025-09-29
Dynamic Context Adaptation for Consistent Role-Playing Agents with Retrieval-Augmented Generations,dynamic-context-adaptation-for-consistent-role-playing-agents-with-retrieval-augmented-generations,Article,Minor,❌,,HTML/Blog,,,,,,https://arxiv.org/abs/2508.02016,Press,Auto-Discovery,,,,2025-09-29
InqEduAgent: Adaptive AI Learning Partners with Gaussian Process Augmentation,inqeduagent-adaptive-ai-learning-partners-with-gaussian-process-augmentation,Article,Minor,❌,,HTML/Blog,,,,,,https://arxiv.org/abs/2508.03174,Press,Auto-Discovery,,,,2025-09-29
MMSearch-Plus: Benchmarking Provenance-Aware Search for Multimodal Browsing Agents,mmsearch-plus-benchmarking-provenance-aware-search-for-multimodal-browsing-agents,Article,Minor,❌,,HTML/Blog,,,,,,https://arxiv.org/abs/2508.21475,Press,Auto-Discovery,,,,2025-09-29
Towards Agentic OS: An LLM Agent Framework for Linux Schedulers,towards-agentic-os-an-llm-agent-framework-for-linux-schedulers,Article,Minor,❌,,HTML/Blog,,,,,,https://arxiv.org/abs/2509.01245,Press,Auto-Discovery,,,,2025-09-29
SEDM: Scalable Self-Evolving Distributed Memory for Agents,sedm-scalable-self-evolving-distributed-memory-for-agents,Article,Minor,❌,,HTML/Blog,,,,,,https://arxiv.org/abs/2509.09498,Press,Auto-Discovery,,,,2025-09-29
"The STAR-XAI Protocol: A Framework for Inducing and Verifying Agency, Reasoning, and Reliability in AI Agents",the-star-xai-protocol-a-framework-for-inducing-and-verifying-agency-reasoning-and-reliability-in-ai-agents,Article,Minor,❌,,HTML/Blog,,,,,,https://arxiv.org/abs/2509.17978,Press,Auto-Discovery,,,,2025-09-29
VDFD: Multi-Agent Value Decomposition Framework with Disentangled World Model,vdfd-multi-agent-value-decomposition-framework-with-disentangled-world-model,Article,Minor,❌,,HTML/Blog,,,,,,https://arxiv.org/abs/2309.04615,Press,Auto-Discovery,,,,2025-09-29
Diffusion Curriculum: Synthetic-to-Real Data Curriculum via Image-Guided Diffusion,diffusion-curriculum-synthetic-to-real-data-curriculum-via-image-guided-diffusion,Article,Minor,❌,,HTML/Blog,,,,,,https://arxiv.org/abs/2410.13674,Press,Auto-Discovery,,,,2025-09-29
Capacity-Aware Planning and Scheduling in Budget-Constrained Multi-Agent MDPs: A Meta-RL Approach,capacity-aware-planning-and-scheduling-in-budget-constrained-multi-agent-mdps-a-meta-rl-approach,Article,Minor,❌,,HTML/Blog,,,,,,https://arxiv.org/abs/2410.21249,Press,Auto-Discovery,,,,2025-09-29
How Strategic Agents Respond: Comparing Analytical Models with LLM-Generated Responses in Strategic Classification,how-strategic-agents-respond-comparing-analytical-models-with-llm-generated-responses-in-strategic-classification,Article,Minor,❌,,HTML/Blog,,,,,,https://arxiv.org/abs/2501.16355,Press,Auto-Discovery,,,,2025-09-29
"VidCRAFT3: Camera, Object, and Lighting Control for Image-to-Video Generation",vidcraft3-camera-object-and-lighting-control-for-image-to-video-generation,Article,Minor,❌,,HTML/Blog,,,,,,https://arxiv.org/abs/2502.07531,Press,Auto-Discovery,,,,2025-09-29
Comparing Uncertainty Measurement and Mitigation Methods for Large Language Models: A Systematic Review,comparing-uncertainty-measurement-and-mitigation-methods-for-large-language-models-a-systematic-review,Article,Minor,❌,,HTML/Blog,,,,,,https://arxiv.org/abs/2504.18346,Press,Auto-Discovery,,,,2025-09-29
Neural Orchestration for Multi-Agent Systems: A Deep Learning Framework for Optimal Agent Selection in Multi-Domain Task Environments,neural-orchestration-for-multi-agent-systems-a-deep-learning-framework-for-optimal-agent-selection-in-multi-domain-task-environments,Article,Minor,❌,,HTML/Blog,,,,,,https://arxiv.org/abs/2505.02861,Press,Auto-Discovery,,,,2025-09-29
HiddenBench: Assessing Collective Reasoning in Multi-Agent LLMs via Hidden Profile Tasks,hiddenbench-assessing-collective-reasoning-in-multi-agent-llms-via-hidden-profile-tasks,Article,Minor,❌,,HTML/Blog,,,,,,https://arxiv.org/abs/2505.11556,Press,Auto-Discovery,,,,2025-09-29
Latent Veracity Inference for Identifying Errors in Stepwise Reasoning,latent-veracity-inference-for-identifying-errors-in-stepwise-reasoning,Article,Minor,❌,,HTML/Blog,,,,,,https://arxiv.org/abs/2505.11824,Press,Auto-Discovery,,,,2025-09-29
VocalAgent: Large Language Models for Vocal Health Diagnostics with Safety-Aware Evaluation,vocalagent-large-language-models-for-vocal-health-diagnostics-with-safety-aware-evaluation,Article,Minor,❌,,HTML/Blog,,,,,,https://arxiv.org/abs/2505.13577,Press,Auto-Discovery,,,,2025-09-29
Beyond Static Testbeds: An Interaction-Centric Agent Simulation Platform for Dynamic Recommender Systems,beyond-static-testbeds-an-interaction-centric-agent-simulation-platform-for-dynamic-recommender-systems,Article,Minor,❌,,HTML/Blog,,,,,,https://arxiv.org/abs/2505.16429,Press,Auto-Discovery,,,,2025-09-29
DORAEMON: Decentralized Ontology-aware Reliable Agent with Enhanced Memory Oriented Navigation,doraemon-decentralized-ontology-aware-reliable-agent-with-enhanced-memory-oriented-navigation,Article,Minor,❌,,HTML/Blog,,,,,,https://arxiv.org/abs/2505.21969,Press,Auto-Discovery,,,,2025-09-29
Physics-Guided Motion Loss for Video Generation Model,physics-guided-motion-loss-for-video-generation-model,Article,Minor,❌,,HTML/Blog,,,,,,https://arxiv.org/abs/2506.02244,Press,Auto-Discovery,,,,2025-09-29
Dual Branch VideoMamba with Gated Class Token Fusion for Violence Detection,dual-branch-videomamba-with-gated-class-token-fusion-for-violence-detection,Article,Minor,❌,,HTML/Blog,,,,,,https://arxiv.org/abs/2506.03162,Press,Auto-Discovery,,,,2025-09-29
VidBridge-R1: Bridging QA and Captioning for RL-based Video Understanding Models with Intermediate Proxy Tasks,vidbridge-r1-bridging-qa-and-captioning-for-rl-based-video-understanding-models-with-intermediate-proxy-tasks,Article,Minor,❌,,HTML/Blog,,,,,,https://arxiv.org/abs/2506.09079,Press,Auto-Discovery,,,,2025-09-29
Think With Videos For Agentic Long-Video Understanding,think-with-videos-for-agentic-long-video-understanding,Article,Minor,❌,,HTML/Blog,,,,,,https://arxiv.org/abs/2506.10821,Press,Auto-Discovery,,,,2025-09-29
Neural-Network solver of ideal MHD equilibria,neural-network-solver-of-ideal-mhd-equilibria,Article,Minor,❌,,HTML/Blog,,,,,,https://arxiv.org/abs/2507.03119,Press,Auto-Discovery,,,,2025-09-29
Evaluating Memory in LLM Agents via Incremental Multi-Turn Interactions,evaluating-memory-in-llm-agents-via-incremental-multi-turn-interactions,Article,Minor,❌,,HTML/Blog,,,,,,https://arxiv.org/abs/2507.05257,Press,Auto-Discovery,,,,2025-09-29
DAMR: Efficient and Adaptive Context-Aware Knowledge Graph Question Answering with LLM-Guided MCTS,damr-efficient-and-adaptive-context-aware-knowledge-graph-question-answering-with-llm-guided-mcts,Article,Minor,❌,,HTML/Blog,,,,,,https://arxiv.org/abs/2508.00719,Press,Auto-Discovery,,,,2025-09-29
Decentralized Aerial Manipulation of a Cable-Suspended Load using Multi-Agent Reinforcement Learning,decentralized-aerial-manipulation-of-a-cable-suspended-load-using-multi-agent-reinforcement-learning,Article,Minor,❌,,HTML/Blog,,,,,,https://arxiv.org/abs/2508.01522,Press,Auto-Discovery,,,,2025-09-29
Hallucination to Truth: A Review of Fact-Checking and Factuality Evaluation in Large Language Models,hallucination-to-truth-a-review-of-fact-checking-and-factuality-evaluation-in-large-language-models,Article,Minor,❌,,HTML/Blog,,,,,,https://arxiv.org/abs/2508.03860,Press,Auto-Discovery,,,,2025-09-29
ERIS: An Energy-Guided Feature Disentanglement Framework for Out-of-Distribution Time Series Classification,eris-an-energy-guided-feature-disentanglement-framework-for-out-of-distribution-time-series-classification,Article,Minor,❌,,HTML/Blog,,,,,,https://arxiv.org/abs/2508.14134,Press,Auto-Discovery,,,,2025-09-29
Show HN: Overcut.ai – Automate Your SDLC with Agentic Workflows,show-hn-overcut-ai-automate-your-sdlc-with-agentic-workflows,Article,Minor,❌,,HTML/Blog,,,,,,https://overcut.ai/,Press,Auto-Discovery,,,,2025-09-30
Show HN: Build an e-commerce store ready for agentic checkout,show-hn-build-an-e-commerce-store-ready-for-agentic-checkout,Article,Minor,❌,,HTML/Blog,,,,,,https://www.searchagora.com/build-store,Press,Auto-Discovery,,,,2025-09-30
BrowserPod: In-browser full-stack environments for IDEs and Agents via Wasm,browserpod-in-browser-full-stack-environments-for-ides-and-agents-via-wasm,Article,Minor,❌,,HTML/Blog,,,,,,https://www.reddit.com/r/programming/comments/1nu853i/browserpod_inbrowser_fullstack_environments_for/,Press,Auto-Discovery,,,,2025-09-30
Prototype-First Software Design With Agents,prototype-first-software-design-with-agents,Article,Minor,❌,,HTML/Blog,,,,,,https://www.reddit.com/r/programming/comments/1nucce7/prototypefirst_software_design_with_agents/,Press,Auto-Discovery,,,,2025-09-30
Release Orchestration: A Practical Guide for 2025,release-orchestration-a-practical-guide-for-2025,Article,Minor,❌,,HTML/Blog,,,,,,https://www.reddit.com/r/programming/comments/1ntmq69/release_orchestration_a_practical_guide_for_2025/,Press,Auto-Discovery,,,,2025-09-30
Inside NVIDIA GPUs: Anatomy of high performance matmul kernels,inside-nvidia-gpus-anatomy-of-high-performance-matmul-kernels,Article,Minor,❌,,HTML/Blog,,,,,,https://www.reddit.com/r/programming/comments/1ntprvz/inside_nvidia_gpus_anatomy_of_high_performance/,Press,Auto-Discovery,,,,2025-09-30
Further experiments with MCP rebuilt on gRPC: enforceable schemas and trust boundaries,further-experiments-with-mcp-rebuilt-on-grpc-enforceable-schemas-and-trust-boundaries,Article,Minor,❌,,HTML/Blog,,,,,,https://www.reddit.com/r/programming/comments/1nu43dq/further_experiments_with_mcp_rebuilt_on_grpc/,Press,Auto-Discovery,,,,2025-09-30
"AI Agents Hackathon in NYC this Saturday (Oct 4) w/ OpenAI, Datadog & $50K+ in prizes",ai-agents-hackathon-in-nyc-this-saturday-oct-4-w-openai-datadog-50k-in-prizes,Article,Minor,❌,,HTML/Blog,,,,,,https://www.reddit.com/r/programming/comments/1nu9pi4/ai_agents_hackathon_in_nyc_this_saturday_oct_4_w/,Press,Auto-Discovery,,,,2025-09-30
Lessons learned from building AI agents in the consumer space,lessons-learned-from-building-ai-agents-in-the-consumer-space,Article,Minor,❌,,HTML/Blog,,,,,,https://www.reddit.com/r/programming/comments/1nu3y89/lessons_learned_from_building_ai_agents_in_the/,Press,Auto-Discovery,,,,2025-09-30
inclusionAI/Ring-1T-preview,inclusionai-ring-1t-preview,Article,Minor,❌,,HTML/Blog,,,,,,https://www.reddit.com/r/LocalLLaMA/comments/1ntrau8/inclusionairing1tpreview/,Press,Auto-Discovery,,,,2025-09-30
Ring 1T Preview out??,ring-1t-preview-out,Article,Minor,❌,,HTML/Blog,,,,,,https://www.reddit.com/r/LocalLLaMA/comments/1nu06l4/ring_1t_preview_out/,Press,Auto-Discovery,,,,2025-09-30
[R] No Prompt Left Behind: Exploiting Zero-Variance Prompts in LLM Reinforcement Learning via Entropy-Guided Advantage Shaping,r-no-prompt-left-behind-exploiting-zero-variance-prompts-in-llm-reinforcement-learning-via-entropy-guided-advantage-shaping,Article,Minor,❌,,HTML/Blog,,,,,,https://www.reddit.com/r/MachineLearning/comments/1ntm0pf/r_no_prompt_left_behind_exploiting_zerovariance/,Press,Auto-Discovery,,,,2025-09-30
Accelerating Qwen3-8B Agent on Intel® Core™ Ultra with Depth-Pruned Draft Models,accelerating-qwen3-8b-agent-on-intel-core-ultra-with-depth-pruned-draft-models,Article,Minor,❌,,HTML/Blog,,,,,,https://huggingface.co/blog/intel-qwen3-agent,Press,Auto-Discovery,,,,2025-09-30
Creative Adversarial Testing (CAT): A Novel Framework for Evaluating Goal-Oriented Agentic AI Systems,creative-adversarial-testing-cat-a-novel-framework-for-evaluating-goal-oriented-agentic-ai-systems,Article,Minor,❌,,HTML/Blog,,,,,,https://arxiv.org/abs/2509.23006,Press,Auto-Discovery,,,,2025-09-30
Kimi-Dev: Agentless Training as Skill Prior for SWE-Agents,kimi-dev-agentless-training-as-skill-prior-for-swe-agents,Article,Minor,❌,,HTML/Blog,,,,,,https://arxiv.org/abs/2509.23045,Press,Auto-Discovery,,,,2025-09-30
Artificial Phantasia: Evidence for Propositional Reasoning-Based Mental Imagery in Large Language Models,artificial-phantasia-evidence-for-propositional-reasoning-based-mental-imagery-in-large-language-models,Article,Minor,❌,,HTML/Blog,,,,,,https://arxiv.org/abs/2509.23108,Press,Auto-Discovery,,,,2025-09-30
"Agentic AI Reasoning for Mobile Edge General Intelligence: Fundamentals, Approaches, and Directions",agentic-ai-reasoning-for-mobile-edge-general-intelligence-fundamentals-approaches-and-directions,Article,Minor,❌,,HTML/Blog,,,,,,https://arxiv.org/abs/2509.23248,Press,Auto-Discovery,,,,2025-09-30
GUI-PRA: Process Reward Agent for GUI Tasks,gui-pra-process-reward-agent-for-gui-tasks,Article,Minor,❌,,HTML/Blog,,,,,,https://arxiv.org/abs/2509.23263,Press,Auto-Discovery,,,,2025-09-30
Socio-Economic Model of AI Agents,socio-economic-model-of-ai-agents,Article,Minor,❌,,HTML/Blog,,,,,,https://arxiv.org/abs/2509.23270,Press,Auto-Discovery,,,,2025-09-30
From Conversation to Query Execution: Benchmarking User and Tool Interactions for EHR Database Agents,from-conversation-to-query-execution-benchmarking-user-and-tool-interactions-for-ehr-database-agents,Article,Minor,❌,,HTML/Blog,,,,,,https://arxiv.org/abs/2509.23415,Press,Auto-Discovery,,,,2025-09-30
ViTSP: A Vision Language Models Guided Framework for Large-Scale Traveling Salesman Problems,vitsp-a-vision-language-models-guided-framework-for-large-scale-traveling-salesman-problems,Article,Minor,❌,,HTML/Blog,,,,,,https://arxiv.org/abs/2509.23465,Press,Auto-Discovery,,,,2025-09-30
Beyond the Strongest LLM: Multi-Turn Multi-Agent Orchestration vs. Single LLMs on Benchmarks,beyond-the-strongest-llm-multi-turn-multi-agent-orchestration-vs-single-llms-on-benchmarks,Article,Minor,❌,,HTML/Blog,,,,,,https://arxiv.org/abs/2509.23537,Press,Auto-Discovery,,,,2025-09-30
PSG-Agent: Personality-Aware Safety Guardrail for LLM-based Agents,psg-agent-personality-aware-safety-guardrail-for-llm-based-agents,Article,Minor,❌,,HTML/Blog,,,,,,https://arxiv.org/abs/2509.23614,Press,Auto-Discovery,,,,2025-09-30
SafeSearch: Automated Red-Teaming for the Safety of LLM-Based Search Agents,safesearch-automated-red-teaming-for-the-safety-of-llm-based-search-agents,Article,Minor,❌,,HTML/Blog,,,,,,https://arxiv.org/abs/2509.23694,Press,Auto-Discovery,,,,2025-09-30
MedLA: A Logic-Driven Multi-Agent Framework for Complex Medical Reasoning with Large Language Models,medla-a-logic-driven-multi-agent-framework-for-complex-medical-reasoning-with-large-language-models,Article,Minor,❌,,HTML/Blog,,,,,,https://arxiv.org/abs/2509.23725,Press,Auto-Discovery,,,,2025-09-30
"Diagnosing Failure Root Causes in Platform-Orchestrated Agentic Systems: Dataset, Taxonomy, and Benchmark",diagnosing-failure-root-causes-in-platform-orchestrated-agentic-systems-dataset-taxonomy-and-benchmark,Article,Minor,❌,,HTML/Blog,,,,,,https://arxiv.org/abs/2509.23735,Press,Auto-Discovery,,,,2025-09-30
Transparent Visual Reasoning via Object-Centric Agent Collaboration,transparent-visual-reasoning-via-object-centric-agent-collaboration,Article,Minor,❌,,HTML/Blog,,,,,,https://arxiv.org/abs/2509.23757,Press,Auto-Discovery,,,,2025-09-30
From What to Why: A Multi-Agent System for Evidence-based Chemical Reaction Condition Reasoning,from-what-to-why-a-multi-agent-system-for-evidence-based-chemical-reaction-condition-reasoning,Article,Minor,❌,,HTML/Blog,,,,,,https://arxiv.org/abs/2509.23768,Press,Auto-Discovery,,,,2025-09-30
AgentGuard: Runtime Verification of AI Agents,agentguard-runtime-verification-of-ai-agents,Article,Minor,❌,,HTML/Blog,,,,,,https://arxiv.org/abs/2509.23864,Press,Auto-Discovery,,,,2025-09-30
Rethinking Reward Miscalibration of GRPO in Agentic RL,rethinking-reward-miscalibration-of-grpo-in-agentic-rl,Article,Minor,❌,,HTML/Blog,,,,,,https://arxiv.org/abs/2509.23870,Press,Auto-Discovery,,,,2025-09-30
Automatic selection of primary studies in systematic reviews with evolutionary rule-based classification,automatic-selection-of-primary-studies-in-systematic-reviews-with-evolutionary-rule-based-classification,Article,Minor,❌,,HTML/Blog,,,,,,https://arxiv.org/abs/2509.23981,Press,Auto-Discovery,,,,2025-09-30
TusoAI: Agentic Optimization for Scientific Methods,tusoai-agentic-optimization-for-scientific-methods,Article,Minor,❌,,HTML/Blog,,,,,,https://arxiv.org/abs/2509.23986,Press,Auto-Discovery,,,,2025-09-30
LLM/Agent-as-Data-Analyst: A Survey,llm-agent-as-data-analyst-a-survey,Article,Minor,❌,,HTML/Blog,,,,,,https://arxiv.org/abs/2509.23988,Press,Auto-Discovery,,,,2025-09-30
"Transparent, Evaluable, and Accessible Data Agents: A Proof-of-Concept Framework",transparent-evaluable-and-accessible-data-agents-a-proof-of-concept-framework,Article,Minor,❌,,HTML/Blog,,,,,,https://arxiv.org/abs/2509.24127,Press,Auto-Discovery,,,,2025-09-30
ELHPlan: Efficient Long-Horizon Task Planning for Multi-Agent Collaboration,elhplan-efficient-long-horizon-task-planning-for-multi-agent-collaboration,Article,Minor,❌,,HTML/Blog,,,,,,https://arxiv.org/abs/2509.24230,Press,Auto-Discovery,,,,2025-09-30
PAME-AI: Patient Messaging Creation and Optimization using Agentic AI,pame-ai-patient-messaging-creation-and-optimization-using-agentic-ai,Article,Minor,❌,,HTML/Blog,,,,,,https://arxiv.org/abs/2509.24263,Press,Auto-Discovery,,,,2025-09-30
MedMMV: A Controllable Multimodal Multi-Agent Framework for Reliable and Verifiable Clinical Reasoning,medmmv-a-controllable-multimodal-multi-agent-framework-for-reliable-and-verifiable-clinical-reasoning,Article,Minor,❌,,HTML/Blog,,,,,,https://arxiv.org/abs/2509.24314,Press,Auto-Discovery,,,,2025-09-30
"A Systematic Review of Digital Twin-Driven Predictive Maintenance in Industrial Engineering: Taxonomy, Architectural Elements, and Future Research Directions",a-systematic-review-of-digital-twin-driven-predictive-maintenance-in-industrial-engineering-taxonomy-architectural-elements-and-future-research-directions,Article,Minor,❌,,HTML/Blog,,,,,,https://arxiv.org/abs/2509.24443,Press,Auto-Discovery,,,,2025-09-30
Experience-guided reflective co-evolution of prompts and heuristics for automatic algorithm design,experience-guided-reflective-co-evolution-of-prompts-and-heuristics-for-automatic-algorithm-design,Article,Minor,❌,,HTML/Blog,,,,,,https://arxiv.org/abs/2509.24509,Press,Auto-Discovery,,,,2025-09-30
Training Agents Inside of Scalable World Models,training-agents-inside-of-scalable-world-models,Article,Minor,❌,,HTML/Blog,,,,,,https://arxiv.org/abs/2509.24527,Press,Auto-Discovery,,,,2025-09-30
