Tool,Moniker,Category,Severity,RSS Available,Feed URL,Tracking Method,Repo URL,Repo Status,Stars,Contributors,Docs URL,Website URL,Source Type,Discovery Method,Launch Status,Last Seen Update,Status,Date Added
MiniMax-M2 is the new king of open source LLMs (especially for agentic tool calling),minimax-m2-is-the-new-king-of-open-source-llms-especially-for-agentic-tool-calling,Article,Minor,❌,,HTML/Blog,,,,,,https://venturebeat.com/ai/minimax-m2-is-the-new-king-of-open-source-llms-especially-for-agentic-tool,Press,Auto-Discovery,,,,2025-10-28
Google's 'Watch & Learn' framework cracks the data bottleneck for training computer-use agents,google-s-watch-learn-framework-cracks-the-data-bottleneck-for-training-computer-use-agents,Article,Minor,❌,,HTML/Blog,,,,,,https://venturebeat.com/ai/googles-watch-and-learn-framework-cracks-the-data-bottleneck-for-training,Press,Auto-Discovery,,,,2025-10-28
Capability Ceilings in Autoregressive Language Models: Empirical Evidence from Knowledge-Intensive Tasks,capability-ceilings-in-autoregressive-language-models-empirical-evidence-from-knowledge-intensive-tasks,Article,Minor,❌,,HTML/Blog,,,,,,https://arxiv.org/abs/2510.21866,Press,Auto-Discovery,,,,2025-10-28
Foundation of Intelligence: Review of Math Word Problems from Human Cognition Perspective,foundation-of-intelligence-review-of-math-word-problems-from-human-cognition-perspective,Article,Minor,❌,,HTML/Blog,,,,,,https://arxiv.org/abs/2510.21999,Press,Auto-Discovery,,,,2025-10-28
LightAgent: Mobile Agentic Foundation Models,lightagent-mobile-agentic-foundation-models,Article,Minor,❌,,HTML/Blog,,,,,,https://arxiv.org/abs/2510.22009,Press,Auto-Discovery,,,,2025-10-28
Energy-Efficient Domain-Specific Artificial Intelligence Models and Agents: Pathways and Paradigms,energy-efficient-domain-specific-artificial-intelligence-models-and-agents-pathways-and-paradigms,Article,Minor,❌,,HTML/Blog,,,,,,https://arxiv.org/abs/2510.22052,Press,Auto-Discovery,,,,2025-10-28
Embracing Trustworthy Brain-Agent Collaboration as Paradigm Extension for Intelligent Assistive Technologies,embracing-trustworthy-brain-agent-collaboration-as-paradigm-extension-for-intelligent-assistive-technologies,Article,Minor,❌,,HTML/Blog,,,,,,https://arxiv.org/abs/2510.22095,Press,Auto-Discovery,,,,2025-10-28
PACR: Progressively Ascending Confidence Reward for LLM Reasoning,pacr-progressively-ascending-confidence-reward-for-llm-reasoning,Article,Minor,❌,,HTML/Blog,,,,,,https://arxiv.org/abs/2510.22255,Press,Auto-Discovery,,,,2025-10-28
OFFSIDE: Benchmarking Unlearning Misinformation in Multimodal Large Language Models,offside-benchmarking-unlearning-misinformation-in-multimodal-large-language-models,Article,Minor,❌,,HTML/Blog,,,,,,https://arxiv.org/abs/2510.22535,Press,Auto-Discovery,,,,2025-10-28
"SwiftSolve: A Self-Iterative, Complexity-Aware Multi-Agent Framework for Competitive Programming",swiftsolve-a-self-iterative-complexity-aware-multi-agent-framework-for-competitive-programming,Article,Minor,❌,,HTML/Blog,,,,,,https://arxiv.org/abs/2510.22626,Press,Auto-Discovery,,,,2025-10-28
How Do AI Agents Do Human Work? Comparing AI and Human Workflows Across Diverse Occupations,how-do-ai-agents-do-human-work-comparing-ai-and-human-workflows-across-diverse-occupations,Article,Minor,❌,,HTML/Blog,,,,,,https://arxiv.org/abs/2510.22780,Press,Auto-Discovery,,,,2025-10-28
Agentic Meta-Orchestrator for Multi-task Copilots,agentic-meta-orchestrator-for-multi-task-copilots,Article,Minor,❌,,HTML/Blog,,,,,,https://arxiv.org/abs/2510.22781,Press,Auto-Discovery,,,,2025-10-28
HRM-Agent: Training a recurrent reasoning model in dynamic environments using reinforcement learning,hrm-agent-training-a-recurrent-reasoning-model-in-dynamic-environments-using-reinforcement-learning,Article,Minor,❌,,HTML/Blog,,,,,,https://arxiv.org/abs/2510.22832,Press,Auto-Discovery,,,,2025-10-28
Toward Agents That Reason About Their Computation,toward-agents-that-reason-about-their-computation,Article,Minor,❌,,HTML/Blog,,,,,,https://arxiv.org/abs/2510.22833,Press,Auto-Discovery,,,,2025-10-28
Lyapunov Function-guided Reinforcement Learning for Flight Control,lyapunov-function-guided-reinforcement-learning-for-flight-control,Article,Minor,❌,,HTML/Blog,,,,,,https://arxiv.org/abs/2510.22840,Press,Auto-Discovery,,,,2025-10-28
On Generalization in Agentic Tool Calling: CoreThink Agentic Reasoner and MAVEN Dataset,on-generalization-in-agentic-tool-calling-corethink-agentic-reasoner-and-maven-dataset,Article,Minor,❌,,HTML/Blog,,,,,,https://arxiv.org/abs/2510.22898,Press,Auto-Discovery,,,,2025-10-28
Multi-Agent Conditional Diffusion Model with Mean Field Communication as Wireless Resource Allocation Planner,multi-agent-conditional-diffusion-model-with-mean-field-communication-as-wireless-resource-allocation-planner,Article,Minor,❌,,HTML/Blog,,,,,,https://arxiv.org/abs/2510.22969,Press,Auto-Discovery,,,,2025-10-28
"Smaller Models, Smarter Rewards: A Two-Sided Approach to Process and Outcome Rewards",smaller-models-smarter-rewards-a-two-sided-approach-to-process-and-outcome-rewards,Article,Minor,❌,,HTML/Blog,,,,,,https://arxiv.org/abs/2510.23083,Press,Auto-Discovery,,,,2025-10-28
A Neuro-Symbolic Multi-Agent Approach to Legal-Cybersecurity Knowledge Integration,a-neuro-symbolic-multi-agent-approach-to-legal-cybersecurity-knowledge-integration,Article,Minor,❌,,HTML/Blog,,,,,,https://arxiv.org/abs/2510.23443,Press,Auto-Discovery,,,,2025-10-28
Are Agents Just Automata? On the Formal Equivalence Between Agentic AI and the Chomsky Hierarchy,are-agents-just-automata-on-the-formal-equivalence-between-agentic-ai-and-the-chomsky-hierarchy,Article,Minor,❌,,HTML/Blog,,,,,,https://arxiv.org/abs/2510.23487,Press,Auto-Discovery,,,,2025-10-28
Reduced AI Acceptance After the Generative AI Boom: Evidence From a Two-Wave Survey Study,reduced-ai-acceptance-after-the-generative-ai-boom-evidence-from-a-two-wave-survey-study,Article,Minor,❌,,HTML/Blog,,,,,,https://arxiv.org/abs/2510.23578,Press,Auto-Discovery,,,,2025-10-28
Multi-Agent Evolve: LLM Self-Improve through Co-evolution,multi-agent-evolve-llm-self-improve-through-co-evolution,Article,Minor,❌,,HTML/Blog,,,,,,https://arxiv.org/abs/2510.23595,Press,Auto-Discovery,,,,2025-10-28
Alita-G: Self-Evolving Generative Agent for Agent Generation,alita-g-self-evolving-generative-agent-for-agent-generation,Article,Minor,❌,,HTML/Blog,,,,,,https://arxiv.org/abs/2510.23601,Press,Auto-Discovery,,,,2025-10-28
"J-ORA: A Framework and Multimodal Dataset for Japanese Object Identification, Reference, Action Prediction in Robot Perception",j-ora-a-framework-and-multimodal-dataset-for-japanese-object-identification-reference-action-prediction-in-robot-perception,Article,Minor,❌,,HTML/Blog,,,,,,https://arxiv.org/abs/2510.21761,Press,Auto-Discovery,,,,2025-10-28
EventFormer: A Node-graph Hierarchical Attention Transformer for Action-centric Video Event Prediction,eventformer-a-node-graph-hierarchical-attention-transformer-for-action-centric-video-event-prediction,Article,Minor,❌,,HTML/Blog,,,,,,https://arxiv.org/abs/2510.21786,Press,Auto-Discovery,,,,2025-10-28
2D_3D Feature Fusion via Cross-Modal Latent Synthesis and Attention Guided Restoration for Industrial Anomaly Detection,2d-3d-feature-fusion-via-cross-modal-latent-synthesis-and-attention-guided-restoration-for-industrial-anomaly-detection,Article,Minor,❌,,HTML/Blog,,,,,,https://arxiv.org/abs/2510.21793,Press,Auto-Discovery,,,,2025-10-28
A Physics-Guided AI Cascaded Corrector Model Significantly Extends Madden-Julian Oscillation Prediction Skill,a-physics-guided-ai-cascaded-corrector-model-significantly-extends-madden-julian-oscillation-prediction-skill,Article,Minor,❌,,HTML/Blog,,,,,,https://arxiv.org/abs/2510.21796,Press,Auto-Discovery,,,,2025-10-28
Quantifying Multimodal Imbalance: A GMM-Guided Adaptive Loss for Audio-Visual Learning,quantifying-multimodal-imbalance-a-gmm-guided-adaptive-loss-for-audio-visual-learning,Article,Minor,❌,,HTML/Blog,,,,,,https://arxiv.org/abs/2510.21797,Press,Auto-Discovery,,,,2025-10-28
Frame-Difference Guided Dynamic Region Perception for CLIP Adaptation in Text-Video Retrieval,frame-difference-guided-dynamic-region-perception-for-clip-adaptation-in-text-video-retrieval,Article,Minor,❌,,HTML/Blog,,,,,,https://arxiv.org/abs/2510.21806,Press,Auto-Discovery,,,,2025-10-28
Prompt fidelity of ChatGPT4o / Dall-E3 text-to-image visualisations,prompt-fidelity-of-chatgpt4o-dall-e3-text-to-image-visualisations,Article,Minor,❌,,HTML/Blog,,,,,,https://arxiv.org/abs/2510.21821,Press,Auto-Discovery,,,,2025-10-28
Software Engineering Agents for Embodied Controller Generation : A Study in Minigrid Environments,software-engineering-agents-for-embodied-controller-generation-a-study-in-minigrid-environments,Article,Minor,❌,,HTML/Blog,,,,,,https://arxiv.org/abs/2510.21902,Press,Auto-Discovery,,,,2025-10-28
TOM-SWE: User Mental Modeling For Software Engineering Agents,tom-swe-user-mental-modeling-for-software-engineering-agents,Article,Minor,❌,,HTML/Blog,,,,,,https://arxiv.org/abs/2510.21903,Press,Auto-Discovery,,,,2025-10-28
Impact and Implications of Generative AI for Enterprise Architects in Agile Environments: A Systematic Literature Review,impact-and-implications-of-generative-ai-for-enterprise-architects-in-agile-environments-a-systematic-literature-review,Article,Minor,❌,,HTML/Blog,,,,,,https://arxiv.org/abs/2510.22003,Press,Auto-Discovery,,,,2025-10-28
VLM-SlideEval: Evaluating VLMs on Structured Comprehension and Perturbation Sensitivity in PPT,vlm-slideeval-evaluating-vlms-on-structured-comprehension-and-perturbation-sensitivity-in-ppt,Article,Minor,❌,,HTML/Blog,,,,,,https://arxiv.org/abs/2510.22045,Press,Auto-Discovery,,,,2025-10-28
Human-Centric Anomaly Detection in Surveillance Videos Using YOLO-World and Spatio-Temporal Deep Learning,human-centric-anomaly-detection-in-surveillance-videos-using-yolo-world-and-spatio-temporal-deep-learning,Article,Minor,❌,,HTML/Blog,,,,,,https://arxiv.org/abs/2510.22056,Press,Auto-Discovery,,,,2025-10-28
Agentic Reinforcement Learning for Real-World Code Repair,agentic-reinforcement-learning-for-real-world-code-repair,Article,Minor,❌,,HTML/Blog,,,,,,https://arxiv.org/abs/2510.22075,Press,Auto-Discovery,,,,2025-10-28
GRAID: Enhancing Spatial Reasoning of VLMs Through High-Fidelity Data Generation,graid-enhancing-spatial-reasoning-of-vlms-through-high-fidelity-data-generation,Article,Minor,❌,,HTML/Blog,,,,,,https://arxiv.org/abs/2510.22118,Press,Auto-Discovery,,,,2025-10-28
LSPRAG: LSP-Guided RAG for Language-Agnostic Real-Time Unit Test Generation,lsprag-lsp-guided-rag-for-language-agnostic-real-time-unit-test-generation,Article,Minor,❌,,HTML/Blog,,,,,,https://arxiv.org/abs/2510.22210,Press,Auto-Discovery,,,,2025-10-28
Knowledge-guided Continual Learning for Behavioral Analytics Systems,knowledge-guided-continual-learning-for-behavioral-analytics-systems,Article,Minor,❌,,HTML/Blog,,,,,,https://arxiv.org/abs/2510.22405,Press,Auto-Discovery,,,,2025-10-28
Group size effects and collective misalignment in LLM multi-agent systems,group-size-effects-and-collective-misalignment-in-llm-multi-agent-systems,Article,Minor,❌,,HTML/Blog,,,,,,https://arxiv.org/abs/2510.22422,Press,Auto-Discovery,,,,2025-10-28
Agent-GSPO: Communication-Efficient Multi-Agent Systems via Group Sequence Policy Optimization,agent-gspo-communication-efficient-multi-agent-systems-via-group-sequence-policy-optimization,Article,Minor,❌,,HTML/Blog,,,,,,https://arxiv.org/abs/2510.22477,Press,Auto-Discovery,,,,2025-10-28
Accelerating Materials Design via LLM-Guided Evolutionary Search,accelerating-materials-design-via-llm-guided-evolutionary-search,Article,Minor,❌,,HTML/Blog,,,,,,https://arxiv.org/abs/2510.22503,Press,Auto-Discovery,,,,2025-10-28
Transitive RL: Value Learning via Divide and Conquer,transitive-rl-value-learning-via-divide-and-conquer,Article,Minor,❌,,HTML/Blog,,,,,,https://arxiv.org/abs/2510.22512,Press,Auto-Discovery,,,,2025-10-28
Does In-IDE Calibration of Large Language Models work at Scale?,does-in-ide-calibration-of-large-language-models-work-at-scale,Article,Minor,❌,,HTML/Blog,,,,,,https://arxiv.org/abs/2510.22614,Press,Auto-Discovery,,,,2025-10-28
Breaking Agent Backbones: Evaluating the Security of Backbone LLMs in AI Agents,breaking-agent-backbones-evaluating-the-security-of-backbone-llms-in-ai-agents,Article,Minor,❌,,HTML/Blog,,,,,,https://arxiv.org/abs/2510.22620,Press,Auto-Discovery,,,,2025-10-28
Collaborative LLM Agents for C4 Software Architecture Design Automation,collaborative-llm-agents-for-c4-software-architecture-design-automation,Article,Minor,❌,,HTML/Blog,,,,,,https://arxiv.org/abs/2510.22787,Press,Auto-Discovery,,,,2025-10-28
Language Server CLI Empowers Language Agents with Process Rewards,language-server-cli-empowers-language-agents-with-process-rewards,Article,Minor,❌,,HTML/Blog,,,,,,https://arxiv.org/abs/2510.22907,Press,Auto-Discovery,,,,2025-10-28
FAME: Fairness-aware Attention-modulated Video Editing,fame-fairness-aware-attention-modulated-video-editing,Article,Minor,❌,,HTML/Blog,,,,,,https://arxiv.org/abs/2510.22960,Press,Auto-Discovery,,,,2025-10-28
CompressionAttack: Exploiting Prompt Compression as a New Attack Surface in LLM-Powered Agents,compressionattack-exploiting-prompt-compression-as-a-new-attack-surface-in-llm-powered-agents,Article,Minor,❌,,HTML/Blog,,,,,,https://arxiv.org/abs/2510.22963,Press,Auto-Discovery,,,,2025-10-28
MAD-Fact: A Multi-Agent Debate Framework for Long-Form Factuality Evaluation in LLMs,mad-fact-a-multi-agent-debate-framework-for-long-form-factuality-evaluation-in-llms,Article,Minor,❌,,HTML/Blog,,,,,,https://arxiv.org/abs/2510.22967,Press,Auto-Discovery,,,,2025-10-28
Incentivizing Agentic Reasoning in LLM Judges via Tool-Integrated Reinforcement Learning,incentivizing-agentic-reasoning-in-llm-judges-via-tool-integrated-reinforcement-learning,Article,Minor,❌,,HTML/Blog,,,,,,https://arxiv.org/abs/2510.23038,Press,Auto-Discovery,,,,2025-10-28
GroupSHAP-Guided Integration of Financial News Keywords and Technical Indicators for Stock Price Prediction,groupshap-guided-integration-of-financial-news-keywords-and-technical-indicators-for-stock-price-prediction,Article,Minor,❌,,HTML/Blog,,,,,,https://arxiv.org/abs/2510.23112,Press,Auto-Discovery,,,,2025-10-28
Adapting Interleaved Encoders with PPO for Language-Guided Reinforcement Learning in BabyAI,adapting-interleaved-encoders-with-ppo-for-language-guided-reinforcement-learning-in-babyai,Article,Minor,❌,,HTML/Blog,,,,,,https://arxiv.org/abs/2510.23148,Press,Auto-Discovery,,,,2025-10-28
BrowseConf: Confidence-Guided Test-Time Scaling for Web Agents,browseconf-confidence-guided-test-time-scaling-for-web-agents,Article,Minor,❌,,HTML/Blog,,,,,,https://arxiv.org/abs/2510.23458,Press,Auto-Discovery,,,,2025-10-28
A Survey of Data Agents: Emerging Paradigm or Overstated Hype?,a-survey-of-data-agents-emerging-paradigm-or-overstated-hype,Article,Minor,❌,,HTML/Blog,,,,,,https://arxiv.org/abs/2510.23587,Press,Auto-Discovery,,,,2025-10-28
Integrated Design and Governance of Agentic AI Systems through Adaptive Information Modulation,integrated-design-and-governance-of-agentic-ai-systems-through-adaptive-information-modulation,Article,Minor,❌,,HTML/Blog,,,,,,https://arxiv.org/abs/2409.10372,Press,Auto-Discovery,,,,2025-10-28
Learning to Better Search with Language Models via Guided Reinforced Self-Training,learning-to-better-search-with-language-models-via-guided-reinforced-self-training,Article,Minor,❌,,HTML/Blog,,,,,,https://arxiv.org/abs/2410.02992,Press,Auto-Discovery,,,,2025-10-28
Why Do Multi-Agent LLM Systems Fail?,why-do-multi-agent-llm-systems-fail,Article,Minor,❌,,HTML/Blog,,,,,,https://arxiv.org/abs/2503.13657,Press,Auto-Discovery,,,,2025-10-28
ContextAgent: Context-Aware Proactive LLM Agents with Open-World Sensory Perceptions,contextagent-context-aware-proactive-llm-agents-with-open-world-sensory-perceptions,Article,Minor,❌,,HTML/Blog,,,,,,https://arxiv.org/abs/2505.14668,Press,Auto-Discovery,,,,2025-10-28
E-bike agents: Large Language Model-Driven E-Bike Accident Analysis and Severity Prediction,e-bike-agents-large-language-model-driven-e-bike-accident-analysis-and-severity-prediction,Article,Minor,❌,,HTML/Blog,,,,,,https://arxiv.org/abs/2506.04654,Press,Auto-Discovery,,,,2025-10-28
SEEA-R1: Tree-Structured Reinforcement Fine-Tuning for Self-Evolving Embodied Agents,seea-r1-tree-structured-reinforcement-fine-tuning-for-self-evolving-embodied-agents,Article,Minor,❌,,HTML/Blog,,,,,,https://arxiv.org/abs/2506.21669,Press,Auto-Discovery,,,,2025-10-28
"What Is Your AI Agent Buying? Evaluation, Implications and Emerging Questions for Agentic E-Commerce",what-is-your-ai-agent-buying-evaluation-implications-and-emerging-questions-for-agentic-e-commerce,Article,Minor,❌,,HTML/Blog,,,,,,https://arxiv.org/abs/2508.02630,Press,Auto-Discovery,,,,2025-10-28
MI9: An Integrated Runtime Governance Framework for Agentic AI,mi9-an-integrated-runtime-governance-framework-for-agentic-ai,Article,Minor,❌,,HTML/Blog,,,,,,https://arxiv.org/abs/2508.03858,Press,Auto-Discovery,,,,2025-10-28
Expandable Decision-Making States for Multi-Agent Deep Reinforcement Learning in Soccer Tactical Analysis,expandable-decision-making-states-for-multi-agent-deep-reinforcement-learning-in-soccer-tactical-analysis,Article,Minor,❌,,HTML/Blog,,,,,,https://arxiv.org/abs/2510.00480,Press,Auto-Discovery,,,,2025-10-28
Centralized Reward Agent for Knowledge Sharing and Transfer in Multi-Task Reinforcement Learning,centralized-reward-agent-for-knowledge-sharing-and-transfer-in-multi-task-reinforcement-learning,Article,Minor,❌,,HTML/Blog,,,,,,https://arxiv.org/abs/2408.10858,Press,Auto-Discovery,,,,2025-10-28
Can Large Language Models Unlock Novel Scientific Research Ideas?,can-large-language-models-unlock-novel-scientific-research-ideas,Article,Minor,❌,,HTML/Blog,,,,,,https://arxiv.org/abs/2409.06185,Press,Auto-Discovery,,,,2025-10-28
Scideator: Human-LLM Scientific Idea Generation Grounded in Research-Paper Facet Recombination,scideator-human-llm-scientific-idea-generation-grounded-in-research-paper-facet-recombination,Article,Minor,❌,,HTML/Blog,,,,,,https://arxiv.org/abs/2409.14634,Press,Auto-Discovery,,,,2025-10-28
A Cycle Ride to HDR: Semantics Aware Self-Supervised Framework for Unpaired LDR-to-HDR Image Reconstruction,a-cycle-ride-to-hdr-semantics-aware-self-supervised-framework-for-unpaired-ldr-to-hdr-image-reconstruction,Article,Minor,❌,,HTML/Blog,,,,,,https://arxiv.org/abs/2410.15068,Press,Auto-Discovery,,,,2025-10-28
TrajAgent: An LLM-Agent Framework for Trajectory Modeling via Large-and-Small Model Collaboration,trajagent-an-llm-agent-framework-for-trajectory-modeling-via-large-and-small-model-collaboration,Article,Minor,❌,,HTML/Blog,,,,,,https://arxiv.org/abs/2410.20445,Press,Auto-Discovery,,,,2025-10-28
Improving Video Generation with Human Feedback,improving-video-generation-with-human-feedback,Article,Minor,❌,,HTML/Blog,,,,,,https://arxiv.org/abs/2501.13918,Press,Auto-Discovery,,,,2025-10-28
Shortcuts and Identifiability in Concept-based Models from a Neuro-Symbolic Lens,shortcuts-and-identifiability-in-concept-based-models-from-a-neuro-symbolic-lens,Article,Minor,❌,,HTML/Blog,,,,,,https://arxiv.org/abs/2502.11245,Press,Auto-Discovery,,,,2025-10-28
Identifying Trustworthiness Challenges in Deep Learning Models for Continental-Scale Water Quality Prediction,identifying-trustworthiness-challenges-in-deep-learning-models-for-continental-scale-water-quality-prediction,Article,Minor,❌,,HTML/Blog,,,,,,https://arxiv.org/abs/2503.09947,Press,Auto-Discovery,,,,2025-10-28
AttentionRAG: Attention-Guided Context Pruning in Retrieval-Augmented Generation,attentionrag-attention-guided-context-pruning-in-retrieval-augmented-generation,Article,Minor,❌,,HTML/Blog,,,,,,https://arxiv.org/abs/2503.10720,Press,Auto-Discovery,,,,2025-10-28
VEGGIE: Instructional Editing and Reasoning Video Concepts with Grounded Generation,veggie-instructional-editing-and-reasoning-video-concepts-with-grounded-generation,Article,Minor,❌,,HTML/Blog,,,,,,https://arxiv.org/abs/2503.14350,Press,Auto-Discovery,,,,2025-10-28
The Lighthouse of Language: Enhancing LLM Agents via Critique-Guided Improvement,the-lighthouse-of-language-enhancing-llm-agents-via-critique-guided-improvement,Article,Minor,❌,,HTML/Blog,,,,,,https://arxiv.org/abs/2503.16024,Press,Auto-Discovery,,,,2025-10-28
MagicMotion: Controllable Video Generation with Dense-to-Sparse Trajectory Guidance,magicmotion-controllable-video-generation-with-dense-to-sparse-trajectory-guidance,Article,Minor,❌,,HTML/Blog,,,,,,https://arxiv.org/abs/2503.16421,Press,Auto-Discovery,,,,2025-10-28
MOSAIC: Modeling Social AI for Content Dissemination and Regulation in Multi-Agent Simulations,mosaic-modeling-social-ai-for-content-dissemination-and-regulation-in-multi-agent-simulations,Article,Minor,❌,,HTML/Blog,,,,,,https://arxiv.org/abs/2504.07830,Press,Auto-Discovery,,,,2025-10-28
Assessing the Potential of Generative Agents in Crowdsourced Fact-Checking,assessing-the-potential-of-generative-agents-in-crowdsourced-fact-checking,Article,Minor,❌,,HTML/Blog,,,,,,https://arxiv.org/abs/2504.19940,Press,Auto-Discovery,,,,2025-10-28
ARCS: Agentic Retrieval-Augmented Code Synthesis with Iterative Refinement,arcs-agentic-retrieval-augmented-code-synthesis-with-iterative-refinement,Article,Minor,❌,,HTML/Blog,,,,,,https://arxiv.org/abs/2504.20434,Press,Auto-Discovery,,,,2025-10-28
MOOSE-Chem3: Toward Experiment-Guided Hypothesis Ranking via Simulated Experimental Feedback,moose-chem3-toward-experiment-guided-hypothesis-ranking-via-simulated-experimental-feedback,Article,Minor,❌,,HTML/Blog,,,,,,https://arxiv.org/abs/2505.17873,Press,Auto-Discovery,,,,2025-10-28
GSO: Challenging Software Optimization Tasks for Evaluating SWE-Agents,gso-challenging-software-optimization-tasks-for-evaluating-swe-agents,Article,Minor,❌,,HTML/Blog,,,,,,https://arxiv.org/abs/2505.23671,Press,Auto-Discovery,,,,2025-10-28
Identifiability of Deep Polynomial Neural Networks,identifiability-of-deep-polynomial-neural-networks,Article,Minor,❌,,HTML/Blog,,,,,,https://arxiv.org/abs/2506.17093,Press,Auto-Discovery,,,,2025-10-28
Curious Causality-Seeking Agents Learn Meta Causal World,curious-causality-seeking-agents-learn-meta-causal-world,Article,Minor,❌,,HTML/Blog,,,,,,https://arxiv.org/abs/2506.23068,Press,Auto-Discovery,,,,2025-10-28
Agent KB: Leveraging Cross-Domain Experience for Agentic Problem Solving,agent-kb-leveraging-cross-domain-experience-for-agentic-problem-solving,Article,Minor,❌,,HTML/Blog,,,,,,https://arxiv.org/abs/2507.06229,Press,Auto-Discovery,,,,2025-10-28
"Unifying Re-Identification, Attribute Inference, and Data Reconstruction Risks in Differential Privacy",unifying-re-identification-attribute-inference-and-data-reconstruction-risks-in-differential-privacy,Article,Minor,❌,,HTML/Blog,,,,,,https://arxiv.org/abs/2507.06969,Press,Auto-Discovery,,,,2025-10-28
Context-Aware Regularization with Markovian Integration for Attention-Based Nucleotide Analysis,context-aware-regularization-with-markovian-integration-for-attention-based-nucleotide-analysis,Article,Minor,❌,,HTML/Blog,,,,,,https://arxiv.org/abs/2507.09378,Press,Auto-Discovery,,,,2025-10-28
Ground-Compose-Reinforce: Grounding Language in Agentic Behaviours using Limited Data,ground-compose-reinforce-grounding-language-in-agentic-behaviours-using-limited-data,Article,Minor,❌,,HTML/Blog,,,,,,https://arxiv.org/abs/2507.10741,Press,Auto-Discovery,,,,2025-10-28
Beyond Ten Turns: Unlocking Long-Horizon Agentic Search with Large-Scale Asynchronous RL,beyond-ten-turns-unlocking-long-horizon-agentic-search-with-large-scale-asynchronous-rl,Article,Minor,❌,,HTML/Blog,,,,,,https://arxiv.org/abs/2508.07976,Press,Auto-Discovery,,,,2025-10-28
The Role of AI in Facilitating Interdisciplinary Collaboration: Evidence from AlphaFold,the-role-of-ai-in-facilitating-interdisciplinary-collaboration-evidence-from-alphafold,Article,Minor,❌,,HTML/Blog,,,,,,https://arxiv.org/abs/2508.13234,Press,Auto-Discovery,,,,2025-10-28
The Complexity Trap: Simple Observation Masking Is as Efficient as LLM Summarization for Agent Context Management,the-complexity-trap-simple-observation-masking-is-as-efficient-as-llm-summarization-for-agent-context-management,Article,Minor,❌,,HTML/Blog,,,,,,https://arxiv.org/abs/2508.21433,Press,Auto-Discovery,,,,2025-10-28
Editable Noise Map Inversion: Encoding Target-image into Noise For High-Fidelity Image Manipulation,editable-noise-map-inversion-encoding-target-image-into-noise-for-high-fidelity-image-manipulation,Article,Minor,❌,,HTML/Blog,,,,,,https://arxiv.org/abs/2509.25776,Press,Auto-Discovery,,,,2025-10-28
Unmasking Puppeteers: Leveraging Biometric Leakage to Disarm Impersonation in AI-based Videoconferencing,unmasking-puppeteers-leveraging-biometric-leakage-to-disarm-impersonation-in-ai-based-videoconferencing,Article,Minor,❌,,HTML/Blog,,,,,,https://arxiv.org/abs/2510.03548,Press,Auto-Discovery,,,,2025-10-28
IKNet: Interpretable Stock Price Prediction via Keyword-Guided Integration of News and Technical Indicators,iknet-interpretable-stock-price-prediction-via-keyword-guided-integration-of-news-and-technical-indicators,Article,Minor,❌,,HTML/Blog,,,,,,https://arxiv.org/abs/2510.07661,Press,Auto-Discovery,,,,2025-10-28
LLM4Cell: A Survey of Large Language and Agentic Models for Single-Cell Biology,llm4cell-a-survey-of-large-language-and-agentic-models-for-single-cell-biology,Article,Minor,❌,,HTML/Blog,,,,,,https://arxiv.org/abs/2510.07793,Press,Auto-Discovery,,,,2025-10-28
