Tool,Moniker,Category,Severity,RSS Available,Feed URL,Tracking Method,Repo URL,Repo Status,Stars,Contributors,Docs URL,Website URL,Source Type,Discovery Method,Launch Status,Last Seen Update,Status,Date Added
Redefining CX with Agentic AI: Minerva CQ Case Study,redefining-cx-with-agentic-ai-minerva-cq-case-study,Article,Minor,❌,,HTML/Blog,,,,,,https://arxiv.org/abs/2509.12589,Press,Auto-Discovery,,,,2025-09-17
GBV-SQL: Guided Generation and SQL2Text Back-Translation Validation for Multi-Agent Text2SQL,gbv-sql-guided-generation-and-sql2text-back-translation-validation-for-multi-agent-text2sql,Article,Minor,❌,,HTML/Blog,,,,,,https://arxiv.org/abs/2509.12612,Press,Auto-Discovery,,,,2025-09-17
H$^2$R: Hierarchical Hindsight Reflection for Multi-Task LLM Agents,h-2-r-hierarchical-hindsight-reflection-for-multi-task-llm-agents,Article,Minor,❌,,HTML/Blog,,,,,,https://arxiv.org/abs/2509.12810,Press,Auto-Discovery,,,,2025-09-17
HLSMAC: A New StarCraft Multi-Agent Challenge for High-Level Strategic Decision-Making,hlsmac-a-new-starcraft-multi-agent-challenge-for-high-level-strategic-decision-making,Article,Minor,❌,,HTML/Blog,,,,,,https://arxiv.org/abs/2509.12927,Press,Auto-Discovery,,,,2025-09-17
A Visualized Framework for Event Cooperation with Generative Agents,a-visualized-framework-for-event-cooperation-with-generative-agents,Article,Minor,❌,,HTML/Blog,,,,,,https://arxiv.org/abs/2509.13011,Press,Auto-Discovery,,,,2025-09-17
Agentic AI for Financial Crime Compliance,agentic-ai-for-financial-crime-compliance,Article,Minor,❌,,HTML/Blog,,,,,,https://arxiv.org/abs/2509.13137,Press,Auto-Discovery,,,,2025-09-17
G-CSEA: A Graph-Based Conflict Set Extraction Algorithm for Identifying Infeasibility in Pseudo-Boolean Models,g-csea-a-graph-based-conflict-set-extraction-algorithm-for-identifying-infeasibility-in-pseudo-boolean-models,Article,Minor,❌,,HTML/Blog,,,,,,https://arxiv.org/abs/2509.13203,Press,Auto-Discovery,,,,2025-09-17
Towards Trustworthy Agentic IoEV: AI Agents for Explainable Cyberthreat Mitigation and State Analytics,towards-trustworthy-agentic-ioev-ai-agents-for-explainable-cyberthreat-mitigation-and-state-analytics,Article,Minor,❌,,HTML/Blog,,,,,,https://arxiv.org/abs/2509.12233,Press,Auto-Discovery,,,,2025-09-17
Omni-CLST: Error-aware Curriculum Learning with guided Selective chain-of-Thought for audio questuin answering,omni-clst-error-aware-curriculum-learning-with-guided-selective-chain-of-thought-for-audio-questuin-answering,Article,Minor,❌,,HTML/Blog,,,,,,https://arxiv.org/abs/2509.12275,Press,Auto-Discovery,,,,2025-09-17
PromptSculptor: Multi-Agent Based Text-to-Image Prompt Optimization,promptsculptor-multi-agent-based-text-to-image-prompt-optimization,Article,Minor,❌,,HTML/Blog,,,,,,https://arxiv.org/abs/2509.12446,Press,Auto-Discovery,,,,2025-09-17
DoubleAgents: Exploring Mechanisms of Building Trust with Proactive AI,doubleagents-exploring-mechanisms-of-building-trust-with-proactive-ai,Article,Minor,❌,,HTML/Blog,,,,,,https://arxiv.org/abs/2509.12626,Press,Auto-Discovery,,,,2025-09-17
Don't Change My View: Ideological Bias Auditing in Large Language Models,don-t-change-my-view-ideological-bias-auditing-in-large-language-models,Article,Minor,❌,,HTML/Blog,,,,,,https://arxiv.org/abs/2509.12652,Press,Auto-Discovery,,,,2025-09-17
MEGAN: Mixture of Experts for Robust Uncertainty Estimation in Endoscopy Videos,megan-mixture-of-experts-for-robust-uncertainty-estimation-in-endoscopy-videos,Article,Minor,❌,,HTML/Blog,,,,,,https://arxiv.org/abs/2509.12772,Press,Auto-Discovery,,,,2025-09-17
AI Factories: It's time to rethink the Cloud-HPC divide,ai-factories-it-s-time-to-rethink-the-cloud-hpc-divide,Article,Minor,❌,,HTML/Blog,,,,,,https://arxiv.org/abs/2509.12849,Press,Auto-Discovery,,,,2025-09-17
All Roads Lead to Rome: Graph-Based Confidence Estimation for Large Language Model Reasoning,all-roads-lead-to-rome-graph-based-confidence-estimation-for-large-language-model-reasoning,Article,Minor,❌,,HTML/Blog,,,,,,https://arxiv.org/abs/2509.12908,Press,Auto-Discovery,,,,2025-09-17
xOffense: An AI-driven autonomous penetration testing framework with offensive knowledge-enhanced LLMs and multi agent systems,xoffense-an-ai-driven-autonomous-penetration-testing-framework-with-offensive-knowledge-enhanced-llms-and-multi-agent-systems,Article,Minor,❌,,HTML/Blog,,,,,,https://arxiv.org/abs/2509.13021,Press,Auto-Discovery,,,,2025-09-17
ResidualViT for Efficient Temporally Dense Video Encoding,residualvit-for-efficient-temporally-dense-video-encoding,Article,Minor,❌,,HTML/Blog,,,,,,https://arxiv.org/abs/2509.13255,Press,Auto-Discovery,,,,2025-09-17
CredID: Credible Multi-Bit Watermark for Large Language Models Identification,credid-credible-multi-bit-watermark-for-large-language-models-identification,Article,Minor,❌,,HTML/Blog,,,,,,https://arxiv.org/abs/2412.03107,Press,Auto-Discovery,,,,2025-09-17
"Comprehend, Divide, and Conquer: Feature Subspace Exploration via Multi-Agent Hierarchical Reinforcement Learning",comprehend-divide-and-conquer-feature-subspace-exploration-via-multi-agent-hierarchical-reinforcement-learning,Article,Minor,❌,,HTML/Blog,,,,,,https://arxiv.org/abs/2504.17356,Press,Auto-Discovery,,,,2025-09-17
"Contra4: Evaluating Contrastive Cross-Modal Reasoning in Audio, Video, Image, and 3D",contra4-evaluating-contrastive-cross-modal-reasoning-in-audio-video-image-and-3d,Article,Minor,❌,,HTML/Blog,,,,,,https://arxiv.org/abs/2506.01275,Press,Auto-Discovery,,,,2025-09-17
Small Language Models are the Future of Agentic AI,small-language-models-are-the-future-of-agentic-ai,Article,Minor,❌,,HTML/Blog,,,,,,https://arxiv.org/abs/2506.02153,Press,Auto-Discovery,,,,2025-09-17
"TRiSM for Agentic AI: A Review of Trust, Risk, and Security Management in LLM-based Agentic Multi-Agent Systems",trism-for-agentic-ai-a-review-of-trust-risk-and-security-management-in-llm-based-agentic-multi-agent-systems,Article,Minor,❌,,HTML/Blog,,,,,,https://arxiv.org/abs/2506.04133,Press,Auto-Discovery,,,,2025-09-17
TRANSAGENT: An LLM-Based Multi-Agent System for Code Translation,transagent-an-llm-based-multi-agent-system-for-code-translation,Article,Minor,❌,,HTML/Blog,,,,,,https://arxiv.org/abs/2409.19894,Press,Auto-Discovery,,,,2025-09-17
"T2V-Turbo-v2: Enhancing Video Generation Model Post-Training through Data, Reward, and Conditional Guidance Design",t2v-turbo-v2-enhancing-video-generation-model-post-training-through-data-reward-and-conditional-guidance-design,Article,Minor,❌,,HTML/Blog,,,,,,https://arxiv.org/abs/2410.05677,Press,Auto-Discovery,,,,2025-09-17
Pitfalls of defacing whole-head MRI: re-identification risk with diffusion models and compromised research potential,pitfalls-of-defacing-whole-head-mri-re-identification-risk-with-diffusion-models-and-compromised-research-potential,Article,Minor,❌,,HTML/Blog,,,,,,https://arxiv.org/abs/2501.18834,Press,Auto-Discovery,,,,2025-09-17
MedEBench: Diagnosing Reliability in Text-Guided Medical Image Editing,medebench-diagnosing-reliability-in-text-guided-medical-image-editing,Article,Minor,❌,,HTML/Blog,,,,,,https://arxiv.org/abs/2506.01921,Press,Auto-Discovery,,,,2025-09-17
PVPO: Pre-Estimated Value-Based Policy Optimization for Agentic Reasoning,pvpo-pre-estimated-value-based-policy-optimization-for-agentic-reasoning,Article,Minor,❌,,HTML/Blog,,,,,,https://arxiv.org/abs/2508.21104,Press,Auto-Discovery,,,,2025-09-17
Show HN: OutfitsGen – Free AI tool that creates outfit ideas from short prompts,show-hn-outfitsgen-free-ai-tool-that-creates-outfit-ideas-from-short-prompts,Article,Minor,❌,,HTML/Blog,,,,,,https://www.outfitsgen.com,Press,Auto-Discovery,,,,2025-09-18
Show HN: AI agents to handle customer support tickets,show-hn-ai-agents-to-handle-customer-support-tickets,Article,Minor,❌,,HTML/Blog,,,,,,https://ticketdesk.ai/,Press,Auto-Discovery,,,,2025-09-18
"UUIDv47: keep v7 in your DB, emit v4 outside (SipHash-masked timestamp)",uuidv47-keep-v7-in-your-db-emit-v4-outside-siphash-masked-timestamp,Article,Minor,❌,,HTML/Blog,,,,,,https://www.reddit.com/r/programming/comments/1njebn0/uuidv47_keep_v7_in_your_db_emit_v4_outside/,Press,Auto-Discovery,,,,2025-09-18
"""The agent kept “working” for more than an hour at a time without ever reaching a solution. Worse, instead of fixing the bug, it started introducing regressions and damaging the project, at one point even deleting a critical file like storage.""",the-agent-kept-working-for-more-than-an-hour-at-a-time-without-ever-reaching-a-solution-worse-instead-of-fixing-the-bug-it-started-introducing-regressions-and-damaging-the-project-at-one-point-even-deleting-a-critical-file-like-storage,Article,Minor,❌,,HTML/Blog,,,,,,https://www.reddit.com/r/programming/comments/1nk8dmc/the_agent_kept_working_for_more_than_an_hour_at_a/,Press,Auto-Discovery,,,,2025-09-18
More than an LLM in a Loop: How Coding Agents Work,more-than-an-llm-in-a-loop-how-coding-agents-work,Article,Minor,❌,,HTML/Blog,,,,,,https://www.reddit.com/r/programming/comments/1nk6a8q/more_than_an_llm_in_a_loop_how_coding_agents_work/,Press,Auto-Discovery,,,,2025-09-18
[D] How about we review the reviewers?,d-how-about-we-review-the-reviewers,Article,Minor,❌,,HTML/Blog,,,,,,https://www.reddit.com/r/MachineLearning/comments/1njmxph/d_how_about_we_review_the_reviewers/,Press,Auto-Discovery,,,,2025-09-18
[D] AAAI 2026: Why did some papers get 3 human reviewers in Phase 1?,d-aaai-2026-why-did-some-papers-get-3-human-reviewers-in-phase-1,Article,Minor,❌,,HTML/Blog,,,,,,https://www.reddit.com/r/MachineLearning/comments/1nk1b7o/d_aaai_2026_why_did_some_papers_get_3_human/,Press,Auto-Discovery,,,,2025-09-18
[D] can we trust agents for time series forecasting?,d-can-we-trust-agents-for-time-series-forecasting,Article,Minor,❌,,HTML/Blog,,,,,,https://www.reddit.com/r/MachineLearning/comments/1njhikh/d_can_we_trust_agents_for_time_series_forecasting/,Press,Auto-Discovery,,,,2025-09-18
Amazon launches AI agent to help sellers complete tasks and manage their businesses,amazon-launches-ai-agent-to-help-sellers-complete-tasks-and-manage-their-businesses,Article,Minor,❌,,HTML/Blog,,,,,,https://techcrunch.com/2025/09/17/amazon-launches-ai-agent-to-help-sellers-complete-tasks-and-manage-their-businesses/,Press,Auto-Discovery,,,,2025-09-18
Public AI on Hugging Face Inference Providers 🔥,public-ai-on-hugging-face-inference-providers,Article,Minor,❌,,HTML/Blog,,,,,,https://huggingface.co/blog/inference-providers-publicai,Press,Auto-Discovery,,,,2025-09-18
OpenHA: A Series of Open-Source Hierarchical Agentic Models in Minecraft,openha-a-series-of-open-source-hierarchical-agentic-models-in-minecraft,Article,Minor,❌,,HTML/Blog,,,,,,https://arxiv.org/abs/2509.13347,Press,Auto-Discovery,,,,2025-09-18
Agentic UAVs: LLM-Driven Autonomy with Integrated Tool-Calling and Cognitive Reasoning,agentic-uavs-llm-driven-autonomy-with-integrated-tool-calling-and-cognitive-reasoning,Article,Minor,❌,,HTML/Blog,,,,,,https://arxiv.org/abs/2509.13352,Press,Auto-Discovery,,,,2025-09-18
$Agent^2$: An Agent-Generates-Agent Framework for Reinforcement Learning Automation,agent-2-an-agent-generates-agent-framework-for-reinforcement-learning-automation,Article,Minor,❌,,HTML/Blog,,,,,,https://arxiv.org/abs/2509.13368,Press,Auto-Discovery,,,,2025-09-18
AI Agents with Human-Like Collaborative Tools: Adaptive Strategies for Enhanced Problem-Solving,ai-agents-with-human-like-collaborative-tools-adaptive-strategies-for-enhanced-problem-solving,Article,Minor,❌,,HTML/Blog,,,,,,https://arxiv.org/abs/2509.13547,Press,Auto-Discovery,,,,2025-09-18
Programmable Cognitive Bias in Social Agents,programmable-cognitive-bias-in-social-agents,Article,Minor,❌,,HTML/Blog,,,,,,https://arxiv.org/abs/2509.13588,Press,Auto-Discovery,,,,2025-09-18
"See, Think, Act: Teaching Multimodal Agents to Effectively Interact with GUI by Identifying Toggles",see-think-act-teaching-multimodal-agents-to-effectively-interact-with-gui-by-identifying-toggles,Article,Minor,❌,,HTML/Blog,,,,,,https://arxiv.org/abs/2509.13615,Press,Auto-Discovery,,,,2025-09-18
InfraMind: A Novel Exploration-based GUI Agentic Framework for Mission-critical Industrial Management,inframind-a-novel-exploration-based-gui-agentic-framework-for-mission-critical-industrial-management,Article,Minor,❌,,HTML/Blog,,,,,,https://arxiv.org/abs/2509.13704,Press,Auto-Discovery,,,,2025-09-18
CrowdAgent: Multi-Agent Managed Multi-Source Annotation System,crowdagent-multi-agent-managed-multi-source-annotation-system,Article,Minor,❌,,HTML/Blog,,,,,,https://arxiv.org/abs/2509.14030,Press,Auto-Discovery,,,,2025-09-18
Prognosis of COVID-19 using Artificial Intelligence: A Systematic Review and Meta-analysis,prognosis-of-covid-19-using-artificial-intelligence-a-systematic-review-and-meta-analysis,Article,Minor,❌,,HTML/Blog,,,,,,https://arxiv.org/abs/2408.00208,Press,Auto-Discovery,,,,2025-09-18
Proximity-Based Evidence Retrieval for Uncertainty-Aware Neural Networks,proximity-based-evidence-retrieval-for-uncertainty-aware-neural-networks,Article,Minor,❌,,HTML/Blog,,,,,,https://arxiv.org/abs/2509.13338,Press,Auto-Discovery,,,,2025-09-18
ASTREA: Introducing Agentic Intelligence for Orbital Thermal Autonomy,astrea-introducing-agentic-intelligence-for-orbital-thermal-autonomy,Article,Minor,❌,,HTML/Blog,,,,,,https://arxiv.org/abs/2509.13380,Press,Auto-Discovery,,,,2025-09-18
"EdiVal-Agent: An Object-Centric Framework for Automated, Scalable, Fine-Grained Evaluation of Multi-Turn Editing",edival-agent-an-object-centric-framework-for-automated-scalable-fine-grained-evaluation-of-multi-turn-editing,Article,Minor,❌,,HTML/Blog,,,,,,https://arxiv.org/abs/2509.13399,Press,Auto-Discovery,,,,2025-09-18
Justice in Judgment: Unveiling (Hidden) Bias in LLM-assisted Peer Reviews,justice-in-judgment-unveiling-hidden-bias-in-llm-assisted-peer-reviews,Article,Minor,❌,,HTML/Blog,,,,,,https://arxiv.org/abs/2509.13400,Press,Auto-Discovery,,,,2025-09-18
An LLM Agentic Approach for Legal-Critical Software: A Case Study for Tax Prep Software,an-llm-agentic-approach-for-legal-critical-software-a-case-study-for-tax-prep-software,Article,Minor,❌,,HTML/Blog,,,,,,https://arxiv.org/abs/2509.13471,Press,Auto-Discovery,,,,2025-09-18
ColonCrafter: A Depth Estimation Model for Colonoscopy Videos Using Diffusion Priors,coloncrafter-a-depth-estimation-model-for-colonoscopy-videos-using-diffusion-priors,Article,Minor,❌,,HTML/Blog,,,,,,https://arxiv.org/abs/2509.13525,Press,Auto-Discovery,,,,2025-09-18
Agentic JWT: A Secure Delegation Protocol for Autonomous AI Agents,agentic-jwt-a-secure-delegation-protocol-for-autonomous-ai-agents,Article,Minor,❌,,HTML/Blog,,,,,,https://arxiv.org/abs/2509.13597,Press,Auto-Discovery,,,,2025-09-18
GitHub's Copilot Code Review: Can AI Spot Security Flaws Before You Commit?,github-s-copilot-code-review-can-ai-spot-security-flaws-before-you-commit,Article,Minor,❌,,HTML/Blog,,,,,,https://arxiv.org/abs/2509.13650,Press,Auto-Discovery,,,,2025-09-18
AgentCTG: Harnessing Multi-Agent Collaboration for Fine-Grained Precise Control in Text Generation,agentctg-harnessing-multi-agent-collaboration-for-fine-grained-precise-control-in-text-generation,Article,Minor,❌,,HTML/Blog,,,,,,https://arxiv.org/abs/2509.13677,Press,Auto-Discovery,,,,2025-09-18
Improving Context Fidelity via Native Retrieval-Augmented Reasoning,improving-context-fidelity-via-native-retrieval-augmented-reasoning,Article,Minor,❌,,HTML/Blog,,,,,,https://arxiv.org/abs/2509.13683,Press,Auto-Discovery,,,,2025-09-18
CraftMesh: High-Fidelity Generative Mesh Manipulation via Poisson Seamless Fusion,craftmesh-high-fidelity-generative-mesh-manipulation-via-poisson-seamless-fusion,Article,Minor,❌,,HTML/Blog,,,,,,https://arxiv.org/abs/2509.13688,Press,Auto-Discovery,,,,2025-09-18
Automated Triaging and Transfer Learning of Incident Learning Safety Reports Using Large Language Representational Models,automated-triaging-and-transfer-learning-of-incident-learning-safety-reports-using-large-language-representational-models,Article,Minor,❌,,HTML/Blog,,,,,,https://arxiv.org/abs/2509.13706,Press,Auto-Discovery,,,,2025-09-18
Mitigating Query Selection Bias in Referring Video Object Segmentation,mitigating-query-selection-bias-in-referring-video-object-segmentation,Article,Minor,❌,,HTML/Blog,,,,,,https://arxiv.org/abs/2509.13722,Press,Auto-Discovery,,,,2025-09-18
Exploring Data and Parameter Efficient Strategies for Arabic Dialect Identifications,exploring-data-and-parameter-efficient-strategies-for-arabic-dialect-identifications,Article,Minor,❌,,HTML/Blog,,,,,,https://arxiv.org/abs/2509.13775,Press,Auto-Discovery,,,,2025-09-18
Who is Introducing the Failure? Automatically Attributing Failures of Multi-Agent Systems via Spectrum Analysis,who-is-introducing-the-failure-automatically-attributing-failures-of-multi-agent-systems-via-spectrum-analysis,Article,Minor,❌,,HTML/Blog,,,,,,https://arxiv.org/abs/2509.13782,Press,Auto-Discovery,,,,2025-09-18
BWCache: Accelerating Video Diffusion Transformers through Block-Wise Caching,bwcache-accelerating-video-diffusion-transformers-through-block-wise-caching,Article,Minor,❌,,HTML/Blog,,,,,,https://arxiv.org/abs/2509.13789,Press,Auto-Discovery,,,,2025-09-18
Combining Evidence and Reasoning for Biomedical Fact-Checking,combining-evidence-and-reasoning-for-biomedical-fact-checking,Article,Minor,❌,,HTML/Blog,,,,,,https://arxiv.org/abs/2509.13879,Press,Auto-Discovery,,,,2025-09-18
Combating Biomedical Misinformation through Multi-modal Claim Detection and Evidence-based Verification,combating-biomedical-misinformation-through-multi-modal-claim-detection-and-evidence-based-verification,Article,Minor,❌,,HTML/Blog,,,,,,https://arxiv.org/abs/2509.13888,Press,Auto-Discovery,,,,2025-09-18
LLM Agents for Interactive Workflow Provenance: Reference Architecture and Evaluation Methodology,llm-agents-for-interactive-workflow-provenance-reference-architecture-and-evaluation-methodology,Article,Minor,❌,,HTML/Blog,,,,,,https://arxiv.org/abs/2509.13978,Press,Auto-Discovery,,,,2025-09-18
RFM-Editing: Rectified Flow Matching for Text-guided Audio Editing,rfm-editing-rectified-flow-matching-for-text-guided-audio-editing,Article,Minor,❌,,HTML/Blog,,,,,,https://arxiv.org/abs/2509.14003,Press,Auto-Discovery,,,,2025-09-18
TGPO: Tree-Guided Preference Optimization for Robust Web Agent Reinforcement Learning,tgpo-tree-guided-preference-optimization-for-robust-web-agent-reinforcement-learning,Article,Minor,❌,,HTML/Blog,,,,,,https://arxiv.org/abs/2509.14172,Press,Auto-Discovery,,,,2025-09-18
Dense Video Understanding with Gated Residual Tokenization,dense-video-understanding-with-gated-residual-tokenization,Article,Minor,❌,,HTML/Blog,,,,,,https://arxiv.org/abs/2509.14199,Press,Auto-Discovery,,,,2025-09-18
Designing AI-Agents with Personalities: A Psychometric Approach,designing-ai-agents-with-personalities-a-psychometric-approach,Article,Minor,❌,,HTML/Blog,,,,,,https://arxiv.org/abs/2410.19238,Press,Auto-Discovery,,,,2025-09-18
Learning Like Humans: Advancing LLM Reasoning Capabilities via Adaptive Difficulty Curriculum Learning and Expert-Guided Self-Reformulation,learning-like-humans-advancing-llm-reasoning-capabilities-via-adaptive-difficulty-curriculum-learning-and-expert-guided-self-reformulation,Article,Minor,❌,,HTML/Blog,,,,,,https://arxiv.org/abs/2505.08364,Press,Auto-Discovery,,,,2025-09-18
MAFA: A multi-agent framework for annotation,mafa-a-multi-agent-framework-for-annotation,Article,Minor,❌,,HTML/Blog,,,,,,https://arxiv.org/abs/2505.13668,Press,Auto-Discovery,,,,2025-09-18
Video-Language Critic: Transferable Reward Functions for Language-Conditioned Robotics,video-language-critic-transferable-reward-functions-for-language-conditioned-robotics,Article,Minor,❌,,HTML/Blog,,,,,,https://arxiv.org/abs/2405.19988,Press,Auto-Discovery,,,,2025-09-18
AppAgent v2: Advanced Agent for Flexible Mobile Interactions,appagent-v2-advanced-agent-for-flexible-mobile-interactions,Article,Minor,❌,,HTML/Blog,,,,,,https://arxiv.org/abs/2408.11824,Press,Auto-Discovery,,,,2025-09-18
Semantic Alignment-Enhanced Code Translation via an LLM-Based Multi-Agent System,semantic-alignment-enhanced-code-translation-via-an-llm-based-multi-agent-system,Article,Minor,❌,,HTML/Blog,,,,,,https://arxiv.org/abs/2409.19894,Press,Auto-Discovery,,,,2025-09-18
DAVIS: Planning Agent with Knowledge Graph-Powered Inner Monologue,davis-planning-agent-with-knowledge-graph-powered-inner-monologue,Article,Minor,❌,,HTML/Blog,,,,,,https://arxiv.org/abs/2410.09252,Press,Auto-Discovery,,,,2025-09-18
Enhancing the De-identification of Personally Identifiable Information in Educational Data,enhancing-the-de-identification-of-personally-identifiable-information-in-educational-data,Article,Minor,❌,,HTML/Blog,,,,,,https://arxiv.org/abs/2501.09765,Press,Auto-Discovery,,,,2025-09-18
ComfyGPT: A Self-Optimizing Multi-Agent System for Comprehensive ComfyUI Workflow Generation,comfygpt-a-self-optimizing-multi-agent-system-for-comprehensive-comfyui-workflow-generation,Article,Minor,❌,,HTML/Blog,,,,,,https://arxiv.org/abs/2503.17671,Press,Auto-Discovery,,,,2025-09-18
Humanoid Agent via Embodied Chain-of-Action Reasoning with Multimodal Foundation Models for Zero-Shot Loco-Manipulation,humanoid-agent-via-embodied-chain-of-action-reasoning-with-multimodal-foundation-models-for-zero-shot-loco-manipulation,Article,Minor,❌,,HTML/Blog,,,,,,https://arxiv.org/abs/2504.09532,Press,Auto-Discovery,,,,2025-09-18
Direct Video-Based Spatiotemporal Deep Learning for Cattle Lameness Detection,direct-video-based-spatiotemporal-deep-learning-for-cattle-lameness-detection,Article,Minor,❌,,HTML/Blog,,,,,,https://arxiv.org/abs/2504.16404,Press,Auto-Discovery,,,,2025-09-18
MythTriage: Scalable Detection of Opioid Use Disorder Myths on a Video-Sharing Platform,mythtriage-scalable-detection-of-opioid-use-disorder-myths-on-a-video-sharing-platform,Article,Minor,❌,,HTML/Blog,,,,,,https://arxiv.org/abs/2506.00308,Press,Auto-Discovery,,,,2025-09-18
Pareto-Grid-Guided Large Language Models for Fast and High-Quality Heuristics Design in Multi-Objective Combinatorial Optimization,pareto-grid-guided-large-language-models-for-fast-and-high-quality-heuristics-design-in-multi-objective-combinatorial-optimization,Article,Minor,❌,,HTML/Blog,,,,,,https://arxiv.org/abs/2507.20923,Press,Auto-Discovery,,,,2025-09-18
Language Models Identify Ambiguities and Exploit Loopholes,language-models-identify-ambiguities-and-exploit-loopholes,Article,Minor,❌,,HTML/Blog,,,,,,https://arxiv.org/abs/2508.19546,Press,Auto-Discovery,,,,2025-09-18
Omni-CLST: Error-aware Curriculum Learning with guided Selective chain-of-Thought for audio question answering,omni-clst-error-aware-curriculum-learning-with-guided-selective-chain-of-thought-for-audio-question-answering,Article,Minor,❌,,HTML/Blog,,,,,,https://arxiv.org/abs/2509.12275,Press,Auto-Discovery,,,,2025-09-18
Show HN: Ray3 AI Video – Reasoning Video Model with HDR and Draft Mode,show-hn-ray3-ai-video-reasoning-video-model-with-hdr-and-draft-mode,Article,Minor,❌,,HTML/Blog,,,,,,https://ray3aivideo.com/,Press,Auto-Discovery,,,,2025-09-19
Show HN: Imagine – Generate and compare images across top models side by side,show-hn-imagine-generate-and-compare-images-across-top-models-side-by-side,Article,Minor,❌,,HTML/Blog,,,,,,https://agentsea.com/imagine,Press,Auto-Discovery,,,,2025-09-19
Show HN: AgentSea – private AI chat for sensitive work,show-hn-agentsea-private-ai-chat-for-sensitive-work,Article,Minor,❌,,HTML/Blog,,,,,,https://agentsea.com/ai-chat,Press,Auto-Discovery,,,,2025-09-19
"Wow, Moondream 3 preview is goated",wow-moondream-3-preview-is-goated,Article,Minor,❌,,HTML/Blog,,,,,,https://www.reddit.com/r/LocalLLaMA/comments/1nkvgn0/wow_moondream_3_preview_is_goated/,Press,Auto-Discovery,,,,2025-09-19
New Wan MoE video model,new-wan-moe-video-model,Article,Minor,❌,,HTML/Blog,,,,,,https://www.reddit.com/r/LocalLLaMA/comments/1nktfxl/new_wan_moe_video_model/,Press,Auto-Discovery,,,,2025-09-19
"Local LLM Coding Stack (24GB minimum, ideal 36GB)",local-llm-coding-stack-24gb-minimum-ideal-36gb,Article,Minor,❌,,HTML/Blog,,,,,,https://www.reddit.com/r/LocalLLaMA/comments/1nkfvrl/local_llm_coding_stack_24gb_minimum_ideal_36gb/,Press,Auto-Discovery,,,,2025-09-19
Moondream 3 (Preview) -- hybrid reasoning vision language model,moondream-3-preview-hybrid-reasoning-vision-language-model,Article,Minor,❌,,HTML/Blog,,,,,,https://www.reddit.com/r/LocalLLaMA/comments/1nkmc7z/moondream_3_preview_hybrid_reasoning_vision/,Press,Auto-Discovery,,,,2025-09-19
Decart-AI releases “Open Source Nano Banana for Video”,decart-ai-releases-open-source-nano-banana-for-video,Article,Minor,❌,,HTML/Blog,,,,,,https://www.reddit.com/r/LocalLLaMA/comments/1nkkghp/decartai_releases_open_source_nano_banana_for/,Press,Auto-Discovery,,,,2025-09-19
Favorite agentic coding llm up to 144GB of vram?,favorite-agentic-coding-llm-up-to-144gb-of-vram,Article,Minor,❌,,HTML/Blog,,,,,,https://www.reddit.com/r/LocalLLaMA/comments/1nkw8v6/favorite_agentic_coding_llm_up_to_144gb_of_vram/,Press,Auto-Discovery,,,,2025-09-19
"I made project called Local Agent personal artificial intelligence also known as LAPAI, i need some advice or what do you think about my project, because i still new on this thing, AI offline for support dev integrate AI to their project entirely offline",i-made-project-called-local-agent-personal-artificial-intelligence-also-known-as-lapai-i-need-some-advice-or-what-do-you-think-about-my-project-because-i-still-new-on-this-thing-ai-offline-for-support-dev-integrate-ai-to-their-project-entirely-offline,Article,Minor,❌,,HTML/Blog,,,,,,https://www.reddit.com/r/LocalLLaMA/comments/1nky2vh/i_made_project_called_local_agent_personal/,Press,Auto-Discovery,,,,2025-09-19
